name,manufacturer,form_factor,evaluation_or_commercialization,processor_architecture,processor_core_count,processor_manufacturer,processor_tdp,memory,onboard_storage,input_voltage,io_count,wireless,operating_system_bsp,operating_temperature_max,operating_temperature_min,certifications,short_summary,full_summary,full_product_description,target_applications
Not Available,Not Available,Not Available,Not Available,Not Available,Not Available,Not Available,Not Available,Not Available,Not Available,Not Available,['Not Available'],Not Available,Not Available,Not Available,Not Available,Not Available,Outline the technical specifications and performance metrics that the product needs to meet.,"A comprehensive guide on crafting product specifications, detailing key elements such as technical requirements, user experience, scalability, and sustainability considerations.","The document provides a detailed approach to writing product specifications, including setting clear objectives, detailing product features and benefits, incorporating technical details, and considering industry standards.",Not Available
EVO M,ALORIUM TECHNOLOGY,ADA FRUIT FEATHER,True,ARM,Not Available,MICROCHIP,Not Available,KB RAM,MB External FLASH,Not Available,"['Analog Inputs, Analog Outputs, Digital IO']",Not Available,Not Available,Not Available,Not Available,Not Available,Evo M module combines Microchip SAMD microcontroller with Intel MAX FPGA for enhanced embedded compute performance.,"The Evo M module by Alorium Technology integrates a Microchip SAMD microcontroller and an Intel MAX FPGA, offering a blend of performance and flexibility in an Adafruit Feather form factor. It supports IoT, Edge Analytics, and Motor Control applications.","Evo M is a compute module featuring a Microchip SAMD ARM Cortex-M microcontroller and Intel MAX FPGA. It includes analog inputs, outputs, digital IO, and external FLASH storage, designed for IoT and Edge Analytics applications.","['IoT', 'Edge Analytics', 'Motor Motion Control', 'Measurement', 'Test Equipment']"
HUMMINGBOARD PULSE,SOLIDRUN,Compact,False,ARM,4,NXP,Not Available,2 GB RAM,16 GB eMMC,7V – 32V,"['Ethernet', 'HDMI', 'MIPI CSI', 'MIPI DSI', 'PCIe', 'PoE', 'UART', 'USB', 'USB OTG']",None,Linux,70 C,0 C,"REACH, RoHS, ISO 9001, EMC/EMI Regulations, UL 94, Green/ Halogen Free","HummingBoard Pulse with NXP iMXM Mini Quad-core ARM Cortex-A53, 2GB RAM, 16GB eMMC, and various connectivity options.","The HummingBoard Pulse is a compact development board featuring an NXP iMXM Mini Quad-core ARM Cortex-A53 processor, 2GB of RAM, and 16GB of onboard eMMC storage. It supports Linux OS and offers a range of connectivity options including Ethernet, HDMI, MIPI CSI, MIPI DSI, PCIe, PoE, UART, USB, and USB OTG.","The HummingBoard Pulse is designed for commercial applications, powered by an NXP iMXM Mini Quad-core ARM Cortex-A53 processor. It includes 2GB of RAM and 16GB of eMMC storage. Connectivity options are extensive, featuring Ethernet, HDMI, MIPI CSI, MIPI DSI, PCIe, PoE, UART, USB, and USB OTG. The board supports Linux operating systems and operates within a temperature range of 0 to 70 degrees Celsius.",Commercial applications requiring robust connectivity and processing power.
IMXM MINI SOM,SOLIDRUN,SOM,True,ARM,Quad-core,NXP,Not Available,LPDDR Up to 4 GB,"NOR QSPI, eMMC",3.45V to 4.4V,"['USB, USB OTG, MIPI-CSI, UART, ESPI, I2C, SAI, SPDIF, GPIO']","WiFi b/g/n/ac, Bluetooth",Linux Board Support Package,85°C,-40°C,"REACH, RoHS, ISO 9001, EMC/EMI Regulations, UL 94",iMXM Mini SOM with ARM Cortex cores and various I/O interfaces.,"The iMXM Mini SOM is a compact system on module featuring ARM Cortex cores, multiple I/O interfaces including USB, MIPI-CSI, and wireless capabilities such as WiFi and Bluetooth.","The iMXM Mini SOM by SolidRun is designed for developers and features ARM Cortex cores, a variety of I/O interfaces including USB, MIPI-CSI, UART, and wireless capabilities like WiFi and Bluetooth. It supports LPDDR memory and onboard storage options like NOR QSPI and eMMC.","Automotive, Industrial, IoT, Edge Computing"
ULCDPTU,D SYSTEMS,Not Available,Not Available,Intel 64,Not Available,Intel,Not Available,Not Available,Not Available,Not Available,['Not Available'],Not Available,Not Available,Not Available,Not Available,Not Available,Not Available,Not Available,Not Available,Not Available
