id,config,extracted_data,usage_data,raw_data_length
conga-B7XDslashP-D1508,"{'max_missing_feature_attempts': 2, 'max_low_confidence_attempts': 2}","{'name': 'CONGABXD', 'manufacturer': 'CONGATEC', 'form_factor': 'COM EXPRESS BASIC 125 X 95 MM', 'evaluation_or_commercialization': False, 'processor_architecture': 'X86', 'processor_core_count': '4, 8, 12, 16', 'processor_manufacturer': 'INTEL', 'processor_tdp': '45W, 65W, 85W', 'memory': 'DUAL CHANNEL DDR4 2400 MT/S, UP TO 64GB, ECC SUPPORT', 'onboard_storage': 'Non-volatile User Data Storage', 'input_voltage': '12V', 'io_count': '4x USB 3.0, 8x USB 2.0, 4x SATA III, 32x PCIe Gen 3, 2x GbE KR', 'wireless': 'WLAN and Bluetooth', 'operating_system_bsp': ['WINDOWS 10', 'WINDOWS SERVER 2016', 'WINDOWS SERVER 2019', 'RHEL', 'SUSE', 'FEDORA', 'UBUNTU', 'CENTOS', 'FREEBSD', 'VMWARE', 'HYPERV', 'XEN', 'ESXI'], 'operating_temperature_max': '85C', 'operating_temperature_min': '-40C', 'certifications': 'Not Available', 'short_summary': 'COM Express Type 7 module with Intel Xeon D processors, supporting up to 64GB DDR4 ECC memory, and various I/O interfaces.', 'full_summary': 'The conga-BXD is a COM Express Type 7 module featuring Intel Xeon D processors with up to 16 cores, supporting up to 64GB DDR4 ECC memory, dual 10GbE KR interfaces, and a wide range of I/O options including PCIe Gen 3, USB 3.0, and SATA III.', 'full_product_description': 'The conga-BXD COM Express Type 7 module is designed for server-class applications, featuring Intel Xeon D processors with up to 16 cores and 45W to 85W TDP. It supports up to 64GB of dual-channel DDR4 2400 MT/s memory with ECC. The module offers extensive I/O capabilities including 32 PCIe Gen 3 lanes, 4 USB 3.0 ports, 8 USB 2.0 ports, 4 SATA III ports, and dual 10GbE KR interfaces. It is suitable for industrial and commercial temperature ranges, making it ideal for a variety of applications.', 'target_applications': ['SERVER', 'INDUSTRIAL AUTOMATION', 'NETWORKING', 'TELECOMMUNICATIONS']}","{'generate_missing_features': [{'input_tokens': 3882, 'output_tokens': 107, 'time_taken': 5.845836877822876}], 'search_missing_features': [{'input_tokens': 0, 'output_tokens': 0, 'time_taken': 33.2532000541687}], 'store_and_chunk_data': [{'input_tokens': 0, 'output_tokens': 0, 'time_taken': 1.676604986190796}], 'extract_features': [{'input_tokens': 2649, 'output_tokens': 881, 'time_taken': 9.931455135345459}]}",8169
NANO-ADL-P-i5C-R10,"{'max_missing_feature_attempts': 2, 'max_low_confidence_attempts': 2}","{'name': 'NANOADLP', 'manufacturer': 'IEI', 'form_factor': 'EPIC SBC', 'evaluation_or_commercialization': False, 'processor_architecture': 'x86', 'processor_core_count': 'quad-core', 'processor_manufacturer': 'Intel', 'processor_tdp': '10W', 'memory': '8GB LPDDR4x 4266MHz', 'onboard_storage': '32 GB eMMC (optional)', 'input_voltage': '12V DC', 'io_count': ['2x HDMI', '2x DP', '2x USB 3.2 Gen 2', '2x USB 2.0', '2x SATA 6Gb/s', '2x RS-232', '2x RS-422/485', '2x GbE LAN', '1x M.2 A Key', '1x M.2 B Key', '1x PCIe x4', '1x PCIe x1'], 'wireless': 'WiFi, Bluetooth', 'operating_system_bsp': 'Not Available', 'operating_temperature_max': '60°C', 'operating_temperature_min': '-20°C', 'certifications': ['CE', 'FCC', 'RoHS'], 'short_summary': 'High-performance EPIC SBC with Intel Alder Lake-P processors, supporting multiple I/O interfaces and quad display outputs.', 'full_summary': 'The NANOADLP is an EPIC SBC that supports Intel Alder Lake-P processors, including Core i3, i5, i7, and Celeron variants. It features 8GB of LPDDR4x memory, multiple I/O interfaces including HDMI, DP, USB, SATA, and PCIe, and supports quad independent displays.', 'full_product_description': ""The NANOADLP is a high-performance EPIC SBC designed for industrial applications. It supports Intel's 12th Gen Alder Lake-P processors and comes with 8GB of LPDDR4x memory. The board offers extensive connectivity options including dual HDMI, dual DP, multiple USB ports, SATA, and PCIe slots. It also supports quad independent displays and features robust network capabilities with dual GbE LAN ports. The board is compliant with CE, FCC, and RoHS standards, making it suitable for a wide range of industrial and commercial applications."", 'target_applications': ['Industrial Automation', 'Digital Signage', 'Medical Devices', 'IoT Gateways', 'Embedded Systems']}","{'generate_missing_features': [{'input_tokens': 4642, 'output_tokens': 114, 'time_taken': 6.028427839279175}], 'search_missing_features': [{'input_tokens': 0, 'output_tokens': 0, 'time_taken': 35.40458106994629}], 'store_and_chunk_data': [{'input_tokens': 0, 'output_tokens': 0, 'time_taken': 1.7028799057006836}], 'extract_features': [{'input_tokens': 1923, 'output_tokens': 889, 'time_taken': 13.61127495765686}]}",4364
81P-0001,"{'max_missing_feature_attempts': 2, 'max_low_confidence_attempts': 2}","{'name': 'CONTROL BOARD', 'manufacturer': 'GRAVES ELECTRONICS LLC', 'form_factor': 'PC/104', 'evaluation_or_commercialization': False, 'processor_architecture': 'ARM Cortex A9', 'processor_core_count': '2', 'processor_manufacturer': 'MICROCHIP', 'processor_tdp': 'Not Available', 'memory': '1GB DDR3', 'onboard_storage': 'Not Available', 'input_voltage': '7-24V DC', 'io_count': '8 IO lines, 4 MOSFET outputs', 'wireless': 'Not Available', 'operating_system_bsp': 'Q-SYS Operating System', 'operating_temperature_max': 'Not Available', 'operating_temperature_min': 'Not Available', 'certifications': 'Not Available', 'short_summary': 'A versatile control board designed for industrial applications with RS232/RS485 communication and multiple IO options.', 'full_summary': 'The control board is built around the powerful PIC18F45K22 microcontroller from Microchip, offering features expected from an industrial controller board. It includes standard RS232 and RS485 communication ports, eight IO lines, analog inputs, digital outputs, and four dedicated MOSFET outputs. The board supports expansion modules via SPI and I2C buses.', 'full_product_description': 'The control board is a unique platform bridging the gap between hobbyist maker boards and custom-designed circuit boards. It is built around the powerful PIC18F45K22 microcontroller chip from Microchip and offers a host of features expected from an industrial controller board. Standard features include RS232 and RS485 communication, eight IO lines, analog inputs, protected and buffered digital inputs, digital outputs, and four dedicated MOSFET outputs. The board also supports two expansion module ports for additional functionality. Unlike hobbyist boards, this board uses SPI and I2C buses for communication, keeping IO lines free for other uses. The board comes with pluggable headers for input power, IO, MOSFET outputs, and RS232/RS485 lines, allowing for easy wiring and field service.', 'target_applications': ['Industrial control', 'Automation', 'Custom circuit design']}","{'generate_missing_features': [{'input_tokens': 3538, 'output_tokens': 286, 'time_taken': 8.559883117675781}], 'search_missing_features': [{'input_tokens': 0, 'output_tokens': 0, 'time_taken': 33.28515315055847}], 'store_and_chunk_data': [{'input_tokens': 0, 'output_tokens': 0, 'time_taken': 1.6979351043701172}], 'extract_features': [{'input_tokens': 3931, 'output_tokens': 779, 'time_taken': 9.147555112838745}]}",16261
ESRP-CMS-U2271V2,"{'max_missing_feature_attempts': 2, 'max_low_confidence_attempts': 2}","{'name': 'ESRPCMSUV', 'manufacturer': 'ADVANTECH', 'form_factor': 'PocketSize', 'evaluation_or_commercialization': False, 'processor_architecture': 'x86', 'processor_core_count': 2, 'processor_manufacturer': 'INTEL', 'processor_tdp': 'Not Available', 'memory': '4GB DDR3 1600MHz onboard', 'onboard_storage': '8 GB eMMC NAND Flash for O.S. and 4 MB SPI NOR Flash for ADV.', 'input_voltage': '12VDC', 'io_count': ['2x RJ45 LAN Ports', '2x USB 3.1 Gen 1', '1x HDMI'], 'wireless': 'CAT4', 'operating_system_bsp': 'ThinManager', 'operating_temperature_max': '60°C', 'operating_temperature_min': '0°C', 'certifications': ['CE', 'FCC', 'UL', 'CCC', 'BSMI', 'RoHS'], 'short_summary': 'Advantech ESRP-CMSUV is a ThinManager Ready, pocket-sized edge IoT thin client with Intel Celeron N processor.', 'full_summary': 'Advantech ESRP-CMSUV is a ThinManager Ready, pocket-sized edge IoT thin client featuring an Intel Celeron N dual-core processor, 4GB DDR3 memory, and multiple I/O interfaces including LAN, USB, and HDMI. It is designed for industrial applications with robust, fanless, and cable-free system design.', 'full_product_description': 'The Advantech ESRP-CMSUV is a compact, robust, fanless, and cable-free system designed for industrial applications. It integrates ThinManager software for distributed applications, allowing multiple thin clients to display content delivered from a remote ThinManager server. The system features an Intel Celeron N dual-core processor, 4GB DDR3 memory, and various I/O interfaces including 2x RJ45 LAN ports, 2x USB 3.1 Gen 1 ports, and 1x HDMI port. It supports multiple mounting options including stand, wall, VESA, and DIN rail mounts.', 'target_applications': ['Industrial Automation', 'Edge Computing', 'IoT Applications']}","{'generate_missing_features': [{'input_tokens': 4255, 'output_tokens': 94, 'time_taken': 3.2659249305725098}], 'search_missing_features': [{'input_tokens': 0, 'output_tokens': 0, 'time_taken': 48.77289795875549}], 'store_and_chunk_data': [{'input_tokens': 0, 'output_tokens': 0, 'time_taken': 0.8615670204162598}], 'extract_features': [{'input_tokens': 1036, 'output_tokens': 827, 'time_taken': 12.47692608833313}]}",2122
SCMD30XP2,"{'max_missing_feature_attempts': 2, 'max_low_confidence_attempts': 2}","{'name': 'STRATO PI CM DUO', 'manufacturer': 'SFERA LABS', 'form_factor': 'DIN RAIL CASE', 'evaluation_or_commercialization': False, 'processor_architecture': 'ARM', 'processor_core_count': 'Not Available', 'processor_manufacturer': 'BROADCOM', 'processor_tdp': 'Not Available', 'memory': 'Not Available', 'onboard_storage': 'eMMC', 'input_voltage': '12-28 VDC', 'io_count': ['ETHERNET PORT', 'TWO USB TYPE-A PORTS', 'RS232 INTERFACE', 'DUAL MICROSD CARD SLOTS'], 'wireless': 'Not Available', 'operating_system_bsp': ['RASPBIAN'], 'operating_temperature_max': '+60 °C', 'operating_temperature_min': '-20 °C', 'certifications': ['EN 55032', 'EN 55024', 'FCC PART 15', 'ICES-003', 'RCM'], 'short_summary': 'A powerful, compact industrial server based on the Raspberry Pi Compute Module, suitable for professional industrial applications.', 'full_summary': 'Strato Pi CM Duo is a compact industrial server based on the Raspberry Pi Compute Module, designed for professional industrial applications where reliability and service continuity are key. It features a DIN rail case, multiple I/O interfaces, and supports various Raspberry Pi Compute Module versions.', 'full_product_description': 'Strato Pi CM Duo is an industrial server housed in a DIN rail case, compatible with various Raspberry Pi Compute Modules. It includes features such as dual microSD card slots, RS232 interface, Ethernet port, and two USB type-A ports. The device is designed for high reliability and service continuity in industrial applications. It also includes a hardware watchdog, secure element chip, and supports Raspbian OS.', 'target_applications': ['INDUSTRIAL AUTOMATION', 'PROFESSIONAL APPLICATIONS', 'RELIABILITY-CRITICAL SYSTEMS']}","{'generate_missing_features': [{'input_tokens': 3937, 'output_tokens': 147, 'time_taken': 3.47723388671875}], 'search_missing_features': [{'input_tokens': 0, 'output_tokens': 0, 'time_taken': 19.885960817337036}], 'store_and_chunk_data': [{'input_tokens': 0, 'output_tokens': 0, 'time_taken': 6.951931953430176}], 'extract_features': [{'input_tokens': 3752, 'output_tokens': 755, 'time_taken': 23.383111238479614}]}",32061
LEC-iMX8MP-Q-N-2G-32G-BW-CT,"{'max_missing_feature_attempts': 2, 'max_low_confidence_attempts': 2}","{'name': 'LECIMXMP SMARC SHORT SIZE MODULE', 'manufacturer': 'ADLINK TECHNOLOGY', 'form_factor': 'SMARC SHORT SIZE MODULE 82MM X 50MM', 'evaluation_or_commercialization': False, 'processor_architecture': 'ARM', 'processor_core_count': '4', 'processor_manufacturer': 'NXP', 'processor_tdp': 'Not Available', 'memory': '4GB LPDDR4', 'onboard_storage': '64GB EMMC', 'input_voltage': '5V DC', 'io_count': ['2x USB 3.0', '2x USB 2.0', '2x GbE', '1x HDMI', '1x LVDS', '1x DSI', '2x CAN', '3x UART', '2x PCIe', '4x I2C', '2x SPI', '1x Audio Codec', '1x SDIO'], 'wireless': ['Wi-Fi 802.11ac', 'Bluetooth 5.0'], 'operating_system_bsp': ['Yocto Linux BSP', 'Android BSP', 'VxWorks BSP'], 'operating_temperature_max': '85°C', 'operating_temperature_min': '-40°C', 'certifications': ['IEC 60068-2-27', 'IEC 60068-2-64', 'MIL-STD-810F'], 'short_summary': 'LECIMXMP is a SMARC short size module featuring NXP i.MX 8M Plus Quad-core ARM Cortex-A53 processor with optional NPU, supporting various I/O interfaces and rugged operating temperatures.', 'full_summary': 'The LECIMXMP SMARC short size module by ADLINK Technology is powered by the NXP i.MX 8M Plus Quad-core ARM Cortex-A53 processor. It includes an optional Neural Processing Unit (NPU) and supports a wide range of I/O interfaces including dual GbE, USB, HDMI, LVDS, DSI, CAN, and more. It is designed for rugged environments with an operating temperature range from -40°C to 85°C.', 'full_product_description': 'The LECIMXMP SMARC short size module is designed for industrial applications requiring high performance and reliability. It features the NXP i.MX 8M Plus Quad-core ARM Cortex-A53 processor with optional NPU for AI and machine learning tasks. The module supports up to 4GB LPDDR4 memory and 64GB eMMC storage. It offers extensive connectivity options including dual GbE ports, multiple USB interfaces, HDMI, LVDS, DSI, CAN, and more. The module is compliant with SMARC 2.1 specifications and is capable of operating in harsh environments with temperatures ranging from -40°C to 85°C. It supports various operating systems including Yocto Linux BSP, Android BSP, and VxWorks BSP.', 'target_applications': ['Industrial Automation', 'AI and Machine Learning', 'IoT Gateways', 'Multimedia Applications', 'Smart Cities']}","{'generate_missing_features': [{'input_tokens': 4230, 'output_tokens': 30, 'time_taken': 1.3581500053405762}], 'search_missing_features': [{'input_tokens': 0, 'output_tokens': 0, 'time_taken': 19.438268899917603}], 'store_and_chunk_data': [{'input_tokens': 0, 'output_tokens': 0, 'time_taken': 5.246742010116577}], 'extract_features': [{'input_tokens': 2167, 'output_tokens': 1035, 'time_taken': 12.14250111579895}]}",5653
uLCD-220RD-Pi,"{'max_missing_feature_attempts': 2, 'max_low_confidence_attempts': 2}","{'name': 'ULCDRD', 'manufacturer': 'D SYSTEMS', 'form_factor': 'Round LCD, 30mm diameter', 'evaluation_or_commercialization': 'False', 'processor_architecture': 'Not Available', 'processor_core_count': 'Not Available', 'processor_manufacturer': 'D SYSTEMS', 'processor_tdp': 'Not Available', 'memory': 'Not Available', 'onboard_storage': 'microSD memory cards', 'input_voltage': '4-5.5V', 'io_count': 'PWM, Sound, General-purpose IO, Analog Inputs, TTL Serial, I2C, SPI', 'wireless': 'Not Available', 'operating_system_bsp': 'Not Available', 'operating_temperature_max': '60°C', 'operating_temperature_min': '-10°C', 'certifications': 'ISO 9001:2015, ISO 14001:2015', 'short_summary': 'The uLCDRD is a unique round LCD intelligent display module powered by the D Systems DIABLO graphics processor.', 'full_summary': 'The uLCDRD features a round LCD with a 30mm diameter and 240x240 pixels, powered by the DIABLO graphics processor. It includes PWM, sound, microSD memory storage, general-purpose IO, analog inputs, multiple TTL serial, I2C, and SPI channels.', 'full_product_description': 'The uLCDRD is a unique round LCD intelligent display module powered by the D Systems DIABLO graphics processor. Designed for applications such as gauges, instruments, and robotics, the round LCD has a 30mm diameter and 240x240 pixels. The DIABLO processor enables standalone functionality and can be programmed using the D Systems Workshop IDE. The module includes features like PWM, sound, microSD memory storage, general-purpose IO, analog inputs, multiple TTL serial, I2C, and SPI channels.', 'target_applications': ['Gauges', 'Instruments', 'Robotics']}","{'generate_missing_features': [{'input_tokens': 4455, 'output_tokens': 266, 'time_taken': 4.439738988876343}], 'search_missing_features': [{'input_tokens': 0, 'output_tokens': 0, 'time_taken': 16.389503002166748}], 'store_and_chunk_data': [{'input_tokens': 0, 'output_tokens': 0, 'time_taken': 4.354021310806274}], 'extract_features': [{'input_tokens': 1044, 'output_tokens': 731, 'time_taken': 8.9725980758667}]}",2453
ASMB-975-00A1,"{'max_missing_feature_attempts': 2, 'max_low_confidence_attempts': 2}","{'name': 'ASMB', 'manufacturer': 'ADVANTECH', 'form_factor': 'Proprietary 305 x 330 mm', 'evaluation_or_commercialization': False, 'processor_architecture': 'x86', 'processor_core_count': 'Not Available', 'processor_manufacturer': 'INTEL', 'processor_tdp': '205W', 'memory': 'Up to 768GB DDR4 ECC RDIMM/LRDIMM', 'onboard_storage': 'Not Available', 'input_voltage': '12V, 5V, 3.3V, 5Vsb', 'io_count': ['4 x PCIe x16 slots', '2 x USB 3.0 ports', '2 x USB 2.0 ports', '1 x VGA port', '2 x RJ45 LAN ports'], 'wireless': 'Not Available', 'operating_system_bsp': 'Not Available', 'operating_temperature_max': '40°C', 'operating_temperature_min': '0°C', 'certifications': 'Not Available', 'short_summary': 'Proprietary server board with dual Intel Xeon Scalable processors, supporting up to 768GB DDR4 ECC RDIMM/LRDIMM.', 'full_summary': 'The ASMB is a proprietary server board designed by Advantech, featuring dual Intel Xeon Scalable processors, up to 768GB DDR4 ECC RDIMM/LRDIMM, multiple PCIe slots, and dual GbE LAN ports.', 'full_product_description': 'The ASMB server board by Advantech is equipped with dual Intel Xeon Scalable processors and supports up to 768GB DDR4 ECC RDIMM/LRDIMM. It includes 4 PCIe x16 slots, dual GbE LAN ports, and various I/O connectors. The board is designed for high-performance computing and server applications, with a robust power supply and cooling requirements.', 'target_applications': ['High-performance computing', 'Server applications', 'Data centers']}","{'generate_missing_features': [{'input_tokens': 3728, 'output_tokens': 126, 'time_taken': 2.4390132427215576}], 'search_missing_features': [{'input_tokens': 0, 'output_tokens': 0, 'time_taken': 16.858893156051636}], 'store_and_chunk_data': [{'input_tokens': 0, 'output_tokens': 0, 'time_taken': 0.9942419528961182}], 'extract_features': [{'input_tokens': 1856, 'output_tokens': 772, 'time_taken': 7.982156991958618}]}",4503
DS-081GB-U2A1E,"{'max_missing_feature_attempts': 2, 'max_low_confidence_attempts': 2}","{'name': 'DS ULTRASLIM FANLESS DIGITAL SIGNAGE PLAYER', 'manufacturer': 'ADVANTECH', 'form_factor': 'ULTRASLIM, 19 MM THICK', 'evaluation_or_commercialization': False, 'processor_architecture': 'X86', 'processor_core_count': '2', 'processor_manufacturer': 'INTEL', 'processor_tdp': 'Not Available', 'memory': 'DDR3L, 1600 MHZ, UP TO 16 GB', 'onboard_storage': '2.5 INCH SATA III HDD/SSD, MSATA', 'input_voltage': '12V DC-IN', 'io_count': ['2 x HDMI', '2 x LAN', '4 x USB', '1 x SPDIF', '1 x MIC-IN', '1 x RS232', '1 x MINI-PCIe'], 'wireless': 'Optional Wi-Fi, Optional HSDPA', 'operating_system_bsp': ['WINDOWS EMBEDDED', 'LINUX'], 'operating_temperature_max': '50°C', 'operating_temperature_min': '0°C', 'certifications': ['CE', 'FCC CLASS B', 'CCC', 'BSMI', 'UL'], 'short_summary': 'DS Ultraslim Fanless Digital Signage Player with Intel Core and Celeron processors, dual HDMI output, fanless design, and highly expandable via MiniPCIe.', 'full_summary': ""The DS Ultraslim Fanless Digital Signage Player is the world's slimmest digital signage player, powered by 6th and 7th Generation Intel Core and Intel Celeron Mobile-U processors. It features dual HDMI display output with up to 4K UHD resolution, fanless and cableless design for easy maintenance, and is highly expandable via internal MiniPCIe interface. It supports Windows Embedded OS and Linux, and comes with Advantech WISE-PaaS/SignageCMS for web-based content management."", 'full_product_description': 'The DS Ultraslim Fanless Digital Signage Player, measuring just 19 mm thick, is powered by 6th and 7th Generation Intel Core and Intel Celeron Mobile-U processors. It features dual HDMI display output capable of achieving 4K UHD resolution, delivering a premium visual experience where graphics performance really matters. The fanless and cableless design ensures easy maintenance, and the device is highly expandable via an internal MiniPCIe interface. It supports Windows Embedded OS and Linux, and includes Advantech WISE-PaaS/SignageCMS for intuitive signage content management and remote monitoring control. The player also supports various I/O interfaces including HDMI, LAN, USB, SPDIF, MIC-IN, and RS232, and offers optional Wi-Fi and HSDPA connectivity.', 'target_applications': ['Digital Signage', 'Retail', 'Hospitality', 'Transportation', 'Corporate Communications']}","{'generate_missing_features': [{'input_tokens': 4584, 'output_tokens': 26, 'time_taken': 3.033912181854248}], 'search_missing_features': [{'input_tokens': 0, 'output_tokens': 0, 'time_taken': 15.541672229766846}], 'store_and_chunk_data': [{'input_tokens': 0, 'output_tokens': 0, 'time_taken': 1.1404118537902832}], 'extract_features': [{'input_tokens': 1404, 'output_tokens': 986, 'time_taken': 20.7378990650177}]}",3380
D:\mouser\mouser_devkit\ESP32-C3-DevKitM-1U,"{'max_missing_feature_attempts': 2, 'max_low_confidence_attempts': 2}","{'name': 'ESPCDEVKITM', 'manufacturer': 'ESPRESSIF', 'form_factor': 'QFN', 'evaluation_or_commercialization': True, 'processor_architecture': 'Xtensa LX6, Xtensa LX7, RISC-V', 'processor_core_count': 'Single-core, Dual-core', 'processor_manufacturer': 'Espressif Systems', 'processor_tdp': 'Not Available', 'memory': '4.5 MB', 'onboard_storage': '4MiB internal flash', 'input_voltage': '5V via MicroUSB or 5V via pin headers', 'io_count': ['GPIO', 'ADC', 'FSPI', 'UART', 'RGB LED'], 'wireless': 'Wi-Fi, Bluetooth LE', 'operating_system_bsp': 'ESP-IDF', 'operating_temperature_max': '125°C', 'operating_temperature_min': '-40°C', 'certifications': 'Not Available', 'short_summary': 'Entry-level development board based on ESPCMINI module with Wi-Fi and Bluetooth LE.', 'full_summary': 'The ESPCDevKitM is an entry-level development board based on the ESPCMINI module, integrating complete Wi-Fi and Bluetooth LE functionalities. Most IO pins of the ESPCMINI module are broken out to pin headers on both sides of the board for easy interfacing.', 'full_product_description': 'The ESPCDevKitM is an entry-level development board based on the ESPCMINI module, named for its small size. This board integrates complete Wi-Fi and Bluetooth LE functionalities. Most IO pins of the ESPCMINI module are broken out to pin headers on both sides of the board for easy interfacing. Developers can either connect peripherals with jumper wires or mount the ESPCDevKitM on a breadboard. The board includes a MicroUSB port for power supply and communication, an RGB LED, and a USB-UART bridge chip for high-speed data transfer.', 'target_applications': 'Mobile devices, wearable electronics, IoT applications'}","{'generate_missing_features': [{'input_tokens': 3855, 'output_tokens': 343, 'time_taken': 11.36142110824585}], 'search_missing_features': [{'input_tokens': 0, 'output_tokens': 0, 'time_taken': 49.627949953079224}], 'store_and_chunk_data': [{'input_tokens': 0, 'output_tokens': 0, 'time_taken': 0.5950379371643066}], 'extract_features': [{'input_tokens': 1613, 'output_tokens': 734, 'time_taken': 11.508434295654297}]}",4173
