id,config,extracted_data,usage_data,raw_data_length
LEC-iMX8MP-Q-N-2G-32G-BW-CT,"{'max_missing_feature_attempts': 1, 'max_low_confidence_attempts': 0}","{'name': 'LECIMXMP SMARC SHORT SIZE MODULE', 'manufacturer': 'ADLINK TECHNOLOGY INC', 'form_factor': 'SMARC SHORT SIZE MODULE', 'evaluation_or_commercialization': False, 'processor_architecture': 'ARM', 'processor_core_count': 4, 'processor_manufacturer': 'NXP', 'processor_tdp': 'Not Available', 'memory': '4 GB LPDDR4', 'onboard_storage': '64 GB eMMC', 'input_voltage': '5 VDC', 'io_count': ['USB 2.0', 'USB 3.0', 'Dual GbE ports', 'CAN bus', 'HDMI', 'LVDS', 'DSI', 'MIPI-CSI', 'PCIe', 'UART', 'SPI', 'I2C', 'GPIO'], 'wireless': ['Wi-Fi', 'Bluetooth'], 'operating_system_bsp': ['Yocto Linux BSP', 'Android', 'VxWorks'], 'operating_temperature_max': '85°C', 'operating_temperature_min': '-40°C', 'certifications': ['IEC 60068-2-27', 'IEC 60068-2-64', 'MIL-STD-810F'], 'short_summary': 'LECIMXMP SMARC Short Size Module featuring NXP i.MX 8M Plus Quad Cortex-A53, optional NPU, dual CAN bus, dual GbE ports, and rugged operating temperature.', 'full_summary': 'The LECIMXMP SMARC Short Size Module is powered by the NXP i.MX 8M Plus Quad Cortex-A53 processor with optional Neural Processing Unit (NPU). It supports a wide range of interfaces including dual CAN bus, dual GbE ports, HDMI, LVDS, DSI, MIPI-CSI, and more. The module is designed for rugged environments with an operating temperature range of -40°C to 85°C.', 'full_product_description': 'The LECIMXMP SMARC Short Size Module by ADLINK Technology Inc. is built around the NXP i.MX 8M Plus Quad Cortex-A53 processor, featuring up to 4 GB LPDDR4 memory and 64 GB eMMC storage. It offers extensive connectivity options including USB 2.0, USB 3.0, dual GbE ports, CAN bus, HDMI, LVDS, DSI, MIPI-CSI, PCIe, UART, SPI, I2C, and GPIO. The module supports wireless communication with Wi-Fi and Bluetooth. It is compliant with SMARC 2.1 specifications and is suitable for rugged applications with an operating temperature range from -40°C to 85°C. The module supports multiple operating systems including Yocto Linux BSP, Android, and VxWorks.', 'target_applications': ['Industrial Automation', 'Smart Cities', 'Healthcare', 'Transportation', 'IoT Gateways']}","{'generate_missing_features': [{'input_tokens': 3786, 'output_tokens': 26, 'time_taken': 5.48396897315979}], 'search_missing_features': [{'input_tokens': 0, 'output_tokens': 0, 'time_taken': 40.60889291763306}], 'store_and_chunk_data': [{'input_tokens': 0, 'output_tokens': 0, 'time_taken': 1.5832619667053223}], 'extract_features': [{'input_tokens': 2167, 'output_tokens': 1003, 'time_taken': 20.735701084136963}]}",5653
uLCD-220RD-Pi,"{'max_missing_feature_attempts': 1, 'max_low_confidence_attempts': 0}","{'name': 'ULCDRD', 'manufacturer': 'D SYSTEMS', 'form_factor': 'Round LCD, 30mm diameter', 'evaluation_or_commercialization': 'False', 'processor_architecture': 'Not Available', 'processor_core_count': 'Not Available', 'processor_manufacturer': 'D SYSTEMS', 'processor_tdp': 'Not Available', 'memory': 'Not Available', 'onboard_storage': 'microSD memory cards', 'input_voltage': '4.0 - 5.5 V', 'io_count': 'Multiple TTL Serial, I2C, SPI channels, multiple GPIO, Analog Inputs', 'wireless': 'Not Available', 'operating_system_bsp': 'Not Available', 'operating_temperature_max': '+60 °C', 'operating_temperature_min': '-10 °C', 'certifications': 'ISO 9001:2015, ISO 14001:2015', 'short_summary': ""The uLCDRD is a unique Round LCD Intelligent Display Module powered by D Systems' DIABLO Graphics Processor."", 'full_summary': 'The uLCDRD features a round LCD display with a diameter of 30mm and a resolution of 240 pixels. It is powered by the DIABLO Graphics Processor, which offers considerable FLASH and RAM upgrades over the PICASO processor. The module includes multiple I/O options such as PWM, Sound, microSD memory storage, general-purpose IO, Analog Inputs, multiple TTL Serial, I2C, and SPI channels.', 'full_product_description': ""The uLCDRD is a unique Round LCD Intelligent Display Module powered by D Systems' DIABLO Graphics Processor. Designed for applications such as gauges, instruments, and robotics, the round LCD has a diameter of 30mm and a resolution of 240 pixels. The DIABLO processor enables standalone functionality and can be programmed using D Systems' Workshop IDE Software. The module features PWM, Sound, microSD memory storage, general-purpose IO, Analog Inputs, multiple TTL Serial, I2C, and SPI channels, and multiple millisecond resolution timers."", 'target_applications': ['Gauges', 'Instruments', 'Robotics']}","{'generate_missing_features': [{'input_tokens': 4707, 'output_tokens': 275, 'time_taken': 4.9016289710998535}], 'search_missing_features': [{'input_tokens': 0, 'output_tokens': 0, 'time_taken': 41.658161878585815}], 'store_and_chunk_data': [{'input_tokens': 0, 'output_tokens': 0, 'time_taken': 0.4655590057373047}], 'extract_features': [{'input_tokens': 1044, 'output_tokens': 768, 'time_taken': 12.156105995178223}]}",2453
ASMB-975-00A1,"{'max_missing_feature_attempts': 1, 'max_low_confidence_attempts': 0}","{'name': 'ASMB', 'manufacturer': 'ADVANTECH', 'form_factor': 'Proprietary 305 x 330 mm', 'evaluation_or_commercialization': 'False', 'processor_architecture': 'x86', 'processor_core_count': 'Not Available', 'processor_manufacturer': 'INTEL', 'processor_tdp': '205W', 'memory': 'Maximum 768GB ECC LRDIMM, Maximum 384GB ECC RDIMM, DDR4 2666MHz', 'onboard_storage': 'Intel C621 chipset, 10 x SATA 6Gb/s, support software RAID', 'input_voltage': '12V, 5V, 3.3V, 5Vsb', 'io_count': ['8 x PCIe x16 slots', '2 x USB 3.0 ports', '2 x USB 2.0 ports', '1 x VGA port', '2 x RJ45 LAN ports'], 'wireless': 'Not Available', 'operating_system_bsp': 'Not Available', 'operating_temperature_max': '40°C', 'operating_temperature_min': '0°C', 'certifications': 'Not Available', 'short_summary': 'Proprietary server board with dual Intel Xeon Scalable processors, DDR4 support, and extensive I/O options.', 'full_summary': 'The ASMB server board by Advantech features dual Intel Xeon Scalable processors, support for up to 768GB ECC LRDIMM or 384GB ECC RDIMM DDR4 2666MHz memory, and a variety of I/O options including multiple PCIe slots, USB ports, and LAN ports. It is designed for high-performance computing applications.', 'full_product_description': 'The Advantech ASMB server board is a high-performance solution designed for demanding computing environments. It supports dual Intel Xeon Scalable processors and offers extensive memory capacity with up to 768GB ECC LRDIMM or 384GB ECC RDIMM DDR4 2666MHz. The board includes 8 PCIe x16 slots, 10 SATA 6Gb/s ports with RAID support, and multiple USB and LAN ports. It operates within a temperature range of 0°C to 40°C and requires a 12V, 5V, 3.3V, and 5Vsb power supply.', 'target_applications': ['High-performance computing', 'Data centers', 'Enterprise servers']}","{'generate_missing_features': [{'input_tokens': 4053, 'output_tokens': 102, 'time_taken': 5.048167943954468}], 'search_missing_features': [{'input_tokens': 0, 'output_tokens': 0, 'time_taken': 19.61375594139099}], 'store_and_chunk_data': [{'input_tokens': 0, 'output_tokens': 0, 'time_taken': 0.6770148277282715}], 'extract_features': [{'input_tokens': 1856, 'output_tokens': 865, 'time_taken': 8.355198860168457}]}",4503
DS-081GB-U2A1E,"{'max_missing_feature_attempts': 1, 'max_low_confidence_attempts': 0}","{'name': 'DS ULTRASLIM FANLESS DIGITAL SIGNAGE PLAYER', 'manufacturer': 'ADVANTECH', 'form_factor': 'ULTRASLIM', 'evaluation_or_commercialization': False, 'processor_architecture': 'x86', 'processor_core_count': '2', 'processor_manufacturer': 'INTEL', 'processor_tdp': 'Not Available', 'memory': 'DDR3 1600MHz, Max Capacity 16GB', 'onboard_storage': '2.5 inch SATA III HDD/SSD, mSATA', 'input_voltage': '12V DC-in', 'io_count': ['Audio SPDIF/Line-out', 'Mic-in support', 'LAN RJ45', 'HDMI x2', 'USB x4', 'Serial Port x2 RS232', 'MiniPCIe Internal Full-size', 'PSW x1', 'Power on/off button', 'LED Indicators x2 (Power, HDD Access)'], 'wireless': 'Optional Wi-Fi, Optional HSDPA', 'operating_system_bsp': ['Windows Embedded', 'Linux'], 'operating_temperature_max': '50°C', 'operating_temperature_min': '0°C', 'certifications': ['EMC CE/FCC Class B', 'CCC', 'BSMI', 'Safety UL/CB/CCC/BSMI'], 'short_summary': 'DS Ultraslim Fanless Digital Signage Player with 6th/7th Generation Intel Core and Intel Celeron Mobile-U processors, dual HDMI display output, fanless design, and highly expandable via internal MiniPCIe interface.', 'full_summary': ""The DS Ultraslim Fanless Digital Signage Player is the world's slimmest digital signage player powered by 6th/7th Generation Intel Core and Intel Celeron Mobile-U processors. It features a dual HDMI display output capable of 4K UHD resolution, fanless and cableless design for easy maintenance, and is highly expandable via internal MiniPCIe interface. It supports Windows Embedded OS and Linux, and comes with Advantech WISE-PaaS/SignageCMS web-based content management software."", 'full_product_description': ""The DS Ultraslim Fanless Digital Signage Player measures just 19 mm thick, making it the world's slimmest digital signage player. It is powered by 6th/7th Generation Intel Core and Intel Celeron Mobile-U processors, and features a dual HDMI display output capable of achieving 4K UHD resolution. The fanless and cableless design ensures easy maintenance, while the internal MiniPCIe interface allows for high expandability. It supports Windows Embedded OS and Linux, and includes Advantech WISE-PaaS/SignageCMS web-based content management software. The player also supports various I/O interfaces including audio SPDIF/Line-out, Mic-in, LAN RJ45, HDMI, USB, and serial ports. It is compliant with EMC CE/FCC Class B, CCC, BSMI, and safety standards UL/CB/CCC/BSMI."", 'target_applications': ['Digital Signage', 'Retail', 'Hospitality', 'Transportation', 'Corporate Communications']}","{'generate_missing_features': [{'input_tokens': 4679, 'output_tokens': 26, 'time_taken': 2.060746908187866}], 'search_missing_features': [{'input_tokens': 0, 'output_tokens': 0, 'time_taken': 39.01983380317688}], 'store_and_chunk_data': [{'input_tokens': 0, 'output_tokens': 0, 'time_taken': 0.622948169708252}], 'extract_features': [{'input_tokens': 1404, 'output_tokens': 1041, 'time_taken': 10.334430932998657}]}",3380
D:\mouser\mouser_devkit\ESP32-C3-DevKitM-1U,"{'max_missing_feature_attempts': 1, 'max_low_confidence_attempts': 0}","{'name': 'ESPCDevKitM', 'manufacturer': 'Espressif', 'form_factor': 'QFN', 'evaluation_or_commercialization': True, 'processor_architecture': 'RISC-V', 'processor_core_count': 'Single-core', 'processor_manufacturer': 'Espressif', 'processor_tdp': 'Not Available', 'memory': '400 KB internal RAM', 'onboard_storage': '4 MB flash', 'input_voltage': '5V via MicroUSB or 5V/3.3V via pin headers', 'io_count': ['GPIO', 'ADC', 'FSPI', 'UART', 'RGB LED'], 'wireless': ['Wi-Fi', 'Bluetooth LE'], 'operating_system_bsp': 'ESP-IDF', 'operating_temperature_max': 'Not Available', 'operating_temperature_min': 'Not Available', 'certifications': 'Not Available', 'short_summary': 'Entry-level development board based on ESPCMINI module with Wi-Fi and Bluetooth LE.', 'full_summary': 'The ESPCDevKitM is an entry-level development board based on the ESPCMINI module, offering complete Wi-Fi and Bluetooth LE functionalities. It features multiple GPIO pins, ADC, FSPI, UART, and an RGB LED for versatile development.', 'full_product_description': 'The ESPCDevKitM is an entry-level development board based on the ESPCMINI module, designed for easy interfacing with peripherals via pin headers. It integrates complete Wi-Fi and Bluetooth LE functionalities and includes multiple GPIO pins, ADC, FSPI, UART, and an RGB LED. The board can be powered via MicroUSB or pin headers, making it versatile for various development needs.', 'target_applications': ['IoT Development', 'Prototyping', 'Embedded Systems', 'Wireless Communication']}","{'generate_missing_features': [{'input_tokens': 4092, 'output_tokens': 286, 'time_taken': 16.468894958496094}], 'search_missing_features': [{'input_tokens': 0, 'output_tokens': 0, 'time_taken': 46.06471085548401}], 'store_and_chunk_data': [{'input_tokens': 0, 'output_tokens': 0, 'time_taken': 1.2902987003326416}], 'extract_features': [{'input_tokens': 1613, 'output_tokens': 728, 'time_taken': 29.70812225341797}]}",4173
TREK-572-LWB7B0E,"{'max_missing_feature_attempts': 1, 'max_low_confidence_attempts': 0}","{'name': 'TREK', 'manufacturer': 'ADVANTECH', 'form_factor': 'Compact In-Vehicle Computing Box', 'evaluation_or_commercialization': False, 'processor_architecture': 'x86', 'processor_core_count': '1', 'processor_manufacturer': 'Intel', 'processor_tdp': '8 watts', 'memory': '2 GB DDR3L SODIMM 1333 MHz non-ECC', 'onboard_storage': '64 GB mSATA', 'input_voltage': '9-36 VDC', 'io_count': ['2 x CAN bus', '1 x RS-232', '2 x USB 2.0 Type A', '1 x Giga LAN', '1 x Line-Out', '1 x Mic-In'], 'wireless': ['WLAN IEEE 802.11 a/b/g/n', 'Bluetooth V4.0', 'WWAN 4G LTE'], 'operating_system_bsp': ['WES7', 'WES8', 'Windows 10 IoT LTSB', 'Linux Ubuntu 14.04 Lite 64-bit', 'Intel IDP 3.1 Moon Island'], 'operating_temperature_max': '70°C', 'operating_temperature_min': '-30°C', 'certifications': ['MIL-STD-810G', 'SAE J1455', 'ISO 7637-2', 'CE', 'FCC Class B', 'UL/cUL', 'CB'], 'short_summary': 'TREK is a compact, economical in-vehicle computing box powered by Intel Atom E3815 SOC, ideal for fleet management applications.', 'full_summary': 'TREK is a compact, economical in-vehicle computing box powered by Intel Atom E3815 SOC. It pairs with TREK in-vehicle smart displays via a single-cable connection, aimed at fleet management applications. It features wide operating temperature, MIL-STD-810G certification, shock and vibration resistance, and intelligent vehicle power management.', 'full_product_description': ""TREK is a compact, economical in-vehicle computing box powered by Intel Atom E3815 SOC. It pairs with TREK in-vehicle smart displays via a single-cable connection, aimed at fleet management applications. TREK's wide operating temperature range and MIL-STD-810G certification ensure it can withstand harsh environments. The inclusion of an intelligent vehicle power management (VPM) chip protects against transient voltage and supports programmable functions like ignition on/off delay and low battery monitoring. TREK also features various I/O for integrating CAN bus devices and peripherals, including a tire pressure monitoring system. The dual CAN bus ports support diverse protocols like J1939 and OBDII/ISO, facilitating vehicle diagnostics and driver behavior management. Built-in wireless communication technologies (WLAN, WWAN, Bluetooth) enable vehicle tracking, real-time data transmissions, and centralized control."", 'target_applications': ['Fleet Management', 'Vehicle Diagnostics', 'Driver Behavior Management', 'Real-time Data Transmission', 'Vehicle Tracking']}","{'generate_missing_features': [{'input_tokens': 4563, 'output_tokens': 26, 'time_taken': 3.0359034538269043}], 'search_missing_features': [{'input_tokens': 0, 'output_tokens': 0, 'time_taken': 42.567415952682495}], 'store_and_chunk_data': [{'input_tokens': 0, 'output_tokens': 0, 'time_taken': 1.0727488994598389}], 'extract_features': [{'input_tokens': 1619, 'output_tokens': 1020, 'time_taken': 9.854120969772339}]}",4556
IMBA-Q370-R10,"{'max_missing_feature_attempts': 1, 'max_low_confidence_attempts': 0}","{'name': 'IMBA-Q470', 'manufacturer': 'IEI', 'form_factor': 'ATX', 'evaluation_or_commercialization': False, 'processor_architecture': 'x86', 'processor_core_count': 'Up to 10 cores', 'processor_manufacturer': 'Intel', 'processor_tdp': 'Not Available', 'memory': 'Four 288-pin 2933 MHz Dual-Channel DDR4 SDRAM Unbuffered DIMMs supported up to 128GB', 'onboard_storage': '1 x M.2 M Key (2240/2280) with PCIe x4', 'input_voltage': 'ATX/AT power supply', 'io_count': ['6 x USB 3.2 Gen 1 (5Gbps)', '6 x RS-232', '2 x USB 3.2 Gen 2 (10Gbps)', '1 x PS/2 KB/MS', '1 x DisplayPort', '1 x HDMI', '1 x VGA', '2 x LAN', '1 x Audio Jack (Line-in, Line-out, Mic-in)', '1 x Analog audio', '1 x Front Panel', '1 x Power LED', '1 x HDD LED', '1 x Speaker', '1 x Reset Button', '1 x LAN LED', '1 x PCIe x16', '1 x PCIe x4', '1 x PCIe x1', '1 x M.2 M Key', '1 x M.2 A Key', '1 x TPM', '1 x CPU fan connector', '1 x System fan connector', '1 x Chassis intrusion'], 'wireless': 'Support M.2 A key for WLAN expansion', 'operating_system_bsp': 'Not Available', 'operating_temperature_max': '60°C', 'operating_temperature_min': '0°C', 'certifications': ['CE', 'FCC'], 'short_summary': 'IMBA-Q470 is an ATX motherboard supporting 10th Generation Intel Core i3/i5/i7, Celeron, and Pentium processors with dual GbE LAN, multiple USB ports, and triple independent displays.', 'full_summary': 'The IMBA-Q470 is an industrial ATX motherboard designed for high performance and reliability. It supports 10th Generation Intel Core i3/i5/i7, Celeron, and Pentium processors, offering dual-channel DDR4 memory up to 128GB, dual GbE LAN, multiple USB ports, and triple independent displays. It is ideal for industrial applications requiring robust computing power and extensive connectivity options.', 'full_product_description': 'The IMBA-Q470 is an industrial-grade ATX motherboard featuring support for 10th Generation Intel Core i3/i5/i7, Celeron, and Pentium processors. It includes four 288-pin 2933 MHz Dual-Channel DDR4 SDRAM slots supporting up to 128GB of memory. The motherboard offers extensive connectivity options including dual GbE LAN, six USB 3.2 Gen 1 ports, two USB 3.2 Gen 2 ports, six RS-232 ports, and multiple display outputs (VGA, HDMI, DisplayPort). It also supports various expansion options with PCIe x16, PCIe x4, PCIe x1, and M.2 slots. The IMBA-Q470 is CE and FCC compliant, making it suitable for a wide range of industrial applications.', 'target_applications': ['Industrial Automation', 'Digital Signage', 'Medical Equipment', 'Surveillance Systems']}","{'generate_missing_features': [{'input_tokens': 4563, 'output_tokens': 160, 'time_taken': 2.936426877975464}], 'search_missing_features': [{'input_tokens': 0, 'output_tokens': 0, 'time_taken': 39.11332297325134}], 'store_and_chunk_data': [{'input_tokens': 0, 'output_tokens': 0, 'time_taken': 1.1422030925750732}], 'extract_features': [{'input_tokens': 1449, 'output_tokens': 1094, 'time_taken': 10.312156200408936}]}",3144
ESP8266-DEVKITC-02U-F,"{'max_missing_feature_attempts': 1, 'max_low_confidence_attempts': 0}","{'name': 'ESPWROOMD', 'manufacturer': 'ESPRESSIF', 'form_factor': 'Not Available', 'evaluation_or_commercialization': 'False', 'processor_architecture': 'TENSILICA LX6', 'processor_core_count': '1', 'processor_manufacturer': 'TENSILICA', 'processor_tdp': 'Not Available', 'memory': '520 KB SRAM', 'onboard_storage': '4 MB SPI Flash', 'input_voltage': '3.0V - 3.6V', 'io_count': 'Not Available', 'wireless': ['Wi-Fi 802.11 b/g/n'], 'operating_system_bsp': ['RTOS', 'FreeRTOS'], 'operating_temperature_max': '85°C', 'operating_temperature_min': '-40°C', 'certifications': ['RoHS', 'REACH'], 'short_summary': 'ESPWROOMD is an optimized ESP8266-based module with onboard antenna and 4 MB SPI flash.', 'full_summary': 'The ESPWROOMD module integrates the ESP8266 SoC, featuring a Tensilica LX6 processor, 520 KB SRAM, and 4 MB SPI flash. It supports Wi-Fi 802.11 b/g/n and operates within a temperature range of -40°C to 85°C.', 'full_product_description': 'ESPWROOMD is an ESP8266-based module developed by Espressif. It integrates a Tensilica LX6 processor, 520 KB SRAM, and 4 MB SPI flash. The module supports Wi-Fi 802.11 b/g/n and operates within a temperature range of -40°C to 85°C. It is certified for RoHS and REACH compliance.', 'target_applications': ['IoT', 'Smart Home', 'Wearables', 'Industrial Automation']}","{'generate_missing_features': [{'input_tokens': 3865, 'output_tokens': 76, 'time_taken': 2.6309359073638916}], 'search_missing_features': [{'input_tokens': 0, 'output_tokens': 0, 'time_taken': 71.22390604019165}], 'store_and_chunk_data': [{'input_tokens': 0, 'output_tokens': 0, 'time_taken': 1.3476347923278809}], 'extract_features': [{'input_tokens': 3668, 'output_tokens': 734, 'time_taken': 27.19569206237793}]}",23137
SOM-6898C7Z2-U8A1E,"{'max_missing_feature_attempts': 1, 'max_low_confidence_attempts': 0}","{'name': 'COM EXPRESS COMPACT MODULE TYPE 6', 'manufacturer': 'ADVANTECH', 'form_factor': 'COM Express Compact Module', 'evaluation_or_commercialization': False, 'processor_architecture': 'x86', 'processor_core_count': '2-4', 'processor_manufacturer': 'INTEL', 'processor_tdp': '15W', 'memory': 'Dual Channel DDR4, up to 32GB', 'onboard_storage': 'Optional eMMC', 'input_voltage': '12V, 5VSB', 'io_count': ['4x USB 3.0', '8x USB 2.0', '4x SATA', '1x PCIe x16', '7x PCIe x1', '1x LPC', '1x SMBus', '1x I2C', '1x SPI', '8x GPIO'], 'wireless': 'Not Available', 'operating_system_bsp': ['Windows 10', 'Linux'], 'operating_temperature_max': '60°C', 'operating_temperature_min': '0°C', 'certifications': 'Not Available', 'short_summary': 'Compact module with 6th Gen Intel Core/Celeron processors, dual-channel DDR4 support, and extensive I/O options.', 'full_summary': 'The COM Express Compact Module Type 6 features 6th Gen Intel Core and Celeron processors, integrated PCH-LP, dual-channel DDR4 SODIMM up to 32GB, integrated graphics with HEVC and VP9 hardware transcode, flexible PCI Express lanes, and support for iManager and WISE-PaaS/RMM embedded software APIs.', 'full_product_description': 'The COM Express Compact Module Type 6 is designed for high-performance embedded applications. It supports 6th Gen Intel Core i7/i5/i3 and Celeron processors with integrated PCH-LP, dual-channel DDR4 SODIMM up to 32GB, and Intel HD Graphics. The module offers extensive I/O options including multiple USB, SATA, PCIe, and display interfaces. It is suitable for a wide range of industrial and commercial applications.', 'target_applications': ['Industrial Automation', 'Medical Equipment', 'Digital Signage', 'Gaming', 'Transportation']}","{'generate_missing_features': [{'input_tokens': 4373, 'output_tokens': 48, 'time_taken': 6.827439069747925}], 'search_missing_features': [{'input_tokens': 0, 'output_tokens': 0, 'time_taken': 32.55063486099243}], 'store_and_chunk_data': [{'input_tokens': 0, 'output_tokens': 0, 'time_taken': 0.9763786792755127}], 'extract_features': [{'input_tokens': 1628, 'output_tokens': 855, 'time_taken': 9.953949928283691}]}",3900
EmNANO-i2300-E3825,"{'max_missing_feature_attempts': 1, 'max_low_confidence_attempts': 1}","{'name': 'EMNANOIE', 'manufacturer': 'ARBOR TECHNOLOGY', 'form_factor': 'COM Express Mini', 'evaluation_or_commercialization': True, 'processor_architecture': 'x86', 'processor_core_count': '4C/8T for i7 and i5, 2C/4T for i3', 'processor_manufacturer': 'INTEL', 'processor_tdp': '15W', 'memory': '4GB DDR3L SDRAM', 'onboard_storage': 'NVMe, up to 256GB (Optional)', 'input_voltage': '+12V and +5VSB for ATX, +12V for AT', 'io_count': ['4 x USB ports', '1 x USB port', '1 x Serial Port', '2 x PCIe x1 Gen2 lanes', '1 x SPI', '1 x LPC', '2 x Serial ATA ports'], 'wireless': 'Not Available', 'operating_system_bsp': 'Windows® 10 (64-bit), Linux Ubuntu 20.04.4/Kernel 5.13.0', 'operating_temperature_max': '185°F (85°C) on selected CPU SKU', 'operating_temperature_min': '-40°F (-40°C) on selected CPU SKU', 'certifications': 'CE/FCC Class A', 'short_summary': 'Intel Atom E series processor COM Express Mini Type CPU Module with soldered onboard Intel Atom E series SoC processor.', 'full_summary': 'The EMNANOIE is a COM Express Mini Type CPU Module featuring an Intel Atom E series processor, integrated Gigabit Ethernet, dual independent display support, and extended operating temperature range.', 'full_product_description': 'The EMNANOIE is a COM Express Mini Type CPU Module equipped with an Intel Atom E series SoC processor. It includes 4GB DDR3L SDRAM, multiple USB ports, serial ports, PCIe lanes, and supports dual independent displays. It is designed for extended operating temperatures and various industrial applications.', 'target_applications': 'Industrial applications, embedded systems, evaluation purposes.'}","{'generate_missing_features': [{'input_tokens': 4185, 'output_tokens': 317, 'time_taken': 10.235355854034424}], 'search_missing_features': [{'input_tokens': 0, 'output_tokens': 0, 'time_taken': 19.064197778701782}], 'store_and_chunk_data': [{'input_tokens': 0, 'output_tokens': 0, 'time_taken': 0.4724738597869873}], 'extract_features': [{'input_tokens': 1087, 'output_tokens': 708, 'time_taken': 7238.058930873871}]}",2003
