id,config,extracted_data,usage_data,raw_data_length
TREK-572-LWB7B0E,"{'max_missing_feature_attempts': 1, 'max_low_confidence_attempts': 1}","{'name': 'TREK', 'manufacturer': 'ADVANTECH', 'form_factor': 'Compact In-Vehicle Computing Box', 'evaluation_or_commercialization': False, 'processor_architecture': 'x86', 'processor_core_count': '1', 'processor_manufacturer': 'Intel', 'processor_tdp': '8 watts', 'memory': '4 GB DDR3L SODIMM 1600 MHz non-ECC', 'onboard_storage': '64 GB mSATA SSD', 'input_voltage': '12-24 VDC', 'io_count': ['2 x CAN bus', '2 x USB 2.0 Type A', '1 x Giga LAN', '1 x Line-Out', '1 x Mic-In', '1 x UART', '1 x Reset button'], 'wireless': ['WLAN IEEE 802.11 a/b/g/n', 'Bluetooth V4.0', 'WWAN 3G/LTE', 'GPS/GLONASS'], 'operating_system_bsp': ['Windows Embedded Standard 7', 'Windows Embedded Standard 8', 'Windows 10 IoT LTSB', 'Linux Ubuntu 14.04 LTS 64-bit'], 'operating_temperature_max': '70°C', 'operating_temperature_min': '-30°C', 'certifications': ['MIL-STD-810G', 'SAE J1455', 'ISO 7637-2', 'CE', 'FCC Class B', 'UL/cUL', 'CB'], 'short_summary': 'TREK is a compact, economical in-vehicle computing box powered by Intel Atom E3815 SOC, designed for fleet management applications with wide operating temperature and MIL-STD-810G certification.', 'full_summary': ""TREK is a compact, economical in-vehicle computing box powered by Intel Atom E3815 SOC. It pairs with TREK in-vehicle smart displays via a single-cable connection, aimed at fleet management applications. TREK's wide operating temperature range and MIL-STD-810G certification ensure it can withstand harsh environments. It includes intelligent vehicle power management (VPM) chip for transient voltage protection and supports various IO interfaces including CAN bus, WLAN, WWAN, and Bluetooth."", 'full_product_description': ""TREK is a compact, economical in-vehicle computing box powered by Intel Atom E3815 SOC. It pairs with TREK in-vehicle smart displays via a single-cable connection, aimed at fleet management applications. TREK's wide operating temperature range and MIL-STD-810G certification ensure it can withstand harsh environments. The inclusion of an intelligent vehicle power management (VPM) chip protects against transient voltage and supports programmable functions like ignition on/off delay and low battery monitoring. TREK also features various IO interfaces for integrating CAN bus devices and peripherals, including a tire pressure monitoring system. The dual CAN bus ports support diverse protocols like J1939 and OBDII/ISO, facilitating vehicle diagnostics and driver behavior management. Built-in wireless communication technologies like WLAN, WWAN, and Bluetooth enable vehicle tracking, real-time data transmissions, and centralized control. The system supports multiple operating systems including Windows Embedded Standard 7, Windows Embedded Standard 8, Windows 10 IoT LTSB, and Linux Ubuntu 14.04 LTS 64-bit."", 'target_applications': ['Fleet Management', 'Vehicle Diagnostics', 'Driver Behavior Management', 'Real-time Data Transmission', 'Vehicle Tracking']}","{'generate_missing_features': [{'input_tokens': 4652, 'output_tokens': 30, 'time_taken': 1.2695631980895996}], 'search_missing_features': [{'input_tokens': 0, 'output_tokens': 0, 'time_taken': 64.42223596572876}], 'store_and_chunk_data': [{'input_tokens': 0, 'output_tokens': 0, 'time_taken': 1.1368420124053955}], 'extract_features': [{'input_tokens': 1619, 'output_tokens': 1109, 'time_taken': 12.408103942871094}]}",4556
IMBA-Q370-R10,"{'max_missing_feature_attempts': 1, 'max_low_confidence_attempts': 1}","{'name': 'IMBA-Q470', 'manufacturer': 'IEI', 'form_factor': 'ATX', 'evaluation_or_commercialization': False, 'processor_architecture': 'x86', 'processor_core_count': 'Up to 10 cores', 'processor_manufacturer': 'Intel', 'processor_tdp': 'Not Available', 'memory': 'Four 288-pin 2933 MHz Dual-Channel DDR4 SDRAM Unbuffered DIMMs supported up to 128GB', 'onboard_storage': 'Not Available', 'input_voltage': 'ATX/AT power supply', 'io_count': ['6 x USB 3.2 Gen 1 (5Gbps)', '6 x RS-232', '2 x USB 3.2 Gen 2 (10Gbps)', '1 x PS/2 KB/MS', '1 x DisplayPort', '1 x HDMI', '1 x VGA', '2 x LAN', '1 x Audio Jack (Line-in, Line-out, Mic-in)', '1 x Analog audio', '1 x Front Panel', '1 x Power LED', '1 x HDD LED', '1 x Speaker', '1 x Reset Button', '1 x LAN LED', '1 x PCIe x16', '1 x PCIe x4', '1 x PCIe x1', '1 x M.2 M Key', '1 x M.2 A Key', '1 x TPM', '1 x CPU fan connector', '1 x System fan connector', '1 x Chassis intrusion'], 'wireless': 'Wi-Fi 6 and Bluetooth 5.2', 'operating_system_bsp': 'Not Available', 'operating_temperature_max': '60°C', 'operating_temperature_min': '0°C', 'certifications': ['CE', 'FCC'], 'short_summary': 'IMBA-Q470 is an ATX motherboard supporting 10th generation Intel Core i3/i5/i7/i9, Pentium, and Celeron processors with dual-channel DDR4 memory, triple independent displays, and dual GbE LAN.', 'full_summary': 'The IMBA-Q470 is an industrial ATX motherboard designed for high performance and reliability. It supports 10th generation Intel Core i3/i5/i7/i9, Pentium, and Celeron processors, dual-channel DDR4 memory up to 128GB, and offers triple independent display outputs. The board features dual GbE LAN, multiple USB 3.2 ports, and extensive I/O options for various industrial applications.', 'full_product_description': 'The IMBA-Q470 ATX motherboard from IEI supports 10th generation Intel Core i3/i5/i7/i9, Pentium, and Celeron processors. It features four 288-pin 2933 MHz Dual-Channel DDR4 SDRAM Unbuffered DIMMs supporting up to 128GB. The board offers triple independent display outputs including VGA, HDMI, and DisplayPort. It includes dual GbE LAN, multiple USB 3.2 Gen 1 and Gen 2 ports, RS-232 interfaces, and various expansion slots including PCIe x16, PCIe x4, PCIe x1, and M.2 slots. The motherboard is CE and FCC compliant and supports an operating temperature range of 0°C to 60°C.', 'target_applications': ['Industrial Automation', 'Digital Signage', 'Medical Equipment', 'Surveillance Systems']}","{'generate_missing_features': [{'input_tokens': 4029, 'output_tokens': 142, 'time_taken': 9.037444829940796}], 'search_missing_features': [{'input_tokens': 168, 'output_tokens': 0, 'time_taken': 52.58971405029297}], 'store_and_chunk_data': [{'input_tokens': 0, 'output_tokens': 0, 'time_taken': 1.0214300155639648}], 'extract_features': [{'input_tokens': 1449, 'output_tokens': 1092, 'time_taken': 13.861212253570557}]}",3144
ESP8266-DEVKITC-02U-F,"{'max_missing_feature_attempts': 1, 'max_low_confidence_attempts': 1}","{'name': 'ESPWROOMD', 'manufacturer': 'ESPRESSIF', 'form_factor': 'QFN 32 (5mm x 5mm)', 'evaluation_or_commercialization': False, 'processor_architecture': 'TENSILICA L106', 'processor_core_count': '1', 'processor_manufacturer': 'ESPRESSIF', 'processor_tdp': 'Not Available', 'memory': '96 KB for RTOS_SDK', 'onboard_storage': '4MB SPI Flash', 'input_voltage': '3.0V - 3.6V', 'io_count': 'Not Available', 'wireless': ['Wi-Fi 802.11 b/g/n'], 'operating_system_bsp': ['RTOS'], 'operating_temperature_max': '85°C', 'operating_temperature_min': '-40°C', 'certifications': ['RoHS', 'REACH'], 'short_summary': 'ESPWROOMD is an optimized ESP-based module with onboard antenna.', 'full_summary': 'ESPWROOMD is an ESP-based module developed by Espressif, optimized for RF performance and includes an onboard antenna.', 'full_product_description': 'The ESPWROOMD integrates the Tensilica L106 32-bit RISC processor, achieving extra low power consumption and a maximum clock speed of 160 MHz. It includes 4MB of SPI Flash and supports Wi-Fi 802.11 b/g/n protocols. The module operates within a voltage range of 3.0V to 3.6V and can function in temperatures ranging from -40°C to 85°C. It is certified for RoHS and REACH compliance.', 'target_applications': ['IoT', 'Smart Home', 'Wearables', 'Industrial Automation']}","{'generate_missing_features': [{'input_tokens': 2866, 'output_tokens': 112, 'time_taken': 8.944819211959839}], 'search_missing_features': [{'input_tokens': 128, 'output_tokens': 0, 'time_taken': 137.83143305778503}], 'store_and_chunk_data': [{'input_tokens': 0, 'output_tokens': 0, 'time_taken': 1.6595048904418945}], 'extract_features': [{'input_tokens': 3668, 'output_tokens': 701, 'time_taken': 11.447952270507812}]}",23137
SOM-6898C7Z2-U8A1E,"{'max_missing_feature_attempts': 1, 'max_low_confidence_attempts': 1}","{'name': 'COM EXPRESS COMPACT MODULE TYPE 6', 'manufacturer': 'ADVANTECH', 'form_factor': 'COM Express Compact Module', 'evaluation_or_commercialization': False, 'processor_architecture': 'x86', 'processor_core_count': '2-4', 'processor_manufacturer': 'INTEL', 'processor_tdp': '15W', 'memory': 'Dual Channel DDR4 SODIMM, up to 32GB', 'onboard_storage': 'Optional eMMC', 'input_voltage': '12V, 5VSB', 'io_count': ['4x USB 3.0', '8x USB 2.0', '4x SATA', '1x PCIe x16', '7x PCIe x1', '1x LPC', '1x SMBus', '1x I2C', '1x SPI', '8x GPIO', '2x COM'], 'wireless': 'Not Available', 'operating_system_bsp': ['Windows 10', 'Linux'], 'operating_temperature_max': '60°C', 'operating_temperature_min': '0°C', 'certifications': 'Not Available', 'short_summary': 'COM Express Compact Module with 6th Gen Intel Core/Celeron Processors, supporting dual channel DDR4 SODIMM up to 32GB.', 'full_summary': 'The COM Express Compact Module Type 6 features 6th Gen Intel Core and Celeron processors, integrated PCH-LP, dual channel DDR4 SODIMM up to 32GB, and a variety of I/O interfaces including PCIe, SATA, USB, and more.', 'full_product_description': 'The COM Express Compact Module Type 6 is designed with 6th Gen Intel Core and Celeron processors, offering integrated PCH-LP, dual channel DDR4 SODIMM up to 32GB, and multiple I/O interfaces such as PCIe, SATA, USB, and more. It supports various display outputs including VGA, HDMI, DVI, and DisplayPort, and is suitable for a wide range of industrial applications.', 'target_applications': ['Industrial Automation', 'Medical Equipment', 'Digital Signage', 'Transportation']}","{'generate_missing_features': [{'input_tokens': 4175, 'output_tokens': 48, 'time_taken': 23.36882996559143}], 'search_missing_features': [{'input_tokens': 0, 'output_tokens': 0, 'time_taken': 13.292211055755615}], 'store_and_chunk_data': [{'input_tokens': 0, 'output_tokens': 0, 'time_taken': 0.720451831817627}], 'extract_features': [{'input_tokens': 1628, 'output_tokens': 844, 'time_taken': 9.06965708732605}]}",3900
EmNANO-i2300-E3825,"{'max_missing_feature_attempts': 2, 'max_low_confidence_attempts': 0}","{'name': 'EMNANOIE', 'manufacturer': 'ARBOR TECHNOLOGY', 'form_factor': 'COM Express Mini', 'evaluation_or_commercialization': True, 'processor_architecture': 'x86', 'processor_core_count': '4C/8T for i7 and i5, 2C/4T for i3', 'processor_manufacturer': 'INTEL', 'processor_tdp': '15W', 'memory': '4GB DDR3L SDRAM', 'onboard_storage': 'NVMe, up to 256GB (Optional)', 'input_voltage': '+12V and +5VSB for ATX, +12V for AT', 'io_count': ['4 x USB ports', '1 x USB port', '1 x Serial Port', '2 x PCIe x1 Gen2 lanes', '1 x SPI', '1 x LPC', '2 x Serial ATA ports', '1 x Gigabit Ethernet'], 'wireless': 'Not Available', 'operating_system_bsp': 'Not Available', 'operating_temperature_max': 'Not Available', 'operating_temperature_min': 'Not Available', 'certifications': 'Not Available', 'short_summary': 'Intel Atom E series processor COM Express Mini Type CPU Module with soldered onboard Intel Atom E series SoC processor.', 'full_summary': 'The EmNANOiE is a COM Express Mini Type CPU module featuring an Intel Atom E series processor, integrated Gigabit Ethernet, and support for dual independent displays. It includes 4GB DDR3L SDRAM and various I/O interfaces.', 'full_product_description': 'The EmNANOiE is a COM Express Mini Type CPU module equipped with an Intel Atom E series processor. It features soldered onboard 4GB DDR3L SDRAM, integrated Gigabit Ethernet, and supports dual independent displays. The module includes multiple I/O interfaces such as USB ports, serial ports, PCIe lanes, SPI, LPC, and SATA ports. It is designed for evaluation purposes and offers extended operating temperature support.', 'target_applications': 'Not Available'}","{'generate_missing_features': [{'input_tokens': 3899, 'output_tokens': 296, 'time_taken': 5.332352876663208}], 'search_missing_features': [{'input_tokens': 0, 'output_tokens': 0, 'time_taken': 31.241392850875854}], 'store_and_chunk_data': [{'input_tokens': 0, 'output_tokens': 0, 'time_taken': 0.5126528739929199}], 'extract_features': [{'input_tokens': 1087, 'output_tokens': 745, 'time_taken': 10.913731098175049}]}",2003
conga-B7XDslashP-D1508,"{'max_missing_feature_attempts': 2, 'max_low_confidence_attempts': 0}","{'name': 'CONGABXD', 'manufacturer': 'CONGATEC', 'form_factor': 'COM EXPRESS BASIC 125 X 95 MM', 'evaluation_or_commercialization': False, 'processor_architecture': 'X86', 'processor_core_count': 'UP TO 16 CORES', 'processor_manufacturer': 'INTEL', 'processor_tdp': 'UP TO 65W', 'memory': 'DUAL CHANNEL DDR4 2400 MT/S, UP TO 64GB, ECC SUPPORT', 'onboard_storage': 'Non-volatile User Data Storage', 'input_voltage': '12V', 'io_count': ['4x USB 3.0', '8x USB 2.0', '4x SATA III', '1x LPC', '1x SPI', '1x I2C', '2x UART', '1x SMBus', '2x GbE KR INTERFACE', '32x PCIe GEN 3 LANES'], 'wireless': 'WLAN and Bluetooth support', 'operating_system_bsp': ['WINDOWS 10', 'WINDOWS SERVER 2016', 'WINDOWS SERVER 2019', 'RHEL', 'SUSE', 'FEDORA', 'UBUNTU', 'CENTOS', 'FREEBSD', 'VMWARE', 'HYPERV', 'XEN', 'ESXI'], 'operating_temperature_max': '85°C', 'operating_temperature_min': '-40°C', 'certifications': 'Not Available', 'short_summary': 'The CONGABXD is a COM Express Type 7 module featuring Intel Xeon D processors, up to 16 cores, dual channel DDR4 memory, and extensive I/O capabilities.', 'full_summary': 'The CONGABXD is a high-performance COM Express Type 7 module designed for server-class applications. It supports Intel Xeon D processors with up to 16 cores, dual channel DDR4 memory with ECC support, and a wide range of I/O interfaces including multiple USB, SATA, PCIe, and Ethernet ports. It is suitable for industrial and commercial use with an operating temperature range from -40°C to 85°C.', 'full_product_description': 'The CONGABXD is a versatile COM Express Type 7 module that integrates Intel Xeon D processors, offering up to 16 cores and 65W TDP. It supports dual channel DDR4 2400 MT/s memory up to 64GB with ECC. The module features extensive I/O capabilities including 4x USB 3.0, 8x USB 2.0, 4x SATA III, 32x PCIe Gen 3 lanes, and 2x GbE KR interfaces. It is designed for both industrial and commercial applications, with an operating temperature range from -40°C to 85°C. The module supports various operating systems including Windows, Linux distributions, and virtualization platforms.', 'target_applications': ['SERVER-CLASS APPLICATIONS', 'INDUSTRIAL AUTOMATION', 'NETWORKING', 'TELECOMMUNICATIONS', 'EDGE COMPUTING']}","{'generate_missing_features': [{'input_tokens': 3605, 'output_tokens': 112, 'time_taken': 5.6169750690460205}], 'search_missing_features': [{'input_tokens': 0, 'output_tokens': 0, 'time_taken': 30.633328914642334}], 'store_and_chunk_data': [{'input_tokens': 0, 'output_tokens': 0, 'time_taken': 1.4745569229125977}], 'extract_features': [{'input_tokens': 2649, 'output_tokens': 990, 'time_taken': 14.931892156600952}]}",8169
NANO-ADL-P-i5C-R10,"{'max_missing_feature_attempts': 2, 'max_low_confidence_attempts': 0}","{'name': 'NANOADLP', 'manufacturer': 'IEI', 'form_factor': 'EPIC SBC', 'evaluation_or_commercialization': False, 'processor_architecture': 'x86', 'processor_core_count': 'Quad-core', 'processor_manufacturer': 'Intel', 'processor_tdp': '10W', 'memory': '8GB LPDDR4x 4266MHz', 'onboard_storage': '32 GB eMMC 5.1 (optional)', 'input_voltage': '12V DC', 'io_count': ['2x HDMI', '2x DP', '1x iDPM', '4x USB 3.2 Gen 2', '2x SATA 6Gb/s', '4x RS-232', '2x RS-422/485', '2x GbE LAN', '1x M.2 A Key', '1x M.2 B Key', '1x PCIe x4', '1x PCIe x1'], 'wireless': 'WiFi, Bluetooth', 'operating_system_bsp': 'Not Available', 'operating_temperature_max': '60°C', 'operating_temperature_min': '-20°C', 'certifications': ['CE', 'FCC', 'RoHS'], 'short_summary': 'High-performance EPIC SBC with Intel Alder Lake-P processors, supporting multiple I/O interfaces and quad display outputs.', 'full_summary': 'The NANOADLP is an EPIC SBC that supports Intel Alder Lake-P processors, offering high performance and multitasking capabilities. It features 8GB LPDDR4x memory, multiple I/O interfaces including HDMI, DP, USB, and SATA, and supports quad independent displays.', 'full_product_description': 'The NANOADLP is a high-performance EPIC SBC designed for industrial applications. It supports Intel Alder Lake-P processors, including Core i3, i5, and Celeron variants. The board comes with 8GB LPDDR4x 4266MHz memory and offers a wide range of I/O interfaces such as HDMI, DP, USB 3.2 Gen 2, SATA 6Gb/s, RS-232, RS-422/485, and GbE LAN. It also supports quad independent displays and features expansion options through M.2 and PCIe slots. The board is compliant with CE, FCC, and RoHS standards and operates within a temperature range of -20°C to 60°C.', 'target_applications': ['Industrial Automation', 'Digital Signage', 'Medical Devices', 'Transportation']}","{'generate_missing_features': [{'input_tokens': 4720, 'output_tokens': 114, 'time_taken': 7.080367803573608}], 'search_missing_features': [{'input_tokens': 0, 'output_tokens': 0, 'time_taken': 37.77090382575989}], 'store_and_chunk_data': [{'input_tokens': 0, 'output_tokens': 0, 'time_taken': 1.2211661338806152}], 'extract_features': [{'input_tokens': 1923, 'output_tokens': 868, 'time_taken': 11.68334174156189}]}",4364
81P-0001,"{'max_missing_feature_attempts': 2, 'max_low_confidence_attempts': 0}","{'name': 'CONTROL BOARD', 'manufacturer': 'GRAVES ELECTRONICS LLC', 'form_factor': 'Small Form Factor', 'evaluation_or_commercialization': False, 'processor_architecture': 'Intel', 'processor_core_count': '4 to 24', 'processor_manufacturer': 'MICROCHIP', 'processor_tdp': '60 W to 65 W', 'memory': 'Not Available', 'onboard_storage': 'Not Available', 'input_voltage': '7-24V DC', 'io_count': '8 IO lines, 4 MOSFET outputs', 'wireless': 'Intel AX211, Qualcomm WCN6856', 'operating_system_bsp': 'Windows 11, Ubuntu Linux 22.04 LTS', 'operating_temperature_max': '50°C', 'operating_temperature_min': '0°C', 'certifications': 'FIPS 140-2, MIL-STD 810H', 'short_summary': 'A versatile control board built around the PICFKIMV microcontroller, suitable for industrial applications.', 'full_summary': 'The control board bridges the gap between hobbyist maker boards and custom-designed circuit boards. It features a PICFKIMV microcontroller from Microchip, RS232 and RS485 communication ports, 8 IO lines, 4 MOSFET outputs, and two expansion module ports.', 'full_product_description': 'The control board is built around the PICFKIMV microcontroller from Microchip and offers a host of features expected from an industrial controller board. It includes standard RS232 and RS485 communication ports, 8 IO lines, 4 MOSFET outputs, and two expansion module ports for additional functionality. The board uses SPI and I2C buses for communication with modules, keeping IO lines free for other uses. It also features pluggable headers for easy wiring and field service.', 'target_applications': 'Industrial control, automation, custom embedded systems'}","{'generate_missing_features': [{'input_tokens': 4005, 'output_tokens': 303, 'time_taken': 5.40864896774292}], 'search_missing_features': [{'input_tokens': 0, 'output_tokens': 0, 'time_taken': 19.63805317878723}], 'store_and_chunk_data': [{'input_tokens': 0, 'output_tokens': 0, 'time_taken': 1.5402238368988037}], 'extract_features': [{'input_tokens': 3931, 'output_tokens': 700, 'time_taken': 9.613273859024048}]}",16261
ESRP-CMS-U2271V2,"{'max_missing_feature_attempts': 2, 'max_low_confidence_attempts': 0}","{'name': 'ESRPCMSUV', 'manufacturer': 'ADVANTECH', 'form_factor': 'PocketSize', 'evaluation_or_commercialization': False, 'processor_architecture': 'x86', 'processor_core_count': 2, 'processor_manufacturer': 'INTEL', 'processor_tdp': '15 W', 'memory': '4GB DDR3 1600MHz onboard', 'onboard_storage': 'Not Available', 'input_voltage': '12VDC', 'io_count': ['2x RJ45 LAN Ports', '2x USB 3.1 Gen 1', '1x HDMI'], 'wireless': 'Not Available', 'operating_system_bsp': 'ThinManager', 'operating_temperature_max': '85 °C', 'operating_temperature_min': '-40 °C', 'certifications': ['CE', 'FCC', 'UL', 'CCC', 'BSMI', 'RoHS COMPLIANT'], 'short_summary': 'Advantech ThinManager Ready PocketSize Edge IoT Thin Client with Intel Celeron N.', 'full_summary': 'Advantech ThinManager compatible industrial thin clients exclusively integrate ThinManager software for distributed applications. The thin clients display content delivered from a remote ThinManager server, with multiple thin clients set across a plant facility for various roles, all maintained by the ThinManager server.', 'full_product_description': 'Advantech ESRPCMSUV ThinManager Ready PocketSize Edge IoT Thin Client features an Intel Celeron N processor, dual-core, 4GB DDR3 1600MHz onboard memory, and multiple I/O interfaces including 2x RJ45 LAN Ports, 2x USB 3.1 Gen 1, and 1x HDMI. It is a compact, robust, fanless, and cable-free system with modular design, suitable for various industrial applications.', 'target_applications': ['Industrial Automation', 'Remote Monitoring', 'IoT Edge Computing']}","{'generate_missing_features': [{'input_tokens': 4267, 'output_tokens': 131, 'time_taken': 3.189547061920166}], 'search_missing_features': [{'input_tokens': 0, 'output_tokens': 0, 'time_taken': 44.54869627952576}], 'store_and_chunk_data': [{'input_tokens': 0, 'output_tokens': 0, 'time_taken': 1.1699860095977783}], 'extract_features': [{'input_tokens': 1036, 'output_tokens': 774, 'time_taken': 10.17779016494751}]}",2122
SCMD30XP2,"{'max_missing_feature_attempts': 2, 'max_low_confidence_attempts': 0}","{'name': 'STRATO PI CM DUO', 'manufacturer': 'SFERA LABS', 'form_factor': 'DIN RAIL CASE', 'evaluation_or_commercialization': False, 'processor_architecture': 'ARM', 'processor_core_count': 'Not Available', 'processor_manufacturer': 'BROADCOM', 'processor_tdp': 'Not Available', 'memory': 'Not Available', 'onboard_storage': 'eMMC, microSD', 'input_voltage': '9-28 VDC', 'io_count': ['RS232', 'Ethernet', '2x USB Type-A'], 'wireless': 'Not Available', 'operating_system_bsp': ['Raspbian'], 'operating_temperature_max': '+60 °C', 'operating_temperature_min': '-20 °C', 'certifications': ['EN 55032', 'EN 55024', 'FCC Part 15', 'ICES-003', 'RCM'], 'short_summary': 'Compact industrial server based on Raspberry Pi Compute Module.', 'full_summary': 'Strato Pi CM Duo is a powerful, compact industrial server designed for professional and industrial applications where reliability and service continuity are key. It is housed in a DIN rail case and is compatible with various Raspberry Pi Compute Modules.', 'full_product_description': 'Strato Pi CM Duo is an industrial server based on the Raspberry Pi Compute Module, housed in a DIN rail case. It supports multiple versions of the Compute Module and features a 9-28 VDC power supply with surge and reverse polarity protection, a real-time clock with a replaceable lithium battery, RS232 interface, Ethernet port, two USB Type-A ports, dual microSD card architecture, and a hardware watchdog. It is suitable for professional and industrial applications requiring high reliability and service continuity.', 'target_applications': ['Industrial automation', 'Professional applications', 'Embedded systems']}","{'generate_missing_features': [{'input_tokens': 3910, 'output_tokens': 151, 'time_taken': 3.71183705329895}], 'search_missing_features': [{'input_tokens': 0, 'output_tokens': 0, 'time_taken': 41.17807197570801}], 'store_and_chunk_data': [{'input_tokens': 0, 'output_tokens': 0, 'time_taken': 4.418442010879517}], 'extract_features': [{'input_tokens': 3752, 'output_tokens': 704, 'time_taken': 9.201999187469482}]}",32061
