id,extracted_data,usage_data,missing_feature_count_history,low_confidence_feature_count_history
cExpress-TL-i3-1115G4E,"{'name': 'CEXPRESSTL', 'manufacturer': 'ADLINK TECHNOLOGY INC', 'form_factor': 'COM EXPRESS', 'evaluation_or_commercialization': False, 'processor_architecture': 'X86', 'processor_core_count': '4', 'processor_manufacturer': 'INTEL', 'processor_tdp': '15W', 'memory': 'Dual channel DDR4, up to 64GB', 'onboard_storage': 'Not Available', 'input_voltage': '12V', 'io_count': 'USB 3.2 Gen 2, USB 2.0, SATA, PCIe Gen 3', 'wireless': 'Not Available', 'operating_system_bsp': ['Windows IOT Enterprise 64-bit', 'Yocto Linux 64-bit', 'VxWorks 64-bit', 'Ubuntu'], 'operating_temperature_max': '85°C', 'operating_temperature_min': '-40°C', 'certifications': ['IEC 60068-2-27', 'IEC 60068-2-64', 'MIL-STD-810F'], 'short_summary': 'Compact COM Express module with Intel Core and Celeron processors, supporting multiple I/O interfaces and operating systems.', 'full_summary': 'The cExpressTL is a COM Express Compact Size Type 6 module featuring 11th Gen Intel Core and Celeron processors, offering robust graphics capabilities with Intel Iris Xe and UHD graphics, and supporting a wide range of I/O interfaces including PCIe Gen 3, USB 3.2, and SATA.', 'full_product_description': 'The cExpressTL module is designed for high-performance computing applications, integrating 11th Gen Intel Core and Celeron processors with advanced graphics and AI capabilities. It supports dual-channel DDR4 memory, multiple display outputs, and a variety of I/O interfaces, making it suitable for industrial and embedded applications. The module is compliant with COM Express Type 6 specifications and supports a wide range of operating systems.', 'target_applications': ['Industrial Automation', 'Embedded Systems', 'AI Inference', 'Graphics-Intensive Applications']}","{'extract_features': [{'input_tokens': 2176, 'output_tokens': 794, 'time_taken': 9.102523803710938}], 'generate_missing_features': [{'input_tokens': 4399, 'output_tokens': 53, 'time_taken': 3.0859081745147705}, {'input_tokens': 4237, 'output_tokens': 53, 'time_taken': 2.3601479530334473}], 'search_missing_features': [{'input_tokens': 0, 'output_tokens': 0, 'time_taken': 20.666227102279663}, {'input_tokens': 0, 'output_tokens': 0, 'time_taken': 18.675870895385742}], 'store_and_chunk_data': [{'input_tokens': 0, 'output_tokens': 0, 'time_taken': 1.477006196975708}]}","[2, 2, 2]","[0, 0, 0]"
t2cExpress-BT-E3827,"{'name': 'CEXPRESSBT', 'manufacturer': 'ADLINK TECHNOLOGY', 'form_factor': 'COM EXPRESS', 'evaluation_or_commercialization': False, 'processor_architecture': 'X86', 'processor_core_count': 'Single, dual, quad-core', 'processor_manufacturer': 'INTEL', 'processor_tdp': '6W to 10W', 'memory': 'Up to 8GB Dual Channel DDR3L 1333/1600 MHz', 'onboard_storage': 'eMMC 8GB', 'input_voltage': '12V', 'io_count': 'USB 2.0 x 8, USB 3.0 x 1, SATA 3Gb/s x 2, PCIe x 4', 'wireless': 'Not Available', 'operating_system_bsp': ['Windows 7 32/64-bit', 'Linux 32/64-bit', 'VxWorks 6.9', 'WEC 7'], 'operating_temperature_max': '85°C', 'operating_temperature_min': '-40°C', 'certifications': ['CE', 'FCC'], 'short_summary': 'Compact COM Express Type 6 Module with Intel Atom and Celeron processors.', 'full_summary': 'The cExpress-BT is a compact COM Express Type 6 module featuring Intel Atom and Celeron processors, supporting up to 8GB DDR3L memory, multiple I/O interfaces, and extended temperature ranges.', 'full_product_description': 'The cExpress-BT module from ADLINK Technology is designed for embedded applications requiring a compact form factor and robust performance. It supports Intel Atom and Celeron processors, offers up to 8GB of DDR3L memory, and includes a variety of I/O options such as USB, SATA, and PCIe. The module is suitable for harsh environments with an operating temperature range from -40°C to 85°C.', 'target_applications': ['Industrial Automation', 'Transportation', 'Medical Equipment', 'Digital Signage']}","{'extract_features': [{'input_tokens': 2125, 'output_tokens': 776, 'time_taken': 8.962815046310425}], 'generate_missing_features': [{'input_tokens': 4091, 'output_tokens': 29, 'time_taken': 1.7120680809020996}, {'input_tokens': 4091, 'output_tokens': 29, 'time_taken': 1.7873399257659912}], 'search_missing_features': [{'input_tokens': 0, 'output_tokens': 0, 'time_taken': 21.30839490890503}, {'input_tokens': 0, 'output_tokens': 0, 'time_taken': 19.07322907447815}], 'store_and_chunk_data': [{'input_tokens': 0, 'output_tokens': 0, 'time_taken': 1.5754668712615967}]}","[1, 1, 1]","[0, 0, 0]"
Express-CFR-E-2254ME,"{'name': 'EXPRESSCFR', 'manufacturer': 'ADLINK TECHNOLOGY INC', 'form_factor': 'COM EXPRESS', 'evaluation_or_commercialization': False, 'processor_architecture': 'X86', 'processor_core_count': '6', 'processor_manufacturer': 'INTEL', 'processor_tdp': '45W', 'memory': 'Up to 96GB DDR4 2666MHz', 'onboard_storage': 'SD functions as storage device only', 'input_voltage': '12V', 'io_count': '4 USB 3.1, 4 USB 2.0, 4 SATA 6Gb/s, 1 PCIe x16, 8 PCIe x1', 'wireless': 'Not Available', 'operating_system_bsp': ['Windows 10 64-bit', 'Linux 64-bit', 'VxWorks 64-bit'], 'operating_temperature_max': '85°C', 'operating_temperature_min': '-40°C', 'certifications': ['IEC 60068-2-27', 'MIL-STD-810F'], 'short_summary': 'The ExpressCFR is a COM Express Type 6 module featuring Intel Xeon, Core, Pentium, and Celeron processors, supporting up to 96GB DDR4 memory.', 'full_summary': ""ExpressCFR is a high-performance COM Express module designed for rugged applications, supporting Intel's latest processors and a wide range of I/O interfaces."", 'full_product_description': ""The ExpressCFR module from ADLINK Technology is built on the COM Express Basic Size Type 6 standard, featuring Intel's 8th Generation Xeon, Core, Pentium, and Celeron processors. It supports up to 96GB of DDR4 memory across three SODIMM sockets, and offers extensive I/O options including multiple USB, SATA, and PCIe interfaces. The module is designed for extreme environments, with an operating temperature range from -40°C to 85°C, and is compliant with IEC and MIL-STD standards."", 'target_applications': ['Industrial Automation', 'Military and Aerospace', 'Telecommunications', 'Medical Equipment']}","{'extract_features': [{'input_tokens': 2247, 'output_tokens': 800, 'time_taken': 9.521228075027466}], 'generate_missing_features': [{'input_tokens': 4610, 'output_tokens': 59, 'time_taken': 3.0863962173461914}, {'input_tokens': 4044, 'output_tokens': 29, 'time_taken': 2.847097873687744}, {'input_tokens': 4044, 'output_tokens': 29, 'time_taken': 2.3825390338897705}], 'search_missing_features': [{'input_tokens': 0, 'output_tokens': 0, 'time_taken': 18.530306100845337}, {'input_tokens': 0, 'output_tokens': 0, 'time_taken': 17.39515209197998}, {'input_tokens': 0, 'output_tokens': 0, 'time_taken': 19.69007182121277}], 'store_and_chunk_data': [{'input_tokens': 0, 'output_tokens': 0, 'time_taken': 1.6079277992248535}]}","[2, 1, 1, 1]","[0, 0, 0, 0]"
PCE-5B05-04A1E,{},"{'extract_features': [{'input_tokens': 2176, 'output_tokens': 604, 'time_taken': 7.6975438594818115}], 'store_and_chunk_data': [{'input_tokens': 0, 'output_tokens': 0, 'time_taken': 1.5923151969909668}]}",[15],[0]
048210,"{'name': 'CONGABAC', 'manufacturer': 'CONGATEC', 'form_factor': 'COM EXPRESS BASIC', 'evaluation_or_commercialization': False, 'processor_architecture': 'ARM', 'processor_core_count': '4', 'processor_manufacturer': 'INTEL', 'processor_tdp': '12W', 'memory': 'Dual channel DDR4 2400 MT/s, up to 32GB', 'onboard_storage': 'eMMC onboard flash, 64GB optional', 'input_voltage': '12V', 'io_count': '4x PCIe Gen3, 4x USB 3.0, 4x USB 2.0, 2x SATA III', 'wireless': 'SMARC 2.0 modules support wireless technologies including WLAN and Bluetooth', 'operating_system_bsp': ['Windows 10', 'Windows Server 2016', 'RHEL', 'SuSE Linux Enterprise Server', 'Fedora', 'Ubuntu LTS', 'CentOS', 'VMWare ESXi', 'HyperV', 'Linux KVM'], 'operating_temperature_max': '85°C', 'operating_temperature_min': '-40°C', 'certifications': 'ISO 27001 certification for DigiKey', 'short_summary': 'COM Express Basic module with Intel Atom C3000 series, supporting up to 32GB DDR4 memory.', 'full_summary': 'The congaBAC is a COM Express Basic module featuring Intel Atom C3000 series processors, offering up to 32GB DDR4 memory, multiple Ethernet interfaces, and a range of industrial-grade features.', 'full_product_description': 'The congaBAC module is designed for industrial applications, featuring Intel Atom C3000 series processors with up to 4 cores, dual-channel DDR4 memory support, and extensive I/O capabilities including PCIe, USB, and SATA interfaces. It supports a wide range of operating systems and is suitable for both commercial and industrial temperature ranges.', 'target_applications': 'Industrial automation, network appliances, and server-class applications.'}","{'extract_features': [{'input_tokens': 2332, 'output_tokens': 776, 'time_taken': 9.575997829437256}], 'generate_missing_features': [{'input_tokens': 3798, 'output_tokens': 99, 'time_taken': 4.090407133102417}, {'input_tokens': 4125, 'output_tokens': 101, 'time_taken': 3.4125661849975586}, {'input_tokens': 3807, 'output_tokens': 77, 'time_taken': 3.227073907852173}, {'input_tokens': 3878, 'output_tokens': 74, 'time_taken': 3.5199122428894043}], 'search_missing_features': [{'input_tokens': 0, 'output_tokens': 0, 'time_taken': 17.204904079437256}, {'input_tokens': 0, 'output_tokens': 0, 'time_taken': 16.9598970413208}, {'input_tokens': 0, 'output_tokens': 0, 'time_taken': 21.33024501800537}, {'input_tokens': 0, 'output_tokens': 0, 'time_taken': 19.20813012123108}], 'store_and_chunk_data': [{'input_tokens': 0, 'output_tokens': 0, 'time_taken': 1.4518442153930664}]}","[4, 4, 3, 2, 0]","[0, 0, 0, 0, 0]"
