id,extracted_data,usage_data,missing_feature_count_history,low_confidence_feature_count_history
CC-WMP157-KIT,"{'name': 'DIGI CONNECTCORE MP', 'manufacturer': 'DIGI INTERNATIONAL INC', 'form_factor': 'DIGI SMTPLUS', 'evaluation_or_commercialization': False, 'processor_architecture': 'ARM', 'processor_core_count': 'Dual', 'processor_manufacturer': 'STMICROELECTRONICS', 'processor_tdp': 'Not Available', 'memory': '512 MB DDR3L', 'onboard_storage': '512 MB SLC NAND Flash', 'input_voltage': '5 V', 'io_count': '176', 'wireless': ['Wi-Fi a/b/g/n/ac', 'Bluetooth'], 'operating_system_bsp': ['Linux', 'Digi Embedded Yocto'], 'operating_temperature_max': '85 C', 'operating_temperature_min': '-40 C', 'certifications': ['FCC', 'CE', 'IC', 'VCCI', 'RCM'], 'short_summary': 'Secure, connected system-on-module with dual-band Wi-Fi and Bluetooth.', 'full_summary': 'The Digi ConnectCore MP is a secure, connected system-on-module featuring dual-band Wi-Fi, Bluetooth, and a scalable platform for industrial and medical applications.', 'full_product_description': 'The Digi ConnectCore MP is an intelligent wireless secure embedded system-on-module family based on STM32MP1 microprocessors. It offers a highly integrated, secure, connected solution with dual-band Wi-Fi, Bluetooth, and Gigabit Ethernet connectivity. Designed for industrial and medical use, it provides high levels of security, reliability, and performance with a 10-year longevity.', 'target_applications': ['Industrial', 'Medical', 'IoT']}","{'extract_features': [{'input_tokens': 3173, 'output_tokens': 696, 'time_taken': 8.831646203994751}], 'generate_missing_features': [{'input_tokens': 3948, 'output_tokens': 78, 'time_taken': 2.4293949604034424}, {'input_tokens': 4136, 'output_tokens': 54, 'time_taken': 1.9436018466949463}, {'input_tokens': 4507, 'output_tokens': 30, 'time_taken': 1.6435589790344238}, {'input_tokens': 4507, 'output_tokens': 30, 'time_taken': 2.181597948074341}], 'search_missing_features': [{'input_tokens': 0, 'output_tokens': 0, 'time_taken': 34.53390097618103}, {'input_tokens': 0, 'output_tokens': 0, 'time_taken': 10.889807224273682}, {'input_tokens': 0, 'output_tokens': 0, 'time_taken': 11.56322693824768}, {'input_tokens': 0, 'output_tokens': 0, 'time_taken': 16.94321894645691}], 'store_and_chunk_data': [{'input_tokens': 0, 'output_tokens': 0, 'time_taken': 0.853503942489624}]}","[3, 2, 1, 1, 1]","[0, 0, 0, 0, 0]"
ARK-2121L-U0A1E,"{'name': 'ARK', 'manufacturer': 'ADVANTECH', 'form_factor': 'Fanless Embedded Box PC', 'evaluation_or_commercialization': False, 'processor_architecture': 'x86', 'processor_core_count': 'Quad Core', 'processor_manufacturer': 'INTEL', 'processor_tdp': '6.5 watts', 'memory': '8 GB DDR3L', 'onboard_storage': 'Supports mSATA and SATA HDD', 'input_voltage': '12 V DC', 'io_count': ['4 x USB', '2 x RS-232', '2 x RS-485', '2 x GbE LAN'], 'wireless': 'Supports WLAN or WWAN module', 'operating_system_bsp': 'Windows 10 IoT Enterprise 2019 LTSC 64bit', 'operating_temperature_max': '60 C', 'operating_temperature_min': '-20 C', 'certifications': 'FCC Class A', 'short_summary': 'The ARK is a fanless embedded box PC powered by Intel Celeron J1900 processor, offering multiple I/O interfaces and dual display support.', 'full_summary': 'The ARK series is an intelligent fanless embedded system powered by Intel Celeron J1900 Quad Core low power processor. It features multiple I/O interfaces, dual display support, and is designed for rugged environments with a wide temperature range.', 'full_product_description': 'The ARK is a rugged, multifunctional embedded box PC powered by Intel Celeron J1900 Quad Core processors. It is fanless, supports dual independent displays via VGA and HDMI, and offers a wide range of I/O interfaces including USB, RS-232, RS-485, and GbE LAN. It is designed for industrial applications with a wide operating temperature range and supports mSATA and SATA HDD storage options.', 'target_applications': ['Factory Automation', 'Machine Automation', 'Kiosks', 'Self-service Applications']}","{'extract_features': [{'input_tokens': 3902, 'output_tokens': 754, 'time_taken': 9.031261920928955}], 'generate_missing_features': [{'input_tokens': 3435, 'output_tokens': 99, 'time_taken': 4.506686210632324}, {'input_tokens': 3882, 'output_tokens': 34, 'time_taken': 2.300704002380371}], 'search_missing_features': [{'input_tokens': 0, 'output_tokens': 0, 'time_taken': 18.40952181816101}, {'input_tokens': 0, 'output_tokens': 0, 'time_taken': 12.284149885177612}], 'store_and_chunk_data': [{'input_tokens': 0, 'output_tokens': 0, 'time_taken': 0.8914508819580078}]}","[3, 1, 0]","[0, 0, 0]"
ESP32-DEVKITC-32D,{},"{'extract_features': [{'input_tokens': 3992, 'output_tokens': 688, 'time_taken': 8.259880065917969}], 'store_and_chunk_data': [{'input_tokens': 0, 'output_tokens': 0, 'time_taken': 0.9811279773712158}]}",[8],[0]
SOM-5788FG-S0A1E,"{'name': 'SOM COMEXPRESS BASIC MODULE', 'manufacturer': 'ADVANTECH CO LTD', 'form_factor': 'COMEXPRESS BASIC', 'evaluation_or_commercialization': False, 'processor_architecture': 'X86', 'processor_core_count': '6', 'processor_manufacturer': 'INTEL', 'processor_tdp': '45W', 'memory': 'DDR3 8GB', 'onboard_storage': 'Not Available', 'input_voltage': '12V', 'io_count': 'Not Available', 'wireless': 'Not Available', 'operating_system_bsp': ['Windows XP Professional', 'Other Windows OS', 'Linux'], 'operating_temperature_max': '60째C', 'operating_temperature_min': '0째C', 'certifications': ['CE', 'FCC Class A'], 'short_summary': 'A highly integrated multimedia COM module with Intel Core processors, supporting multiple display interfaces and high-definition audio.', 'full_summary': 'The SOM COMExpress Basic Module is a scalable, high-performance solution with Intel Core processors, supporting dual-channel LVDS, HDMI, DVI, and TV-out. It offers advanced I/O capacity with PCI Express, SATA, USB, and HD Audio interfaces.', 'full_product_description': 'The SOM COMExpress Basic Module integrates Intel Arrandale CPU and Ibex Peak-M chipset, supporting Intel Embedded Gen graphics and multiple display outputs. It features DDR3 memory up to 8GB, high-definition audio, and complies with the COMExpress Basic Module form factor.', 'target_applications': ['Embedded computing', 'Industrial applications', 'Multimedia systems']}","{'extract_features': [{'input_tokens': 4263, 'output_tokens': 682, 'time_taken': 10.691142320632935}], 'generate_missing_features': [{'input_tokens': 3963, 'output_tokens': 127, 'time_taken': 5.01961612701416}, {'input_tokens': 4339, 'output_tokens': 76, 'time_taken': 2.617926836013794}, {'input_tokens': 4304, 'output_tokens': 76, 'time_taken': 3.1753199100494385}], 'search_missing_features': [{'input_tokens': 0, 'output_tokens': 0, 'time_taken': 21.919528245925903}, {'input_tokens': 0, 'output_tokens': 0, 'time_taken': 11.847896099090576}, {'input_tokens': 0, 'output_tokens': 0, 'time_taken': 10.709702968597412}], 'store_and_chunk_data': [{'input_tokens': 0, 'output_tokens': 0, 'time_taken': 1.4156076908111572}]}","[5, 3, 3, 3]","[0, 0, 0, 0]"
tKINO-BW-N2-R10,"{'name': 'PPCF H SERIES', 'manufacturer': 'IEI', 'form_factor': 'Panel PC', 'evaluation_or_commercialization': False, 'processor_architecture': 'x86', 'processor_core_count': 'Quad Core', 'processor_manufacturer': 'Intel', 'processor_tdp': '35W', 'memory': 'Up to 32GB DDR4', 'onboard_storage': 'Supports HDD/SSD and mSATA', 'input_voltage': '100-240VAC or 12VDC', 'io_count': '2x RJ45, 4x USB 3.0, 2x USB 2.0, 1x HDMI, 2x RS232, 1x RS485, 1x MIC-in, 1x Line-out, 1x VGA', 'wireless': 'Optional Wi-Fi b/g/n', 'operating_system_bsp': 'Not Available', 'operating_temperature_max': '60째C', 'operating_temperature_min': '-10째C', 'certifications': 'CE, FCC', 'short_summary': 'Intelligent Industrial Panel PC with Intel H chipset, robust design, and multiple I/O options.', 'full_summary': 'The PPCF H Series is an intelligent industrial panel PC featuring a scalable Intel H chipset supporting LGA 1151 Intel 9th/8th generation Core i3/i5/i7, Pentium, and Celeron processors. It offers robust IP65 aluminum front bezel, dual full-size PCIe Mini card expansion, and various power input options.', 'full_product_description': ""The PPCF H Series Panel PC is designed for industrial applications, offering a robust and aesthetic ultrathin bezel with seamless panel mount installation. It supports Intel's 9th/8th generation processors with a 35W TDP, dual-channel DDR4 memory up to 32GB, and multiple storage options including HDD/SSD and mSATA. The system includes a variety of I/O ports, optional wireless capabilities, and is certified with CE and FCC standards."", 'target_applications': 'Industrial automation, HMI, and control systems.'}","{'extract_features': [{'input_tokens': 4133, 'output_tokens': 804, 'time_taken': 9.255783081054688}], 'generate_missing_features': [{'input_tokens': 4110, 'output_tokens': 32, 'time_taken': 4.535428762435913}, {'input_tokens': 4110, 'output_tokens': 32, 'time_taken': 1.3782660961151123}], 'search_missing_features': [{'input_tokens': 0, 'output_tokens': 0, 'time_taken': 12.72599482536316}, {'input_tokens': 0, 'output_tokens': 0, 'time_taken': 11.923594951629639}], 'store_and_chunk_data': [{'input_tokens': 0, 'output_tokens': 0, 'time_taken': 0.7657120227813721}]}","[1, 1, 1]","[0, 0, 0]"
