id,extracted_data,usage_data,missing_feature_count_history,low_confidence_feature_count_history
51009-0104-08-1,"{'name': 'SMARCSAMX', 'manufacturer': 'KONTRON', 'form_factor': 'SMARC', 'evaluation_or_commercialization': 'Not Available', 'processor_architecture': 'ARM', 'processor_core_count': 'Dual', 'processor_manufacturer': 'NXP', 'processor_tdp': 'Not Available', 'memory': 'Up to 4 GByte DDR3L', 'onboard_storage': 'Up to 64 GByte eMMC', 'input_voltage': '5V', 'io_count': 'Multiple USB, PCIe, Ethernet, LVDS, GPIO', 'wireless': 'Antenna connector for WiFI & Bluetooth', 'operating_system_bsp': 'Yocto Linux', 'operating_temperature_max': '85°C', 'operating_temperature_min': '-20°C', 'certifications': 'Not Available', 'short_summary': 'SMARC module with low power iMX series processor, dual-core, up to 4GB RAM, multiple I/O support.', 'full_summary': 'The SMARCSAMX is a SMARC module featuring an NXP iMX series processor with dual-core architecture, supporting up to 4GB DDR3L memory and 64GB eMMC storage. It offers extensive I/O options including USB, PCIe, Ethernet, and LVDS interfaces.', 'full_product_description': 'The SMARCSAMX module by Kontron is designed for low power applications, integrating an NXP iMX processor with dual-core capabilities. It supports up to 4GB of DDR3L memory and up to 64GB of onboard eMMC storage. The module provides a wide range of I/O interfaces such as USB, PCIe, Ethernet, and LVDS, making it suitable for various embedded applications. It operates within a temperature range of -20°C to 85°C and supports Yocto Linux as its operating system.', 'target_applications': 'Embedded systems, industrial automation, IoT devices'}","{'extract_features': [{'input_tokens': 1432, 'output_tokens': 753, 'time_taken': 9.615753889083862}], 'search_missing_features': [{'input_tokens': 0, 'output_tokens': 0, 'time_taken': 18.50302481651306}, {'input_tokens': 0, 'output_tokens': 0, 'time_taken': 24.304830074310303}, {'input_tokens': 0, 'output_tokens': 0, 'time_taken': 17.587313890457153}], 'generate_missing_features': [{'input_tokens': 3902, 'output_tokens': 111, 'time_taken': 3.2071619033813477}, {'input_tokens': 3515, 'output_tokens': 79, 'time_taken': 2.3334460258483887}, {'input_tokens': 3452, 'output_tokens': 79, 'time_taken': 3.551147222518921}], 'store_and_chunk_data': [{'input_tokens': 0, 'output_tokens': 0, 'time_taken': 0.7581009864807129}]}","[4, 3, 3, 3]","[0, 0, 0, 0]"
ARK-1122H-S6A1E,"{'name': 'ARK-1123H', 'manufacturer': 'ADVANTECH', 'form_factor': 'PALMSIZE', 'evaluation_or_commercialization': False, 'processor_architecture': 'X86', 'processor_core_count': 2, 'processor_manufacturer': 'INTEL', 'processor_tdp': '10 watts', 'memory': 'DDR3 1066MHz 4GB', 'onboard_storage': 'mSATA and/or SATA HDD bay', 'input_voltage': '12VDC', 'io_count': ['2x GbE', '4x USB 2.0', '2x RS-232', '1x VGA', '1x HDMI', 'Audio Line-in/Line-out'], 'wireless': 'Supports Wi-Fi via Mini PCIe', 'operating_system_bsp': ['Windows 7', 'Windows 8', 'Windows 10', 'WES 7', 'XP Embedded'], 'operating_temperature_max': '60°C', 'operating_temperature_min': '-20°C', 'certifications': ['RoHS', 'CE', 'FCC Class A', 'CCC', 'BSMI', 'CB', 'UL'], 'short_summary': 'Fanless embedded box PC with Intel Atom dual-core processor, supporting independent dual displays and wide temperature range.', 'full_summary': 'The ARK-1123H is a fanless embedded box PC featuring an Intel Atom dual-core processor, supporting independent dual displays via VGA and HDMI, with a wide operating temperature range and multiple mounting options.', 'full_product_description': 'The ARK-1123H is a compact, fanless embedded box PC designed for industrial applications. It features an Intel Atom N2600 dual-core processor, supports up to 4GB DDR3 memory, and offers flexible storage options with mSATA and SATA HDD bays. The device supports independent dual displays through VGA and HDMI interfaces, and includes a variety of I/O ports such as USB, RS-232, and audio. It is designed for wide temperature operation and offers multiple mounting options including VESA, DIN-rail, and wall mount.', 'target_applications': ['Industrial automation', 'Digital signage', 'Kiosk systems', 'Transportation']}","{'extract_features': [{'input_tokens': 1467, 'output_tokens': 854, 'time_taken': 45.413461208343506}], 'search_missing_features': [{'input_tokens': 0, 'output_tokens': 0, 'time_taken': 9.045373916625977}, {'input_tokens': 0, 'output_tokens': 0, 'time_taken': 25.35705304145813}], 'generate_missing_features': [{'input_tokens': 1902, 'output_tokens': 30, 'time_taken': 1.7321479320526123}, {'input_tokens': 3928, 'output_tokens': 32, 'time_taken': 2.04514479637146}], 'store_and_chunk_data': [{'input_tokens': 0, 'output_tokens': 0, 'time_taken': 0.643212080001831}]}","[1, 1, 0]","[0, 0, 0]"
UTC-620E-PE,"{'name': 'UTC RETAIL TOUCH COMPUTER', 'manufacturer': 'ADVANTECH', 'form_factor': 'ALL-IN-ONE', 'evaluation_or_commercialization': False, 'processor_architecture': 'X86', 'processor_core_count': '2', 'processor_manufacturer': 'INTEL', 'processor_tdp': 'Not Available', 'memory': '4 GB DDR3L', 'onboard_storage': '320 GB HDD', 'input_voltage': '100-240 V', 'io_count': ['2 x RS232 COM', '4 x USB', '2 x Gigabit Ethernet', '1 x VGA', '1 x HDMI/DP', '1 x Audio Line-out'], 'wireless': '802.11 a/b/g/n', 'operating_system_bsp': ['Windows Embedded', 'Linux Ubuntu'], 'operating_temperature_max': '40°C', 'operating_temperature_min': '0°C', 'certifications': ['CE', 'FCC', 'UL', 'CB', 'CCC', 'BSMI'], 'short_summary': 'Fanless all-in-one touch computer with Intel Core i5, 4GB RAM, and 320GB HDD.', 'full_summary': 'The UTC Retail Touch Computer is a fanless, all-in-one system featuring an Intel Core i5 processor, 4GB DDR3L RAM, and a 320GB HDD. It supports Windows Embedded and Linux Ubuntu, and offers a range of I/O ports including USB, Ethernet, and HDMI/DP. It is designed for retail self-service and interactive signage applications.', 'full_product_description': 'The UTC Retail Touch Computer by Advantech is designed for retail and self-service applications. It features a fanless design with an Intel Core i5 processor, 4GB DDR3L RAM, and a 320GB HDD. The system supports multiple operating systems including Windows Embedded and Linux Ubuntu. It includes a variety of I/O ports such as USB, Ethernet, and HDMI/DP, and offers wireless connectivity with 802.11 a/b/g/n. The device is compliant with CE, FCC, UL, CB, CCC, and BSMI certifications.', 'target_applications': ['Retail self-service', 'Interactive signage']}","{'extract_features': [{'input_tokens': 1372, 'output_tokens': 847, 'time_taken': 10.565593004226685}], 'search_missing_features': [{'input_tokens': 0, 'output_tokens': 0, 'time_taken': 13.414268255233765}, {'input_tokens': 0, 'output_tokens': 0, 'time_taken': 21.496142864227295}], 'generate_missing_features': [{'input_tokens': 4326, 'output_tokens': 30, 'time_taken': 4.082159042358398}, {'input_tokens': 4003, 'output_tokens': 30, 'time_taken': 1.979820966720581}], 'store_and_chunk_data': [{'input_tokens': 0, 'output_tokens': 0, 'time_taken': 0.9331591129302979}]}","[1, 1, 1]","[0, 0, 0]"
IMBA-H310-R10,"{'name': 'IMBA-H110', 'manufacturer': 'IEI', 'form_factor': 'ATX', 'evaluation_or_commercialization': False, 'processor_architecture': 'x86', 'processor_core_count': '4', 'processor_manufacturer': 'Intel', 'processor_tdp': 'Not Available', 'memory': 'Two 288-pin 2133 MHz Dual-Channel DDR4 SDRAM Unbuffered DIMMs supported up to 32GB', 'onboard_storage': 'Not Available', 'input_voltage': 'ATX/AT power supply', 'io_count': ['2 x USB 3.0 Gen1', '6 x USB 2.0', '6 x RS-232', '2 x LAN', '1 x VGA', '1 x DVI-D', '1 x DisplayPort', '1 x Audio Jack', '1 x Line-in', '1 x Line-out', '1 x Mic-in'], 'wireless': 'Not Available', 'operating_system_bsp': 'Windows 7/8.1/10, Linux Fedora 64bit', 'operating_temperature_max': '60°C', 'operating_temperature_min': '0°C', 'certifications': ['CE', 'FCC'], 'short_summary': 'Industrial ATX motherboard with Intel H110 chipset, supporting 6th/7th Gen Intel Core processors, dual independent displays, and multiple I/O interfaces.', 'full_summary': 'The IMBA-H110 is an industrial ATX motherboard designed for high performance and reliability. It supports 6th and 7th Generation Intel Core, Celeron, and Pentium processors, dual-channel DDR4 memory, and offers a wide range of I/O interfaces including USB 3.0, RS-232, and dual GbE LAN. It is suitable for applications requiring robust computing power and extensive connectivity.', 'full_product_description': 'The IMBA-H110 motherboard features the Intel H110 chipset, supporting LGA 1151 socket processors including Intel Core i3/i5/i7, Celeron, and Pentium. It offers dual-channel DDR4 memory slots supporting up to 32GB, triple independent display outputs (VGA, DVI-D, DisplayPort), and a variety of I/O options such as USB 3.0, RS-232, and dual LAN ports. The board is compliant with CE and FCC standards, ensuring high quality and reliability for industrial applications.', 'target_applications': ['Industrial Automation', 'Digital Signage', 'Kiosk Systems', 'Network Security Appliances']}","{'extract_features': [{'input_tokens': 1476, 'output_tokens': 891, 'time_taken': 11.464301109313965}], 'search_missing_features': [{'input_tokens': 0, 'output_tokens': 0, 'time_taken': 30.62655997276306}, {'input_tokens': 0, 'output_tokens': 0, 'time_taken': 27.48126220703125}, {'input_tokens': 0, 'output_tokens': 0, 'time_taken': 11.797023057937622}, {'input_tokens': 0, 'output_tokens': 0, 'time_taken': 12.434079885482788}], 'generate_missing_features': [{'input_tokens': 4102, 'output_tokens': 142, 'time_taken': 5.2463390827178955}, {'input_tokens': 4465, 'output_tokens': 102, 'time_taken': 4.043169975280762}, {'input_tokens': 4735, 'output_tokens': 77, 'time_taken': 3.7474939823150635}, {'input_tokens': 4754, 'output_tokens': 77, 'time_taken': 3.5306789875030518}], 'store_and_chunk_data': [{'input_tokens': 0, 'output_tokens': 0, 'time_taken': 0.6187148094177246}]}","[5, 4, 3, 3, 3]","[0, 0, 0, 0, 0]"
ARK-1123L-S3A1E,"{'name': 'ARKL', 'manufacturer': 'ADVANTECH', 'form_factor': 'Fanless Box PC', 'evaluation_or_commercialization': False, 'processor_architecture': 'x86', 'processor_core_count': 2, 'processor_manufacturer': 'Intel', 'processor_tdp': 'Not Available', 'memory': 'DDR3L 1600 MHz, Max Capacity 8 GB', 'onboard_storage': '1 x SATA HDD Bay, 1 x mSATA', 'input_voltage': '12 VDC', 'io_count': '2 x RS-232/422/485, 2 x USB 3.0, 2 x USB 2.0, 1 x VGA, 1 x GbE', 'wireless': 'WLAN, WWAN module support', 'operating_system_bsp': 'Windows 10 IoT, Linux', 'operating_temperature_max': '60°C', 'operating_temperature_min': '-20°C', 'certifications': 'CE, FCC Class A, CCC, BSMI, UL', 'short_summary': 'Fanless embedded box PC with Intel Atom E processor, dual core, supporting various I/O and expansion options.', 'full_summary': 'The ARKL is a fanless embedded box PC featuring an Intel Atom E dual-core processor. It supports a range of I/O interfaces including RS-232/422/485, USB, VGA, and GbE. The device is designed for industrial applications with options for WLAN and WWAN modules, and supports both Windows and Linux operating systems.', 'full_product_description': 'The ARKL fanless embedded box PC is equipped with an Intel Atom E dual-core SoC, offering robust performance for industrial applications. It includes a variety of I/O ports such as RS-232/422/485, USB 3.0, USB 2.0, VGA, and GbE. The device supports up to 8 GB of DDR3L memory and provides storage options with a SATA HDD bay and mSATA. It is designed for extended temperature operation and includes mounting options for VESA, DIN rail, and wall mounting.', 'target_applications': 'Industrial automation, IoT applications, embedded systems'}","{'extract_features': [{'input_tokens': 1474, 'output_tokens': 822, 'time_taken': 10.315822124481201}], 'search_missing_features': [{'input_tokens': 0, 'output_tokens': 0, 'time_taken': 14.330433130264282}, {'input_tokens': 0, 'output_tokens': 0, 'time_taken': 14.456495761871338}], 'generate_missing_features': [{'input_tokens': 2954, 'output_tokens': 30, 'time_taken': 2.704871892929077}, {'input_tokens': 2954, 'output_tokens': 30, 'time_taken': 3.0424070358276367}], 'store_and_chunk_data': [{'input_tokens': 0, 'output_tokens': 0, 'time_taken': 0.7717700004577637}]}","[1, 1, 1]","[0, 0, 0]"
