id,extracted_data,usage_data,missing_feature_count_history,low_confidence_feature_count_history
AIMB-782QG2-00A1E,"{'name': 'AIMB', 'manufacturer': 'ADVANTECH', 'form_factor': 'ATX', 'evaluation_or_commercialization': False, 'processor_architecture': 'x86', 'processor_core_count': '4', 'processor_manufacturer': 'INTEL', 'processor_tdp': '6W', 'memory': 'Up to 32GB DDR3', 'onboard_storage': '32Gb/s M.2', 'input_voltage': '12V DC-in', 'io_count': ['VGA', 'DVI', 'Dual GbE LAN', 'USB', 'Audio', 'Serial RS-232', 'PS/2'], 'wireless': 'Intel® 802.11ac WiFi Module, Bluetooth 4.2', 'operating_system_bsp': 'Win10/Ubuntu', 'operating_temperature_max': '60° C', 'operating_temperature_min': '0° C', 'certifications': 'EMC, CE, FCC', 'short_summary': 'Industrial motherboard with Intel Core processors, ATX form factor, dual display support, and extensive I/O options.', 'full_summary': 'The AIMB is an industrial motherboard designed for high-performance applications, featuring Intel Core processors, ATX form factor, dual display support via VGA and DVI, dual GbE LAN, and a variety of I/O interfaces including USB, audio, and serial ports.', 'full_product_description': ""The AIMB motherboard supports Intel's 3rd generation Core processors and Pentium series, with a Q chipset. It offers four DIMM sockets for up to 32GB of DDR3 memory, dual display outputs, dual GbE LAN, and a comprehensive set of I/O ports. Expansion options include multiple PCI and PCIe slots, making it suitable for a range of industrial applications."", 'target_applications': 'Industrial automation, embedded systems, digital signage, and other high-performance computing applications.'}","{'extract_features': [{'input_tokens': 1498, 'output_tokens': 726, 'time_taken': 11.305755138397217}], 'generate_missing_features': [{'input_tokens': 4191, 'output_tokens': 230, 'time_taken': 9.903934240341187}, {'input_tokens': 4005, 'output_tokens': 98, 'time_taken': 2.396821975708008}, {'input_tokens': 2543, 'output_tokens': 35, 'time_taken': 3.34072208404541}], 'store_and_chunk_data': [{'input_tokens': 0, 'output_tokens': 0, 'time_taken': 8.285380125045776}], 'search_missing_features': [{'input_tokens': 0, 'output_tokens': 0, 'time_taken': 29.574461936950684}, {'input_tokens': 0, 'output_tokens': 0, 'time_taken': 42.67663598060608}, {'input_tokens': 0, 'output_tokens': 0, 'time_taken': 38.05915689468384}]}","[9, 3, 1, 0]","[0, 0, 0, 0]"
iW-G53M-OMUL-4D001G-E008G-BIA,{},"{'extract_features': [{'input_tokens': 1791, 'output_tokens': 841, 'time_taken': 13.854653120040894}], 'generate_missing_features': [{'input_tokens': 3089, 'output_tokens': 66, 'time_taken': 3.124382257461548}, {'input_tokens': 4664, 'output_tokens': 30, 'time_taken': 3.4853909015655518}], 'store_and_chunk_data': [{'input_tokens': 0, 'output_tokens': 0, 'time_taken': 7.213032960891724}], 'search_missing_features': [{'input_tokens': 0, 'output_tokens': 0, 'time_taken': 27.119078159332275}]}","[2, 1, 1]","[0, 0, 0]"
SOM-7569BC0CC-S3B2,{},"{'extract_features': [{'input_tokens': 1673, 'output_tokens': 685, 'time_taken': 12.465553045272827}], 'generate_missing_features': [{'input_tokens': 3949, 'output_tokens': 99, 'time_taken': 4.467991828918457}, {'input_tokens': 4443, 'output_tokens': 100, 'time_taken': 7.5137059688568115}], 'store_and_chunk_data': [{'input_tokens': 0, 'output_tokens': 0, 'time_taken': 7.767072916030884}], 'search_missing_features': [{'input_tokens': 0, 'output_tokens': 0, 'time_taken': 24.97520399093628}]}","[4, 4, 3]","[0, 0, 0]"
MIO-2360N-S1A1E,"{'name': 'MIO EXTENSION SBC', 'manufacturer': 'ADVANTECH', 'form_factor': 'PICOITX', 'evaluation_or_commercialization': False, 'processor_architecture': 'X86', 'processor_core_count': 'QuadCore', 'processor_manufacturer': 'INTEL', 'processor_tdp': '6W, 9W, 12W', 'memory': '8GB DDR3L SODIMM', 'onboard_storage': 'mSATA', 'input_voltage': '12V DC', 'io_count': ['VGA', 'HDMI', 'USB', 'RS232', 'RS485', 'SMBus', 'GPIO'], 'wireless': 'Supported via M.2 E-Key for 2230 module', 'operating_system_bsp': ['Windows', 'VxWorks', 'Linux'], 'operating_temperature_max': '60C', 'operating_temperature_min': '0C', 'certifications': 'CE, FCC Class B', 'short_summary': 'Compact PicoITX SBC with Intel processors and rich I/O interfaces.', 'full_summary': 'The MIO Extension SBC is a compact PicoITX board featuring Intel Pentium, Celeron, and Atom processors. It supports dual independent displays, multiple I/O interfaces, and is suitable for embedded applications.', 'full_product_description': 'The MIO Extension SBC offers a flexible design with integrated multiple I/O using the MIOe approach, supporting vertical applications. It includes Intel processors, DDR3L memory, mSATA storage, and various connectivity options such as VGA, HDMI, USB, and RS232/485.', 'target_applications': ['Embedded systems', 'Industrial automation', 'IoT applications']}","{'extract_features': [{'input_tokens': 1648, 'output_tokens': 717, 'time_taken': 8.64307975769043}], 'generate_missing_features': [{'input_tokens': 4006, 'output_tokens': 103, 'time_taken': 4.733371019363403}], 'store_and_chunk_data': [{'input_tokens': 0, 'output_tokens': 0, 'time_taken': 11.589546918869019}], 'search_missing_features': [{'input_tokens': 0, 'output_tokens': 0, 'time_taken': 44.06498408317566}]}","[3, 0]","[0, 0]"
ARK-2150L-S4A1E,"{'name': 'FANLESS EMBEDDED BOX PC', 'manufacturer': 'ADVANTECH', 'form_factor': 'BOX PC', 'evaluation_or_commercialization': False, 'processor_architecture': 'X86', 'processor_core_count': '2', 'processor_manufacturer': 'INTEL', 'processor_tdp': '15 watts', 'memory': 'Up to 16GB DDR3L', 'onboard_storage': 'Supports one internal mSATA socket, one SATA HDD Bay', 'input_voltage': '12 VDC', 'io_count': '4 x USB 3.0, 2 x USB 2.0, 4 x COM ports, 2 x GbE LAN', 'wireless': 'Wi-Fi/Bluetooth, 3g and GPS', 'operating_system_bsp': ['Microsoft Windows 7', 'Windows 8', 'Windows Embedded', 'XP Professional', 'XP Embedded', 'Linux Ubuntu'], 'operating_temperature_max': '60°C', 'operating_temperature_min': '-20°C', 'certifications': ['CE', 'FCC Class A', 'CCC', 'BSMI', 'UL'], 'short_summary': 'Fanless Embedded Box PC with Intel Core and Celeron processors, dual independent display support.', 'full_summary': 'The Fanless Embedded Box PC features Intel Core and Celeron processors, dual independent display support via VGA, HDMI, and DisplayPort, and a robust set of I/O interfaces including USB, COM ports, and GbE LAN. It supports a wide range of operating systems and is designed for industrial applications with extended temperature range and multiple mounting options.', 'full_product_description': 'This Fanless Embedded Box PC is equipped with Intel Core and Celeron processors, offering dual independent display capabilities through VGA, HDMI, and DisplayPort. It supports up to 16GB DDR3L memory and provides flexible storage options with an internal mSATA socket and a SATA HDD Bay. The device includes a comprehensive set of I/O interfaces, such as USB 3.0, USB 2.0, COM ports, and dual GbE LAN, making it suitable for various industrial applications. It operates within a temperature range of -20°C to 60°C and complies with multiple safety and EMC standards.', 'target_applications': ['Industrial Automation', 'Digital Signage', 'Kiosk', 'Transportation']}","{'extract_features': [{'input_tokens': 1639, 'output_tokens': 839, 'time_taken': 12.141383171081543}], 'generate_missing_features': [{'input_tokens': 4432, 'output_tokens': 63, 'time_taken': 5.009754180908203}, {'input_tokens': 4551, 'output_tokens': 32, 'time_taken': 1.9910390377044678}], 'store_and_chunk_data': [{'input_tokens': 0, 'output_tokens': 0, 'time_taken': 8.917134046554565}], 'search_missing_features': [{'input_tokens': 0, 'output_tokens': 0, 'time_taken': 35.041584730148315}, {'input_tokens': 0, 'output_tokens': 0, 'time_taken': 38.934524059295654}]}","[2, 1, 0]","[0, 0, 0]"
