id,extracted_data,usage_data,missing_feature_count_history,low_confidence_feature_count_history
IMBA-Q170-i2-R10,"{'name': 'IMBA-Q370', 'manufacturer': 'IEI', 'form_factor': 'ATX', 'evaluation_or_commercialization': False, 'processor_architecture': 'x86', 'processor_core_count': '4', 'processor_manufacturer': 'Intel', 'processor_tdp': '35W to 65W', 'memory': 'Four DDR4 DIMMs, up to 64GB', 'onboard_storage': '6 x SATA 6Gb/s (RAID 0/1/5/10 supported)', 'input_voltage': '+12V, +5V, +3.3V', 'io_count': ['6 x USB 3.1 Gen 2', '6 x USB 2.0', '6 x SATA 6Gb/s', '2 x LAN', '1 x HDMI', '1 x VGA', '1 x DVI-D', '1 x iDP'], 'wireless': 'Bluetooth, WiFi', 'operating_system_bsp': 'Not Available', 'operating_temperature_max': '60°C', 'operating_temperature_min': '0°C', 'certifications': ['CE', 'FCC', 'RoHS'], 'short_summary': 'ATX motherboard with Intel Q370 chipset, supports 8th/9th Gen Intel Core processors, triple display, dual LAN, and USB 3.1 Gen 2.', 'full_summary': 'The IMBA-Q370 is an industrial ATX motherboard featuring the Intel Q370 chipset. It supports 8th and 9th generation Intel Core processors, offering robust performance for industrial applications. The board supports triple independent displays via HDMI, VGA, and DVI-D, and provides extensive connectivity options including dual Intel GbE LAN, multiple USB ports, and SATA interfaces.', 'full_product_description': ""The IMBA-Q370 motherboard is designed for industrial applications, supporting Intel's 8th and 9th generation Core i3/i5/i7, Pentium, and Celeron processors. It features four DDR4 DIMM slots for up to 64GB of memory, triple display outputs, dual Intel GbE LAN ports, and a variety of I/O interfaces including USB 3.1 Gen 2, USB 2.0, SATA 6Gb/s, and PCIe expansion slots. The board is compliant with CE, FCC, and RoHS standards, ensuring reliability and safety in various environments."", 'target_applications': ['Industrial automation', 'Digital signage', 'Surveillance systems', 'Embedded computing']}","{'generate_missing_features': [{'input_tokens': 3488, 'output_tokens': 154, 'time_taken': 4.2514190673828125}, {'input_tokens': 4575, 'output_tokens': 139, 'time_taken': 3.2687039375305176}, {'input_tokens': 4522, 'output_tokens': 104, 'time_taken': 3.8324108123779297}, {'input_tokens': 4550, 'output_tokens': 111, 'time_taken': 2.921504020690918}, {'input_tokens': 4113, 'output_tokens': 75, 'time_taken': 4.20126485824585}], 'store_and_chunk_data': [{'input_tokens': 0, 'output_tokens': 0, 'time_taken': 0.6269388198852539}], 'extract_features': [{'input_tokens': 1744, 'output_tokens': 866, 'time_taken': 9.518280029296875}], 'search_missing_features': [{'input_tokens': 0, 'output_tokens': 0, 'time_taken': 14.321027994155884}, {'input_tokens': 0, 'output_tokens': 0, 'time_taken': 11.710480690002441}, {'input_tokens': 0, 'output_tokens': 0, 'time_taken': 12.228954076766968}, {'input_tokens': 0, 'output_tokens': 0, 'time_taken': 17.137037754058838}, {'input_tokens': 0, 'output_tokens': 0, 'time_taken': 19.513487815856934}]}","[6, 5, 4, 4, 2, 1]","[0, 0, 0, 0, 0, 0]"
IMB-ADL-H610,"{'name': 'IMBADLH', 'manufacturer': 'IEI', 'form_factor': 'MICRO ATX', 'evaluation_or_commercialization': False, 'processor_architecture': 'X86', 'processor_core_count': 'Up to 16 cores', 'processor_manufacturer': 'INTEL', 'processor_tdp': '125W', 'memory': 'DUAL CHANNEL DDR4, MAX 64GB', 'onboard_storage': 'M.2 Socket 3 Interface for SATA/PCIe Mode SSD support', 'input_voltage': 'ATX', 'io_count': ['6 x USB 3.2 Gen 1', '4 x USB 2.0', '2 x RS-232', '1 x HDMI', '1 x DP', '1 x iDPM slot'], 'wireless': 'M.2 Socket 1 Interface for WIFI+BT Module Support', 'operating_system_bsp': 'Not Available', 'operating_temperature_max': '60°C', 'operating_temperature_min': '0°C', 'certifications': ['CE', 'FCC', 'RoHS'], 'short_summary': ""The IMBADLH is a micro ATX motherboard supporting Intel's 12th/13th Gen processors with rich I/O and triple display support."", 'full_summary': ""The IMBADLH motherboard by IEI supports Intel's Alder Lake-S and Raptor Lake-S processors, offering dual-channel DDR4 memory, multiple PCIe slots, and triple independent display outputs."", 'full_product_description': ""The IMBADLH is a micro ATX motherboard designed for industrial applications, featuring support for Intel's 12th and 13th generation processors. It includes dual-channel DDR4 memory slots, multiple PCIe expansion slots, and supports triple independent displays via DP, HDMI, and iDPM slot. The board is equipped with Intel's I225V and I219LM Ethernet controllers for high-speed networking and offers a variety of I/O interfaces including USB 3.2 Gen 1, USB 2.0, and RS-232."", 'target_applications': ['Industrial Automation', 'Digital Signage', 'Embedded Systems']}","{'generate_missing_features': [{'input_tokens': 4223, 'output_tokens': 108, 'time_taken': 2.756927967071533}, {'input_tokens': 4379, 'output_tokens': 107, 'time_taken': 3.952004909515381}, {'input_tokens': 4237, 'output_tokens': 32, 'time_taken': 4.533547639846802}, {'input_tokens': 4237, 'output_tokens': 32, 'time_taken': 4.758590936660767}], 'store_and_chunk_data': [{'input_tokens': 0, 'output_tokens': 0, 'time_taken': 0.9002881050109863}], 'extract_features': [{'input_tokens': 1914, 'output_tokens': 790, 'time_taken': 8.600264072418213}], 'search_missing_features': [{'input_tokens': 0, 'output_tokens': 0, 'time_taken': 21.68031883239746}, {'input_tokens': 0, 'output_tokens': 0, 'time_taken': 15.5312180519104}, {'input_tokens': 0, 'output_tokens': 0, 'time_taken': 37.23368501663208}, {'input_tokens': 0, 'output_tokens': 0, 'time_taken': 17.4847309589386}]}","[4, 3, 1, 1, 1]","[0, 0, 0, 0, 0]"
PCM-9562N-S6A1E,"{'name': 'PCM-NSAE', 'manufacturer': 'ADVANTECH', 'form_factor': 'EBX', 'evaluation_or_commercialization': False, 'processor_architecture': 'x86', 'processor_core_count': 'Single Core/Dual Core', 'processor_manufacturer': 'INTEL', 'processor_tdp': '6W/6W/12W/9W/6W up to 45W', 'memory': 'DDR2 667 MHz, Max Capacity 2GB, 1 x 200-pin SODIMM', 'onboard_storage': 'CompactFlash Type III, SATA II', 'input_voltage': 'ATX: 5V, 5VSB', 'io_count': 'Serial x 6 (RS-232/422/485), USB x 8, Ethernet x 3, GPIO 8-bit', 'wireless': '802.11 b/g', 'operating_system_bsp': ['Windows XP Embedded', 'Windows CE', 'QNX', 'VxWorks', 'Linux Ubuntu'], 'operating_temperature_max': '60°C', 'operating_temperature_min': '0°C', 'certifications': 'UL', 'short_summary': 'Embedded Single Board Computer with Intel Atom N/D processor, supporting multiple I/O and expansion options.', 'full_summary': 'The PCM-NSAE is an embedded single board computer featuring the Intel Atom N/D processor, offering a range of I/O interfaces including multiple serial ports, USB, and Ethernet. It supports DDR2 memory and various storage options, making it suitable for industrial applications.', 'full_product_description': 'The PCM-NSAE is designed for industrial applications, equipped with an Intel Atom N/D processor, supporting DDR2 memory up to 2GB. It includes a variety of I/O options such as 6 serial ports, 8 USB ports, and 3 Ethernet ports. The board supports CompactFlash and SATA storage, and is compliant with UL standards. It operates within a temperature range of 0°C to 60°C.', 'target_applications': ['Industrial Automation', 'Embedded Systems', 'Networking']}","{'generate_missing_features': [{'input_tokens': 4456, 'output_tokens': 72, 'time_taken': 2.197627067565918}, {'input_tokens': 3945, 'output_tokens': 29, 'time_taken': 2.7805261611938477}, {'input_tokens': 3865, 'output_tokens': 34, 'time_taken': 3.1718599796295166}], 'store_and_chunk_data': [{'input_tokens': 0, 'output_tokens': 0, 'time_taken': 0.9554181098937988}], 'extract_features': [{'input_tokens': 1856, 'output_tokens': 773, 'time_taken': 8.415150880813599}], 'search_missing_features': [{'input_tokens': 0, 'output_tokens': 0, 'time_taken': 22.84518814086914}, {'input_tokens': 0, 'output_tokens': 0, 'time_taken': 16.625181913375854}, {'input_tokens': 0, 'output_tokens': 0, 'time_taken': 19.649320125579834}]}","[2, 1, 1, 0]","[0, 0, 0, 0]"
AIMB-705G2-00A3,"{'name': 'AIMB', 'manufacturer': 'ADVANTECH', 'form_factor': 'ATX', 'evaluation_or_commercialization': False, 'processor_architecture': 'x86', 'processor_core_count': '4', 'processor_manufacturer': 'INTEL', 'processor_tdp': '6W', 'memory': 'Dual Channel Non-ECC DDR4, Max Capacity 64GB', 'onboard_storage': 'Supports 2242/2260/2280/22110 storage devices', 'input_voltage': '12V', 'io_count': 'VGA, DVI, USB, COM, Ethernet', 'wireless': 'Intel® 802.11ac WiFi Module, Supports IEEE 802.11a/b/g/n/ac, Dual-Band (2.4/5 GHz), Bluetooth 4.2 / 3.0', 'operating_system_bsp': 'Windows (only with Intel 8th generation processor)', 'operating_temperature_max': '60°C', 'operating_temperature_min': '0°C', 'certifications': 'ISO 9001, ISO 14001, ISO 13485, IEC60601-1, IPC-A-610G Class 3, MIL-STD-810', 'short_summary': 'Industrial motherboard supporting Intel 8th generation processors with ATX form factor.', 'full_summary': 'The AIMB series industrial motherboards support Intel 8th generation Core processors, offering dual channel non-ECC DDR4 memory, multiple I/O interfaces including VGA, DVI, USB, and COM ports, and are designed for commercial use.', 'full_product_description': 'The AIMB industrial motherboards by Advantech are designed for robust performance with Intel 8th generation Core processors. They feature an ATX form factor, dual channel non-ECC DDR4 memory support up to 64GB, and a variety of I/O options including VGA, DVI, USB, and COM ports. These motherboards are suitable for commercial applications and support Windows OS with specific processor configurations.', 'target_applications': 'Industrial automation, commercial computing solutions'}","{'generate_missing_features': [{'input_tokens': 3985, 'output_tokens': 123, 'time_taken': 3.7575812339782715}, {'input_tokens': 3967, 'output_tokens': 120, 'time_taken': 3.1673381328582764}, {'input_tokens': 3558, 'output_tokens': 68, 'time_taken': 4.001043081283569}, {'input_tokens': 4143, 'output_tokens': 64, 'time_taken': 3.518676996231079}], 'store_and_chunk_data': [{'input_tokens': 0, 'output_tokens': 0, 'time_taken': 1.077394962310791}], 'extract_features': [{'input_tokens': 1700, 'output_tokens': 705, 'time_taken': 7.891970872879028}], 'search_missing_features': [{'input_tokens': 0, 'output_tokens': 0, 'time_taken': 18.030566930770874}, {'input_tokens': 0, 'output_tokens': 0, 'time_taken': 23.854450941085815}, {'input_tokens': 0, 'output_tokens': 0, 'time_taken': 14.139432191848755}, {'input_tokens': 0, 'output_tokens': 0, 'time_taken': 50.492703914642334}]}","[5, 3, 2, 1, 0]","[0, 0, 0, 0, 0]"
AIMB-706VG-00A2,"{'name': 'AIMB', 'manufacturer': 'ADVANTECH', 'form_factor': 'ATX', 'evaluation_or_commercialization': False, 'processor_architecture': 'Not Available', 'processor_core_count': '4', 'processor_manufacturer': 'INTEL', 'processor_tdp': '35W', 'memory': 'Dual Channel Non-ECC DDR3 32GB', 'onboard_storage': 'Not Available', 'input_voltage': '12V', 'io_count': ['VGA', 'DVI', 'USB 3.2 Gen 1', 'USB 2.0', 'RS-232', 'RS-422/485', 'PCIe x16', 'PCIe x4', 'PCI'], 'wireless': 'Not Available', 'operating_system_bsp': 'Windows', 'operating_temperature_max': '60°C', 'operating_temperature_min': '0°C', 'certifications': 'Not Available', 'short_summary': 'Industrial motherboard with Intel H chipset, supporting Intel Core processors, dual channel DDR3 memory, and multiple I/O interfaces.', 'full_summary': ""The AIMB industrial motherboard features Intel's H chipset, supporting the latest Intel Core processors. It offers dual channel DDR3 memory up to 32GB, and a variety of I/O interfaces including VGA, DVI, USB, and serial ports, making it suitable for industrial applications."", 'full_product_description': ""The AIMB motherboard is designed for industrial applications, featuring Intel's H chipset and support for Intel Core processors. It includes dual channel DDR3 memory support up to 32GB, and a comprehensive range of I/O interfaces such as VGA, DVI, USB 3.2 Gen 1, USB 2.0, RS-232, RS-422/485, PCIe x16, PCIe x4, and PCI slots. The board is equipped with Intel HD Graphics and supports Windows operating systems. It operates within a temperature range of 0°C to 60°C."", 'target_applications': ['Industrial automation', 'Embedded systems', 'Digital signage', 'Networking']}","{'generate_missing_features': [{'input_tokens': 4109, 'output_tokens': 125, 'time_taken': 3.262176990509033}, {'input_tokens': 3732, 'output_tokens': 100, 'time_taken': 3.964750051498413}, {'input_tokens': 3530, 'output_tokens': 100, 'time_taken': 3.8832991123199463}], 'store_and_chunk_data': [{'input_tokens': 0, 'output_tokens': 0, 'time_taken': 1.0588710308074951}], 'extract_features': [{'input_tokens': 1704, 'output_tokens': 807, 'time_taken': 11.275884866714478}], 'search_missing_features': [{'input_tokens': 0, 'output_tokens': 0, 'time_taken': 25.480827808380127}, {'input_tokens': 0, 'output_tokens': 0, 'time_taken': 9.677062273025513}, {'input_tokens': 0, 'output_tokens': 0, 'time_taken': 19.019073963165283}]}","[5, 4, 4, 4]","[0, 0, 0, 0]"
