id,extracted_data,usage_data,missing_feature_count_history,low_confidence_feature_count_history
AMI222AF,"{'name': 'FANLESS BOX SYSTEM', 'manufacturer': 'IBASE', 'form_factor': 'COMPACT EXPANDABLE', 'evaluation_or_commercialization': False, 'processor_architecture': 'x86', 'processor_core_count': '4', 'processor_manufacturer': 'INTEL', 'processor_tdp': '35W', 'memory': '8GB DDR4 SODIMM', 'onboard_storage': '128GB MLC SSD', 'input_voltage': '12V', 'io_count': ['2x DVI-D', '1x VGA', '2x Audio jack', '6x USB ports', '2x RJ45 Gigabit Ethernet', '4x RS232/422/485 ports'], 'wireless': 'WLAN/4G/5G connections', 'operating_system_bsp': 'Multiple OS support', 'operating_temperature_max': '60°C', 'operating_temperature_min': '-20°C', 'certifications': ['CE', 'FCC Class B'], 'short_summary': 'Fanless, compact, expandable system with Intel Core processors and multiple I/O options.', 'full_summary': 'The IBASE Fanless Box System is a compact and expandable system featuring Intel Core i3/i5/i7 desktop processors with a 35W TDP. It supports three independent display outputs, dual SIM slots for WWAN redundancy, and RAID support. The system is designed for industrial applications with a wide range of I/O interfaces and robust construction.', 'full_product_description': ""The IBASE Fanless Box System is engineered for industrial applications requiring robust performance and reliability. It features a fanless design with Intel's 8th/9th Gen Core i3/i5/i7 processors, offering up to 4 cores and 8 threads. The system supports up to 32GB DDR4 memory and includes multiple storage options such as HDD/SSD and mSATA. It provides extensive I/O connectivity, including USB, Ethernet, and serial ports, and is certified for CE and FCC Class B standards."", 'target_applications': ['Industrial Automation', 'Digital Signage', 'Network Security', 'Transportation']}","{'extract_features': [{'input_tokens': 1399, 'output_tokens': 814, 'time_taken': 8.92728066444397}], 'store_and_chunk_data': [{'input_tokens': 0, 'output_tokens': 0, 'time_taken': 1.2461659908294678}], 'search_missing_features': [{'input_tokens': 0, 'output_tokens': 0, 'time_taken': 28.59278392791748}], 'generate_missing_features': [{'input_tokens': 4516, 'output_tokens': 67, 'time_taken': 2.1729390621185303}]}","[2, 0]","[0, 0]"
ARK-DS262GB-S6A1E,"{'name': 'ARKDS', 'manufacturer': 'ADVANTECH', 'form_factor': 'OPS', 'evaluation_or_commercialization': False, 'processor_architecture': 'x86', 'processor_core_count': '24', 'processor_manufacturer': 'INTEL', 'processor_tdp': '28W (passive cooled)', 'memory': 'Up to 16 GB DDR3', 'onboard_storage': 'SATA III HDD/SSD support', 'input_voltage': '12V', 'io_count': 'JAE TX25 pin, JAE TX30 pin, HDMI, LAN RJ45, USB 2.0, Audio Line-out, COM RS232', 'wireless': 'Optional WiFi b/g/n MiniPCIe module', 'operating_system_bsp': ['Microsoft Windows', 'Windows Embedded Standard', 'XP Embedded', 'Linux Fedora'], 'operating_temperature_max': '60°C', 'operating_temperature_min': '0°C', 'certifications': ['CE', 'FCC Class B', 'CCC', 'BSMI', 'C-Tick', 'UL'], 'short_summary': 'Intel Core OPS Digital Signage Platform with HDMI, eDP, and multiple I/O interfaces.', 'full_summary': 'The ARKDS is a digital signage platform based on 3rd generation Intel Core processors, compliant with the OPS standard, supporting HDMI, eDP, and various I/O interfaces for flexible integration.', 'full_product_description': 'The ARKDS platform features 3rd generation Intel Core processors, Intel QM77 chipset, and supports up to 16 GB DDR3 memory. It offers multiple I/O options including HDMI, LAN, USB, and audio interfaces, with optional wireless connectivity. The platform is designed for easy maintenance and integration, compliant with Energy Star standards.', 'target_applications': ['Digital Signage', 'Interactive Kiosks', 'Information Displays']}","{'extract_features': [{'input_tokens': 1512, 'output_tokens': 743, 'time_taken': 8.599277973175049}], 'store_and_chunk_data': [{'input_tokens': 0, 'output_tokens': 0, 'time_taken': 1.4764583110809326}], 'search_missing_features': [{'input_tokens': 0, 'output_tokens': 0, 'time_taken': 23.43708324432373}, {'input_tokens': 0, 'output_tokens': 0, 'time_taken': 35.1641800403595}], 'generate_missing_features': [{'input_tokens': 3731, 'output_tokens': 55, 'time_taken': 3.272413969039917}, {'input_tokens': 4288, 'output_tokens': 36, 'time_taken': 1.729773998260498}]}","[2, 1, 0]","[0, 0, 0]"
RKCONS1901,"{'name': 'RKCONS', 'manufacturer': 'STARTECHCOM', 'form_factor': 'RACKMOUNT', 'evaluation_or_commercialization': False, 'processor_architecture': 'Intel 64', 'processor_core_count': '14', 'processor_manufacturer': 'Intel', 'processor_tdp': '45 W', 'memory': '64 GB', 'onboard_storage': 'M.2 NVMe (PCIe 4.0 x2) slots', 'input_voltage': 'AC', 'io_count': 'VGA, USB', 'wireless': 'Intel AX211, Qualcomm WCN6856', 'operating_system_bsp': 'Not Available', 'operating_temperature_max': '50 C', 'operating_temperature_min': '0 C', 'certifications': 'CE/FCC', 'short_summary': 'Rackmount KVM console with VGA and USB support, featuring a durable steel design.', 'full_summary': 'The RKCONS is a rackmount KVM console providing keyboard, monitor, and mouse control for single or multiple servers. It features a built-in keyboard, touchpad, and an LCD display supporting various resolutions. The console is designed for space efficiency and durability, with a steel housing and integrated power supply.', 'full_product_description': 'This rackmount KVM console, model RKCONS, offers complete control over servers with a built-in keyboard, touchpad, and LCD monitor. It supports VGA and USB interfaces and is designed to fit in a 1U rack space. The console is made from durable steel and includes features like a handle for easy sliding and an integrated power supply. It is backed by a StarTechcom 2-year warranty and lifetime technical support.', 'target_applications': 'Server management, data centers, IT infrastructure.'}","{'extract_features': [{'input_tokens': 1369, 'output_tokens': 687, 'time_taken': 7.365462064743042}], 'store_and_chunk_data': [{'input_tokens': 0, 'output_tokens': 0, 'time_taken': 1.6333699226379395}], 'search_missing_features': [{'input_tokens': 0, 'output_tokens': 0, 'time_taken': 22.753817081451416}, {'input_tokens': 0, 'output_tokens': 0, 'time_taken': 30.094104051589966}, {'input_tokens': 0, 'output_tokens': 0, 'time_taken': 23.965418100357056}, {'input_tokens': 0, 'output_tokens': 0, 'time_taken': 21.697362899780273}, {'input_tokens': 0, 'output_tokens': 0, 'time_taken': 19.869404077529907}], 'generate_missing_features': [{'input_tokens': 4383, 'output_tokens': 223, 'time_taken': 5.467605829238892}, {'input_tokens': 4365, 'output_tokens': 206, 'time_taken': 3.9354500770568848}, {'input_tokens': 4178, 'output_tokens': 88, 'time_taken': 3.456818103790283}, {'input_tokens': 3944, 'output_tokens': 56, 'time_taken': 3.3729281425476074}, {'input_tokens': 3944, 'output_tokens': 72, 'time_taken': 6.431575059890747}]}","[9, 8, 3, 2, 2, 1]","[0, 0, 0, 0, 0, 0]"
CPU-162-22-01,"{'name': 'CPU COM EXPRESS BASIC TYPE', 'manufacturer': 'EUROTECH', 'form_factor': 'COM EXPRESS BASIC', 'evaluation_or_commercialization': False, 'processor_architecture': 'x86', 'processor_core_count': '4', 'processor_manufacturer': 'INTEL', 'processor_tdp': '15W', 'memory': 'Up to 32GB DDR4 2400MHz Dual Channel', 'onboard_storage': 'Not Available', 'input_voltage': '12V', 'io_count': ['1 Gbit Ethernet', '4 SATA', '4 USB 2.0', '8 USB 3.0', '8-16 PCIe Gen 3 lanes', '3 independent video ports'], 'wireless': 'Not Available', 'operating_system_bsp': ['Windows IoT Enterprise', 'Linux', 'Yocto', 'Fedora', 'RTOS', 'Everyware Software Framework'], 'operating_temperature_max': '85°C', 'operating_temperature_min': '-40°C', 'certifications': ['RoHS', 'REACH', 'PICMG COM Express R2.1'], 'short_summary': 'Rugged COM Express module with Intel Core/Celeron processors, supporting wide temperature range and IoT integration.', 'full_summary': 'The CPU COM Express Basic Type module features Intel Core and Celeron processors, offering dual and quad-core configurations. It supports a wide range of interfaces including PCIe lanes, SATA, and multiple video outputs, designed for industrial and rugged applications.', 'full_product_description': ""The Eurotech CPU COM Express Basic Type module is designed for industrial applications requiring robust performance and reliability. It features Intel's latest generation Core and Celeron processors, supports up to 32GB DDR4 RAM, and offers extensive I/O options including Ethernet, SATA, USB, and PCIe. The module is compliant with PICMG COM Express R2.1 standards and supports a wide operating temperature range, making it suitable for harsh environments."", 'target_applications': ['Industrial automation', 'Rugged computing', 'IoT gateways', 'Embedded systems']}","{'extract_features': [{'input_tokens': 1418, 'output_tokens': 824, 'time_taken': 8.716038227081299}], 'store_and_chunk_data': [{'input_tokens': 0, 'output_tokens': 0, 'time_taken': 1.455962896347046}], 'search_missing_features': [{'input_tokens': 0, 'output_tokens': 0, 'time_taken': 19.74599814414978}, {'input_tokens': 0, 'output_tokens': 0, 'time_taken': 24.435070991516113}], 'generate_missing_features': [{'input_tokens': 4145, 'output_tokens': 53, 'time_taken': 5.078336000442505}, {'input_tokens': 3925, 'output_tokens': 53, 'time_taken': 6.4645960330963135}]}","[2, 2, 2]","[0, 0, 0]"
IB919AF-8365,"{'name': 'IBAF', 'manufacturer': 'IBASE', 'form_factor': 'SBC', 'evaluation_or_commercialization': False, 'processor_architecture': 'x86', 'processor_core_count': 'Not Available', 'processor_manufacturer': 'Intel', 'processor_tdp': 'Not Available', 'memory': 'DDR4 SODIMM, Max 64GB, Non-ECC', 'onboard_storage': 'Not Available', 'input_voltage': '12V DC', 'io_count': ['2x USB 3.1 Type A', '2x USB Type-C', '2x SATA III', '2x M.2 M-Key', '1x M.2 E-Key', '2x DisplayPort', '1x eDP', '1x LVDS', '2x Intel PCIe GbE LAN'], 'wireless': 'Support CNVi', 'operating_system_bsp': 'Not Available', 'operating_temperature_max': '60°C', 'operating_temperature_min': '0°C', 'certifications': 'RoHS', 'short_summary': ""IBAF is a single board computer featuring Intel's 8th Gen Core and Celeron processors, with extensive I/O options and dual Gigabit LAN."", 'full_summary': ""The IBAF series offers a compact SBC solution with Intel's 8th Gen Core i7/i5/i3 and Celeron processors, supporting up to 64GB DDR4 memory, dual DisplayPort, and dual Gigabit Ethernet, ideal for industrial applications."", 'full_product_description': ""IBAF series SBCs are designed for industrial applications, equipped with Intel's 8th Gen processors, supporting up to 64GB DDR4 memory, dual DisplayPort, dual Gigabit Ethernet, and a variety of I/O interfaces including USB 3.1, SATA III, and M.2 slots. The boards are RoHS compliant and support TPM for enhanced security."", 'target_applications': ['Industrial Automation', 'Digital Signage', 'Kiosk Systems', 'Network Appliances']}","{'extract_features': [{'input_tokens': 1483, 'output_tokens': 797, 'time_taken': 8.366329908370972}], 'store_and_chunk_data': [{'input_tokens': 0, 'output_tokens': 0, 'time_taken': 1.5587399005889893}], 'search_missing_features': [{'input_tokens': 0, 'output_tokens': 0, 'time_taken': 24.18458127975464}, {'input_tokens': 0, 'output_tokens': 0, 'time_taken': 31.76591992378235}], 'generate_missing_features': [{'input_tokens': 4385, 'output_tokens': 104, 'time_taken': 3.801325798034668}, {'input_tokens': 4497, 'output_tokens': 104, 'time_taken': 4.339055776596069}]}","[4, 4, 4]","[0, 0, 0]"
