id,extracted_data,usage_data,missing_feature_count_history,low_confidence_feature_count_history
conga-TS570slash6600HE,"{'name': 'CONGATS', 'manufacturer': 'CONGATEC', 'form_factor': 'COM EXPRESS BASIC', 'evaluation_or_commercialization': True, 'processor_architecture': 'X86', 'processor_core_count': '16 cores', 'processor_manufacturer': 'INTEL', 'processor_tdp': '65W', 'memory': 'Up to 64 GByte DDR4 ECC', 'onboard_storage': 'Optional NVMe SSD', 'input_voltage': 'Not Available', 'io_count': ['4x USB 3.1', '8x USB 2.0', '4x SATA III', '1x GbE', '1x PCIe Gen 3', '1x PCIe Gen 4'], 'wireless': 'Not Available', 'operating_system_bsp': ['Microsoft Windows', 'Microsoft Windows IoT Enterprise', 'Linux', 'Yocto', 'RTS RealTime Hypervisor'], 'operating_temperature_max': '85°C', 'operating_temperature_min': '-40°C', 'certifications': 'Not Available', 'short_summary': 'COM Express Basic module with Intel Xeon and Core processors, supporting industrial temperature range.', 'full_summary': 'The congaTS is a COM Express Basic module featuring Intel Xeon and Core processors, integrated Intel UHD Graphics, and support for industrial temperature ranges. It offers multiple I/O interfaces and optional NVMe SSD storage.', 'full_product_description': 'The congaTS module is designed for high-performance computing in industrial environments. It supports Intel Xeon and Core processors with integrated Intel UHD Graphics, dual-channel DDR4 ECC memory, and a variety of I/O interfaces including USB, SATA, and PCIe. The module is capable of operating in extreme temperatures, making it suitable for a wide range of applications.', 'target_applications': ['Industrial automation', 'Embedded systems', 'High-performance computing']}","{'extract_features': [{'input_tokens': 2394, 'output_tokens': 767, 'time_taken': 7.820130109786987}], 'generate_missing_features': [{'input_tokens': 4219, 'output_tokens': 127, 'time_taken': 3.0908799171447754}, {'input_tokens': 3643, 'output_tokens': 75, 'time_taken': 2.6440560817718506}, {'input_tokens': 3706, 'output_tokens': 75, 'time_taken': 2.2131948471069336}], 'search_missing_features': [{'input_tokens': 0, 'output_tokens': 0, 'time_taken': 14.757721900939941}, {'input_tokens': 0, 'output_tokens': 0, 'time_taken': 15.309646844863892}, {'input_tokens': 0, 'output_tokens': 0, 'time_taken': 13.608720064163208}], 'store_and_chunk_data': [{'input_tokens': 0, 'output_tokens': 0, 'time_taken': 1.168578863143921}]}","[5, 3, 3, 3]","[0, 0, 0, 0]"
MYC-JX8MQ6-8E2D-130-E,"{'name': 'MYCJXMX CPU MODULE', 'manufacturer': 'MYIR ELECTRONICS LIMITED', 'form_factor': 'MXM', 'evaluation_or_commercialization': False, 'processor_architecture': 'ARM', 'processor_core_count': 'Quad', 'processor_manufacturer': 'NXP', 'processor_tdp': 'Not Available', 'memory': '2GB LPDDR4', 'onboard_storage': '8GB eMMC', 'input_voltage': '5V', 'io_count': ['1x Gigabit Ethernet', '2x USB', '1x HDMI', '1x PCIe', '1x MIPI Camera Interface'], 'wireless': ['Wi-Fi', 'Bluetooth'], 'operating_system_bsp': ['Yocto Linux', 'Ubuntu Linux', 'Android'], 'operating_temperature_max': '85°C', 'operating_temperature_min': '-40°C', 'certifications': 'Not Available', 'short_summary': 'High-performance, low-power CPU module with NXP iMX8M Quad processor, suitable for multimedia applications.', 'full_summary': 'The MYCJXMX CPU Module is an embedded solution featuring the NXP iMX8M Quad processor, offering high multimedia performance with support for Yocto Linux, Ubuntu Linux, and Android. It includes 2GB LPDDR4 memory, 8GB eMMC storage, and a variety of I/O interfaces.', 'full_product_description': 'The MYCJXMX CPU Module, manufactured by MYIR Electronics Limited, is based on the NXP iMX8M Quad processor with a 1.5GHz quad ARM Cortex-A53 and a 266MHz Cortex-M4 core. It supports up to 2GB LPDDR4 RAM and 8GB eMMC storage. The module includes a range of interfaces such as Gigabit Ethernet, USB, HDMI, PCIe, and MIPI Camera Interface, making it ideal for applications in scanning, imaging, and multimedia devices. It operates within a temperature range of -40°C to 85°C and supports multiple operating systems including Yocto Linux, Ubuntu Linux, and Android.', 'target_applications': ['Scanning and Imaging Devices', 'Building Automation', 'Smart Home', 'Human Machine Interface (HMI)', 'Machine Vision']}","{'extract_features': [{'input_tokens': 2440, 'output_tokens': 848, 'time_taken': 8.25959825515747}], 'generate_missing_features': [{'input_tokens': 4211, 'output_tokens': 53, 'time_taken': 2.1764988899230957}, {'input_tokens': 4211, 'output_tokens': 53, 'time_taken': 1.9453620910644531}], 'search_missing_features': [{'input_tokens': 0, 'output_tokens': 0, 'time_taken': 13.568117141723633}, {'input_tokens': 0, 'output_tokens': 0, 'time_taken': 10.063791275024414}], 'store_and_chunk_data': [{'input_tokens': 0, 'output_tokens': 0, 'time_taken': 0.6726727485656738}]}","[2, 2, 2]","[0, 0, 0]"
MYC-YA157C-V3-4E512D-65-C,{},"{'extract_features': [{'input_tokens': 2395, 'output_tokens': 907, 'time_taken': 8.948705196380615}], 'store_and_chunk_data': [{'input_tokens': 0, 'output_tokens': 0, 'time_taken': 0.6877927780151367}]}",[3],[0]
PCIE-Q470-R10,"{'name': 'PCIEQ', 'manufacturer': 'IEI', 'form_factor': 'PICMG', 'evaluation_or_commercialization': False, 'processor_architecture': 'x86', 'processor_core_count': '16 cores', 'processor_manufacturer': 'Intel', 'processor_tdp': '35-65W', 'memory': 'Dual-channel DDR4 3200 MHz', 'onboard_storage': '1x M.2 Type M 2280 for SSD', 'input_voltage': '5V/12V', 'io_count': ['USB 3.2 Gen 2', 'USB 3.2 Gen 1', 'USB Type-C', 'RS-232', 'RS-422', 'SATA 6Gb/s', 'PCIe Gen 3', 'PCIe Gen 2'], 'wireless': 'Bluetooth, Wi-Fi', 'operating_system_bsp': 'Linux-based BSP', 'operating_temperature_max': '60°C', 'operating_temperature_min': '0°C', 'certifications': 'CE, FCC', 'short_summary': ""PCIEQ is a full-size PICMG CPU card supporting Intel's latest processors with extensive I/O options."", 'full_summary': ""The PCIEQ is designed for high-performance applications, supporting Intel's 10th generation Core, Celeron, and Pentium processors. It features dual-channel DDR4 memory, multiple PCIe slots, and extensive I/O including USB 3.2, SATA, and RS-232/422."", 'full_product_description': ""The PCIEQ full-size PICMG CPU card is engineered for industrial applications, offering support for Intel's 10th generation processors. It includes dual Intel GbE controllers, multiple USB and SATA interfaces, and expansion options via M.2 keys. The board is compliant with CE and FCC standards, ensuring reliable performance in demanding environments."", 'target_applications': ['Industrial automation', 'Embedded systems', 'Networking', 'High-performance computing']}","{'extract_features': [{'input_tokens': 2338, 'output_tokens': 763, 'time_taken': 7.51269793510437}], 'generate_missing_features': [{'input_tokens': 4151, 'output_tokens': 150, 'time_taken': 3.746951103210449}, {'input_tokens': 4104, 'output_tokens': 32, 'time_taken': 2.1464056968688965}, {'input_tokens': 4104, 'output_tokens': 35, 'time_taken': 2.0383787155151367}], 'search_missing_features': [{'input_tokens': 0, 'output_tokens': 0, 'time_taken': 13.36429500579834}, {'input_tokens': 0, 'output_tokens': 0, 'time_taken': 9.293510913848877}, {'input_tokens': 0, 'output_tokens': 0, 'time_taken': 15.202191829681396}], 'store_and_chunk_data': [{'input_tokens': 0, 'output_tokens': 0, 'time_taken': 0.7917349338531494}]}","[5, 1, 1, 0]","[0, 0, 0, 0]"
Express-ADP-i3-12300HE,"{'name': 'EXPRESSADP', 'manufacturer': 'ADLINK TECHNOLOGY', 'form_factor': 'COM EXPRESS', 'evaluation_or_commercialization': False, 'processor_architecture': 'X86', 'processor_core_count': 'Up to 14 cores', 'processor_manufacturer': 'INTEL', 'processor_tdp': 'Up to 45W', 'memory': 'Up to 64GB DDR4 SODIMM', 'onboard_storage': 'NVMe SSD (optional)', 'input_voltage': '12V', 'io_count': 'PCIe, USB, SATA, Ethernet', 'wireless': 'Not Available', 'operating_system_bsp': ['Windows IoT Enterprise LTSC', 'Ubuntu', 'Yocto', 'VxWorks'], 'operating_temperature_max': '85°C', 'operating_temperature_min': '-40°C', 'certifications': ['IEC', 'MIL-STD'], 'short_summary': 'High-performance COM Express module with Intel Alder Lake-P processors.', 'full_summary': 'The EXPRESSADP is a COM Express module featuring Intel Alder Lake-P processors, offering a hybrid architecture with up to 14 cores and advanced graphics capabilities.', 'full_product_description': 'The EXPRESSADP module is based on the Intel Alder Lake-P platform, providing a hybrid architecture with P-cores and E-cores, supporting up to 64GB DDR4 memory, and featuring Intel Iris Xe graphics. It offers extensive I/O options including PCIe, USB, SATA, and Ethernet, and supports multiple operating systems.', 'target_applications': ['Industrial Automation', 'AI Inference', 'Embedded Systems']}","{'extract_features': [{'input_tokens': 2626, 'output_tokens': 695, 'time_taken': 7.052250862121582}], 'generate_missing_features': [{'input_tokens': 3881, 'output_tokens': 29, 'time_taken': 1.9937198162078857}, {'input_tokens': 3881, 'output_tokens': 29, 'time_taken': 1.0750129222869873}], 'search_missing_features': [{'input_tokens': 0, 'output_tokens': 0, 'time_taken': 14.852932929992676}, {'input_tokens': 0, 'output_tokens': 0, 'time_taken': 12.833892822265625}], 'store_and_chunk_data': [{'input_tokens': 0, 'output_tokens': 0, 'time_taken': 0.7914571762084961}]}","[1, 1, 1]","[0, 0, 0]"
