id,extracted_data,usage_data,missing_feature_count_history,low_confidence_feature_count_history
AIIS-3410P-00A1E,"{'name': 'INTELLIGENT INSPECTION SYSTEM', 'manufacturer': 'ADVANTECH', 'form_factor': 'COMPACT VISION SYSTEM', 'evaluation_or_commercialization': False, 'processor_architecture': 'x86', 'processor_core_count': '4', 'processor_manufacturer': 'INTEL', 'processor_tdp': 'Not Available', 'memory': 'Dual Channel DDR4 2133 MHz non-ECC, Max Capacity 32GB', 'onboard_storage': 'Internal HDD Bay, CFast', 'input_voltage': '9-36 VDC', 'io_count': ['VGA', 'DVI-D', 'USB 3.0', 'RS-232/422/485', 'Isolated DIO', 'PCIe x4 slot'], 'wireless': 'Not Available', 'operating_system_bsp': ['Windows 10', 'Windows 7'], 'operating_temperature_max': '60°C', 'operating_temperature_min': '-20°C', 'certifications': 'IEEE 802.3af compliant', 'short_summary': 'Compact vision system with Intel Core CPU, PoE, and USB interfaces.', 'full_summary': ""The Intelligent Inspection System features a compact design with Intel's latest generation Core CPU, supporting PoE and USB interfaces for versatile camera connectivity."", 'full_product_description': ""The Intelligent Inspection System by Advantech is a compact vision system designed for industrial applications. It supports Intel's latest generation Core CPUs, offering robust processing power. The system includes multiple camera interfaces such as GigE PoE and USB, along with PCIe expansion slots for additional functionality. It is compliant with IEEE 802.3af standards, ensuring reliable power over Ethernet capabilities."", 'target_applications': ['Industrial automation', 'Machine vision', 'Quality inspection']}","{'generate_missing_features': [{'input_tokens': 3767, 'output_tokens': 78, 'time_taken': 3.354213237762451}, {'input_tokens': 3479, 'output_tokens': 53, 'time_taken': 3.2787649631500244}, {'input_tokens': 3587, 'output_tokens': 53, 'time_taken': 2.8270301818847656}], 'search_missing_features': [{'input_tokens': 0, 'output_tokens': 0, 'time_taken': 17.570743083953857}, {'input_tokens': 0, 'output_tokens': 0, 'time_taken': 21.558716297149658}, {'input_tokens': 0, 'output_tokens': 0, 'time_taken': 14.613239049911499}], 'extract_features': [{'input_tokens': 1611, 'output_tokens': 751, 'time_taken': 7.827849864959717}], 'store_and_chunk_data': [{'input_tokens': 0, 'output_tokens': 0, 'time_taken': 0.7403628826141357}]}","[3, 2, 2, 2]","[0, 0, 0, 0]"
S19-QM87i-i5slashPCslash4g-R11,"{'name': 'SAQM', 'manufacturer': 'IEI', 'form_factor': 'Panel PC', 'evaluation_or_commercialization': False, 'processor_architecture': 'x86', 'processor_core_count': 'Dual-core', 'processor_manufacturer': 'Intel', 'processor_tdp': '35W to 65W', 'memory': '8 GB DDR3 SDRAM', 'onboard_storage': 'SSD bay, CFast socket', 'input_voltage': '9-36 V DC', 'io_count': ['6 x USB', '1 x VGA', '1 x DVI-D', '1 x HDMI', '1 x Mic-in', '1 x Line-out', '1 x Line-in', '1 x Antenna SMA', '2 x RJ-45 GbE LAN', '1 x CANbus', '2 x RS-232', '1 x RS-422/485'], 'wireless': 'Wi-Fi 6, Bluetooth 5.0, LTE, 5G ready', 'operating_system_bsp': 'Microsoft Windows 10 IoT Enterprise LTSC 2021, Linux (Yocto LTS kernel 2022)', 'operating_temperature_max': '60°C', 'operating_temperature_min': '-20°C', 'certifications': ['EMC', 'CE', 'FCC', 'DNV GL', 'IEC 60945', 'IACS-E10'], 'short_summary': 'Fanless Panel PC with Intel Core Dual-core Processor, IP Protection, and Projected Capacitive Touchscreen.', 'full_summary': 'The SAQM is a fanless panel PC featuring an Intel Core Dual-core processor, designed for marine applications with IP protection and a projected capacitive touchscreen. It supports multiple I/O interfaces and isolated power input.', 'full_product_description': 'The SAQM series is a robust marine panel PC equipped with a 6th generation Intel Core i5 processor, offering excellent visual performance with three independent displays. It includes a full OSD function configuration, wide viewing angles, and optical bonding for improved visibility in bright light. The system supports isolated RS-232/422/485 serial ports, isolated 9-36 V DC input, and an iRIS remote management module.', 'target_applications': ['Marine', 'Industrial Automation', 'Transportation']}","{'generate_missing_features': [{'input_tokens': 3621, 'output_tokens': 125, 'time_taken': 2.8314168453216553}], 'search_missing_features': [{'input_tokens': 0, 'output_tokens': 0, 'time_taken': 21.095568895339966}], 'extract_features': [{'input_tokens': 1623, 'output_tokens': 818, 'time_taken': 8.319850206375122}], 'store_and_chunk_data': [{'input_tokens': 0, 'output_tokens': 0, 'time_taken': 1.161902904510498}]}","[3, 0]","[0, 0]"
ASMB-830I-00A1,"{'name': 'ASMB', 'manufacturer': 'ADVANTECH', 'form_factor': 'ATX', 'evaluation_or_commercialization': False, 'processor_architecture': 'Intel Xeon E and 8th/9th Generation Core i3/i5/i7 series', 'processor_core_count': 'Up to 16 cores', 'processor_manufacturer': 'AMD', 'processor_tdp': 'Up to 125W', 'memory': 'DDR4 ECC REG, up to 128GB', 'onboard_storage': 'Eight SATA 3 and one M.2 connectors (SATA/PCIe compatible)', 'input_voltage': '3.3V/5V/5Vsb/12V/12V_8P', 'io_count': ['8 SATA via Mini-SAS HD', '2 USB 3.0', '2 USB 2.0', 'Dual GbE LAN'], 'wireless': 'Not Available', 'operating_system_bsp': 'Not Available', 'operating_temperature_max': '60 C', 'operating_temperature_min': '0 C', 'certifications': 'CE/FCC', 'short_summary': 'ATX server board with AMD EPYC support and dual GbE LAN.', 'full_summary': 'The ASMB ATX server board supports AMD EPYC processors, features dual GbE LAN, multiple PCIe slots, and ECC REG DDR4 memory support.', 'full_product_description': 'The ASMB server board is designed for high-performance computing with support for AMD EPYC processors. It includes multiple PCIe slots for expansion, dual GbE LAN for networking, and supports up to 128GB of ECC REG DDR4 memory. The board is suitable for various server applications with its robust design and comprehensive I/O options.', 'target_applications': ['Data centers', 'Enterprise servers', 'High-performance computing']}","{'generate_missing_features': [{'input_tokens': 3828, 'output_tokens': 230, 'time_taken': 5.805102109909058}, {'input_tokens': 3971, 'output_tokens': 120, 'time_taken': 3.5411603450775146}, {'input_tokens': 3969, 'output_tokens': 79, 'time_taken': 3.404608964920044}, {'input_tokens': 3600, 'output_tokens': 99, 'time_taken': 3.2023608684539795}, {'input_tokens': 3725, 'output_tokens': 55, 'time_taken': 3.0438072681427}], 'search_missing_features': [{'input_tokens': 0, 'output_tokens': 0, 'time_taken': 16.247148990631104}, {'input_tokens': 0, 'output_tokens': 0, 'time_taken': 8.210963010787964}, {'input_tokens': 0, 'output_tokens': 0, 'time_taken': 24.01120400428772}, {'input_tokens': 0, 'output_tokens': 0, 'time_taken': 21.239383935928345}, {'input_tokens': 0, 'output_tokens': 0, 'time_taken': 15.243482828140259}], 'extract_features': [{'input_tokens': 1671, 'output_tokens': 685, 'time_taken': 7.563880920410156}], 'store_and_chunk_data': [{'input_tokens': 0, 'output_tokens': 0, 'time_taken': 1.744112253189087}]}","[8, 4, 3, 3, 2, 2]","[0, 0, 0, 0, 0, 0]"
DPX-S425-00A1E,{},"{'extract_features': [{'input_tokens': 1657, 'output_tokens': 646, 'time_taken': 8.197284698486328}], 'store_and_chunk_data': [{'input_tokens': 0, 'output_tokens': 0, 'time_taken': 1.2389740943908691}]}",[10],[0]
PCIE-H810-R10,"{'name': 'PCIEH', 'manufacturer': 'IEI', 'form_factor': 'Fullsize PICMG', 'evaluation_or_commercialization': False, 'processor_architecture': 'x86', 'processor_core_count': 'Up to 16 cores', 'processor_manufacturer': 'Intel', 'processor_tdp': '35-65W', 'memory': 'Two DDR3 1600 MHz DIMM SDRAM, up to 16GB', 'onboard_storage': 'mSATA', 'input_voltage': '12V', 'io_count': ['2 x VGA', '2 x RJ45', '8 x USB', '2 x SATA 6Gb/s', '2 x RS232', '1 x LPT', '1 x KBMS'], 'wireless': 'Supports wireless connectivity for remote applications', 'operating_system_bsp': 'Windows 10 64-bit, Windows 11 64-bit, Linux', 'operating_temperature_max': '60°C', 'operating_temperature_min': '0°C', 'certifications': 'RoHS', 'short_summary': 'Fullsize PICMG CPU card with Intel Core i3/i5/i7, Pentium, Celeron support, dual Realtek PCIe GbE, TPM 2.0.', 'full_summary': 'The PCIEH is a fullsize PICMG CPU card supporting Intel Core i3/i5/i7, Pentium, and Celeron processors, with dual-channel DDR3 memory, dual Realtek PCIe GbE, TPM 2.0, and a variety of I/O interfaces.', 'full_product_description': ""The PCIEH fullsize PICMG CPU card supports Intel's 8th generation Core i3/i5/i7, Pentium, and Celeron processors. It features dual-channel DDR3 1600 MHz memory up to 16GB, dual Realtek PCIe GbE controllers, TPM 2.0 for hardware security, and a wide range of I/O interfaces including VGA, USB, SATA, and RS232. The card is designed for robust industrial applications with a wide operating temperature range and RoHS compliance."", 'target_applications': 'Industrial automation, embedded systems, digital signage, and network security.'}","{'generate_missing_features': [{'input_tokens': 4171, 'output_tokens': 133, 'time_taken': 3.567819118499756}], 'search_missing_features': [{'input_tokens': 0, 'output_tokens': 0, 'time_taken': 20.86079168319702}], 'extract_features': [{'input_tokens': 1653, 'output_tokens': 804, 'time_taken': 8.392555952072144}], 'store_and_chunk_data': [{'input_tokens': 0, 'output_tokens': 0, 'time_taken': 0.9966630935668945}]}","[4, 0]","[0, 0]"
