id,extracted_data,usage_data,missing_feature_count_history,low_confidence_feature_count_history
4DPI-35-II,"{'name': 'DPIII', 'manufacturer': 'D SYSTEMS', 'form_factor': 'RASPBERRY PI', 'evaluation_or_commercialization': 'True', 'processor_architecture': 'ARM Cortex-A72', 'processor_core_count': 'Quad-core', 'processor_manufacturer': 'Broadcom', 'processor_tdp': 'Not Available', 'memory': '1GB/2GB/4GB/8GB LPDDR4 SDRAM', 'onboard_storage': 'Not Available', 'input_voltage': '5V/3A, USB-C', 'io_count': '28x user GPIO', 'wireless': '802.11 b/g/n/ac Wireless LAN, Bluetooth 5.0 with BLE', 'operating_system_bsp': ['Raspberry Pi OS', 'Pixel'], 'operating_temperature_max': '85 degrees Celsius', 'operating_temperature_min': '0 degrees Celsius', 'certifications': 'Not Available', 'short_summary': 'The DPiII is a primary display for Raspberry Pi with integrated resistive touch panel.', 'full_summary': 'The DPiII functions as a primary display for Raspberry Pi, featuring an integrated resistive touch panel and high-speed SPI connection for direct command interpretation.', 'full_product_description': 'The DPiII is designed to work with Raspberry Pi, providing a primary display output through a high-speed SPI connection. It includes an integrated resistive touch panel, allowing it to function without a mouse. The device supports the Raspberry Pi Operating System and Pixel.', 'target_applications': 'Not Available'}","{'search_missing_features': [{'input_tokens': 0, 'output_tokens': 0, 'time_taken': 17.298802137374878}, {'input_tokens': 0, 'output_tokens': 0, 'time_taken': 17.376816272735596}, {'input_tokens': 0, 'output_tokens': 0, 'time_taken': 18.66658902168274}], 'generate_missing_features': [{'input_tokens': 4563, 'output_tokens': 373, 'time_taken': 7.229791641235352}, {'input_tokens': 3304, 'output_tokens': 101, 'time_taken': 3.622105121612549}, {'input_tokens': 3384, 'output_tokens': 101, 'time_taken': 2.213146924972534}], 'store_and_chunk_data': [{'input_tokens': 0, 'output_tokens': 0, 'time_taken': 0.6454470157623291}], 'extract_features': [{'input_tokens': 1011, 'output_tokens': 618, 'time_taken': 6.915179014205933}]}","[13, 4, 4, 4]","[0, 0, 0, 0]"
IBR210-D308,"{'name': 'IBASE IBR-QI', 'manufacturer': 'IBASE', 'form_factor': 'SBC', 'evaluation_or_commercialization': True, 'processor_architecture': 'ARM', 'processor_core_count': 'Quad', 'processor_manufacturer': 'NXP', 'processor_tdp': 'Not Available', 'memory': '4 GB LPDDR4', 'onboard_storage': '16 GB eMMC', 'input_voltage': '12V', 'io_count': ['2 x RJ45 GbE LAN', '4 x USB Type-A', '1 x USB OTG mini-USB Type-B', '1 x HDMI', '2 x RS-232', '1 x SD socket'], 'wireless': 'GLTE', 'operating_system_bsp': ['Yocto', 'Android', 'Ubuntu'], 'operating_temperature_max': '60°C', 'operating_temperature_min': '-40°C', 'certifications': ['CE', 'FCC Class B'], 'short_summary': 'Industrial Grade SBC with NXP i.MX 8M Quad processor, 4GB LPDDR4, 16GB eMMC, and extensive I/O options.', 'full_summary': 'The IBASE IBR-QI is an industrial-grade single board computer featuring the NXP i.MX 8M Quad Cortex-A53 processor, 4GB LPDDR4 memory, and 16GB eMMC storage. It supports dual-channel FHD LVDS, HDMI, and a wide range of I/O interfaces including Ethernet, USB, and RS-232, making it suitable for various embedded applications.', 'full_product_description': 'The IBASE IBR-QI is designed for industrial applications, powered by the NXP i.MX 8M Quad Cortex-A53 processor. It includes 4GB of LPDDR4 RAM and 16GB of eMMC storage. The board supports dual-channel LVDS, HDMI output, and a comprehensive set of I/O interfaces such as Ethernet, USB, RS-232, and more. It is capable of operating in harsh environments with a temperature range of -40°C to 60°C and is certified with CE and FCC Class B standards.', 'target_applications': ['Industrial automation', 'Embedded systems', 'IoT devices']}","{'search_missing_features': [{'input_tokens': 0, 'output_tokens': 0, 'time_taken': 17.288567066192627}, {'input_tokens': 0, 'output_tokens': 0, 'time_taken': 20.866463899612427}], 'generate_missing_features': [{'input_tokens': 4534, 'output_tokens': 30, 'time_taken': 3.1127238273620605}, {'input_tokens': 4095, 'output_tokens': 30, 'time_taken': 1.9562969207763672}], 'store_and_chunk_data': [{'input_tokens': 0, 'output_tokens': 0, 'time_taken': 0.6685409545898438}], 'extract_features': [{'input_tokens': 1177, 'output_tokens': 851, 'time_taken': 8.37052321434021}]}","[1, 1, 1]","[0, 0, 0]"
IP416,{},"{'store_and_chunk_data': [{'input_tokens': 0, 'output_tokens': 0, 'time_taken': 0.8056912422180176}], 'extract_features': [{'input_tokens': 992, 'output_tokens': 714, 'time_taken': 7.950516939163208}]}",[12],[0]
UCC-099-091-FX-BBGA,"{'name': 'CUPCAKE EDGE SERVER', 'manufacturer': 'UNIGEN CORPORATION', 'form_factor': 'RUGGEDIZED DESIGN', 'evaluation_or_commercialization': False, 'processor_architecture': 'X86', 'processor_core_count': '4', 'processor_manufacturer': 'INTEL', 'processor_tdp': 'Not Available', 'memory': '8 GB DDR4', 'onboard_storage': '512 GB NVMe SSD', 'input_voltage': '12 V DC', 'io_count': ['2x GbE with POE', '2x USB 3.0 Type A', '1x USB 3.0 Type C', '1x HDMI 2.0b', '1x SD card slot', '2x M.2 slots'], 'wireless': ['Wi-Fi', '5G', 'GPS'], 'operating_system_bsp': ['Linux', 'Microsoft Windows'], 'operating_temperature_max': '60°C', 'operating_temperature_min': '-20°C', 'certifications': 'FCC, CE, VCCI, KC', 'short_summary': 'The Cupcake Edge Server is a ruggedized, fanless device with Intel Atom SoC, designed for secure performance in various industries.', 'full_summary': 'The Cupcake Edge Server combines secure performance with an Intel Atom SoC in a compact, fanless, rugged chassis. It supports multiple interfaces and expansion capabilities, making it suitable for industries like transportation, retail, and healthcare.', 'full_product_description': 'The Cupcake Edge Server by Unigen Corporation features an Intel Atom x86 processor, 8 GB DDR4 memory, and 512 GB NVMe SSD storage. It offers extensive I/O capabilities, including GbE with POE, USB, HDMI, and M.2 slots, along with wireless options like Wi-Fi and 5G. The device supports Linux and Windows operating systems and operates in temperatures ranging from -20°C to 60°C.', 'target_applications': ['Delivery', 'Transportation', 'Retail', 'Agriculture', 'Healthcare', 'Manufacturing', 'Hospitality', 'Security']}","{'search_missing_features': [{'input_tokens': 0, 'output_tokens': 0, 'time_taken': 16.243292093276978}, {'input_tokens': 0, 'output_tokens': 0, 'time_taken': 20.186694145202637}, {'input_tokens': 0, 'output_tokens': 0, 'time_taken': 16.70028305053711}], 'generate_missing_features': [{'input_tokens': 3266, 'output_tokens': 86, 'time_taken': 3.2013068199157715}, {'input_tokens': 3920, 'output_tokens': 30, 'time_taken': 1.8264038562774658}, {'input_tokens': 3588, 'output_tokens': 30, 'time_taken': 2.744569778442383}], 'store_and_chunk_data': [{'input_tokens': 0, 'output_tokens': 0, 'time_taken': 0.6211340427398682}], 'extract_features': [{'input_tokens': 1299, 'output_tokens': 819, 'time_taken': 8.254519939422607}]}","[3, 1, 1, 1]","[0, 0, 0, 0]"
EmQ-i2301-E3825D0-4G,"{'name': 'EMQI', 'manufacturer': 'ARBOR TECHNOLOGY', 'form_factor': 'QSEVEN', 'evaluation_or_commercialization': True, 'processor_architecture': 'X86', 'processor_core_count': 'Not Available', 'processor_manufacturer': 'INTEL', 'processor_tdp': 'Not Available', 'memory': '4 GB DDR3L SDRAM', 'onboard_storage': '64 GB eMMC', 'input_voltage': '12V', 'io_count': 'USB ports, PCIe, SATA, Ethernet', 'wireless': 'Not Available', 'operating_system_bsp': ['Windows 10', 'Linux Ubuntu'], 'operating_temperature_max': '85°C', 'operating_temperature_min': '-40°C', 'certifications': 'Not Available', 'short_summary': 'Fanless Qseven module with Intel Atom E family processor, 4GB DDR3L RAM, and 64GB eMMC storage.', 'full_summary': 'The EMQI is a Qseven CPU module featuring a fanless design with an Intel Atom E family processor. It includes 4GB of soldered DDR3L SDRAM and 64GB of eMMC storage, supporting extended temperature ranges and multiple I/O interfaces.', 'full_product_description': 'The EMQI module by ARBOR TECHNOLOGY is designed for industrial applications, offering a robust solution with an Intel Atom E family processor. It supports a wide range of operating systems including Windows 10 and Linux Ubuntu. The module is equipped with 4GB DDR3L RAM and 64GB eMMC storage, providing ample memory and storage for various applications. It features multiple I/O options including USB, PCIe, SATA, and Ethernet, making it versatile for different industrial needs.', 'target_applications': ['Industrial automation', 'Embedded systems', 'IoT devices']}","{'search_missing_features': [{'input_tokens': 0, 'output_tokens': 0, 'time_taken': 16.555025100708008}, {'input_tokens': 0, 'output_tokens': 0, 'time_taken': 14.290818929672241}], 'generate_missing_features': [{'input_tokens': 3882, 'output_tokens': 100, 'time_taken': 3.9605188369750977}, {'input_tokens': 3446, 'output_tokens': 100, 'time_taken': 3.9393370151519775}], 'store_and_chunk_data': [{'input_tokens': 0, 'output_tokens': 0, 'time_taken': 1.3072738647460938}], 'extract_features': [{'input_tokens': 1217, 'output_tokens': 732, 'time_taken': 7.6129069328308105}]}","[4, 4, 4]","[0, 0, 0]"
