id,extracted_data,usage_data,missing_feature_count_history,low_confidence_feature_count_history
UEVM5432G-02-12-00,{},"{'extract_features': [{'input_tokens': 1427, 'output_tokens': 681, 'time_taken': 7.947293996810913}], 'store_and_chunk_data': [{'input_tokens': 0, 'output_tokens': 0, 'time_taken': 1.4844248294830322}]}",[6],[0]
ROM-7420CD-MDA2E,"{'name': 'ROM QSEVEN MODULE', 'manufacturer': 'ADVANTECH', 'form_factor': 'QSEVEN', 'evaluation_or_commercialization': True, 'processor_architecture': 'ARM', 'processor_core_count': 'Dual', 'processor_manufacturer': 'NXP', 'processor_tdp': 'Low power consumption', 'memory': 'DDR3 2GB', 'onboard_storage': '4GB eMMC NAND Flash', 'input_voltage': '5V', 'io_count': ['HDMI', 'VGA', 'LVDS', 'CAN', 'UART', 'Giga LAN', 'PCIe', 'SATA', 'USB'], 'wireless': '802.11 b/g/n, AR9287, 2T2R, Full size Mini PCIe', 'operating_system_bsp': ['Linux', 'Android'], 'operating_temperature_max': '85°C', 'operating_temperature_min': '-40°C', 'certifications': ['RoHS', 'CE', 'FCC Class B'], 'short_summary': 'High performance, low power Qseven module with NXP ARM Cortex-A iMX processor.', 'full_summary': 'The ROM Qseven Module integrates an ARM Cortex-A NXP iMX series ultra-low power SoC with rich I/O solutions, supporting Linux and Android BSPs, ideal for embedded applications.', 'full_product_description': 'The ROM Qseven Module by Advantech features an NXP ARM Cortex-A iMX Dual GHz processor, 2GB DDR3 memory, and 4GB eMMC NAND Flash storage. It supports a variety of interfaces including HDMI, VGA, LVDS, CAN, UART, Giga LAN, PCIe, and SATA. Designed for low power consumption and fanless operation, it is suitable for a wide range of industrial applications.', 'target_applications': 'Embedded systems, industrial automation, IoT devices.'}","{'extract_features': [{'input_tokens': 1483, 'output_tokens': 753, 'time_taken': 8.213801860809326}], 'search_missing_features': [{'input_tokens': 0, 'output_tokens': 0, 'time_taken': 17.97164297103882}], 'generate_missing_features': [{'input_tokens': 4472, 'output_tokens': 51, 'time_taken': 3.16930890083313}], 'store_and_chunk_data': [{'input_tokens': 0, 'output_tokens': 0, 'time_taken': 1.6770470142364502}]}","[1, 0]","[0, 0]"
20-101-0561,{},"{'extract_features': [{'input_tokens': 1422, 'output_tokens': 665, 'time_taken': 7.430166006088257}], 'store_and_chunk_data': [{'input_tokens': 0, 'output_tokens': 0, 'time_taken': 2.0089690685272217}]}",[6],[0]
QC-DB-K10004D,"{'name': 'OPENQ A SOM', 'manufacturer': 'LANTRONIX', 'form_factor': 'SOM', 'evaluation_or_commercialization': True, 'processor_architecture': 'ARM', 'processor_core_count': 'Quad-Core', 'processor_manufacturer': 'QUALCOMM', 'processor_tdp': 'Not Available', 'memory': '2 GB LPDDR RAM', 'onboard_storage': '8 GB eMMC Flash storage', 'input_voltage': '3.6V - 4.2V', 'io_count': 'Multiple BLSP ports, GPIO, UART, SPI, I2C buses, debug UART', 'wireless': 'Wi-Fi a/b/g/n/ac, Bluetooth BLE', 'operating_system_bsp': 'OpenEmbedded Yocto Linux', 'operating_temperature_max': '85°C', 'operating_temperature_min': '-25°C', 'certifications': 'Not Available', 'short_summary': 'Compact SOM with Qualcomm APQ SoC, high-end Wi-Fi/BT, and extensive audio features.', 'full_summary': 'The OpenQ A SOM is a compact, production-ready module based on the Qualcomm APQ SoC, featuring a quad-core ARM Cortex-A processor, high-performance Wi-Fi/BT module, and extensive audio capabilities, ideal for smart speakers and voice-controlled home hubs.', 'full_product_description': ""Lantronix's OpenQ A SOM is a system-on-module featuring a Qualcomm APQ quad-core ARM Cortex-A processor, Qualcomm Adreno GPU, and Qualcomm QDSP DSP. It includes 2 GB LPDDR RAM, 8 GB eMMC storage, and a pre-certified Wi-Fi/BT module. The SOM supports OpenEmbedded Yocto Linux OS and is designed for applications requiring cloud connectivity and edge compute capabilities."", 'target_applications': ['Audio home hubs', 'Home automation control', 'Streaming audio devices', 'Voice recognition', 'Smart speakers']}","{'extract_features': [{'input_tokens': 1382, 'output_tokens': 752, 'time_taken': 8.680767059326172}], 'search_missing_features': [{'input_tokens': 0, 'output_tokens': 0, 'time_taken': 18.290194988250732}, {'input_tokens': 0, 'output_tokens': 0, 'time_taken': 17.37239670753479}], 'generate_missing_features': [{'input_tokens': 2202, 'output_tokens': 53, 'time_taken': 2.5794930458068848}, {'input_tokens': 2202, 'output_tokens': 53, 'time_taken': 2.8208088874816895}], 'store_and_chunk_data': [{'input_tokens': 0, 'output_tokens': 0, 'time_taken': 1.4850759506225586}]}","[2, 2, 2]","[0, 0, 0]"
PCE-7127G2-00A1E,"{'name': 'PCEGAE', 'manufacturer': 'ADVANTECH', 'form_factor': 'SBC', 'evaluation_or_commercialization': False, 'processor_architecture': 'x86', 'processor_core_count': '4', 'processor_manufacturer': 'INTEL', 'processor_tdp': '6W/6W/12W/9W/6W up to 45W', 'memory': 'Dual Channel ECC DDR3', 'onboard_storage': '1GB onboard', 'input_voltage': '5V/12V', 'io_count': ['USB: 9', 'SATA: 4', 'Serial: 2', 'Parallel: 1', 'Ethernet: 2'], 'wireless': 'Optional 3G, 4G LTE and WiFi connectivity', 'operating_system_bsp': 'Microsoft Windows, Linux', 'operating_temperature_max': '60°C', 'operating_temperature_min': '0°C', 'certifications': 'CE, FCC', 'short_summary': 'PCEGAE is a single board computer supporting Intel Xeon, Core i, and Pentium processors with dual channel ECC DDR3 memory.', 'full_summary': 'The PCEGAE is designed for industrial applications, featuring support for Intel Xeon, Core i, and Pentium processors, dual channel ECC DDR3 memory, and a variety of I/O interfaces including USB, SATA, and Ethernet.', 'full_product_description': 'The PCEGAE single board computer by Advantech supports Intel Xeon, Core i, and Pentium processors. It features dual channel ECC DDR3 memory, multiple USB and SATA ports, and dual Ethernet interfaces. The board is suitable for industrial applications requiring robust performance and reliability.', 'target_applications': ['Industrial Automation', 'Embedded Systems', 'Networking']}","{'extract_features': [{'input_tokens': 1523, 'output_tokens': 706, 'time_taken': 9.252963781356812}], 'search_missing_features': [{'input_tokens': 0, 'output_tokens': 0, 'time_taken': 18.350117683410645}, {'input_tokens': 0, 'output_tokens': 0, 'time_taken': 18.763265132904053}, {'input_tokens': 0, 'output_tokens': 0, 'time_taken': 17.0263249874115}], 'generate_missing_features': [{'input_tokens': 4613, 'output_tokens': 208, 'time_taken': 5.115886211395264}, {'input_tokens': 3872, 'output_tokens': 29, 'time_taken': 1.9275646209716797}, {'input_tokens': 3123, 'output_tokens': 42, 'time_taken': 2.395066022872925}], 'store_and_chunk_data': [{'input_tokens': 0, 'output_tokens': 0, 'time_taken': 1.80137300491333}]}","[7, 1, 1, 0]","[0, 0, 0, 0]"
