id,extracted_data,usage_data,missing_feature_count_history,low_confidence_feature_count_history
102110798,"{'name': 'JETSON ORIN NANO', 'manufacturer': 'NVIDIA', 'form_factor': 'SODIMM', 'evaluation_or_commercialization': False, 'processor_architecture': 'ARM', 'processor_core_count': '6', 'processor_manufacturer': 'NVIDIA', 'processor_tdp': 'Not Available', 'memory': '8 GB LPDDR', 'onboard_storage': 'Not Available', 'input_voltage': '5V', 'io_count': 'Not Available', 'wireless': 'Not Available', 'operating_system_bsp': 'Linux', 'operating_temperature_max': '85째C', 'operating_temperature_min': '-25째C', 'certifications': 'Not Available', 'short_summary': 'NVIDIA Jetson Orin Nano is a compact module with ARM Cortex CPU and Ampere GPU, designed for AI applications.', 'full_summary': 'The NVIDIA Jetson Orin Nano features an ARM Cortex CPU and Ampere GPU, offering high AI performance in a compact SODIMM form factor. It supports various interfaces and is suitable for AI and machine learning applications.', 'full_product_description': 'NVIDIA Jetson Orin Nano is a system-on-module that integrates an ARM Cortex CPU and Ampere GPU, providing powerful AI capabilities. It supports LPDDR memory and various I/O interfaces, making it ideal for embedded AI applications.', 'target_applications': ['AI applications', 'Machine learning', 'Embedded systems']}","{'extract_features': [{'input_tokens': 4089, 'output_tokens': 654, 'time_taken': 7.267884969711304}], 'generate_missing_features': [{'input_tokens': 4620, 'output_tokens': 123, 'time_taken': 2.6701650619506836}, {'input_tokens': 4620, 'output_tokens': 123, 'time_taken': 2.253288984298706}], 'store_and_chunk_data': [{'input_tokens': 0, 'output_tokens': 0, 'time_taken': 2.2785298824310303}], 'search_missing_features': [{'input_tokens': 0, 'output_tokens': 0, 'time_taken': 59.80738091468811}, {'input_tokens': 0, 'output_tokens': 0, 'time_taken': 15.02477216720581}]}","[5, 5, 5]","[0, 0, 0]"
101-0411,{},"{'extract_features': [{'input_tokens': 4273, 'output_tokens': 730, 'time_taken': 8.010534048080444}], 'store_and_chunk_data': [{'input_tokens': 0, 'output_tokens': 0, 'time_taken': 2.273571014404297}]}",[6],[0]
A20-OLinuXino-MICRO-e16Gs16M,{},"{'extract_features': [{'input_tokens': 4045, 'output_tokens': 674, 'time_taken': 7.907572031021118}], 'store_and_chunk_data': [{'input_tokens': 0, 'output_tokens': 0, 'time_taken': 2.275038003921509}]}",[5],[0]
TREK-723R-A1E,"{'name': 'TREK', 'manufacturer': 'ADVANTECH', 'form_factor': 'Mobile Data Terminal', 'evaluation_or_commercialization': False, 'processor_architecture': 'ARM', 'processor_core_count': 'Dual-core', 'processor_manufacturer': 'TEXAS INSTRUMENTS', 'processor_tdp': '28/15/12W', 'memory': '256 MB Mobile LPDDR', 'onboard_storage': '4 GB NAND', 'input_voltage': '12 VDC', 'io_count': '54 I/Os', 'wireless': ['WWAN', 'Bluetooth', 'GPS'], 'operating_system_bsp': ['Windows Embedded CE', 'Android'], 'operating_temperature_max': '70 C', 'operating_temperature_min': '-30 C', 'certifications': 'ISO 7637-2', 'short_summary': 'TREK is a mobile data terminal designed for vehicle power compliance with ISO 7637-2, featuring a resistive touchscreen and multiple wireless options.', 'full_summary': 'The TREK mobile data terminal is equipped with a TI ARM Cortex-A8 processor, 256 MB LPDDR memory, and 4 GB NAND storage. It supports Windows Embedded CE and Android, and offers wireless capabilities including WWAN, Bluetooth, and GPS. Designed for vehicle environments, it operates between -30 C and 70 C.', 'full_product_description': 'TREK is an all-in-one mobile data terminal with a 7-inch resistive touchscreen, powered by a TI ARM Cortex-A8 processor. It includes 256 MB of LPDDR memory and 4 GB of NAND storage. The device supports Windows Embedded CE and Android operating systems. It is designed for vehicle power compliance with ISO 7637-2, featuring built-in CAN bus, GPS, and multiple wireless options. The operating temperature ranges from -30 C to 70 C, making it suitable for harsh environments.', 'target_applications': ['Fleet Management', 'Vehicle Telematics']}","{'extract_features': [{'input_tokens': 3933, 'output_tokens': 762, 'time_taken': 8.030061960220337}], 'generate_missing_features': [{'input_tokens': 4192, 'output_tokens': 79, 'time_taken': 3.786452054977417}, {'input_tokens': 4366, 'output_tokens': 59, 'time_taken': 1.8977258205413818}, {'input_tokens': 3877, 'output_tokens': 33, 'time_taken': 1.992676019668579}], 'store_and_chunk_data': [{'input_tokens': 0, 'output_tokens': 0, 'time_taken': 2.2727253437042236}], 'search_missing_features': [{'input_tokens': 0, 'output_tokens': 0, 'time_taken': 18.537451028823853}, {'input_tokens': 0, 'output_tokens': 0, 'time_taken': 22.669594764709473}, {'input_tokens': 0, 'output_tokens': 0, 'time_taken': 24.15909481048584}]}","[3, 2, 1, 0]","[0, 0, 0, 0]"
Q7-BT1-2G-8G-ER,"{'name': 'QBT', 'manufacturer': 'ADLINK TECHNOLOGY', 'form_factor': 'QSEVEN', 'evaluation_or_commercialization': False, 'processor_architecture': 'INTEL', 'processor_core_count': 'Quad Core', 'processor_manufacturer': 'INTEL', 'processor_tdp': '5W', 'memory': 'Up to 8GB DDR3L', 'onboard_storage': 'eMMC up to 64GB, SATA SSD', 'input_voltage': '5V', 'io_count': 'PCIe, USB, SATA, Ethernet, Audio, MIPI CSI', 'wireless': 'Not Available', 'operating_system_bsp': 'QNX, Android, VxWorks', 'operating_temperature_max': '85째C', 'operating_temperature_min': '-40째C', 'certifications': 'IEC 60068-2-64, IEC-60068-2-27, MIL-STD-202 F', 'short_summary': 'The QBT is a compact Qseven module featuring Intel Atom E series SoC, ideal for IoT applications.', 'full_summary': 'The QBT module combines the Qseven standard with Intel Atom E series SoC, offering high integration, performance, and low power consumption. It is suitable for IoT applications, retail, digital signage, and in-vehicle systems.', 'full_product_description': 'The QBT Computer-On-Module (COM) integrates the Qseven standard with Intel Atom E series SoC, providing a solution for midrange power and high pin-area density requirements. It features high integration, performance, and low power, making it ideal for IoT applications. The module supports up to 8GB DDR3L memory, eMMC up to 64GB, and SATA SSD storage. It includes interfaces for PCIe, USB, SATA, Ethernet, Audio, and MIPI CSI.', 'target_applications': 'IoT, Retail, Digital Signage, In-Vehicle Systems'}","{'extract_features': [{'input_tokens': 4252, 'output_tokens': 740, 'time_taken': 8.53191089630127}], 'generate_missing_features': [{'input_tokens': 3722, 'output_tokens': 110, 'time_taken': 2.803825855255127}, {'input_tokens': 4106, 'output_tokens': 29, 'time_taken': 3.670567035675049}, {'input_tokens': 3999, 'output_tokens': 29, 'time_taken': 2.0547382831573486}], 'store_and_chunk_data': [{'input_tokens': 0, 'output_tokens': 0, 'time_taken': 2.271822929382324}], 'search_missing_features': [{'input_tokens': 0, 'output_tokens': 0, 'time_taken': 19.815920114517212}, {'input_tokens': 0, 'output_tokens': 0, 'time_taken': 17.684187173843384}, {'input_tokens': 0, 'output_tokens': 0, 'time_taken': 9.107460975646973}]}","[3, 1, 1, 1]","[0, 0, 0, 0]"
