id,extracted_data,usage_data,missing_feature_count_history,low_confidence_feature_count_history
AIIS-3400P-00A1E,"{'name': 'INTELLIGENT INSPECTION SYSTEM', 'manufacturer': 'ADVANTECH', 'form_factor': 'COMPACT VISION SYSTEM', 'evaluation_or_commercialization': False, 'processor_architecture': 'x86', 'processor_core_count': 'Not Available', 'processor_manufacturer': 'INTEL', 'processor_tdp': 'Not Available', 'memory': 'Dual Channel DDR4 2133 MHz non-ECC, Max Capacity 32 GB', 'onboard_storage': 'Internal HDD Bay max 9.5 mm height, CFast', 'input_voltage': '9-36 VDC', 'io_count': ['VGA', 'DVI-D', 'USB 3.0', 'USB 2.0', 'Serial RS-232/422/485', 'Isolated DIO'], 'wireless': 'Not Available', 'operating_system_bsp': ['Windows 10 IoT Enterprise', 'Windows Embedded Standard 7'], 'operating_temperature_max': '60°C', 'operating_temperature_min': '-20°C', 'certifications': 'IEEE 802.3af compliant', 'short_summary': 'Compact vision system with Intel Core CPU, PoE, and USB interfaces.', 'full_summary': ""The Intelligent Inspection System is a compact vision system featuring Intel's latest generation Core CPUs, multiple camera interfaces including PoE and USB, and robust I/O capabilities for industrial applications."", 'full_product_description': ""The Intelligent Inspection System by Advantech is designed for industrial applications requiring high-performance computing and versatile connectivity. It supports Intel's latest generation Core CPUs, offers dual-channel DDR4 memory, and provides multiple camera interfaces such as PoE and USB. The system is compliant with IEEE 802.3af standards and supports a wide range of operating temperatures, making it suitable for harsh environments."", 'target_applications': ['Industrial automation', 'Machine vision', 'Quality inspection']}","{'extract_features': [{'input_tokens': 1577, 'output_tokens': 769, 'time_taken': 11.054889917373657}], 'generate_missing_features': [{'input_tokens': 3947, 'output_tokens': 77, 'time_taken': 5.9901769161224365}, {'input_tokens': 3647, 'output_tokens': 77, 'time_taken': 4.54456901550293}], 'store_and_chunk_data': [{'input_tokens': 0, 'output_tokens': 0, 'time_taken': 1.457871913909912}], 'search_missing_features': [{'input_tokens': 0, 'output_tokens': 0, 'time_taken': 17.633229970932007}, {'input_tokens': 0, 'output_tokens': 0, 'time_taken': 37.849796772003174}]}","[3, 3, 3]","[0, 0, 0]"
CAPA13RPH4G-V1605B,"{'name': 'CAPARPHGVB', 'manufacturer': 'AXIOMTEK', 'form_factor': 'Embedded SBC', 'evaluation_or_commercialization': False, 'processor_architecture': 'x86', 'processor_core_count': '10-core', 'processor_manufacturer': 'AMD', 'processor_tdp': '28W', 'memory': 'DDR4 SODIMM, 32GB', 'onboard_storage': 'M.2 Key B SATA', 'input_voltage': '12V DC', 'io_count': ['2x GbE LAN', '4x USB 3.1 Gen1', '2x DisplayPort', '2x HDMI', '1x LVDS', '2x COM', '1x M.2 Key E', '1x M.2 Key B'], 'wireless': '5G with M.2 Key B socket', 'operating_system_bsp': 'Not Available', 'operating_temperature_max': '60°C', 'operating_temperature_min': '-20°C', 'certifications': 'DO-178C/DO-254 certifiable', 'short_summary': 'Embedded SBC with AMD Ryzen V1807B APU, supporting multiple display interfaces and extensive I/O options.', 'full_summary': 'The CAPARPHGVB is an embedded SBC featuring the AMD Ryzen Embedded V1807B APU, offering robust performance with support for quad-view display and a variety of I/O interfaces including DisplayPort, HDMI, LVDS, and multiple USB ports.', 'full_product_description': 'The CAPARPHGVB by Axiomtek is a high-performance embedded SBC powered by the AMD Ryzen Embedded V1807B APU. It supports up to 32GB of DDR4 SODIMM memory and offers a wide range of connectivity options including dual GbE LAN, multiple USB 3.1 Gen1 ports, and dual M.2 slots for expansion. The board is designed for industrial applications with a wide operating temperature range and robust build quality.', 'target_applications': 'Industrial automation, digital signage, and embedded systems requiring high-performance computing and multiple display outputs.'}","{'extract_features': [{'input_tokens': 1645, 'output_tokens': 785, 'time_taken': 10.644347906112671}], 'generate_missing_features': [{'input_tokens': 4158, 'output_tokens': 139, 'time_taken': 3.7653138637542725}, {'input_tokens': 4086, 'output_tokens': 55, 'time_taken': 2.2426071166992188}, {'input_tokens': 4015, 'output_tokens': 65, 'time_taken': 3.781582832336426}, {'input_tokens': 3899, 'output_tokens': 32, 'time_taken': 3.1355738639831543}, {'input_tokens': 3899, 'output_tokens': 32, 'time_taken': 3.6819419860839844}], 'store_and_chunk_data': [{'input_tokens': 0, 'output_tokens': 0, 'time_taken': 3.016573190689087}], 'search_missing_features': [{'input_tokens': 0, 'output_tokens': 0, 'time_taken': 66.97222685813904}, {'input_tokens': 0, 'output_tokens': 0, 'time_taken': 54.1620306968689}, {'input_tokens': 0, 'output_tokens': 0, 'time_taken': 23.357989072799683}, {'input_tokens': 0, 'output_tokens': 0, 'time_taken': 23.409353256225586}, {'input_tokens': 0, 'output_tokens': 0, 'time_taken': 19.072384119033813}]}","[5, 2, 2, 1, 1, 1]","[0, 0, 0, 0, 0, 0]"
SOM-3569CN0C-S1A1,"{'name': 'SOM INTEL ATOM PENTIUM CELERON SERIES QSEVEN CPU MODULE', 'manufacturer': 'ADVANTECH', 'form_factor': 'QSEVEN', 'evaluation_or_commercialization': 'True', 'processor_architecture': 'X86', 'processor_core_count': '4', 'processor_manufacturer': 'INTEL', 'processor_tdp': '6W to 12W', 'memory': 'LPDDR4 8GB', 'onboard_storage': 'eMMC 64GB', 'input_voltage': '12V', 'io_count': ['USB 3.0', 'USB 2.0', 'PCIe', 'HDMI', 'DP', 'LVDS', 'Ethernet'], 'wireless': 'Not Available', 'operating_system_bsp': ['Windows', 'Linux'], 'operating_temperature_max': '85°C', 'operating_temperature_min': '-40°C', 'certifications': 'Not Available', 'short_summary': 'Intel Atom/Pentium/Celeron Qseven CPU module with onboard LPDDR4 and eMMC storage.', 'full_summary': 'The SOM Intel Atom/Pentium/Celeron Series Qseven CPU Module is designed for embedded applications, featuring Intel processors, onboard LPDDR4 memory, and eMMC storage. It supports multiple I/O interfaces including USB, PCIe, HDMI, and Ethernet.', 'full_product_description': 'This module is based on the Intel Atom, Pentium, and Celeron series SoCs, adhering to the Qseven specification. It includes up to 8GB of LPDDR4 memory and 64GB of eMMC storage. The module supports a wide range of interfaces such as USB 3.0, PCIe, HDMI, and Ethernet, making it suitable for various embedded applications. It operates in temperatures ranging from -40°C to 85°C.', 'target_applications': ['Embedded systems', 'Industrial automation', 'IoT devices']}","{'extract_features': [{'input_tokens': 1584, 'output_tokens': 784, 'time_taken': 10.840487957000732}], 'generate_missing_features': [{'input_tokens': 3894, 'output_tokens': 77, 'time_taken': 3.3494319915771484}, {'input_tokens': 4351, 'output_tokens': 52, 'time_taken': 6.289041042327881}, {'input_tokens': 4005, 'output_tokens': 52, 'time_taken': 6.633616924285889}], 'store_and_chunk_data': [{'input_tokens': 0, 'output_tokens': 0, 'time_taken': 3.651352643966675}], 'search_missing_features': [{'input_tokens': 0, 'output_tokens': 0, 'time_taken': 18.449506998062134}, {'input_tokens': 0, 'output_tokens': 0, 'time_taken': 33.184475898742676}, {'input_tokens': 0, 'output_tokens': 0, 'time_taken': 11.201354026794434}]}","[3, 2, 2, 2]","[0, 0, 0, 0]"
SOM-4463D-S8B1E,"{'name': 'SOM B', 'manufacturer': 'ADVANTECH', 'form_factor': 'ETX', 'evaluation_or_commercialization': 'True', 'processor_architecture': 'x86', 'processor_core_count': 'Single Core or Dual Core', 'processor_manufacturer': 'INTEL', 'processor_tdp': 'Not Available', 'memory': 'DDR3, Up to 2 GB', 'onboard_storage': 'eMMC, Optional SSD', 'input_voltage': '5V, 5VSB', 'io_count': 'PATA, SATAII, USB, COM Ports, GPIO', 'wireless': 'WiFi 802.11ac and BT 4.0', 'operating_system_bsp': ['WinCE', 'Win XPE', 'QNX'], 'operating_temperature_max': '60°C', 'operating_temperature_min': '0°C', 'certifications': 'Not Available', 'short_summary': 'ETX CPU module with Intel Atom processor, supporting DDR3 memory and multiple I/O interfaces.', 'full_summary': 'The SOM B is an ETX form factor CPU module featuring Intel Atom processors, supporting DDR3 memory up to 2 GB, and offering a range of I/O interfaces including PATA, SATAII, USB, and COM ports. It is suitable for embedded applications with a focus on flexibility and performance.', 'full_product_description': 'The SOM B module is designed for embedded applications, featuring Intel Atom N and D series processors with single and dual-core options. It supports DDR3 memory up to 2 GB and provides a variety of I/O interfaces such as PATA, SATAII, USB, and COM ports. The module operates within a temperature range of 0°C to 60°C and is compatible with operating systems like WinCE, Win XPE, and QNX.', 'target_applications': ['Embedded Systems', 'Industrial Automation', 'Digital Signage']}","{'extract_features': [{'input_tokens': 1486, 'output_tokens': 737, 'time_taken': 9.580278873443604}], 'generate_missing_features': [{'input_tokens': 3739, 'output_tokens': 118, 'time_taken': 4.225307941436768}, {'input_tokens': 3368, 'output_tokens': 53, 'time_taken': 4.012728929519653}, {'input_tokens': 3707, 'output_tokens': 53, 'time_taken': 3.657663106918335}], 'store_and_chunk_data': [{'input_tokens': 0, 'output_tokens': 0, 'time_taken': 3.6518912315368652}], 'search_missing_features': [{'input_tokens': 0, 'output_tokens': 0, 'time_taken': 62.645654916763306}, {'input_tokens': 0, 'output_tokens': 0, 'time_taken': 52.27976179122925}, {'input_tokens': 0, 'output_tokens': 0, 'time_taken': 27.764140129089355}]}","[4, 2, 2, 2]","[0, 0, 0, 0]"
UPX-TGLCR-A10-0000-0001,{},"{'extract_features': [{'input_tokens': 1788, 'output_tokens': 928, 'time_taken': 10.824396133422852}], 'store_and_chunk_data': [{'input_tokens': 0, 'output_tokens': 0, 'time_taken': 2.8283090591430664}]}",[4],[0]
