id,extracted_data,usage_data,missing_feature_count_history,low_confidence_feature_count_history
SC0564,"{'name': 'COMPUTE MODULE', 'manufacturer': 'RASPBERRY PI TRADING LTD', 'form_factor': 'SODIMM', 'evaluation_or_commercialization': False, 'processor_architecture': 'ARM', 'processor_core_count': 'Quad core', 'processor_manufacturer': 'BROADCOM', 'processor_tdp': 'Not Available', 'memory': '1 GByte LPDDR RAM', 'onboard_storage': '4 GBytes eMMC Flash', 'input_voltage': '3.3V', 'io_count': '48x GPIO', 'wireless': '2.4 GHz, 5.0 GHz IEEE 802.11 b/g/n/ac wireless, Bluetooth 5.0, BLE', 'operating_system_bsp': ['Linux'], 'operating_temperature_max': '85°C', 'operating_temperature_min': '-25°C', 'certifications': 'Certified antenna kit available', 'short_summary': 'Low-cost, low-power, high-reliability compute module with extensive IO options.', 'full_summary': 'The Compute Module is a low-cost, high-reliability module featuring a Broadcom ARM processor, 1GB LPDDR RAM, and 4GB eMMC Flash. It offers extensive IO options and is compatible with the Raspberry Pi hardware and software stack.', 'full_product_description': 'The Raspberry Pi Compute Module is designed for custom systems and form factors, leveraging the Raspberry Pi hardware and software stack. It includes a Broadcom ARM processor, 1GB LPDDR RAM, and 4GB eMMC Flash. The module supports a wide range of peripherals and interfaces, including HDMI, USB, and various GPIO options.', 'target_applications': ['Custom systems', 'Embedded applications', 'Industrial automation']}","{'extract_features': [{'input_tokens': 3894, 'output_tokens': 687, 'time_taken': 8.550927877426147}], 'generate_missing_features': [{'input_tokens': 4053, 'output_tokens': 134, 'time_taken': 3.51491117477417}, {'input_tokens': 3906, 'output_tokens': 30, 'time_taken': 2.617476224899292}, {'input_tokens': 3645, 'output_tokens': 30, 'time_taken': 2.051750898361206}], 'search_missing_features': [{'input_tokens': 0, 'output_tokens': 0, 'time_taken': 27.23550319671631}, {'input_tokens': 0, 'output_tokens': 0, 'time_taken': 17.26714015007019}, {'input_tokens': 0, 'output_tokens': 0, 'time_taken': 16.80948781967163}], 'store_and_chunk_data': [{'input_tokens': 0, 'output_tokens': 0, 'time_taken': 0.9655606746673584}]}","[4, 1, 1, 1]","[0, 0, 0, 0]"
ED-IPC2010-0108,"{'name': 'EDIPC SERIES', 'manufacturer': 'EDA TECHNOLOGY CO LTD', 'form_factor': 'RASPBERRY PI', 'evaluation_or_commercialization': False, 'processor_architecture': 'ARM', 'processor_core_count': '4', 'processor_manufacturer': 'BROADCOM', 'processor_tdp': 'Not Available', 'memory': '1GB, 2GB, 4GB, 8GB LPDDR4', 'onboard_storage': '8GB, 16GB, 32GB eMMC', 'input_voltage': '12V', 'io_count': 'HDMI, USB, Ethernet, Micro SD, GPIO', 'wireless': ['Wi-Fi', 'Bluetooth'], 'operating_system_bsp': 'Raspberry Pi OS', 'operating_temperature_max': '70°C', 'operating_temperature_min': '-20°C', 'certifications': 'Not Available', 'short_summary': 'The EDIPC Series is an industrial computer based on Raspberry Pi CM, designed for enhanced heat dissipation and industrial applications.', 'full_summary': 'The EDIPC Series offers a robust industrial computing solution with enhanced heat dissipation, onboard encryption, and compatibility with Raspberry Pi hardware and software. It supports various interfaces including HDMI, USB, and Ethernet, and offers optional Wi-Fi and Bluetooth connectivity.', 'full_product_description': 'The EDIPC Series is designed for industrial applications, featuring a Broadcom BCM processor with ARM Cortex-A architecture. It supports up to 8GB of LPDDR4 RAM and up to 32GB of eMMC storage. The device includes multiple I/O options such as HDMI, USB, and Ethernet, and supports optional wireless communication. It is housed in an aluminum alloy case for improved heat dissipation.', 'target_applications': ['Multimedia entertainment', 'AI development', 'Intelligent instruments', 'Panoramic display', 'Intelligent life']}","{'extract_features': [{'input_tokens': 3555, 'output_tokens': 745, 'time_taken': 8.180449962615967}], 'generate_missing_features': [{'input_tokens': 3550, 'output_tokens': 53, 'time_taken': 3.272150993347168}, {'input_tokens': 3918, 'output_tokens': 53, 'time_taken': 2.2571189403533936}], 'search_missing_features': [{'input_tokens': 0, 'output_tokens': 0, 'time_taken': 165.0187737941742}, {'input_tokens': 0, 'output_tokens': 0, 'time_taken': 9.409352779388428}], 'store_and_chunk_data': [{'input_tokens': 0, 'output_tokens': 0, 'time_taken': 0.7766232490539551}]}","[2, 2, 2]","[0, 0, 0]"
TX6Q-1010,"{'name': 'TXCOM MODULE', 'manufacturer': 'KARO ELECTRONICS GMBH', 'form_factor': 'SODIMM', 'evaluation_or_commercialization': False, 'processor_architecture': 'ARM', 'processor_core_count': '4', 'processor_manufacturer': 'NXP', 'processor_tdp': 'Not Available', 'memory': '1 GB DDR3 SDRAM', 'onboard_storage': '2 GB SLC NAND Flash', 'input_voltage': '5V', 'io_count': ['2 x USB', '1 x Ethernet', '2 x Camera Interfaces', '1 x PCIe', '1 x SATA', '1 x LVDS'], 'wireless': 'Not Available', 'operating_system_bsp': ['Linux', 'Windows Embedded Compact', 'Android', 'QNX'], 'operating_temperature_max': '85°C', 'operating_temperature_min': '-40°C', 'certifications': 'Not Available', 'short_summary': 'The TXCOM Module is a compact, high-performance computer-on-module featuring an NXP iMX Quad ARM Cortex-A processor, designed for embedded applications.', 'full_summary': 'The TXCOM Module by KaRo Electronics is a highly integrated computer-on-module with a quad-core ARM Cortex-A processor from NXP, offering robust multimedia capabilities, including HD video decoding/encoding and 3D graphics acceleration. It supports multiple operating systems and is suitable for a wide range of embedded applications.', 'full_product_description': 'The TXCOM Module is designed for high-performance embedded applications, featuring an NXP iMX Quad ARM Cortex-A processor with 1 GHz speed, 1 GB DDR3 SDRAM, and 2 GB SLC NAND Flash. It includes a variety of interfaces such as USB, Ethernet, PCIe, SATA, and LVDS, making it versatile for various industrial applications. The module supports operating temperatures from -40°C to 85°C, making it suitable for extended consumer and industrial grade applications.', 'target_applications': ['Embedded systems', 'Industrial automation', 'Multimedia processing', 'Consumer electronics']}","{'extract_features': [{'input_tokens': 3923, 'output_tokens': 809, 'time_taken': 9.819184303283691}], 'generate_missing_features': [{'input_tokens': 4583, 'output_tokens': 76, 'time_taken': 6.7688891887664795}, {'input_tokens': 4585, 'output_tokens': 76, 'time_taken': 3.821974039077759}], 'search_missing_features': [{'input_tokens': 0, 'output_tokens': 0, 'time_taken': 18.543009042739868}, {'input_tokens': 0, 'output_tokens': 0, 'time_taken': 19.932425260543823}], 'store_and_chunk_data': [{'input_tokens': 0, 'output_tokens': 0, 'time_taken': 1.2668960094451904}]}","[3, 3, 3]","[0, 0, 0]"
MIC-720AI-00A1,{},"{'extract_features': [{'input_tokens': 3950, 'output_tokens': 752, 'time_taken': 10.663583993911743}], 'store_and_chunk_data': [{'input_tokens': 0, 'output_tokens': 0, 'time_taken': 0.9731838703155518}]}",[3],[0]
TE0726-03-11C64-A,"{'name': 'TE ZYNQBERRY', 'manufacturer': 'TRENZ ELECTRONIC', 'form_factor': 'RASPBERRY PI', 'evaluation_or_commercialization': False, 'processor_architecture': 'ARM', 'processor_core_count': '2', 'processor_manufacturer': 'XILINX', 'processor_tdp': 'Not Available', 'memory': '512 MByte DDR3L SDRAM', 'onboard_storage': '16 MByte Flash', 'input_voltage': '5V', 'io_count': 'Not Available', 'wireless': 'Not Available', 'operating_system_bsp': 'Linux', 'operating_temperature_max': 'Not Available', 'operating_temperature_min': 'Not Available', 'certifications': 'REACH, RoHS, WEEE', 'short_summary': 'Industrial-grade Raspberry Pi form-factor compatible FPGA SoM based on Xilinx Zynq SoC.', 'full_summary': 'The TE ZynqBerry is an industrial-grade System on Module (SoM) in a Raspberry Pi form factor, featuring a Xilinx Zynq SoC, 512 MByte DDR3L SDRAM, and 16 MByte Flash memory. It supports a variety of interfaces including HDMI, USB, Ethernet, and more.', 'full_product_description': 'The Trenz Electronic TE ZynqBerry is a compact System on Module (SoM) designed for industrial applications, compatible with the Raspberry Pi form factor. It is built around the Xilinx Zynq SoC, offering a combination of ARM processing and FPGA capabilities. The module includes 512 MByte DDR3L SDRAM, 16 MByte Flash memory, and supports multiple interfaces such as HDMI, USB, Ethernet, and more, making it suitable for a wide range of applications.', 'target_applications': 'Industrial automation, embedded systems, prototyping, and educational purposes.'}","{'extract_features': [{'input_tokens': 3919, 'output_tokens': 743, 'time_taken': 8.060027122497559}], 'generate_missing_features': [{'input_tokens': 4055, 'output_tokens': 151, 'time_taken': 3.706256151199341}, {'input_tokens': 4632, 'output_tokens': 126, 'time_taken': 2.682426929473877}, {'input_tokens': 4632, 'output_tokens': 126, 'time_taken': 4.672252178192139}], 'search_missing_features': [{'input_tokens': 0, 'output_tokens': 0, 'time_taken': 10.515606164932251}, {'input_tokens': 0, 'output_tokens': 0, 'time_taken': 18.879850149154663}, {'input_tokens': 0, 'output_tokens': 0, 'time_taken': 11.284668922424316}], 'store_and_chunk_data': [{'input_tokens': 0, 'output_tokens': 0, 'time_taken': 0.8982820510864258}]}","[6, 5, 5, 5]","[0, 0, 0, 0]"
