id,extracted_data,usage_data,missing_feature_count_history,low_confidence_feature_count_history
AIMB-585WG2-SVA2E,"{'name': 'AIMBSV', 'manufacturer': 'ADVANTECH', 'form_factor': 'MICROATX', 'evaluation_or_commercialization': False, 'processor_architecture': 'X86', 'processor_core_count': 'Up to 24Core', 'processor_manufacturer': 'INTEL', 'processor_tdp': '95W', 'memory': 'Up to 64GB DDR4 2666MHz SDRAM', 'onboard_storage': 'M.2 M key for NVMe SSD', 'input_voltage': '12V', 'io_count': ['2x GbE LAN', '6x USB 3.0', '4x USB 2.0', '4x SATA III', '1x HDMI', '1x VGA', '1x DVI-D', '1x DisplayPort'], 'wireless': 'M.2 E key for wireless', 'operating_system_bsp': ['Windows 10 IoT Enterprise'], 'operating_temperature_max': '60°C', 'operating_temperature_min': '0°C', 'certifications': ['RoHS COMPLIANT'], 'short_summary': 'Industrial motherboard supporting Intel Xeon and Core processors with multiple display outputs and extensive I/O options.', 'full_summary': 'The AIMBSV is an industrial-grade motherboard designed for high-performance applications, supporting Intel Xeon and Core processors. It features multiple display outputs including HDMI, VGA, DVI-D, and DisplayPort, along with extensive I/O options such as dual GbE LAN, USB 3.0, and SATA III.', 'full_product_description': ""The AIMBSV motherboard by Advantech is built for industrial applications, offering support for Intel's Xeon and Core processors. It includes four DIMM sockets for up to 64GB of DDR4 2666MHz SDRAM, and features a variety of display outputs including HDMI, VGA, DVI-D, and DisplayPort. The board supports dual GbE LAN, multiple USB ports, and SATA III for storage. It is compliant with RoHS standards and is designed to operate in temperatures ranging from 0°C to 60°C."", 'target_applications': ['Industrial Automation', 'Embedded Systems', 'Digital Signage', 'Network Security']}","{'generate_missing_features': [{'input_tokens': 3571, 'output_tokens': 98, 'time_taken': 2.734623908996582}], 'store_and_chunk_data': [{'input_tokens': 0, 'output_tokens': 0, 'time_taken': 0.7584750652313232}], 'extract_features': [{'input_tokens': 1830, 'output_tokens': 829, 'time_taken': 9.5106942653656}], 'search_missing_features': [{'input_tokens': 0, 'output_tokens': 0, 'time_taken': 19.622195959091187}]}","[3, 0]","[0, 0]"
WAFER-ULT3-C-R10,"{'name': 'WAFERULT', 'manufacturer': 'IEI', 'form_factor': 'Single Board Computer', 'evaluation_or_commercialization': False, 'processor_architecture': 'x86', 'processor_core_count': '2', 'processor_manufacturer': 'Intel', 'processor_tdp': '15W', 'memory': '8GB DDR3 SDRAM', 'onboard_storage': 'eMMC 5.0 high-speed drive 32GB soldered on board', 'input_voltage': '12V DC', 'io_count': 'Multiple USB, SATA, COM, Ethernet ports', 'wireless': 'Wi-Fi and Bluetooth modules via PCIe interfaces', 'operating_system_bsp': 'Windows 10 and Linux', 'operating_temperature_max': '60°C', 'operating_temperature_min': '0°C', 'certifications': 'CE, FCC', 'short_summary': 'Single Board Computer with Intel ULT Processor, Triple Display Support, and Dual GbE LAN.', 'full_summary': ""The WAFERULT is a single board computer featuring Intel's ULT processors, supporting DDR3 SODIMM memory, triple display outputs, and dual GbE LAN. It is designed for industrial applications with a wide range of I/O interfaces."", 'full_product_description': ""The WAFERULT series supports Intel's 6th generation ULT processors, offering dual-core performance with low power consumption. It includes multiple display outputs (VGA, HDMI, LVDS), dual GbE LAN, and various I/O interfaces such as USB, SATA, and COM ports. The board is compliant with CE and FCC standards, making it suitable for industrial environments."", 'target_applications': 'Industrial automation, digital signage, transportation systems.'}","{'generate_missing_features': [{'input_tokens': 3557, 'output_tokens': 109, 'time_taken': 3.956782102584839}], 'store_and_chunk_data': [{'input_tokens': 0, 'output_tokens': 0, 'time_taken': 0.7114338874816895}], 'extract_features': [{'input_tokens': 1965, 'output_tokens': 690, 'time_taken': 7.186628818511963}], 'search_missing_features': [{'input_tokens': 0, 'output_tokens': 0, 'time_taken': 14.705996751785278}]}","[3, 0]","[0, 0]"
ASMB-816-00A1,"{'name': 'ASMB-TA', 'manufacturer': 'ADVANTECH', 'form_factor': 'ATX', 'evaluation_or_commercialization': False, 'processor_architecture': 'x86', 'processor_core_count': 'Not Available', 'processor_manufacturer': 'INTEL', 'processor_tdp': '205W', 'memory': 'DDR4 ECC REG 3200 MHz RDIMM/LRDIMM', 'onboard_storage': '64G eMMC', 'input_voltage': '10 ~ 36 VDC', 'io_count': 'Not Available', 'wireless': 'Wi-Fi, LTE & GPS expansion', 'operating_system_bsp': 'Microsoft Azure IoT Edge and Amazon AWS IoT Greengrass', 'operating_temperature_max': '60°C', 'operating_temperature_min': '0°C', 'certifications': 'C1D2, ATEX, IECEx', 'short_summary': 'ATX server board supporting Intel 3rd Gen Xeon Scalable processors with DDR4 ECC memory and multiple PCIe slots.', 'full_summary': 'The ASMB-TA is an ATX server board designed for Intel 3rd Gen Xeon Scalable processors, featuring DDR4 ECC REG memory support, multiple PCIe slots, dual GbE LAN, and a range of I/O connectors.', 'full_product_description': 'The ASMB-TA server board by Advantech supports Intel 3rd Gen Xeon Scalable processors with a maximum memory capacity of 2TB using DDR4 ECC REG RDIMM/LRDIMM. It includes multiple PCIe slots for expansion, dual Intel X550-AT2 GbE ports, and various onboard I/O connectors. The board is designed for high-performance server applications with a robust power design supporting up to 205W TDP processors.', 'target_applications': ['Data centers', 'Enterprise servers', 'High-performance computing']}","{'generate_missing_features': [{'input_tokens': 4450, 'output_tokens': 236, 'time_taken': 5.985635995864868}, {'input_tokens': 4582, 'output_tokens': 79, 'time_taken': 7.172874927520752}, {'input_tokens': 4560, 'output_tokens': 53, 'time_taken': 3.923574924468994}, {'input_tokens': 4492, 'output_tokens': 53, 'time_taken': 2.9137630462646484}], 'store_and_chunk_data': [{'input_tokens': 0, 'output_tokens': 0, 'time_taken': 0.6443829536437988}], 'extract_features': [{'input_tokens': 1847, 'output_tokens': 712, 'time_taken': 7.9630961418151855}], 'search_missing_features': [{'input_tokens': 0, 'output_tokens': 0, 'time_taken': 14.822351932525635}, {'input_tokens': 0, 'output_tokens': 0, 'time_taken': 19.05890703201294}, {'input_tokens': 0, 'output_tokens': 0, 'time_taken': 15.457262754440308}, {'input_tokens': 0, 'output_tokens': 0, 'time_taken': 23.63041090965271}]}","[8, 3, 2, 2, 2]","[0, 0, 0, 0, 0]"
ROM-5720CD-PEA1E,"{'name': 'ROM NXP IMXM CORTEXA SMARC COMPUTERONMODULE', 'manufacturer': 'ADVANTECH', 'form_factor': 'SMARC', 'evaluation_or_commercialization': False, 'processor_architecture': 'ARM', 'processor_core_count': 'Dual/Quad', 'processor_manufacturer': 'NXP', 'processor_tdp': 'Not Available', 'memory': '4 GB LPDDR4', 'onboard_storage': '16 GB eMMC', 'input_voltage': '5V DC', 'io_count': ['1x HDMI', '2x USB', '1x USB OTG', '2x UART', '1x PCIe', '2x MIPI CSI', '1x Gigabit LAN'], 'wireless': '802.11 a/b/g/n/ac, Bluetooth 4.1', 'operating_system_bsp': ['Linux', 'Android'], 'operating_temperature_max': '85°C', 'operating_temperature_min': '-40°C', 'certifications': ['RoHS', 'CE', 'FCC Class B'], 'short_summary': 'Advantech ROM NXP iMXM SMARC module with dual/quad ARM Cortex-A cores, ideal for embedded applications.', 'full_summary': 'The Advantech ROM NXP iMXM SMARC Computer-on-Module features dual/quad ARM Cortex-A cores, onboard 4GB LPDDR4 memory, and 16GB eMMC storage. It supports Linux and Android BSPs, making it suitable for a variety of embedded applications.', 'full_product_description': ""Advantech's ROM NXP iMXM SMARC Computer-on-Module is powered by NXP's iMXM SoC, featuring dual/quad-core ARM Cortex-A processors and a Cortex-M real-time processor. It includes a Vivante GC7000Lite 3D graphics engine, supports multiple I/O interfaces including HDMI, USB, PCIe, and MIPI CSI, and is designed for low power consumption. The module is compliant with SMARC standards and supports a wide range of operating temperatures, making it ideal for industrial and embedded applications."", 'target_applications': ['Transportation', 'Infotainment', 'Vending', 'Medical']}","{'generate_missing_features': [{'input_tokens': 3348, 'output_tokens': 67, 'time_taken': 2.7324979305267334}, {'input_tokens': 3660, 'output_tokens': 30, 'time_taken': 3.262453079223633}, {'input_tokens': 3660, 'output_tokens': 30, 'time_taken': 2.896265983581543}], 'store_and_chunk_data': [{'input_tokens': 0, 'output_tokens': 0, 'time_taken': 0.7825968265533447}], 'extract_features': [{'input_tokens': 1808, 'output_tokens': 830, 'time_taken': 8.509554147720337}], 'search_missing_features': [{'input_tokens': 0, 'output_tokens': 0, 'time_taken': 14.871248960494995}, {'input_tokens': 0, 'output_tokens': 0, 'time_taken': 183.94652009010315}, {'input_tokens': 0, 'output_tokens': 0, 'time_taken': 18.27550220489502}]}","[2, 1, 1, 1]","[0, 0, 0, 0]"
ASMB-923-00A1E,"{'name': 'EATX SERVER BOARD', 'manufacturer': 'ADVANTECH', 'form_factor': 'EATX', 'evaluation_or_commercialization': False, 'processor_architecture': 'x86', 'processor_core_count': 'Up to 60 cores', 'processor_manufacturer': 'INTEL', 'processor_tdp': 'Up to 250W', 'memory': 'DDR4 ECC REG 2933 MHz, up to 768 GB', 'onboard_storage': '9 x SATA3 ports + 1 x M.2 2280 (PCIe+SATA)', 'input_voltage': '3.3V/5V/5Vsb/12V/12V_8P', 'io_count': ['PCIe x16 slots', 'PCIe x8 slots', 'USB ports', 'SATA ports', 'LAN ports'], 'wireless': 'Not Available', 'operating_system_bsp': 'Not Available', 'operating_temperature_max': '40 °C', 'operating_temperature_min': '0 °C', 'certifications': 'CE/FCC', 'short_summary': 'EATX server board with dual Intel Xeon support, extensive I/O options, and high memory capacity.', 'full_summary': 'The EATX Server Board by Advantech supports dual Intel Xeon E5-2600 v4/v3 processors, offers high memory capacity with DDR4 ECC REG support, and features multiple PCIe slots for expansion. It is designed for robust server applications with comprehensive I/O connectivity.', 'full_product_description': ""Advantech's EATX Server Board is engineered for high-performance server applications, supporting dual Intel Xeon E5-2600 v4/v3 processors. It features an Extended ATX form factor, with a maximum memory capacity of 768 GB DDR4 ECC REG. The board includes multiple PCIe slots, USB ports, and SATA ports, providing extensive connectivity options. It is equipped with Intel C612 chipset and supports Intel Rapid Storage Technology."", 'target_applications': ['Data centers', 'Enterprise servers', 'High-performance computing']}","{'generate_missing_features': [{'input_tokens': 4235, 'output_tokens': 307, 'time_taken': 6.676058053970337}, {'input_tokens': 3983, 'output_tokens': 79, 'time_taken': 3.3258140087127686}, {'input_tokens': 3842, 'output_tokens': 81, 'time_taken': 2.738231897354126}, {'input_tokens': 3766, 'output_tokens': 55, 'time_taken': 3.775861978530884}, {'input_tokens': 3766, 'output_tokens': 55, 'time_taken': 3.334160089492798}], 'store_and_chunk_data': [{'input_tokens': 0, 'output_tokens': 0, 'time_taken': 0.7084159851074219}], 'extract_features': [{'input_tokens': 1715, 'output_tokens': 745, 'time_taken': 7.642196893692017}], 'search_missing_features': [{'input_tokens': 0, 'output_tokens': 0, 'time_taken': 13.135374784469604}, {'input_tokens': 0, 'output_tokens': 0, 'time_taken': 60.70833683013916}, {'input_tokens': 0, 'output_tokens': 0, 'time_taken': 11.566344022750854}, {'input_tokens': 0, 'output_tokens': 0, 'time_taken': 20.221922159194946}, {'input_tokens': 0, 'output_tokens': 0, 'time_taken': 15.628237009048462}]}","[10, 3, 3, 2, 2, 2]","[0, 0, 0, 0, 0, 0]"
