id,extracted_data,usage_data,missing_feature_count_history,low_confidence_feature_count_history
SRT6442W00D01GE008P02I0,"{'name': 'HUMMINGBOARD T', 'manufacturer': 'SOLIDRUN', 'form_factor': 'SBC', 'evaluation_or_commercialization': False, 'processor_architecture': 'ARM', 'processor_core_count': '2', 'processor_manufacturer': 'TI', 'processor_tdp': 'Not Available', 'memory': '2 GB DDR3', 'onboard_storage': '8 GB eMMC', 'input_voltage': '12V', 'io_count': 'USB Type A, CANFD, RS, GPIO, SPI, I2C', 'wireless': 'LTE supported via M.2 slot', 'operating_system_bsp': 'Optimized BSP', 'operating_temperature_max': '70°C', 'operating_temperature_min': '-40°C', 'certifications': 'Not Available', 'short_summary': 'HummingBoard T is designed for industrial applications with real-time processing and multiprotocol industrial Ethernet support.', 'full_summary': 'The HummingBoard T features a TI Sitara AM processor with dual-core ARM Cortex-A9, supporting industrial protocols and real-time processing. It includes multiple I/O options and expansion capabilities.', 'full_product_description': 'HummingBoard T is equipped with a TI Sitara AM processor, dual-core ARM Cortex-A9, and supports industrial protocols like TSN, EtherCAT, PROFINET, and EtherNet/IP. It offers 2 GB DDR3 memory, optional 8 GB eMMC storage, and various I/O interfaces including USB, CANFD, and RS. The board supports LTE via an M.2 slot and operates within a temperature range of -40°C to 70°C.', 'target_applications': 'Industrial applications, real-time processing, multiprotocol industrial Ethernet.'}","{'extract_features': [{'input_tokens': 1023, 'output_tokens': 719, 'time_taken': 10.218321323394775}], 'store_and_chunk_data': [{'input_tokens': 0, 'output_tokens': 0, 'time_taken': 1.6235790252685547}], 'search_missing_features': [{'input_tokens': 0, 'output_tokens': 0, 'time_taken': 22.10526394844055}, {'input_tokens': 0, 'output_tokens': 0, 'time_taken': 20.04080104827881}, {'input_tokens': 0, 'output_tokens': 0, 'time_taken': 14.147078275680542}], 'generate_missing_features': [{'input_tokens': 3456, 'output_tokens': 82, 'time_taken': 3.447209119796753}, {'input_tokens': 3183, 'output_tokens': 53, 'time_taken': 2.28157377243042}, {'input_tokens': 3183, 'output_tokens': 53, 'time_taken': 2.992478847503662}]}","[3, 2, 2, 2]","[0, 0, 0, 0]"
KEIL00 PK51 DEV KIT PRO KEIL-NL 1YR,{},"{'extract_features': [{'input_tokens': 800, 'output_tokens': 504, 'time_taken': 6.79188084602356}], 'store_and_chunk_data': [{'input_tokens': 0, 'output_tokens': 0, 'time_taken': 1.7452328205108643}]}",[19],[0]
SRS9130S00D04GE008P02CE,"{'name': 'CLEARFOG CN PRO', 'manufacturer': 'SOLIDRUN', 'form_factor': 'SBC', 'evaluation_or_commercialization': False, 'processor_architecture': 'ARM', 'processor_core_count': 'Quad core', 'processor_manufacturer': 'MARVELL', 'processor_tdp': 'Not Available', 'memory': 'Up to 16 GB DDR4', 'onboard_storage': '8 GB eMMC', 'input_voltage': '12V', 'io_count': 'USB, Ethernet, SFP, Micro USB, JTAG', 'wireless': 'Not Available', 'operating_system_bsp': 'Linux', 'operating_temperature_max': '70°C', 'operating_temperature_min': '0°C', 'certifications': 'Not Available', 'short_summary': 'ClearFog CN Pro is a powerful SBC with Marvell OCTEON CN processor, supporting up to 16 GB DDR4 memory and 8 GB eMMC storage.', 'full_summary': 'The ClearFog CN Pro is designed for commercial applications, featuring a Marvell OCTEON CN Quad core ARM Cortex-A processor, up to 16 GB DDR4 memory, and 8 GB eMMC storage. It supports various I/O interfaces including USB, Ethernet, and SFP.', 'full_product_description': 'ClearFog CN Pro is a robust single-board computer (SBC) powered by a Marvell OCTEON CN Quad core ARM Cortex-A processor. It offers up to 16 GB of DDR4 memory and 8 GB of eMMC storage. The board includes multiple I/O options such as USB, Ethernet, SFP, and Micro USB, making it suitable for a wide range of applications. It operates within a commercial temperature range of 0°C to 70°C.', 'target_applications': 'Commercial applications requiring robust processing and versatile I/O options.'}","{'extract_features': [{'input_tokens': 1026, 'output_tokens': 744, 'time_taken': 10.943026304244995}], 'store_and_chunk_data': [{'input_tokens': 0, 'output_tokens': 0, 'time_taken': 1.7440340518951416}], 'search_missing_features': [{'input_tokens': 0, 'output_tokens': 0, 'time_taken': 18.324404001235962}, {'input_tokens': 0, 'output_tokens': 0, 'time_taken': 16.482324361801147}, {'input_tokens': 0, 'output_tokens': 0, 'time_taken': 18.854145050048828}], 'generate_missing_features': [{'input_tokens': 4306, 'output_tokens': 78, 'time_taken': 3.526684284210205}, {'input_tokens': 4129, 'output_tokens': 53, 'time_taken': 3.3968498706817627}, {'input_tokens': 4129, 'output_tokens': 53, 'time_taken': 3.590280055999756}]}","[3, 2, 2, 2]","[0, 1, 1, 1]"
FORLINX-OKT507-C+152GSE8GIA10I11,{},"{'extract_features': [{'input_tokens': 1149, 'output_tokens': 733, 'time_taken': 10.19009804725647}], 'store_and_chunk_data': [{'input_tokens': 0, 'output_tokens': 0, 'time_taken': 1.657729148864746}]}",[4],[0]
BK-DEVKIT-SM,"{'name': 'COIN CELL BATTERY HOLDERS', 'manufacturer': 'MPD', 'form_factor': 'SURFACE MOUNTING', 'evaluation_or_commercialization': False, 'processor_architecture': 'Not Available', 'processor_core_count': 'Not Available', 'processor_manufacturer': 'Not Available', 'processor_tdp': 'Not Available', 'memory': 'Not Available', 'onboard_storage': 'Not Available', 'input_voltage': 'Not Available', 'io_count': 'Not Available', 'wireless': 'Not Available', 'operating_system_bsp': 'Not Available', 'operating_temperature_max': 'Not Available', 'operating_temperature_min': 'Not Available', 'certifications': 'Not Available', 'short_summary': ""MPD's development kit includes surface mounting coin cell battery holders for various sizes."", 'full_summary': 'The kit offers a wide diversity of battery holders, retainers, and gliders for CR lithium batteries, accommodating various shape requirements.', 'full_product_description': ""MPD's new development kit includes surface mounting coin cell battery holders with advanced technologies. It offers a wide range of popular sizes, including 12mm, 16mm, 20mm, and 24mm diameters, to accommodate various shape requirements. The kit includes pieces for multiple choices of mounting CR lithium batteries, providing designers with numerous options. The gliders offer a hybrid retainer holder with price competitiveness and reliable connection. The retainers offer ultra-low profile variations, accepting cells of 12mm to 24mm diameter, with surface mounting positive contacts to place the lithium battery directly on the PCB pad, reducing height."", 'target_applications': 'Everyday products requiring lithium coin cell batteries.'}","{'extract_features': [{'input_tokens': 943, 'output_tokens': 690, 'time_taken': 11.29647183418274}], 'store_and_chunk_data': [{'input_tokens': 0, 'output_tokens': 0, 'time_taken': 1.6644389629364014}], 'search_missing_features': [{'input_tokens': 0, 'output_tokens': 0, 'time_taken': 15.91492509841919}, {'input_tokens': 0, 'output_tokens': 0, 'time_taken': 10.931185245513916}], 'generate_missing_features': [{'input_tokens': 4081, 'output_tokens': 316, 'time_taken': 7.147873163223267}, {'input_tokens': 4081, 'output_tokens': 316, 'time_taken': 7.6453282833099365}]}","[13, 13, 13]","[0, 0, 0]"
