id,extracted_data,usage_data,missing_feature_count_history,low_confidence_feature_count_history
MIO-5152N-U6A1,"{'name': 'MIO', 'manufacturer': 'ADVANTECH', 'form_factor': 'SBC', 'evaluation_or_commercialization': False, 'processor_architecture': 'x86', 'processor_core_count': 'Quad/Dual', 'processor_manufacturer': 'INTEL', 'processor_tdp': '6W/10W', 'memory': 'DDR4, 8GB', 'onboard_storage': 'eMMC up to 64GB', 'input_voltage': '12V DC', 'io_count': ['2x Ethernet', '4x USB', '2x RS-232', '1x RS-485', 'GPIO'], 'wireless': 'Not Available', 'operating_system_bsp': ['Windows 10 LTSC', 'Ubuntu 20.04 LTS', 'Yocto'], 'operating_temperature_max': '60°C', 'operating_temperature_min': '-20°C', 'certifications': ['CE', 'FCC Class B'], 'short_summary': 'MIO SBC with Intel Celeron and Atom processors, supporting multiple OS and rich I/O.', 'full_summary': 'The MIO SBC features Intel Celeron J/N and Atom xE processors, offering quad/dual-core performance with a TDP of 6W/10W. It supports DDR4 memory up to 8GB and provides extensive I/O options including Ethernet, USB, and serial ports. Compatible with Windows 10 LTSC, Ubuntu 20.04 LTS, and Yocto.', 'full_product_description': ""Advantech's MIO series SBCs are designed for industrial applications, featuring Intel Celeron and Atom processors. They offer robust performance with low power consumption, supporting up to 8GB DDR4 memory. The boards provide a variety of I/O interfaces, including dual Ethernet, multiple USB ports, and serial communication options. They are suitable for harsh environments with an operating temperature range of -20°C to 60°C and are certified for CE and FCC Class B standards."", 'target_applications': ['Industrial Automation', 'Embedded Systems', 'IoT Gateways']}","{'extract_features': [{'input_tokens': 1645, 'output_tokens': 810, 'time_taken': 9.363957166671753}], 'generate_missing_features': [{'input_tokens': 4117, 'output_tokens': 60, 'time_taken': 8.590712070465088}, {'input_tokens': 4002, 'output_tokens': 29, 'time_taken': 7.3824622631073}, {'input_tokens': 4002, 'output_tokens': 29, 'time_taken': 5.3648600578308105}], 'store_and_chunk_data': [{'input_tokens': 0, 'output_tokens': 0, 'time_taken': 0.7248990535736084}], 'search_missing_features': [{'input_tokens': 0, 'output_tokens': 0, 'time_taken': 470.11448407173157}, {'input_tokens': 0, 'output_tokens': 0, 'time_taken': 18.88384985923767}, {'input_tokens': 0, 'output_tokens': 0, 'time_taken': 15.737083196640015}]}","[2, 1, 1, 1]","[0, 0, 0, 0]"
ARK-1503F-D4A1E,"{'name': 'ARK', 'manufacturer': 'ADVANTECH', 'form_factor': 'Embedded IPC', 'evaluation_or_commercialization': False, 'processor_architecture': 'x86', 'processor_core_count': 'Dual core', 'processor_manufacturer': 'INTEL', 'processor_tdp': '35 watts', 'memory': 'Single channel DDR2 667 MHz, Up to 2GB', 'onboard_storage': 'Supports SATA HDD and CompactFlash', 'input_voltage': '12 VDC', 'io_count': ['2 x RS-232', '2 x RS-232/422/485', '6 x USB 2.0', '2 x LAN'], 'wireless': 'Supports WLAN via Mini PCIe', 'operating_system_bsp': ['Microsoft Windows XP Professional', 'XP Embedded'], 'operating_temperature_max': '60°C', 'operating_temperature_min': '-20°C', 'certifications': ['CE', 'FCC Class A', 'BSMI', 'CCC', 'KCC', 'UL', 'RoHS COMPLIANT'], 'short_summary': 'Fanless Embedded IPC with Intel Atom D510, compact design, supports multiple I/O interfaces.', 'full_summary': 'The ARK is a fanless embedded IPC featuring an Intel Atom D510 processor, designed for industrial applications with a compact and sealed construction. It supports a variety of I/O interfaces including RS-232, USB, and LAN, and offers expansion options via Mini PCIe.', 'full_product_description': 'The ARK series from Advantech is a robust embedded IPC solution, powered by the Intel Atom D510 processor. It is designed for industrial environments, offering fanless operation and a compact form factor. The system supports integrated LVDS interfaces, multiple USB ports, and dual LAN connectivity. It also provides expansion capabilities through a Mini PCIe slot, making it suitable for a range of industrial applications.', 'target_applications': ['Industrial Automation', 'Embedded Systems', 'Commercial Applications']}","{'extract_features': [{'input_tokens': 1502, 'output_tokens': 799, 'time_taken': 10.374212741851807}], 'generate_missing_features': [{'input_tokens': 4037, 'output_tokens': 58, 'time_taken': 3.6202502250671387}], 'store_and_chunk_data': [{'input_tokens': 0, 'output_tokens': 0, 'time_taken': 0.709244966506958}], 'search_missing_features': [{'input_tokens': 0, 'output_tokens': 0, 'time_taken': 29.728750944137573}]}","[2, 0]","[0, 0]"
IMB-Q770-R10,"{'name': 'IMBQR', 'manufacturer': 'IEI', 'form_factor': 'MICROATX', 'evaluation_or_commercialization': False, 'processor_architecture': 'X86', 'processor_core_count': '4', 'processor_manufacturer': 'INTEL', 'processor_tdp': 'Not Available', 'memory': 'Supports up to 32GB DDR3 1600MHz', 'onboard_storage': 'Not Available', 'input_voltage': 'ATX power supply', 'io_count': '10 Serial Ports, 6 USB Ports, 6 SATA Ports', 'wireless': 'Not Available', 'operating_system_bsp': 'Not Available', 'operating_temperature_max': '60°C', 'operating_temperature_min': '0°C', 'certifications': 'RoHS', 'short_summary': 'The IMBQR is a microATX motherboard supporting Intel Core i3 processors with multiple display outputs and extensive I/O options.', 'full_summary': 'The IMBQR microATX motherboard supports Intel Core i3 processors, offering dual-channel DDR3 memory, multiple display outputs including HDMI and DVI, dual Intel PCIe GbE, and extensive I/O options including 10 serial ports and 6 USB ports.', 'full_product_description': 'The IMBQR is a microATX motherboard designed for industrial applications, supporting Intel Core i3 processors with a maximum of 32GB DDR3 memory. It features dual HDMI and DVI display outputs, dual Intel PCIe GbE, and a wide range of I/O interfaces including 10 serial ports, 6 USB ports, and 6 SATA ports. The board is RoHS compliant and supports Intel AMT for remote management.', 'target_applications': 'Industrial applications requiring robust computing and extensive I/O capabilities.'}","{'extract_features': [{'input_tokens': 1514, 'output_tokens': 728, 'time_taken': 8.31836485862732}], 'generate_missing_features': [{'input_tokens': 3836, 'output_tokens': 103, 'time_taken': 4.048584938049316}, {'input_tokens': 3560, 'output_tokens': 103, 'time_taken': 3.5220370292663574}], 'store_and_chunk_data': [{'input_tokens': 0, 'output_tokens': 0, 'time_taken': 0.5958220958709717}], 'search_missing_features': [{'input_tokens': 0, 'output_tokens': 0, 'time_taken': 19.875069856643677}, {'input_tokens': 0, 'output_tokens': 0, 'time_taken': 30.072208881378174}]}","[4, 4, 4]","[0, 0, 0]"
DS-060GB-U3A1E,"{'name': 'DS SERIES', 'manufacturer': 'ADVANTECH', 'form_factor': 'ULTRASLIM', 'evaluation_or_commercialization': False, 'processor_architecture': 'X86', 'processor_core_count': '24', 'processor_manufacturer': 'INTEL', 'processor_tdp': 'WATTS', 'memory': 'DDR3 1600MHz, Max Capacity 8GB', 'onboard_storage': 'SATA 2.5 inch HDD/SSD support', 'input_voltage': '19V DC', 'io_count': 'VGA, DisplayPort, HDMI, USB, Ethernet, Audio Line-Out, Mic-In, Serial Port', 'wireless': 'Optional WLAN module', 'operating_system_bsp': 'Windows Embedded, Linux', 'operating_temperature_max': '60°C', 'operating_temperature_min': '0°C', 'certifications': 'EMC, CE, FCC Class B, CCC, BSMI, Safety UL, CB', 'short_summary': 'Ultraslim digital signage player with Intel processors, dual display support, and expandable via MiniPCIe.', 'full_summary': 'The DS Series is a compact digital signage player powered by Intel Core, Celeron, and Atom processors. It supports dual P displays, offers multiple I/O interfaces, and is highly expandable via internal MiniPCIe. It is designed for space-limited installations and supports Windows Embedded and Linux operating systems.', 'full_product_description': ""The DS Series digital signage player is one of the world's slimmest, featuring Intel's 3rd generation processors with a TDP of watts. It offers simultaneous dual PFHD capability, delivering premium visual experiences. The player supports a variety of display outputs including VGA, DisplayPort, and HDMI, and is equipped with a range of I/O interfaces. It is designed for easy mounting and supports a wide range of operating systems, making it ideal for various digital signage applications."", 'target_applications': 'Digital signage, space-limited installations, dual display setups'}","{'extract_features': [{'input_tokens': 1606, 'output_tokens': 778, 'time_taken': 10.297837972640991}], 'generate_missing_features': [{'input_tokens': 3698, 'output_tokens': 31, 'time_taken': 1.8005449771881104}], 'store_and_chunk_data': [{'input_tokens': 0, 'output_tokens': 0, 'time_taken': 0.9911141395568848}], 'search_missing_features': [{'input_tokens': 0, 'output_tokens': 0, 'time_taken': 16.91102123260498}]}","[1, 0]","[0, 0]"
PLT-RFID-M3E-DEVKIT,"{'name': 'THINGMAGIC ME HFLF RFID SECURE MODULE', 'manufacturer': 'JADAK', 'form_factor': 'COMPACT EMBEDDED MODULE', 'evaluation_or_commercialization': False, 'processor_architecture': 'ARM Cortex-M4', 'processor_core_count': 'Not Available', 'processor_manufacturer': 'ARM', 'processor_tdp': 'Not Available', 'memory': 'Not Available', 'onboard_storage': 'Not Available', 'input_voltage': '5 VDC', 'io_count': 'UART, TTL, IC, SPI, GPIO', 'wireless': 'Not Available', 'operating_system_bsp': 'THINGMAGIC MERCURY API', 'operating_temperature_max': '85 C', 'operating_temperature_min': '-40 C', 'certifications': ['FCC Class B', 'Industrie Canada IC', 'RED EU', 'CE', 'ROHS', 'REACH', 'WEEE'], 'short_summary': 'Compact embedded module supporting HF and LF RFID protocols with secure access features.', 'full_summary': 'The ThingMagic ME HFLF RFID Secure Module is a compact embedded module that supports both High Frequency (HF) and Low Frequency (LF) RFID protocols. It is designed for secure access applications and offers flexibility in reading HF and LF ID cards. The module is precertified with high gain antennas and provides full modular certification, reducing regulatory burdens for OEMs.', 'full_product_description': 'The ThingMagic ME HFLF RFID Secure Module is part of the Secure Access family of products, enabling secure RFID interactions across a wide range of security environments. It supports a broad range of HF and LF transponders, including secure access credentials, and offers a high-performance, long read range. The module is designed for easy integration with the ThingMagic Mercury API and provides flexible SKU options for OEMs.', 'target_applications': ['Nurses Carts', 'Med Dispensing', 'Pharmacy', 'Anesthesia Carts', 'Patient Monitoring', 'Blood Tracking', 'Inventory Cabinets', 'Infusion Pumps', 'Pneumatic Systems', 'Transport', 'Ultrasound Machines', 'POC IVD Analyzers']}","{'extract_features': [{'input_tokens': 1532, 'output_tokens': 796, 'time_taken': 10.012521982192993}], 'generate_missing_features': [{'input_tokens': 3374, 'output_tokens': 176, 'time_taken': 5.00130820274353}, {'input_tokens': 3746, 'output_tokens': 123, 'time_taken': 4.281644105911255}, {'input_tokens': 3746, 'output_tokens': 123, 'time_taken': 4.11589503288269}], 'store_and_chunk_data': [{'input_tokens': 0, 'output_tokens': 0, 'time_taken': 0.7604019641876221}], 'search_missing_features': [{'input_tokens': 0, 'output_tokens': 0, 'time_taken': 12.549487113952637}, {'input_tokens': 0, 'output_tokens': 0, 'time_taken': 14.433014869689941}, {'input_tokens': 0, 'output_tokens': 0, 'time_taken': 14.87424898147583}]}","[7, 5, 5, 5]","[0, 0, 0, 0]"
