id,extracted_data,usage_data,missing_feature_count_history,low_confidence_feature_count_history
AmITX-BT-I-E3815,"{'name': 'AMITXBTI', 'manufacturer': 'ADLINK TECHNOLOGY INC', 'form_factor': 'MINI-ITX', 'evaluation_or_commercialization': False, 'processor_architecture': 'X86', 'processor_core_count': 'Single, Dual, Quad', 'processor_manufacturer': 'INTEL', 'processor_tdp': '6W to 10W', 'memory': 'Up to 8GB Dual SODIMM DDR3L 1333MHz', 'onboard_storage': 'Optional eMMC up to 64GB', 'input_voltage': '12V', 'io_count': 'Multiple USB, SATA, PCIe, COM ports', 'wireless': 'Not Available', 'operating_system_bsp': 'Windows 7', 'operating_temperature_max': '85°C', 'operating_temperature_min': '-40°C', 'certifications': 'IEC, MIL-STD-810F', 'short_summary': 'Industrial Mini-ITX motherboard with Intel Atom E series processors.', 'full_summary': 'The AMITXBTI is an industrial-grade Mini-ITX motherboard featuring Intel Atom E series processors, supporting up to 8GB DDR3L memory, multiple I/O interfaces, and rugged operating temperatures.', 'full_product_description': 'The AMITXBTI Mini-ITX motherboard is designed for industrial applications, equipped with Intel Atom E series processors, offering single, dual, and quad-core options. It supports up to 8GB of DDR3L memory, features multiple I/O interfaces including USB, SATA, PCIe, and COM ports, and is capable of operating in extreme temperatures ranging from -40°C to 85°C. Optional eMMC storage up to 64GB is available.', 'target_applications': 'Industrial automation, embedded systems, rugged computing environments.'}","{'store_and_chunk_data': [{'input_tokens': 0, 'output_tokens': 0, 'time_taken': 1.5832858085632324}], 'generate_missing_features': [{'input_tokens': 4605, 'output_tokens': 58, 'time_taken': 4.009385108947754}, {'input_tokens': 4131, 'output_tokens': 29, 'time_taken': 2.0362870693206787}, {'input_tokens': 3951, 'output_tokens': 29, 'time_taken': 2.829149007797241}], 'search_missing_features': [{'input_tokens': 0, 'output_tokens': 0, 'time_taken': 21.17025899887085}, {'input_tokens': 0, 'output_tokens': 0, 'time_taken': 25.43867802619934}, {'input_tokens': 0, 'output_tokens': 0, 'time_taken': 12.223148107528687}], 'extract_features': [{'input_tokens': 2133, 'output_tokens': 740, 'time_taken': 8.68432903289795}]}","[2, 1, 1, 1]","[1, 1, 1, 1]"
WAFER-ADL-P-CC-R10,"{'name': 'WAFERADLP', 'manufacturer': 'IEI', 'form_factor': 'SBC', 'evaluation_or_commercialization': False, 'processor_architecture': 'x86', 'processor_core_count': 'Up to 4 performance and 8 efficient cores', 'processor_manufacturer': 'Intel', 'processor_tdp': '6W', 'memory': 'LPDDRx, up to 64GB', 'onboard_storage': 'Expandable SSD-based storage, NVMe, and SATA III', 'input_voltage': '12V DC', 'io_count': ['2x HDMI', '2x DP', '2x GbE', '4x USB 3.2 Gen 2', '2x SATA 6Gb/s', '2x RS-232', '1x PCIe x16'], 'wireless': 'Wi-Fi, Bluetooth', 'operating_system_bsp': 'Not Available', 'operating_temperature_max': '60°C', 'operating_temperature_min': '0°C', 'certifications': 'CE, FCC, RoHS', 'short_summary': 'WAFERADLP is a single board computer featuring Intel Alder Lake-P processors, supporting up to 64GB LPDDRx memory, with multiple I/O options and expansion capabilities.', 'full_summary': 'The WAFERADLP SBC supports Intel Alder Lake-P processors, offering high performance with up to 64GB LPDDRx memory. It includes multiple I/O interfaces such as HDMI, DP, GbE, USB, and SATA, along with expansion slots for PCIe and wireless modules.', 'full_product_description': 'The WAFERADLP is an industrial-grade single board computer designed for high-performance applications. It supports Intel Alder Lake-P processors and up to 64GB of LPDDRx memory. The board features a variety of I/O options including HDMI, DP, dual GbE, USB 3.2 Gen 2, and SATA 6Gb/s. Expansion capabilities are provided through PCIe slots and M.2 connectors for Wi-Fi and Bluetooth modules. The board is compliant with CE, FCC, and RoHS standards, ensuring reliability and safety in industrial environments.', 'target_applications': ['Industrial Automation', 'Embedded Systems', 'IoT Gateways', 'Digital Signage']}","{'store_and_chunk_data': [{'input_tokens': 0, 'output_tokens': 0, 'time_taken': 1.7064719200134277}], 'generate_missing_features': [{'input_tokens': 3427, 'output_tokens': 125, 'time_taken': 4.250982999801636}, {'input_tokens': 4190, 'output_tokens': 58, 'time_taken': 2.9580347537994385}, {'input_tokens': 4253, 'output_tokens': 32, 'time_taken': 3.194459915161133}, {'input_tokens': 4253, 'output_tokens': 32, 'time_taken': 2.6489529609680176}], 'search_missing_features': [{'input_tokens': 0, 'output_tokens': 0, 'time_taken': 30.398205995559692}, {'input_tokens': 0, 'output_tokens': 0, 'time_taken': 25.097655057907104}, {'input_tokens': 0, 'output_tokens': 0, 'time_taken': 17.671210050582886}, {'input_tokens': 0, 'output_tokens': 0, 'time_taken': 21.761483907699585}], 'extract_features': [{'input_tokens': 2051, 'output_tokens': 832, 'time_taken': 12.553977727890015}]}","[4, 2, 1, 1, 1]","[0, 0, 0, 0, 0]"
B002-HD1AC4-N4,{},"{'store_and_chunk_data': [{'input_tokens': 0, 'output_tokens': 0, 'time_taken': 1.8196699619293213}], 'extract_features': [{'input_tokens': 1788, 'output_tokens': 664, 'time_taken': 7.807530164718628}]}",[8],[0]
VL-EPICS-36S,"{'name': 'KOMODO SUMIT EPIC SINGLE BOARD COMPUTER', 'manufacturer': 'VERSALOGIC CORPORATION', 'form_factor': 'EPIC', 'evaluation_or_commercialization': False, 'processor_architecture': 'x86', 'processor_core_count': '2', 'processor_manufacturer': 'INTEL', 'processor_tdp': 'Not Available', 'memory': 'Up to 4 GB DDR2 SDRAM', 'onboard_storage': 'MiniBlade socket, eUSB interface', 'input_voltage': '5V', 'io_count': 'Four USB ports, Four serial ports, Dual SATA interface', 'wireless': 'Wi-Fi, Bluetooth, Cellular Socket', 'operating_system_bsp': ['Windows', 'Windows Embedded', 'Linux', 'VxWorks', 'QNX'], 'operating_temperature_max': '60°C', 'operating_temperature_min': '-40°C', 'certifications': ['RoHS', 'CE'], 'short_summary': 'Versatile single board computer with Intel Core Duo processor, EPIC form factor, and SUMIT expansion interface.', 'full_summary': 'The Komodo is a robust single board computer ideal for demanding industrial, medical, defense, and aerospace applications. It features an Intel Core Duo processor, EPIC form factor, and SUMIT expansion interface, supporting a variety of operating systems.', 'full_product_description': 'The Komodo SBC leverages an ultra-high performance Intel Core Duo processor, ideal for applications where performance and dependability are crucial. It features a SUMIT expansion interface, PCIe, USB, LPC, SPI, SMBus, and ISA bus support, with a MiniBlade socket and eUSB interface for high-reliability flash storage. It supports up to 4 GB DDR2 SDRAM and is designed to meet MIL-STD-810G shock and vibration standards.', 'target_applications': ['Industrial', 'Medical', 'Defense', 'Aerospace']}","{'store_and_chunk_data': [{'input_tokens': 0, 'output_tokens': 0, 'time_taken': 1.7676758766174316}], 'generate_missing_features': [{'input_tokens': 4453, 'output_tokens': 60, 'time_taken': 4.89372992515564}, {'input_tokens': 4347, 'output_tokens': 30, 'time_taken': 3.415660858154297}, {'input_tokens': 4529, 'output_tokens': 30, 'time_taken': 2.580918788909912}], 'search_missing_features': [{'input_tokens': 0, 'output_tokens': 0, 'time_taken': 18.504055976867676}, {'input_tokens': 0, 'output_tokens': 0, 'time_taken': 20.050852060317993}, {'input_tokens': 0, 'output_tokens': 0, 'time_taken': 15.556163787841797}], 'extract_features': [{'input_tokens': 2078, 'output_tokens': 755, 'time_taken': 9.05255913734436}]}","[2, 1, 1, 1]","[0, 0, 0, 0]"
MIO-5375C3-P9A1,{},"{'store_and_chunk_data': [{'input_tokens': 0, 'output_tokens': 0, 'time_taken': 1.7016198635101318}], 'generate_missing_features': [{'input_tokens': 4688, 'output_tokens': 57, 'time_taken': 3.095341920852661}], 'extract_features': [{'input_tokens': 2053, 'output_tokens': 850, 'time_taken': 9.4307279586792}]}","[2, 1]","[0, 0]"
