id,extracted_data,usage_data,missing_feature_count_history,low_confidence_feature_count_history
IW-G33D-SCMD-4L002G-E008G-ACJ,{},"{'extract_features': [{'input_tokens': 4156, 'output_tokens': 766, 'time_taken': 8.49983811378479}], 'generate_missing_features': [{'input_tokens': 3928, 'output_tokens': 227, 'time_taken': 4.651832103729248}], 'store_and_chunk_data': [{'input_tokens': 0, 'output_tokens': 0, 'time_taken': 3.294656991958618}]}","[9, 6]","[0, 0]"
SC0679,"{'name': 'RASPBERRY PI COMPUTE MODULE', 'manufacturer': 'RASPBERRY PI LTD', 'form_factor': 'SYSTEM ON MODULE', 'evaluation_or_commercialization': False, 'processor_architecture': 'ARM', 'processor_core_count': '4', 'processor_manufacturer': 'BROADCOM', 'processor_tdp': 'Not Available', 'memory': '1GB, 2GB, 4GB, 8GB LPDDR4 SDRAM', 'onboard_storage': '8GB, 16GB, 32GB eMMC', 'input_voltage': '5V', 'io_count': 'Not Available', 'wireless': ['Wi-Fi 2.4GHz/5GHz', 'Bluetooth 5.0 BLE'], 'operating_system_bsp': ['Linux', 'Raspberry Pi OS'], 'operating_temperature_max': '85°C', 'operating_temperature_min': '-20°C', 'certifications': 'Not Available', 'short_summary': 'A compact system on module with Broadcom BCM2711 quad-core Cortex-A72 processor, supporting multiple RAM and storage options, and featuring wireless connectivity.', 'full_summary': 'The Raspberry Pi Compute Module is a versatile system on module featuring a Broadcom BCM2711 quad-core Cortex-A72 processor, available with up to 8GB LPDDR4 SDRAM and up to 32GB eMMC storage. It supports dual HDMI, PCIe, and Gigabit Ethernet, along with wireless capabilities including Wi-Fi and Bluetooth.', 'full_product_description': 'The Raspberry Pi Compute Module is designed for custom systems and form factors, leveraging the Raspberry Pi hardware and software stack. It includes a Broadcom BCM2711 quad-core Cortex-A72 processor, options for 1GB, 2GB, 4GB, or 8GB LPDDR4 SDRAM, and 8GB, 16GB, or 32GB eMMC storage. The module supports a wide range of interfaces including dual HDMI, PCIe, Gigabit Ethernet, and wireless connectivity with Wi-Fi and Bluetooth. It is suitable for cost-sensitive applications and offers a small footprint with high-density connectors.', 'target_applications': ['Custom embedded systems', 'Industrial applications', 'IoT devices', 'Kiosk systems']}","{'extract_features': [{'input_tokens': 4261, 'output_tokens': 823, 'time_taken': 8.782597303390503}], 'generate_missing_features': [{'input_tokens': 4438, 'output_tokens': 76, 'time_taken': 4.47593092918396}, {'input_tokens': 4337, 'output_tokens': 76, 'time_taken': 2.8507280349731445}], 'store_and_chunk_data': [{'input_tokens': 0, 'output_tokens': 0, 'time_taken': 3.4323182106018066}], 'search_missing_features': [{'input_tokens': 0, 'output_tokens': 0, 'time_taken': 23.000811100006104}, {'input_tokens': 0, 'output_tokens': 0, 'time_taken': 16.008199214935303}]}","[3, 3, 3]","[0, 0, 0]"
IMX233-OLINUXINO-MICRO,"{'name': 'OLINUXINO MICRO', 'manufacturer': 'OLIMEX', 'form_factor': 'Single Board Computer', 'evaluation_or_commercialization': True, 'processor_architecture': 'ARM', 'processor_core_count': 'Not Available', 'processor_manufacturer': 'FREESCALE SEMICONDUCTOR', 'processor_tdp': 'Not Available', 'memory': '64 MB DDR SDRAM', 'onboard_storage': 'SD card connector', 'input_voltage': '5V', 'io_count': 'GPIO, USB, Composite Video, Audio', 'wireless': 'Not Available', 'operating_system_bsp': 'Linux', 'operating_temperature_max': 'Not Available', 'operating_temperature_min': 'Not Available', 'certifications': 'Not Available', 'short_summary': 'OLinuXino MICRO is a compact single board computer for development with Freescale iMX ARM processor.', 'full_summary': 'The OLinuXino MICRO is an open-source, open-hardware development board featuring a Freescale iMX ARM processor, 64 MB DDR SDRAM, and an SD card connector for booting Linux images. It supports various I/O interfaces including GPIO, USB, and composite video output.', 'full_product_description': 'OLinuXino MICRO is a single board computer designed for development applications running on a Freescale iMX ARM processor. It includes 64 MB DDR SDRAM, an SD card connector for Linux booting, and supports multiple I/O interfaces such as GPIO, USB, and composite video. The board is part of the OLinuXino family, known for its open-source and open-hardware approach.', 'target_applications': 'Embedded systems development, educational purposes, prototyping'}","{'extract_features': [{'input_tokens': 4166, 'output_tokens': 711, 'time_taken': 7.878692150115967}], 'generate_missing_features': [{'input_tokens': 4496, 'output_tokens': 150, 'time_taken': 4.102109909057617}, {'input_tokens': 4437, 'output_tokens': 150, 'time_taken': 4.221326112747192}], 'store_and_chunk_data': [{'input_tokens': 0, 'output_tokens': 0, 'time_taken': 2.788893222808838}], 'search_missing_features': [{'input_tokens': 0, 'output_tokens': 0, 'time_taken': 24.319091796875}, {'input_tokens': 0, 'output_tokens': 0, 'time_taken': 9.830868005752563}]}","[6, 6, 6]","[0, 0, 0]"
ARK-3440F-U1A2E,"{'name': 'ARK', 'manufacturer': 'ADVANTECH', 'form_factor': 'Fanless Embedded Box PC', 'evaluation_or_commercialization': 'False', 'processor_architecture': 'x86', 'processor_core_count': 'Quad Core', 'processor_manufacturer': 'INTEL', 'processor_tdp': '17 watts', 'memory': 'Supports DDR3 1066 MHz, up to 8GB', 'onboard_storage': 'Supports 1x SATA HDD, 1x Compact Flash Card', 'input_voltage': '9-34 VDC', 'io_count': ['4x USB 2.0', '2x RS-232', '2x RS-232/422/485', '2x Gigabit LAN', '1x HDMI', '1x DVI-I'], 'wireless': 'Wi-Fi', 'operating_system_bsp': 'Windows 10 IoT Enterprise 2021 LTSC Entry EPKEA, Ubuntu OS License for Desktop & Server for ARK-1125H', 'operating_temperature_max': '60°C', 'operating_temperature_min': '-20°C', 'certifications': ['UL', 'CCC', 'BSMI', 'CB', 'CE', 'FCC'], 'short_summary': 'The ARK is a fanless embedded box PC designed for versatile applications with Intel Core processors and a wide range of I/O interfaces.', 'full_summary': 'The ARK series offers a compact, fanless embedded box PC solution with Intel Core i processors, supporting dual display, multiple I/O interfaces, and a wide input voltage range, ideal for harsh environments.', 'full_product_description': 'The ARK is a rugged, fanless embedded box PC featuring Intel Core i processors, dual display support, and a variety of I/O interfaces including USB, COM, and Gigabit LAN. It supports both SATA HDD and Compact Flash storage options, making it suitable for diverse industrial applications.', 'target_applications': ['Industrial Automation', 'Digital Signage', 'Transportation', 'Kiosk', 'POS Systems']}","{'extract_features': [{'input_tokens': 3856, 'output_tokens': 772, 'time_taken': 8.435657978057861}], 'refine_low_confidence_features': [{'input_tokens': 4006, 'output_tokens': 61, 'time_taken': 2.8832619190216064}], 'search_low_confidence_features': [{'input_tokens': 0, 'output_tokens': 0, 'time_taken': 14.922012090682983}], 'search_missing_features': [{'input_tokens': 0, 'output_tokens': 0, 'time_taken': 19.543229818344116}, {'input_tokens': 0, 'output_tokens': 0, 'time_taken': 19.882127046585083}, {'input_tokens': 0, 'output_tokens': 0, 'time_taken': 16.291810750961304}], 'generate_missing_features': [{'input_tokens': 3950, 'output_tokens': 105, 'time_taken': 3.6781179904937744}, {'input_tokens': 4130, 'output_tokens': 88, 'time_taken': 2.1782939434051514}, {'input_tokens': 3729, 'output_tokens': 32, 'time_taken': 1.5993552207946777}], 'store_and_chunk_data': [{'input_tokens': 0, 'output_tokens': 0, 'time_taken': 2.582392930984497}]}","[4, 3, 1, 0, 0]","[0, 0, 1, 1, 0]"
IW-G40M-OLPQ-4L002G-E016G-BIA,"{'name': 'IMX M PLUS OSM LGA MODULE', 'manufacturer': 'IWAVE SYSTEMS TECHNOLOGIES', 'form_factor': 'OSM V', 'evaluation_or_commercialization': False, 'processor_architecture': 'ARM', 'processor_core_count': 'Quad', 'processor_manufacturer': 'NXP', 'processor_tdp': 'Not Available', 'memory': '4 GB LPDDR4', 'onboard_storage': '16 GB eMMC', 'input_voltage': '5V', 'io_count': 'Multiple interfaces including USB, PCIe, HDMI, MIPI CSI, LVDS', 'wireless': 'Wi-Fi, Bluetooth', 'operating_system_bsp': 'Linux', 'operating_temperature_max': '85°C', 'operating_temperature_min': '-40°C', 'certifications': 'RoHS', 'short_summary': 'Compact OSM LGA module with NXP iMX M Plus processor, supporting Wi-Fi and Bluetooth.', 'full_summary': 'The iMX M Plus OSM LGA Module is a compact, versatile embedded system module featuring the NXP iMX M Plus processor. It supports a range of interfaces including USB, PCIe, HDMI, and MIPI CSI, and offers wireless connectivity with Wi-Fi and Bluetooth.', 'full_product_description': 'The iMX M Plus OSM LGA Module by iWave Systems Technologies is designed for high-performance, low-cost applications. It features the NXP iMX M Plus processor with ARM architecture, offering up to quad-core processing power. The module includes 4 GB LPDDR4 RAM and 16 GB eMMC storage, and supports a wide range of interfaces such as USB, PCIe, HDMI, and MIPI CSI. It is compliant with the OSM V specification and is suitable for industrial applications with an operating temperature range of -40°C to 85°C.', 'target_applications': 'Industrial automation, portable and stationary embedded systems, IoT devices.'}","{'extract_features': [{'input_tokens': 4283, 'output_tokens': 766, 'time_taken': 8.722776174545288}], 'generate_missing_features': [{'input_tokens': 4595, 'output_tokens': 30, 'time_taken': 1.4877071380615234}, {'input_tokens': 4270, 'output_tokens': 30, 'time_taken': 1.2818398475646973}], 'store_and_chunk_data': [{'input_tokens': 0, 'output_tokens': 0, 'time_taken': 3.33758282661438}], 'search_missing_features': [{'input_tokens': 0, 'output_tokens': 0, 'time_taken': 29.39649987220764}, {'input_tokens': 0, 'output_tokens': 0, 'time_taken': 16.560069799423218}]}","[1, 1, 1]","[0, 0, 0]"
