id,extracted_data,usage_data,missing_feature_count_history,low_confidence_feature_count_history
ASMB-815-00A1E,{},"{'store_and_chunk_data': [{'input_tokens': 0, 'output_tokens': 0, 'time_taken': 0.8595688343048096}], 'generate_missing_features': [{'input_tokens': 3731, 'output_tokens': 105, 'time_taken': 3.286226987838745}, {'input_tokens': 4109, 'output_tokens': 83, 'time_taken': 2.8423240184783936}, {'input_tokens': 3550, 'output_tokens': 66, 'time_taken': 3.575662851333618}], 'search_missing_features': [{'input_tokens': 0, 'output_tokens': 0, 'time_taken': 19.082942962646484}, {'input_tokens': 0, 'output_tokens': 0, 'time_taken': 18.564844131469727}], 'extract_features': [{'input_tokens': 1924, 'output_tokens': 751, 'time_taken': 9.685424327850342}]}","[4, 3, 2, 0]","[0, 0, 0, 1]"
B002-DP1AC8-N4,{},"{'store_and_chunk_data': [{'input_tokens': 0, 'output_tokens': 0, 'time_taken': 1.0767929553985596}], 'extract_features': [{'input_tokens': 1845, 'output_tokens': 730, 'time_taken': 9.701560258865356}]}",[8],[0]
VL-EPM-16E,"{'name': 'TOMCAT', 'manufacturer': 'VERSALOGIC CORPORATION', 'form_factor': 'PCPLUS', 'evaluation_or_commercialization': False, 'processor_architecture': 'x86', 'processor_core_count': '1', 'processor_manufacturer': 'DMP ELECTRONICS INC', 'processor_tdp': '6.7W', 'memory': 'Up to 512 MB soldered-on DDR2 SDRAM', 'onboard_storage': 'CompactFlash socket Type II', 'input_voltage': '5V', 'io_count': 'Two USB ports, Four serial ports, IDE, LPT', 'wireless': 'Wi-Fi, Bluetooth, Cellular', 'operating_system_bsp': ['Windows', 'Windows Embedded', 'Linux', 'VxWorks', 'QNX'], 'operating_temperature_max': '85°C', 'operating_temperature_min': '-40°C', 'certifications': 'RoHS Compliant, MIL-STD-810G', 'short_summary': 'The Tomcat is a rugged, fanless single board computer with ultra-low power consumption, supporting PCI and ISA expansion.', 'full_summary': 'The Tomcat single board computer features an ultra-low power DMP VortexDX processor, PCPlus form factor, and supports PCI and ISA expansion. It is designed for harsh environments with fanless operation and extended temperature range.', 'full_product_description': 'The Tomcat is a durable embedded computer solution featuring a DMP VortexDX processor running at 800 MHz. It includes 512 MB soldered-on DDR2 RAM, two USB ports, four serial ports, IDE, LPT interfaces, and a CompactFlash socket for removable storage. The PCPlus platform allows for industry-standard expansion modules. It is compatible with various x86 operating systems and meets MIL-STD-810G specifications for shock and vibration.', 'target_applications': 'Harsh environments, mobile and remote applications, OEM applications requiring high reliability and long-term availability.'}","{'store_and_chunk_data': [{'input_tokens': 0, 'output_tokens': 0, 'time_taken': 1.0141279697418213}], 'generate_missing_features': [{'input_tokens': 3993, 'output_tokens': 77, 'time_taken': 3.216580867767334}, {'input_tokens': 4578, 'output_tokens': 88, 'time_taken': 4.455630779266357}], 'search_missing_features': [{'input_tokens': 0, 'output_tokens': 0, 'time_taken': 18.32386302947998}, {'input_tokens': 0, 'output_tokens': 0, 'time_taken': 15.424861907958984}], 'extract_features': [{'input_tokens': 1929, 'output_tokens': 757, 'time_taken': 9.322845935821533}]}","[3, 3, 0]","[0, 0, 0]"
SOM-5899C3Q-H0A3,"{'name': 'SOM', 'manufacturer': 'ADVANTECH', 'form_factor': 'COM EXPRESS BASIC MODULE', 'evaluation_or_commercialization': False, 'processor_architecture': 'X86', 'processor_core_count': 'Hexa/Quad', 'processor_manufacturer': 'INTEL', 'processor_tdp': '12W', 'memory': 'DDR4 SODIMM, ECC optional', 'onboard_storage': 'Up to 64GB eMMC', 'input_voltage': '12V', 'io_count': 'PCIe, USB, SATA, Ethernet', 'wireless': 'Yes, supports LoRaWAN and other wireless protocols', 'operating_system_bsp': ['Windows IoT', 'Ubuntu'], 'operating_temperature_max': '85°C', 'operating_temperature_min': '-40°C', 'certifications': 'Sparkplug Compatible', 'short_summary': 'COM Express Basic Module with Intel Xeon processors, supporting high-speed I/O and multiple displays.', 'full_summary': 'The SOM is a COM Express Basic Module featuring Intel Xeon processors, offering high-speed I/O, dual-channel DDR4 memory with ECC support, and multiple display outputs.', 'full_product_description': 'The SOM module is designed for high-performance computing applications, equipped with Intel Xeon processors, supporting dual-channel DDR4 memory with ECC, and providing extensive I/O options including PCIe, USB, and SATA. It supports multiple independent displays and is suitable for industrial and embedded applications.', 'target_applications': ['Industrial Automation', 'Embedded Systems', 'Edge Computing']}","{'store_and_chunk_data': [{'input_tokens': 0, 'output_tokens': 0, 'time_taken': 0.9374549388885498}], 'generate_missing_features': [{'input_tokens': 3952, 'output_tokens': 109, 'time_taken': 2.817340850830078}, {'input_tokens': 3973, 'output_tokens': 52, 'time_taken': 2.344649076461792}, {'input_tokens': 3952, 'output_tokens': 65, 'time_taken': 2.994205951690674}], 'search_missing_features': [{'input_tokens': 0, 'output_tokens': 0, 'time_taken': 26.129982948303223}, {'input_tokens': 0, 'output_tokens': 0, 'time_taken': 15.273811340332031}, {'input_tokens': 0, 'output_tokens': 0, 'time_taken': 20.360268115997314}], 'extract_features': [{'input_tokens': 1974, 'output_tokens': 660, 'time_taken': 8.446336030960083}]}","[4, 2, 2, 0]","[0, 0, 0, 0]"
ASMB-935-00A1,"{'name': 'ASMB', 'manufacturer': 'ADVANTECH', 'form_factor': 'EATX', 'evaluation_or_commercialization': False, 'processor_architecture': 'Not Available', 'processor_core_count': 'Not Available', 'processor_manufacturer': 'INTEL', 'processor_tdp': 'Not Available', 'memory': 'Maximum 1.5 TB ECC LRDIMM, Maximum 768 GB ECC RDIMM, DDR4 ECC REG 2666 MHz', 'onboard_storage': 'Not Available', 'input_voltage': '+12V/+5V/+3.3V/+5Vsb/-12V', 'io_count': '10 SATA, 6 USB ports, 1 M.2 SATA', 'wireless': 'Not Available', 'operating_system_bsp': 'Not Available', 'operating_temperature_max': '45°C', 'operating_temperature_min': '0°C', 'certifications': 'CE/FCC', 'short_summary': 'EATX server board supporting dual Intel Xeon Scalable processors with extensive I/O options.', 'full_summary': 'The ASMB EATX server board is designed for high-performance computing with support for dual Intel Xeon Scalable processors, up to 1.5 TB of ECC LRDIMM memory, and a variety of I/O interfaces including 10 SATA and 6 USB ports.', 'full_product_description': 'The ASMB EATX server board by Advantech is engineered for robust server applications, featuring dual Intel Xeon Scalable processors, extensive memory support with up to 1.5 TB ECC LRDIMM, and a comprehensive set of I/O options including 10 SATA ports, 6 USB ports, and 1 M.2 SATA. It is equipped with Intel C622 chipset and supports advanced management features such as IPMI.', 'target_applications': 'Data centers, enterprise servers, high-performance computing'}","{'store_and_chunk_data': [{'input_tokens': 0, 'output_tokens': 0, 'time_taken': 1.0452930927276611}], 'generate_missing_features': [{'input_tokens': 3889, 'output_tokens': 271, 'time_taken': 5.231831789016724}, {'input_tokens': 3416, 'output_tokens': 151, 'time_taken': 3.550394058227539}, {'input_tokens': 3368, 'output_tokens': 151, 'time_taken': 3.473123788833618}], 'search_missing_features': [{'input_tokens': 0, 'output_tokens': 0, 'time_taken': 18.047966957092285}, {'input_tokens': 0, 'output_tokens': 0, 'time_taken': 19.55307912826538}, {'input_tokens': 0, 'output_tokens': 0, 'time_taken': 20.696868181228638}], 'extract_features': [{'input_tokens': 1923, 'output_tokens': 724, 'time_taken': 9.683577299118042}]}","[10, 6, 6, 6]","[0, 0, 0, 0]"
