id,extracted_data,usage_data,missing_feature_count_history,low_confidence_feature_count_history
UBC-200CD-MDA1E,"{'name': 'UBC', 'manufacturer': 'ADVANTECH', 'form_factor': 'BOX COMPUTER', 'evaluation_or_commercialization': False, 'processor_architecture': 'ARM', 'processor_core_count': 'DUAL/QUAD CORE', 'processor_manufacturer': 'NXP', 'processor_tdp': 'Not Available', 'memory': '2GB DDR3', 'onboard_storage': '8GB eMMC', 'input_voltage': '12V DC', 'io_count': ['2x USB', '1x HDMI', '1x Ethernet', '1x SD slot'], 'wireless': ['Wi-Fi', 'Bluetooth'], 'operating_system_bsp': ['Linux', 'Android'], 'operating_temperature_max': '60°C', 'operating_temperature_min': '-20°C', 'certifications': ['CE', 'FCC Class B'], 'short_summary': 'RISC compact box computer with NXP ARM Cortex-A iMX processor, suitable for industrial IoT applications.', 'full_summary': 'The UBC is a RISC compact box computer featuring a powerful NXP ARM Cortex-A iMX dual/quad-core processor, designed for industrial IoT applications. It offers excellent CPU performance with reduced power consumption, supporting USB, HDMI, and Gigabit Ethernet interfaces.', 'full_product_description': 'The UBC is an IP-based RISC compact box computer developed for industrial IoT applications. It is equipped with a powerful NXP ARM Cortex-A iMX dual/quad-core processor, delivering excellent CPU performance with reduced power consumption. The system supports USB, HDMI with 1080p resolution, and Gigabit Ethernet. It features a mini PCIe slot for integrating Wi-Fi/3G modules and a built-in SD card slot for storage expansion. The UBC system includes wall mount brackets for flexible installation.', 'target_applications': ['Industrial IoT', 'Rugged applications']}","{'extract_features': [{'input_tokens': 1385, 'output_tokens': 753, 'time_taken': 8.95729112625122}], 'store_and_chunk_data': [{'input_tokens': 0, 'output_tokens': 0, 'time_taken': 0.7433228492736816}], 'search_missing_features': [{'input_tokens': 0, 'output_tokens': 0, 'time_taken': 18.19476580619812}, {'input_tokens': 0, 'output_tokens': 0, 'time_taken': 15.915721893310547}], 'generate_missing_features': [{'input_tokens': 4083, 'output_tokens': 30, 'time_taken': 4.22070574760437}, {'input_tokens': 3460, 'output_tokens': 30, 'time_taken': 5.340726852416992}]}","[1, 1, 1]","[0, 0, 0]"
MIC-711D-OX3A1,{},"{'extract_features': [{'input_tokens': 1177, 'output_tokens': 634, 'time_taken': 7.686712026596069}], 'store_and_chunk_data': [{'input_tokens': 0, 'output_tokens': 0, 'time_taken': 0.8713951110839844}], 'generate_missing_features': [{'input_tokens': 4041, 'output_tokens': 204, 'time_taken': 4.976373672485352}]}","[7, 3]","[0, 0]"
EmETXe-i65M2-827E,"{'name': 'EMETXEIM', 'manufacturer': 'ARBOR TECHNOLOGY', 'form_factor': 'COM EXPRESS', 'evaluation_or_commercialization': True, 'processor_architecture': 'x86', 'processor_core_count': 'Not Available', 'processor_manufacturer': 'INTEL', 'processor_tdp': '15W', 'memory': 'Up to 8GB DDR3 SDRAM', 'onboard_storage': 'Soldered onboard eMMC 5.0 up to 32GB', 'input_voltage': '12V', 'io_count': ['4 USB ports', '2 SATA ports', '1 PCIe x16', '3 PCIe x1', '1 Gigabit Ethernet'], 'wireless': 'Supports wireless technologies on SMARC 2.0 modules', 'operating_system_bsp': 'Windows 8.1 64-bit, Windows 10 64-bit, Linux: Ubuntu', 'operating_temperature_max': '60°C', 'operating_temperature_min': '-40°C', 'certifications': 'Not Available', 'short_summary': 'COM Express Basic Type 6 CPU module with Intel 2nd Gen Core processors.', 'full_summary': 'The EMETXEIM is a COM Express Basic Type 6 CPU module featuring soldered onboard 2nd Gen Intel Core i7/i5/i3 and Celeron processors, integrated Gigabit Ethernet, dual channels 18/24-bit LVDS, and support for dual independent displays.', 'full_product_description': 'The EMETXEIM module is designed for high-performance embedded applications, offering a range of Intel 2nd Gen Core processors, integrated graphics, and extensive I/O capabilities including multiple USB, SATA, and PCIe interfaces. It supports Intel Active Management Technology and extended operating temperatures, making it suitable for industrial environments.', 'target_applications': ['Industrial automation', 'Digital signage', 'Medical devices', 'Transportation systems']}","{'extract_features': [{'input_tokens': 1318, 'output_tokens': 721, 'time_taken': 8.36051082611084}], 'store_and_chunk_data': [{'input_tokens': 0, 'output_tokens': 0, 'time_taken': 0.9438810348510742}], 'search_missing_features': [{'input_tokens': 0, 'output_tokens': 0, 'time_taken': 27.35286593437195}, {'input_tokens': 0, 'output_tokens': 0, 'time_taken': 28.65830421447754}, {'input_tokens': 0, 'output_tokens': 0, 'time_taken': 15.12613296508789}, {'input_tokens': 0, 'output_tokens': 0, 'time_taken': 21.853267908096313}, {'input_tokens': 0, 'output_tokens': 0, 'time_taken': 24.108596801757812}], 'generate_missing_features': [{'input_tokens': 3885, 'output_tokens': 184, 'time_taken': 4.593893051147461}, {'input_tokens': 4373, 'output_tokens': 102, 'time_taken': 4.070502281188965}, {'input_tokens': 4148, 'output_tokens': 87, 'time_taken': 3.732501983642578}, {'input_tokens': 3941, 'output_tokens': 53, 'time_taken': 3.1258881092071533}, {'input_tokens': 4144, 'output_tokens': 53, 'time_taken': 3.5335497856140137}]}","[6, 4, 3, 2, 2, 2]","[0, 0, 0, 0, 0, 0]"
UBX-310D-L0B0E,"{'name': 'UBXD', 'manufacturer': 'ADVANTECH', 'form_factor': 'Fanless Box PC', 'evaluation_or_commercialization': False, 'processor_architecture': 'x86', 'processor_core_count': 'Quad Core', 'processor_manufacturer': 'Intel', 'processor_tdp': '28W', 'memory': '8 GB DDR3L 1333 MHz SODIMM', 'onboard_storage': '1 x SATA HDD Bay, 1 x mSATA', 'input_voltage': '12 VDC', 'io_count': ['6 x USB', '2 x LAN', '6 x COM', '1 x RJ11', '1 x LPT'], 'wireless': 'Supports WWAN module via Mini PCIe', 'operating_system_bsp': ['Microsoft Windows', 'Windows Embedded POSReady', 'Windows 10 IoT', 'Linux Kernel 3.10 and above'], 'operating_temperature_max': '50°C', 'operating_temperature_min': '0°C', 'certifications': ['CCC', 'BSMI', 'CE', 'FCC', 'RoHS COMPLIANT'], 'short_summary': 'Fanless embedded system with Intel Celeron J Quad Core, multiple IO interfaces, and energy-efficient design.', 'full_summary': 'The UBXD is an intelligent fanless embedded system powered by an Intel Celeron J Quad Core processor, offering multiple IO interfaces and improved processing power and graphics performance over previous generations. It is designed for energy-efficient and environmentally responsible applications.', 'full_product_description': 'The UBXD features an Intel Bay Trail Quad Core J1900 processor with a maximum speed of 2.42 GHz and integrated Intel HD Graphics. It supports up to 8 GB of DDR3L 1333 MHz SODIMM memory and offers storage options including a SATA HDD bay and mSATA. The system includes a variety of IO interfaces such as USB, LAN, COM, RJ11, and LPT, and supports expansion via Mini PCIe. It is suitable for applications in factory automation, machine automation, retail kiosks, and self-service terminals.', 'target_applications': ['Factory automation', 'Machine automation', 'Retail kiosks', 'Self-service applications']}","{'extract_features': [{'input_tokens': 1356, 'output_tokens': 848, 'time_taken': 10.658368110656738}], 'store_and_chunk_data': [{'input_tokens': 0, 'output_tokens': 0, 'time_taken': 0.895827054977417}], 'search_missing_features': [{'input_tokens': 0, 'output_tokens': 0, 'time_taken': 21.540188312530518}], 'generate_missing_features': [{'input_tokens': 2912, 'output_tokens': 32, 'time_taken': 2.8589041233062744}]}","[1, 0]","[0, 0]"
EmETXe-i87M0-4402E,"{'name': 'EMETXEIM', 'manufacturer': 'ARBOR TECHNOLOGY', 'form_factor': 'COM EXPRESS', 'evaluation_or_commercialization': True, 'processor_architecture': 'ARM', 'processor_core_count': '4C/8T', 'processor_manufacturer': 'INTEL', 'processor_tdp': '15W', 'memory': 'DDR3L SODIMM sockets supporting up to 16GB', 'onboard_storage': 'NVMe, up to 256GB (Optional)', 'input_voltage': '+12V and +5VSB for ATX, +12V for AT', 'io_count': '4 USB 3.0 ports, 4 USB 2.0 ports, 8-bit programmable Digital I/O', 'wireless': 'Wi-Fi and Bluetooth', 'operating_system_bsp': 'ESP-IDF', 'operating_temperature_max': '60°C', 'operating_temperature_min': '-40°C', 'certifications': 'Not Available', 'short_summary': 'Intel 4th Generation Core COM Express Basic Type CPU Module with extended operating temperature.', 'full_summary': 'The EmETXeiM is a COM Express Basic Type CPU Module featuring a soldered onboard Intel 4th Generation Core processor, integrated Gigabit Ethernet, dual channels 18/24-bit LVDS, and supports independent displays with RAID support.', 'full_product_description': 'The EmETXeiM module includes a soldered onboard Intel 4th Generation Core i7/i5/i3 processor, dual DDR3L SODIMM sockets supporting up to 16GB SDRAM, Intel PCH QM87 chipset, and AMI UEFI BIOS. It offers extensive I/O options including USB ports, PCIe lanes, SATA ports with RAID support, and integrated Intel HD Graphics supporting multiple display interfaces.', 'target_applications': 'Industrial automation, digital signage, medical equipment, and transportation systems.'}","{'extract_features': [{'input_tokens': 1306, 'output_tokens': 715, 'time_taken': 8.380563020706177}], 'store_and_chunk_data': [{'input_tokens': 0, 'output_tokens': 0, 'time_taken': 1.2885191440582275}], 'search_missing_features': [{'input_tokens': 0, 'output_tokens': 0, 'time_taken': 24.96841025352478}, {'input_tokens': 0, 'output_tokens': 0, 'time_taken': 28.509480237960815}, {'input_tokens': 0, 'output_tokens': 0, 'time_taken': 16.91257095336914}, {'input_tokens': 0, 'output_tokens': 0, 'time_taken': 26.24354100227356}, {'input_tokens': 0, 'output_tokens': 0, 'time_taken': 22.979368209838867}], 'generate_missing_features': [{'input_tokens': 4023, 'output_tokens': 230, 'time_taken': 7.200698137283325}, {'input_tokens': 4083, 'output_tokens': 103, 'time_taken': 3.991657257080078}, {'input_tokens': 3878, 'output_tokens': 85, 'time_taken': 3.448265790939331}, {'input_tokens': 3759, 'output_tokens': 29, 'time_taken': 1.6856529712677002}, {'input_tokens': 3759, 'output_tokens': 29, 'time_taken': 1.9115958213806152}]}","[8, 4, 3, 1, 1, 1]","[0, 0, 0, 0, 0, 0]"
