id,extracted_data,usage_data,missing_feature_count_history,low_confidence_feature_count_history
SOMRZG2H-10-1DE5SNIR,"{'name': 'RZG SOM', 'manufacturer': 'BEACON EMBEDDEDWORKS', 'form_factor': 'SYSTEM ON MODULE', 'evaluation_or_commercialization': True, 'processor_architecture': 'ARM', 'processor_core_count': 'Dual-core to Octa-core', 'processor_manufacturer': 'Renesas', 'processor_tdp': 'Not Available', 'memory': 'Up to 4 GB LPDDR4', 'onboard_storage': 'Up to 64 GB eMMC, Up to 512 MB Quad SPI NOR Flash', 'input_voltage': '5 V', 'io_count': ['USB 2.0', 'HDMI', 'PCIe', 'UART', 'I2C', 'SPI', 'CAN', 'GPIO', 'SDIO'], 'wireless': ['Wi-Fi', 'Bluetooth', 'Optional LTE Cat M/NB-IoT'], 'operating_system_bsp': ['Linux', 'Android', 'Real-time operating systems'], 'operating_temperature_max': '85°C (185°F)', 'operating_temperature_min': '-40°C (-40°F)', 'certifications': 'RoHS Compliant', 'short_summary': 'High-performance RZG SOM series with dual-core to octa-core processors, onboard Wi-Fi, Bluetooth, and optional LTE.', 'full_summary': 'The RZG SOM series offers configurable dual-core to octa-core processors, high-performance multimedia processing, and extensive connectivity options including Wi-Fi, Bluetooth, and optional LTE Cat M/NB-IoT. Ideal for demanding embedded applications in medical, military, aerospace, and industrial sectors.', 'full_product_description': ""Beacon EmbeddedWorks' RZG SOM series provides a flexible, high-performance platform for embedded applications. It features dual-core to octa-core ARM Cortex-A processors, up to 4 GB LPDDR4 memory, and up to 64 GB eMMC storage. Connectivity options include Wi-Fi, Bluetooth, and optional LTE Cat M/NB-IoT. The SOM supports various I/O interfaces such as USB, HDMI, PCIe, UART, I2C, SPI, CAN, and GPIO. It is RoHS compliant and supports Linux, Android, and real-time operating systems."", 'target_applications': ['High-performance multimedia processing', 'Medical', 'Military', 'Aerospace', 'Industrial applications']}","{'extract_features': [{'input_tokens': 1423, 'output_tokens': 856, 'time_taken': 9.674984216690063}], 'store_and_chunk_data': [{'input_tokens': 0, 'output_tokens': 0, 'time_taken': 1.0790820121765137}], 'search_missing_features': [{'input_tokens': 0, 'output_tokens': 0, 'time_taken': 19.987605094909668}, {'input_tokens': 0, 'output_tokens': 0, 'time_taken': 19.060790061950684}, {'input_tokens': 0, 'output_tokens': 0, 'time_taken': 13.541491985321045}], 'generate_missing_features': [{'input_tokens': 3332, 'output_tokens': 141, 'time_taken': 3.1381797790527344}, {'input_tokens': 2944, 'output_tokens': 30, 'time_taken': 4.935866117477417}, {'input_tokens': 2944, 'output_tokens': 30, 'time_taken': 2.7774558067321777}]}","[5, 1, 1, 1]","[0, 0, 0, 0]"
SC0400AU,"{'name': 'RASPBERRY PI MODEL B', 'manufacturer': 'RASPBERRY PI LTD', 'form_factor': 'RASPBERRY PI', 'evaluation_or_commercialization': False, 'processor_architecture': 'ARM', 'processor_core_count': '4', 'processor_manufacturer': 'BROADCOM', 'processor_tdp': 'Not Available', 'memory': '2GB, 4GB, 8GB LPDDR4', 'onboard_storage': 'Micro SD card slot', 'input_voltage': '5V DC', 'io_count': 'USB ports, GPIO header, micro HDMI ports, MIPI DSI, MIPI CSI, audio port', 'wireless': 'Dual-band 2.4GHz and 5GHz IEEE 802.11.b/g/n/ac wireless LAN, Bluetooth 5.0, BLE', 'operating_system_bsp': 'Raspberry Pi OS (formerly Raspbian), Ubuntu, Windows 10 IoT Core, RISC OS, LibreELEC', 'operating_temperature_max': '85°C', 'operating_temperature_min': '0°C', 'certifications': 'Modular compliance certification', 'short_summary': 'High-performance Raspberry Pi with quad-core processor, dual-display support, and extensive connectivity.', 'full_summary': 'The Raspberry Pi Model B features a high-performance 64-bit quad-core processor, dual-display support with 4K resolution via micro HDMI ports, 2GB to 8GB RAM, dual-band wireless LAN, Bluetooth, Gigabit Ethernet, USB ports, and PoE capability via a separate PoE HAT.', 'full_product_description': 'Raspberry Pi Model B offers desktop performance comparable to entry-level x86 PC systems, with backwards compatibility to previous Raspberry Pi models. It includes a Broadcom BCM2711 quad-core Cortex-A72 ARM v8 64-bit SoC at 1.5GHz, LPDDR4 RAM, and extensive connectivity options including dual-band wireless LAN, Bluetooth 5.0, Gigabit Ethernet, USB 3.0 and 2.0 ports, and GPIO header. It supports 4Kp60 hardware video decode and has modular compliance certification.', 'target_applications': 'Desktop computing, IoT, education, embedded systems, prototyping'}","{'extract_features': [{'input_tokens': 1357, 'output_tokens': 770, 'time_taken': 8.285462141036987}], 'store_and_chunk_data': [{'input_tokens': 0, 'output_tokens': 0, 'time_taken': 2.010215997695923}], 'search_missing_features': [{'input_tokens': 0, 'output_tokens': 0, 'time_taken': 21.81426191329956}, {'input_tokens': 0, 'output_tokens': 0, 'time_taken': 30.481863975524902}, {'input_tokens': 0, 'output_tokens': 0, 'time_taken': 16.98334527015686}], 'generate_missing_features': [{'input_tokens': 4071, 'output_tokens': 82, 'time_taken': 3.2974181175231934}, {'input_tokens': 4169, 'output_tokens': 30, 'time_taken': 5.001477241516113}, {'input_tokens': 4169, 'output_tokens': 30, 'time_taken': 3.3731000423431396}]}","[2, 1, 1, 1]","[0, 0, 0, 0]"
MI990EF-6100E,{},"{'extract_features': [{'input_tokens': 1412, 'output_tokens': 817, 'time_taken': 8.761758089065552}], 'store_and_chunk_data': [{'input_tokens': 0, 'output_tokens': 0, 'time_taken': 1.9871160984039307}]}",[7],[0]
iQ7-BT-E38151-R10,"{'name': 'IQBT', 'manufacturer': 'IEI', 'form_factor': 'QSEVEN', 'evaluation_or_commercialization': False, 'processor_architecture': 'X86', 'processor_core_count': 'Quad-core', 'processor_manufacturer': 'INTEL', 'processor_tdp': '6W', 'memory': '4GB DDR3L', 'onboard_storage': 'Optional 8GB/16GB SSD', 'input_voltage': '12V', 'io_count': '4 USB, 1 SATA, 1 Ethernet, 1 Serial, 1 SDIO', 'wireless': 'Not Available', 'operating_system_bsp': 'UEFI BIOS', 'operating_temperature_max': '60°C', 'operating_temperature_min': '-20°C', 'certifications': 'RoHS', 'short_summary': 'Qseven Rev module with Intel Atom processor, supporting dual independent displays and multiple I/O interfaces.', 'full_summary': 'The IQBT is a Qseven Rev module featuring Intel Atom processors, offering quad-core and dual-core options. It supports dual independent displays, multiple I/O interfaces including USB, SATA, and Ethernet, and is compliant with RoHS standards.', 'full_product_description': 'The IQBT single board computer is designed for embedded applications, featuring Intel Atom E series processors with options for quad-core and dual-core configurations. It includes 4GB of soldered DDR3L memory and optional onboard SSD storage. The board supports dual independent displays via LVDS and DDI, and offers a range of I/O interfaces including USB, SATA, Ethernet, and more. It operates within a temperature range of -20°C to 60°C and complies with RoHS standards.', 'target_applications': 'Embedded systems, industrial automation, digital signage, and IoT applications.'}","{'extract_features': [{'input_tokens': 1506, 'output_tokens': 732, 'time_taken': 8.202133178710938}], 'store_and_chunk_data': [{'input_tokens': 0, 'output_tokens': 0, 'time_taken': 1.8382079601287842}], 'search_missing_features': [{'input_tokens': 0, 'output_tokens': 0, 'time_taken': 17.896749258041382}, {'input_tokens': 0, 'output_tokens': 0, 'time_taken': 32.51839995384216}], 'generate_missing_features': [{'input_tokens': 3956, 'output_tokens': 29, 'time_taken': 2.053736925125122}, {'input_tokens': 4068, 'output_tokens': 29, 'time_taken': 4.820852994918823}]}","[1, 1, 1]","[0, 0, 0]"
PCA-6763G2-00A1E,"{'name': 'PCA', 'manufacturer': 'ADVANTECH', 'form_factor': 'ISA Half-size SBC', 'evaluation_or_commercialization': False, 'processor_architecture': 'x86', 'processor_core_count': 'Dual-core', 'processor_manufacturer': 'AMD', 'processor_tdp': 'Not Available', 'memory': '4 GB DDR3 onboard, 8 GB DDR3 SODIMM socket', 'onboard_storage': 'mSATA', 'input_voltage': '5V, 12V, 3.3V, 5VSB', 'io_count': 'USB 2.0, USB 3.0, SATA, mSATA, RS-232, RS-422, RS-485, LPT, FDD, GPIO', 'wireless': 'Not Available', 'operating_system_bsp': 'Not Available', 'operating_temperature_max': '60°C', 'operating_temperature_min': '0°C', 'certifications': 'TCG', 'short_summary': 'Ultra low power AMD dual-core APU with fanless design and dual independent display support.', 'full_summary': 'The PCA is a half-size ISA SBC featuring an ultra low power AMD dual-core APU, fanless design, dual independent display support, and a variety of I/O interfaces including USB, SATA, and legacy ports.', 'full_product_description': 'The PCA is designed for industrial applications requiring low power consumption and high performance. It features an AMD G-Series APU, integrated Radeon HD graphics, dual independent display outputs, and extensive I/O options including USB, SATA, mSATA, and legacy interfaces. The board supports up to 8 GB of DDR3 memory and includes onboard storage options.', 'target_applications': 'Industrial automation, embedded systems, digital signage, and other applications requiring reliable, low-power computing solutions.'}","{'extract_features': [{'input_tokens': 1518, 'output_tokens': 743, 'time_taken': 8.013193845748901}], 'store_and_chunk_data': [{'input_tokens': 0, 'output_tokens': 0, 'time_taken': 1.7949531078338623}], 'search_missing_features': [{'input_tokens': 0, 'output_tokens': 0, 'time_taken': 10.626875877380371}, {'input_tokens': 0, 'output_tokens': 0, 'time_taken': 19.00949192047119}], 'generate_missing_features': [{'input_tokens': 3716, 'output_tokens': 79, 'time_taken': 3.5453898906707764}, {'input_tokens': 4071, 'output_tokens': 79, 'time_taken': 7.227304935455322}]}","[3, 3, 3]","[0, 0, 0]"
