id,extracted_data,usage_data,missing_feature_count_history,low_confidence_feature_count_history
G4PB32DEC,{},"{'extract_features': [{'input_tokens': 3837, 'output_tokens': 655, 'time_taken': 7.5117950439453125}], 'store_and_chunk_data': [{'input_tokens': 0, 'output_tokens': 0, 'time_taken': 2.185302972793579}]}",[13],[0]
iW-G36S-4EV1-4E002G-E008G-BEE,"{'name': 'ZYNQ ULTRASCALE MPSOC SBC', 'manufacturer': 'IWAVE SYSTEMS TECHNOLOGIES', 'form_factor': 'SBC', 'evaluation_or_commercialization': False, 'processor_architecture': 'ARM', 'processor_core_count': 'Quad/Dual Cortex A53', 'processor_manufacturer': 'XILINX', 'processor_tdp': 'Not Available', 'memory': '4 GB DDR4', 'onboard_storage': '16 GB eMMC', 'input_voltage': '5V', 'io_count': 'HDMI, USB, SFP, SDI', 'wireless': 'Wi-Fi', 'operating_system_bsp': 'Linux', 'operating_temperature_max': '+85°C', 'operating_temperature_min': '-40°C', 'certifications': 'RoHS', 'short_summary': 'A high-performance SBC based on Xilinx Zynq Ultrascale MPSoC.', 'full_summary': 'The Zynq Ultrascale MPSoC SBC is designed for embedded applications, featuring high-speed connectors and a robust thermal management system.', 'full_product_description': ""The Zynq Ultrascale MPSoC SBC by iWave Systems Technologies is a single board computer that integrates Xilinx's Zynq Ultrascale MPSoC. It includes 4 GB DDR4 RAM, 16 GB eMMC storage, and supports various interfaces such as HDMI, USB, and SFP. The board is designed for industrial applications with a focus on high performance and reliability."", 'target_applications': 'Embedded applications, industrial automation, and high-performance computing.'}","{'extract_features': [{'input_tokens': 3988, 'output_tokens': 677, 'time_taken': 7.939436912536621}], 'generate_missing_features': [{'input_tokens': 3072, 'output_tokens': 166, 'time_taken': 4.70172905921936}, {'input_tokens': 3802, 'output_tokens': 30, 'time_taken': 1.2455017566680908}, {'input_tokens': 3802, 'output_tokens': 30, 'time_taken': 1.8667809963226318}], 'store_and_chunk_data': [{'input_tokens': 0, 'output_tokens': 0, 'time_taken': 2.726907968521118}], 'search_missing_features': [{'input_tokens': 0, 'output_tokens': 0, 'time_taken': 10.375560283660889}, {'input_tokens': 0, 'output_tokens': 0, 'time_taken': 12.085715770721436}, {'input_tokens': 0, 'output_tokens': 0, 'time_taken': 12.469453811645508}]}","[6, 1, 1, 1]","[0, 0, 0, 0]"
iW-G54M-OS35-3D512M-E004G-BIA,"{'name': 'STMMP OSM LGA MODULE', 'manufacturer': 'IWAVE SYSTEMS TECHNOLOGIES', 'form_factor': 'OSM', 'evaluation_or_commercialization': False, 'processor_architecture': 'ARM', 'processor_core_count': 'Not Available', 'processor_manufacturer': 'STMICROELECTRONICS', 'processor_tdp': 'Not Available', 'memory': '512 MB DDR4L', 'onboard_storage': '4 GB eMMC', 'input_voltage': '5V', 'io_count': 'Not Available', 'wireless': 'Not Available', 'operating_system_bsp': 'Not Available', 'operating_temperature_max': '85°C', 'operating_temperature_min': '-40°C', 'certifications': 'RoHS', 'short_summary': 'STMMP OSM LGA Module by iWave Systems, featuring STMMP Cortex-A processor, 512 MB DDR4L, and 4 GB eMMC storage.', 'full_summary': 'The STMMP OSM LGA Module is a compact, high-performance module designed by iWave Systems, featuring a STMMP Cortex-A processor, 512 MB DDR4L memory, and 4 GB eMMC storage. It supports a range of interfaces including RGMII, USB OTG, and CAN.', 'full_product_description': 'The STMMP OSM LGA Module is built on the STMMP series MPUs by STMicroelectronics, offering a rich set of features including DDR4L memory, eMMC storage, and a variety of I/O interfaces. It is designed for low power, high performance applications and is compliant with RoHS standards.', 'target_applications': 'Embedded systems, industrial automation, IoT devices.'}","{'extract_features': [{'input_tokens': 4113, 'output_tokens': 707, 'time_taken': 9.238872051239014}], 'generate_missing_features': [{'input_tokens': 4669, 'output_tokens': 182, 'time_taken': 4.351938009262085}, {'input_tokens': 4607, 'output_tokens': 103, 'time_taken': 4.932496786117554}, {'input_tokens': 4607, 'output_tokens': 103, 'time_taken': 2.5772838592529297}], 'store_and_chunk_data': [{'input_tokens': 0, 'output_tokens': 0, 'time_taken': 2.744176149368286}], 'search_missing_features': [{'input_tokens': 0, 'output_tokens': 0, 'time_taken': 20.503739833831787}, {'input_tokens': 0, 'output_tokens': 0, 'time_taken': 15.207688808441162}, {'input_tokens': 0, 'output_tokens': 0, 'time_taken': 18.68033003807068}]}","[7, 4, 4, 4]","[0, 1, 1, 1]"
A20-OLINUXINO-MICRO-4GB,{},"{'extract_features': [{'input_tokens': 3956, 'output_tokens': 726, 'time_taken': 8.258579969406128}], 'store_and_chunk_data': [{'input_tokens': 0, 'output_tokens': 0, 'time_taken': 2.704864978790283}]}",[5],[0]
68004-0000-99-1,"{'name': 'COMEBBD', 'manufacturer': 'KONTRON', 'form_factor': 'COM EXPRESS BASIC', 'evaluation_or_commercialization': False, 'processor_architecture': 'X86', 'processor_core_count': '16', 'processor_manufacturer': 'INTEL', 'processor_tdp': '45 W', 'memory': 'DDR4, UP TO 64GB ECC', 'onboard_storage': '2x SATA3, 6Gb/s', 'input_voltage': '8.5 V – 20 V', 'io_count': '24x PCIe 3.0, 8x PCIe 2.0, 4x USB 3.0/2.0, 2x serial interface', 'wireless': 'Not Available', 'operating_system_bsp': 'Linux, Windows Server 2012 / 2012 R2 / 2016, Windows 7, Windows 10, VxWorks 7.x', 'operating_temperature_max': '85C', 'operating_temperature_min': '-40C', 'certifications': ['RoHS II', 'UL', 'CE', 'WEEE'], 'short_summary': 'KONTRON COMEBBD is a COM Express Basic module featuring Intel Xeon D processors, designed for industrial environments.', 'full_summary': 'The KONTRON COMEBBD module is a high-performance COM Express Basic module equipped with Intel Xeon D processors, supporting DDR4 ECC memory, dual GbE interfaces, and designed for industrial temperature ranges.', 'full_product_description': ""KONTRON's COMEBBD is a Computer-on-Module (COM) Express Basic type featuring Intel Xeon D processors. It supports up to 64GB of DDR4 ECC memory, dual GbE interfaces, and is designed for industrial temperature environments. The module complies with RoHS II, UL, CE, and WEEE standards, ensuring high reliability and environmental compliance."", 'target_applications': ['Industrial', 'IoT', 'Embedded Systems']}","{'extract_features': [{'input_tokens': 4263, 'output_tokens': 693, 'time_taken': 7.698344945907593}], 'generate_missing_features': [{'input_tokens': 3914, 'output_tokens': 213, 'time_taken': 4.689165830612183}, {'input_tokens': 3929, 'output_tokens': 170, 'time_taken': 6.729398012161255}, {'input_tokens': 4283, 'output_tokens': 80, 'time_taken': 1.8894028663635254}, {'input_tokens': 4225, 'output_tokens': 29, 'time_taken': 2.1959779262542725}, {'input_tokens': 4225, 'output_tokens': 29, 'time_taken': 2.94323992729187}], 'store_and_chunk_data': [{'input_tokens': 0, 'output_tokens': 0, 'time_taken': 3.345531702041626}], 'search_missing_features': [{'input_tokens': 0, 'output_tokens': 0, 'time_taken': 19.488091230392456}, {'input_tokens': 0, 'output_tokens': 0, 'time_taken': 14.363664865493774}, {'input_tokens': 0, 'output_tokens': 0, 'time_taken': 23.084994792938232}, {'input_tokens': 0, 'output_tokens': 0, 'time_taken': 12.251282930374146}, {'input_tokens': 0, 'output_tokens': 0, 'time_taken': 18.440377950668335}]}","[7, 5, 3, 1, 1, 1]","[0, 0, 0, 0, 0, 0]"
