id,extracted_data,usage_data,missing_feature_count_history,low_confidence_feature_count_history
DFR1080,{},"{'extract_features': [{'input_tokens': 1695, 'output_tokens': 684, 'time_taken': 7.840458869934082}], 'store_and_chunk_data': [{'input_tokens': 0, 'output_tokens': 0, 'time_taken': 0.7501561641693115}]}",[8],[0]
AIMB-706G2-00A3,"{'name': 'AIMB', 'manufacturer': 'ADVANTECH', 'form_factor': 'ATX', 'evaluation_or_commercialization': False, 'processor_architecture': 'x86', 'processor_core_count': '4', 'processor_manufacturer': 'INTEL', 'processor_tdp': '65W / 35W', 'memory': 'Dual Channel Non-ECC DDR4, Max Capacity 64GB', 'onboard_storage': '32Gb/s M.2', 'input_voltage': '12V', 'io_count': ['USB 3.2 Gen 1', 'USB 2.0', 'RS-232', 'RS-422/485', 'VGA', 'DVI', 'Ethernet'], 'wireless': 'Supports type 2230 WiFi/BT PCIe WiFi module', 'operating_system_bsp': 'Windows', 'operating_temperature_max': '60°C', 'operating_temperature_min': '0°C', 'certifications': 'CE, FCC', 'short_summary': 'Industrial motherboard with Intel H chipset, supporting 9th/8th Gen Intel Core processors, dual channel DDR4, and multiple I/O interfaces.', 'full_summary': 'The AIMB industrial motherboard features an Intel H chipset, supporting 9th/8th Gen Intel Core processors. It offers dual channel DDR4 memory support up to 64GB, and a variety of I/O interfaces including USB 3.2 Gen 1, USB 2.0, RS-232, RS-422/485, VGA, DVI, and Ethernet.', 'full_product_description': 'The AIMB motherboard is designed for industrial applications, featuring an Intel H chipset and support for 9th/8th Gen Intel Core processors. It includes dual channel DDR4 memory support up to 64GB, integrated Intel HD Graphics, and a comprehensive range of I/O interfaces such as USB 3.2 Gen 1, USB 2.0, RS-232, RS-422/485, VGA, DVI, and dual GbE LAN. The board is equipped with PCIe and PCI expansion slots, and supports Intel vPro and TPM technologies.', 'target_applications': ['Industrial Automation', 'Embedded Systems', 'Networking', 'Digital Signage']}","{'generate_missing_features': [{'input_tokens': 3785, 'output_tokens': 131, 'time_taken': 3.7953720092773438}, {'input_tokens': 4052, 'output_tokens': 99, 'time_taken': 2.382880926132202}], 'search_missing_features': [{'input_tokens': 0, 'output_tokens': 0, 'time_taken': 13.363605976104736}, {'input_tokens': 0, 'output_tokens': 0, 'time_taken': 24.166203022003174}], 'extract_features': [{'input_tokens': 1704, 'output_tokens': 825, 'time_taken': 9.909499883651733}], 'store_and_chunk_data': [{'input_tokens': 0, 'output_tokens': 0, 'time_taken': 1.6431241035461426}]}","[5, 3, 0]","[0, 0, 0]"
PCE-3032G2-00A2,"{'name': 'PCE-5120', 'manufacturer': 'ADVANTECH', 'form_factor': 'Half-size SHB', 'evaluation_or_commercialization': False, 'processor_architecture': 'x86', 'processor_core_count': '4', 'processor_manufacturer': 'INTEL', 'processor_tdp': '35W', 'memory': 'Dual Channel Non-ECC DDR4 64GB Max', 'onboard_storage': 'Not Available', 'input_voltage': '12V', 'io_count': ['USB 3.0', 'USB 2.0', 'SATA III', 'PCIe', 'Ethernet', 'VGA', 'DVI-D', 'DP', 'COM', 'GPIO'], 'wireless': 'Not Available', 'operating_system_bsp': 'Not Available', 'operating_temperature_max': '60°C', 'operating_temperature_min': '0°C', 'certifications': 'PICMG 1.3', 'short_summary': 'Half-size SHB with Intel Core processor, dual independent display, and dual GbE LAN.', 'full_summary': 'The PCE-5120 is a half-size SHB supporting Intel Core processors, dual independent display outputs, dual GbE LAN, and a variety of I/O interfaces including USB, SATA III, and PCIe.', 'full_product_description': 'The Advantech PCE-5120 is a half-size SHB designed for industrial applications. It supports Intel Core processors with a TDP of 35W, dual channel Non-ECC DDR4 memory up to 64GB, and offers a range of I/O options including USB 3.0, USB 2.0, SATA III, PCIe, Ethernet, VGA, DVI-D, DP, COM, and GPIO. The board is compliant with PICMG 1.3 standards and is suitable for environments with operating temperatures between 0°C and 60°C.', 'target_applications': ['Industrial Automation', 'Embedded Systems', 'Networking']}","{'generate_missing_features': [{'input_tokens': 4116, 'output_tokens': 79, 'time_taken': 3.6324381828308105}, {'input_tokens': 4321, 'output_tokens': 79, 'time_taken': 3.129729986190796}], 'search_missing_features': [{'input_tokens': 0, 'output_tokens': 0, 'time_taken': 11.54895806312561}, {'input_tokens': 0, 'output_tokens': 0, 'time_taken': 15.23945927619934}], 'extract_features': [{'input_tokens': 1825, 'output_tokens': 791, 'time_taken': 9.053398847579956}], 'store_and_chunk_data': [{'input_tokens': 0, 'output_tokens': 0, 'time_taken': 1.61332106590271}]}","[3, 3, 3]","[0, 0, 0]"
KINO-DQM871-i1-CE-R10,"{'name': 'KINODQMI', 'manufacturer': 'IEI', 'form_factor': 'Mini-ITX', 'evaluation_or_commercialization': False, 'processor_architecture': 'x86', 'processor_core_count': 'Quad-core', 'processor_manufacturer': 'Intel', 'processor_tdp': 'Not Available', 'memory': 'Supports up to 32GB DDR3 1600MHz', 'onboard_storage': 'Not Available', 'input_voltage': '12V DC', 'io_count': 'Multiple USB, SATA, PCIe, HDMI, VGA, LVDS, DP', 'wireless': 'Not Available', 'operating_system_bsp': 'Not Available', 'operating_temperature_max': '60°C', 'operating_temperature_min': '0°C', 'certifications': 'RoHS', 'short_summary': 'Mini-ITX SBC with Intel mobile processors, dual HDMI, and multiple I/O options.', 'full_summary': ""The KINODQMI is a Mini-ITX single board computer featuring Intel's mobile processors, supporting dual HDMI outputs, multiple USB and SATA interfaces, and Intel AMT for remote management."", 'full_product_description': ""The KINODQMI motherboard is designed for industrial applications, equipped with Intel's mobile Core and Celeron processors. It supports dual-channel DDR3 memory, dual HDMI, VGA, LVDS, and DP outputs, and offers extensive I/O options including USB, SATA, and PCIe. The board also supports Intel AMT for advanced remote management capabilities."", 'target_applications': 'Industrial automation, digital signage, and embedded systems.'}","{'generate_missing_features': [{'input_tokens': 3628, 'output_tokens': 103, 'time_taken': 3.008401870727539}, {'input_tokens': 3389, 'output_tokens': 103, 'time_taken': 2.9344470500946045}], 'search_missing_features': [{'input_tokens': 0, 'output_tokens': 0, 'time_taken': 18.720134973526}, {'input_tokens': 0, 'output_tokens': 0, 'time_taken': 16.033496141433716}], 'extract_features': [{'input_tokens': 1921, 'output_tokens': 689, 'time_taken': 8.621699810028076}], 'store_and_chunk_data': [{'input_tokens': 0, 'output_tokens': 0, 'time_taken': 1.0643739700317383}]}","[4, 4, 4]","[0, 0, 0]"
PCM-9365E-2GS3A1E,"{'name': 'PCM', 'manufacturer': 'ADVANTECH', 'form_factor': 'Single Board Computer', 'evaluation_or_commercialization': False, 'processor_architecture': 'x86', 'processor_core_count': 'Quad-Core', 'processor_manufacturer': 'INTEL', 'processor_tdp': '6W', 'memory': '8GB DDR3L', 'onboard_storage': 'mSATA', 'input_voltage': '12V', 'io_count': ['VGA', 'HDMI', 'USB', 'Ethernet', 'SATA', 'PCIe', 'RS-232'], 'wireless': 'Wi-Fi, Bluetooth, GSM', 'operating_system_bsp': ['Windows Embedded', 'Linux', 'VxWorks', 'Android Kit Kat'], 'operating_temperature_max': '60°C', 'operating_temperature_min': '-20°C', 'certifications': 'CE, FCC', 'short_summary': 'Embedded Single Board Computer with Intel Atom and Celeron processors, supporting multiple display outputs and rich I/O interfaces.', 'full_summary': 'The PCM series from Advantech offers embedded single board computers featuring Intel Atom and Celeron processors. These boards support multiple display outputs including VGA, HDMI, and LVDS, and provide a variety of I/O interfaces such as USB, Ethernet, and PCIe. Designed for industrial applications, they operate in a wide temperature range and support various operating systems.', 'full_product_description': ""Advantech's PCM series embedded SBCs are equipped with Intel Atom E and Celeron N processors, offering quad-core and dual-core options. They feature DDR3L memory, multiple display interfaces, and extensive I/O capabilities including SATA, USB, and PCIe. These boards are suitable for industrial environments with operational temperatures ranging from -20°C to 60°C. They support a range of operating systems, making them versatile for various applications."", 'target_applications': ['Industrial Automation', 'Digital Signage', 'Kiosk Systems', 'Embedded Control Systems']}","{'generate_missing_features': [{'input_tokens': 4618, 'output_tokens': 79, 'time_taken': 2.3488309383392334}, {'input_tokens': 4288, 'output_tokens': 55, 'time_taken': 1.819004774093628}, {'input_tokens': 4217, 'output_tokens': 35, 'time_taken': 1.6918301582336426}], 'search_missing_features': [{'input_tokens': 0, 'output_tokens': 0, 'time_taken': 20.411614894866943}, {'input_tokens': 0, 'output_tokens': 0, 'time_taken': 12.668466806411743}, {'input_tokens': 0, 'output_tokens': 0, 'time_taken': 12.189960241317749}], 'extract_features': [{'input_tokens': 1880, 'output_tokens': 789, 'time_taken': 8.584147930145264}], 'store_and_chunk_data': [{'input_tokens': 0, 'output_tokens': 0, 'time_taken': 1.0300548076629639}]}","[3, 2, 1, 0]","[0, 0, 0, 0]"
