id,extracted_data,usage_data,missing_feature_count_history,low_confidence_feature_count_history
ARK-1122F-S8A1E,"{'name': 'ARKFSAE', 'manufacturer': 'ADVANTECH', 'form_factor': 'PALMSIZE', 'evaluation_or_commercialization': False, 'processor_architecture': 'X86', 'processor_core_count': '2', 'processor_manufacturer': 'INTEL', 'processor_tdp': 'Not Available', 'memory': '4 GB DDR3 1333 MHz', 'onboard_storage': 'mSATA', 'input_voltage': '12 VDC', 'io_count': ['2 x RS-232/422/485', '6 x USB 2.0', '2 x GbE LAN', '1 x VGA', '1 x HDMI', 'Audio Line-in/Line-out'], 'wireless': 'Wi-Fi', 'operating_system_bsp': ['Windows 10', 'Windows 10 Pro 64-bit', 'WES7 64-bit', 'XP Embedded'], 'operating_temperature_max': '60°C', 'operating_temperature_min': '-20°C', 'certifications': ['CE', 'FCC Class A', 'CCC', 'BSMI', 'CB', 'UL'], 'short_summary': 'Fanless Embedded Box PC with Intel Atom Dual Core N2600, supporting diverse communications and wide operating temperature.', 'full_summary': 'The ARKFSAE is a fanless embedded box PC featuring an Intel Atom Dual Core N2600 processor, designed for diverse communication needs with support for dual independent displays, multiple I/O interfaces, and wide operating temperature range.', 'full_product_description': 'The ARKFSAE is a compact, fanless embedded box PC powered by an Intel Atom Dual Core N2600 processor. It supports up to 4 GB DDR3 memory and mSATA storage. The device offers extensive connectivity options including 2 GbE LAN ports, 6 USB ports, and dual display support via VGA and HDMI. It is designed for harsh environments with an operating temperature range from -20°C to 60°C. The ARKFSAE is compliant with multiple certifications including CE, FCC, and UL, making it suitable for industrial applications.', 'target_applications': ['Industrial Automation', 'Digital Signage', 'Kiosk Systems', 'Transportation']}","{'extract_features': [{'input_tokens': 1471, 'output_tokens': 847, 'time_taken': 9.32407808303833}], 'search_missing_features': [{'input_tokens': 0, 'output_tokens': 0, 'time_taken': 14.264811038970947}, {'input_tokens': 0, 'output_tokens': 0, 'time_taken': 17.32804298400879}], 'generate_missing_features': [{'input_tokens': 3915, 'output_tokens': 30, 'time_taken': 2.973236083984375}, {'input_tokens': 3915, 'output_tokens': 30, 'time_taken': 1.646296739578247}], 'store_and_chunk_data': [{'input_tokens': 0, 'output_tokens': 0, 'time_taken': 1.2548332214355469}]}","[1, 1, 1]","[0, 0, 0]"
AIMB-766G2-00A2E,"{'name': 'AIMB', 'manufacturer': 'ADVANTECH', 'form_factor': 'ATX', 'evaluation_or_commercialization': False, 'processor_architecture': 'x86', 'processor_core_count': 'Quad Core', 'processor_manufacturer': 'INTEL', 'processor_tdp': '35 watts', 'memory': 'Dual channel DDR2 800 MHz, Max Capacity 8 GB', 'onboard_storage': 'CFast', 'input_voltage': '12V', 'io_count': 'VGA, USB, Audio, Serial x 2 RS-232, Parallel, PS/2 keyboard, PS/2 mouse', 'wireless': 'Possible via MiniPCIe', 'operating_system_bsp': 'Microsoft Windows Embedded', 'operating_temperature_max': '60°C', 'operating_temperature_min': '0°C', 'certifications': 'Class I, Division 2 Solution', 'short_summary': 'Industrial motherboard with Intel Core Quad/Duo support, ATX form factor, dual LAN, and multiple I/O interfaces.', 'full_summary': 'The AIMB motherboard supports Intel Core Quad and Duo processors, features an ATX form factor, dual channel DDR2 memory, dual LAN, and a variety of I/O interfaces including VGA, USB, and serial ports.', 'full_product_description': 'The AIMB series industrial motherboard by Advantech is designed for high-performance applications, supporting Intel Core Quad and Duo processors. It features an ATX form factor, dual channel DDR2 800 MHz memory with a maximum capacity of 8 GB, and dual Gigabit Ethernet LAN. The board includes multiple I/O interfaces such as VGA, USB, audio, serial, and parallel ports, making it suitable for a wide range of industrial applications.', 'target_applications': 'Industrial automation, embedded systems, and high-performance computing applications.'}","{'extract_features': [{'input_tokens': 1410, 'output_tokens': 727, 'time_taken': 8.788518905639648}], 'search_missing_features': [{'input_tokens': 0, 'output_tokens': 0, 'time_taken': 12.885798931121826}, {'input_tokens': 0, 'output_tokens': 0, 'time_taken': 12.724441289901733}, {'input_tokens': 0, 'output_tokens': 0, 'time_taken': 9.859160900115967}], 'generate_missing_features': [{'input_tokens': 3988, 'output_tokens': 135, 'time_taken': 4.370226860046387}, {'input_tokens': 4159, 'output_tokens': 55, 'time_taken': 3.7970550060272217}, {'input_tokens': 3792, 'output_tokens': 65, 'time_taken': 3.843031883239746}], 'store_and_chunk_data': [{'input_tokens': 0, 'output_tokens': 0, 'time_taken': 1.5443189144134521}]}","[5, 2, 2, 0]","[0, 0, 0, 0]"
EmETXe-i250C-D25,"{'name': 'EMETXEIC', 'manufacturer': 'ARBOR TECHNOLOGY', 'form_factor': 'COM EXPRESS COMPACT', 'evaluation_or_commercialization': True, 'processor_architecture': 'Skylake-U', 'processor_core_count': '6 P-Cores, 8 E-Cores, 2 Low Power E-Cores', 'processor_manufacturer': 'INTEL', 'processor_tdp': '15W', 'memory': 'DDR3 SODIMM, 4 GB', 'onboard_storage': '32GB eMMC', 'input_voltage': '12V', 'io_count': '12 USB ports, 2 UART ports', 'wireless': 'Not Available', 'operating_system_bsp': ['Windows Starter', 'Home Basic', 'Home Premium', 'MeeGO', 'Linux', 'Google Chrome'], 'operating_temperature_max': '60°C', 'operating_temperature_min': '-20°C', 'certifications': 'CE, FCC Class B, RoHS', 'short_summary': 'Fanless COM Express Compact CPU module with Intel Atom D processor.', 'full_summary': 'The EmETXeiC is a fanless COM Express Compact CPU module featuring a soldered onboard Intel Atom D processor, integrated Gigabit Ethernet, and support for extended operating temperatures.', 'full_product_description': 'The EmETXeiC module is designed for industrial applications, offering a fanless design with a soldered Intel Atom D processor. It includes integrated Gigabit Ethernet, single-channel 18-bit LVDS, and multiple DDI ports. The module supports DDR3 SODIMM memory and features a wide range of I/O interfaces, including USB, SATA, and PCIe.', 'target_applications': 'Industrial applications requiring compact, fanless computing solutions.'}","{'extract_features': [{'input_tokens': 1360, 'output_tokens': 685, 'time_taken': 7.804912090301514}], 'search_missing_features': [{'input_tokens': 0, 'output_tokens': 0, 'time_taken': 15.224021911621094}, {'input_tokens': 0, 'output_tokens': 0, 'time_taken': 113.10636806488037}, {'input_tokens': 0, 'output_tokens': 0, 'time_taken': 19.370869159698486}, {'input_tokens': 0, 'output_tokens': 0, 'time_taken': 16.393418073654175}, {'input_tokens': 0, 'output_tokens': 0, 'time_taken': 16.890156030654907}], 'generate_missing_features': [{'input_tokens': 4154, 'output_tokens': 185, 'time_taken': 4.979374170303345}, {'input_tokens': 3974, 'output_tokens': 104, 'time_taken': 7.214236259460449}, {'input_tokens': 3954, 'output_tokens': 76, 'time_taken': 3.7684900760650635}, {'input_tokens': 4310, 'output_tokens': 94, 'time_taken': 3.4986090660095215}, {'input_tokens': 4041, 'output_tokens': 60, 'time_taken': 3.4759349822998047}], 'store_and_chunk_data': [{'input_tokens': 0, 'output_tokens': 0, 'time_taken': 1.9045381546020508}]}","[7, 4, 3, 3, 2, 1]","[0, 0, 0, 0, 0, 0]"
DFR0697,"{'name': 'RASPBERRY PI MODEL B', 'manufacturer': 'RASPBERRY PI TRADING LTD', 'form_factor': 'RASPBERRY PI', 'evaluation_or_commercialization': False, 'processor_architecture': 'ARM', 'processor_core_count': '4', 'processor_manufacturer': 'BROADCOM', 'processor_tdp': 'Not Available', 'memory': '2GB, 4GB, 8GB LPDDR4', 'onboard_storage': 'Micro SD card slot', 'input_voltage': '5V DC', 'io_count': 'USB 3.0 ports, USB 2.0 ports, GPIO header', 'wireless': 'Dual-band 2.4GHz and 5GHz IEEE 802.11.b/g/n/ac wireless LAN, Bluetooth 5.0, BLE', 'operating_system_bsp': 'Not Available', 'operating_temperature_max': '85°C', 'operating_temperature_min': '0°C', 'certifications': 'Modular compliance certification', 'short_summary': 'High-performance Raspberry Pi Model B with quad-core processor, dual-display support, and extensive connectivity options.', 'full_summary': 'The Raspberry Pi Model B offers significant improvements in processor speed, multimedia performance, memory, and connectivity, while maintaining compatibility with previous models. It features a quad-core ARM Cortex-A72 processor, dual-display support, and extensive I/O options.', 'full_product_description': 'The Raspberry Pi Model B is a high-performance computer featuring a Broadcom BCM2711 quad-core Cortex-A72 ARM v8 64-bit SoC at 1.5GHz, with 2GB, 4GB, or 8GB LPDDR4 RAM. It supports dual-display output via micro-HDMI ports, 4Kp60 hardware video decode, and includes dual-band wireless LAN, Bluetooth 5.0, BLE, Gigabit Ethernet, and USB 3.0 ports. It is powered via a 5V DC USB-C connector and supports PoE with an additional HAT.', 'target_applications': 'Desktop computing, multimedia applications, IoT projects, educational purposes, and embedded systems.'}","{'extract_features': [{'input_tokens': 1390, 'output_tokens': 804, 'time_taken': 9.49917984008789}], 'search_missing_features': [{'input_tokens': 0, 'output_tokens': 0, 'time_taken': 20.153905153274536}, {'input_tokens': 0, 'output_tokens': 0, 'time_taken': 24.752824068069458}], 'generate_missing_features': [{'input_tokens': 4023, 'output_tokens': 56, 'time_taken': 2.2838809490203857}, {'input_tokens': 3900, 'output_tokens': 56, 'time_taken': 2.6307921409606934}], 'store_and_chunk_data': [{'input_tokens': 0, 'output_tokens': 0, 'time_taken': 1.5153930187225342}]}","[2, 2, 2]","[0, 0, 0]"
CPU-1482-00,"{'name': 'CPU PENTIUM M FANLESS SBC', 'manufacturer': 'EUROTECH', 'form_factor': 'PCPLUS', 'evaluation_or_commercialization': False, 'processor_architecture': 'x86', 'processor_core_count': 'Not Available', 'processor_manufacturer': 'INTEL', 'processor_tdp': '21 W', 'memory': '512 MB DDR 333 MHz PC2700', 'onboard_storage': '32 MB solid-state disk', 'input_voltage': '5 V DC', 'io_count': ['4 x USB ports', '2 x RS-232', '1 x RS-485', '1 x 10/100 Mbps Ethernet', 'Analog VGA', 'Flat Panel LVDS', ""AC'97 audio interface"", 'Keyboard', 'Mouse'], 'wireless': '802.11 Wireless with optional Intel PRO/Wireless 2200BG card', 'operating_system_bsp': ['WinCE', 'WinXPE', 'Linux'], 'operating_temperature_max': '60 C', 'operating_temperature_min': '-20 C', 'certifications': ['RoHS', 'CE'], 'short_summary': 'Fanless SBC with Intel Pentium M, PCPlus form factor, and extended temperature range.', 'full_summary': 'The CPU Pentium M Fanless SBC is a robust embedded board featuring an Intel Pentium M processor, PCPlus form factor, and a range of I/O interfaces including USB, Ethernet, and VGA. It supports multiple operating systems and is designed for extended temperature ranges.', 'full_product_description': 'The Eurotech CPU Pentium M Fanless SBC is an embedded board designed for high capability and low power applications. It features an Intel Pentium M processor with a 1.6 GHz clock speed, 512 MB DDR 333 MHz PC2700 memory soldered onboard, and a variety of I/O interfaces including USB, Ethernet, and VGA. The board is compliant with RoHS and CE standards and supports operating systems such as WinCE, WinXPE, and Linux. It operates within a temperature range of -20 C to 60 C, making it suitable for industrial applications.', 'target_applications': ['Industrial', 'Transportation', 'Medical', 'Networking', 'Wearable computing']}","{'extract_features': [{'input_tokens': 1368, 'output_tokens': 833, 'time_taken': 9.988163232803345}], 'search_missing_features': [{'input_tokens': 0, 'output_tokens': 0, 'time_taken': 12.491199016571045}, {'input_tokens': 0, 'output_tokens': 0, 'time_taken': 27.11374831199646}, {'input_tokens': 0, 'output_tokens': 0, 'time_taken': 20.211694955825806}, {'input_tokens': 0, 'output_tokens': 0, 'time_taken': 28.71122717857361}], 'generate_missing_features': [{'input_tokens': 4229, 'output_tokens': 108, 'time_taken': 3.6585209369659424}, {'input_tokens': 4354, 'output_tokens': 69, 'time_taken': 3.266211986541748}, {'input_tokens': 3775, 'output_tokens': 30, 'time_taken': 5.412068843841553}, {'input_tokens': 3775, 'output_tokens': 30, 'time_taken': 3.8112168312072754}], 'store_and_chunk_data': [{'input_tokens': 0, 'output_tokens': 0, 'time_taken': 1.9048130512237549}]}","[4, 2, 1, 1, 1]","[0, 0, 0, 0, 0]"
