id,extracted_data,usage_data,missing_feature_count_history,low_confidence_feature_count_history
SOM-5992D8F-U0A1,"{'name': 'SOM INTEL XEON PROCESSOR D COM EXPRESS R TYPE MODULE', 'manufacturer': 'ADVANTECH', 'form_factor': 'COM EXPRESS BASIC MODULE', 'evaluation_or_commercialization': False, 'processor_architecture': 'x86', 'processor_core_count': '6', 'processor_manufacturer': 'INTEL', 'processor_tdp': '45W', 'memory': 'Up to 128GB DDR4 ECC/non-ECC', 'onboard_storage': '2x SATA3, 6Gb/s', 'input_voltage': '12V', 'io_count': 'PCIe x16, PCIe x8, PCIe x4, USB 3.0, USB 2.0, SATA III, LPC, SMBus, SPI, GPIO', 'wireless': 'Not Available', 'operating_system_bsp': ['Windows IoT Enterprise LTSB'], 'operating_temperature_max': '85°C', 'operating_temperature_min': '-40°C', 'certifications': 'Not Available', 'short_summary': 'High-performance COM Express module with Intel Xeon D processor.', 'full_summary': 'The SOM Intel Xeon Processor D COM Express R Type Module is designed for high-performance computing applications, featuring Intel Xeon D processors, support for up to 128GB DDR4 ECC/non-ECC memory, and a variety of I/O interfaces including PCIe, USB, and Ethernet.', 'full_product_description': 'This module is a COM Express Basic Module with Intel Xeon D processors, offering robust performance for industrial applications. It supports up to 128GB of DDR4 ECC/non-ECC memory and provides extensive I/O options including PCIe, USB, SATA, and Ethernet interfaces. The module is suitable for harsh environments with an operating temperature range from -40°C to 85°C.', 'target_applications': ['Industrial automation', 'Networking', 'Telecommunications', 'Data centers']}","{'generate_missing_features': [{'input_tokens': 4510, 'output_tokens': 127, 'time_taken': 4.17765998840332}, {'input_tokens': 3878, 'output_tokens': 85, 'time_taken': 3.318704128265381}, {'input_tokens': 3957, 'output_tokens': 52, 'time_taken': 3.0347402095794678}, {'input_tokens': 4080, 'output_tokens': 52, 'time_taken': 2.584070920944214}], 'store_and_chunk_data': [{'input_tokens': 0, 'output_tokens': 0, 'time_taken': 0.8418498039245605}], 'extract_features': [{'input_tokens': 1718, 'output_tokens': 742, 'time_taken': 8.177769899368286}], 'search_missing_features': [{'input_tokens': 0, 'output_tokens': 0, 'time_taken': 11.116416931152344}, {'input_tokens': 0, 'output_tokens': 0, 'time_taken': 29.811051845550537}, {'input_tokens': 0, 'output_tokens': 0, 'time_taken': 13.821266174316406}, {'input_tokens': 0, 'output_tokens': 0, 'time_taken': 10.712882041931152}]}","[5, 3, 2, 2, 2]","[0, 0, 0, 0, 0]"
ASMB-913-00A1E,"{'name': 'ASMB-781', 'manufacturer': 'ADVANTECH', 'form_factor': 'EATX', 'evaluation_or_commercialization': False, 'processor_architecture': 'x86', 'processor_core_count': 'Not Available', 'processor_manufacturer': 'INTEL', 'processor_tdp': '95W', 'memory': 'Up to 512GB DDR4 ECC RDIMM', 'onboard_storage': 'Not Available', 'input_voltage': 'Not Available', 'io_count': ['3 PCIe x16 slots', 'USB ports', 'VGA port', 'RJ-45 ports'], 'wireless': 'Not Available', 'operating_system_bsp': 'Not Available', 'operating_temperature_max': '60°C', 'operating_temperature_min': '0°C', 'certifications': 'Not Available', 'short_summary': 'EATX server board with dual Intel Xeon support and extensive I/O options.', 'full_summary': 'The ASMB-781 is an EATX server motherboard designed for dual Intel Xeon E5-2600 v3/v4 processors, supporting up to 512GB DDR4 ECC RDIMM memory, with extensive I/O options including multiple PCIe slots and USB ports.', 'full_product_description': 'The ASMB-781 server motherboard by Advantech supports dual Intel Xeon E5-2600 v3/v4 processors, offering robust performance for industrial applications. It features an EATX form factor, supports up to 512GB of DDR4 ECC RDIMM memory, and includes multiple PCIe slots for expansion. The board is equipped with various I/O connectors, including USB, VGA, and RJ-45 ports, making it suitable for a wide range of server applications.', 'target_applications': ['Industrial servers', 'Data centers', 'Enterprise applications']}","{'generate_missing_features': [{'input_tokens': 4341, 'output_tokens': 175, 'time_taken': 4.8063929080963135}, {'input_tokens': 3757, 'output_tokens': 149, 'time_taken': 3.791682720184326}, {'input_tokens': 3757, 'output_tokens': 149, 'time_taken': 4.396838903427124}], 'store_and_chunk_data': [{'input_tokens': 0, 'output_tokens': 0, 'time_taken': 0.9644391536712646}], 'extract_features': [{'input_tokens': 1729, 'output_tokens': 743, 'time_taken': 8.204737186431885}], 'search_missing_features': [{'input_tokens': 0, 'output_tokens': 0, 'time_taken': 32.34462904930115}, {'input_tokens': 0, 'output_tokens': 0, 'time_taken': 21.736330032348633}, {'input_tokens': 0, 'output_tokens': 0, 'time_taken': 20.46155285835266}]}","[7, 6, 6, 6]","[0, 0, 0, 0]"
102110539,"{'name': 'ODYSSEY XJ', 'manufacturer': 'SEEED STUDIO', 'form_factor': 'Raspberry Pi compatible', 'evaluation_or_commercialization': False, 'processor_architecture': 'x86', 'processor_core_count': 'Quad-core', 'processor_manufacturer': 'INTEL', 'processor_tdp': 'Not Available', 'memory': '8GB LPDDR4', 'onboard_storage': '64GB eMMC', 'input_voltage': '12V DC', 'io_count': 'USB Type-A x4, USB Type-C x1, HDMI x1, DP x1, SATA III x1, Micro SD card slot x1, SIM Card slot x1', 'wireless': 'Wi-Fi a/b/g/n/ac, Bluetooth, 4G LTE (with module)', 'operating_system_bsp': 'Windows, Linux', 'operating_temperature_max': '75°C', 'operating_temperature_min': '0°C', 'certifications': 'FCC, CE', 'short_summary': 'ODYSSEY XJ is a versatile single-board computer compatible with Raspberry Pi, featuring Intel Celeron J processor, 8GB RAM, and multiple connectivity options.', 'full_summary': 'The ODYSSEY XJ is a powerful single-board computer designed for both commercial and personal use. It supports Windows and Linux operating systems, and offers extensive connectivity options including Wi-Fi, Bluetooth, and optional 4G LTE. It is equipped with an Intel Celeron J processor, 8GB of LPDDR4 RAM, and 64GB of eMMC storage.', 'full_product_description': 'ODYSSEY XJ is a high-performance single-board computer featuring an Intel Celeron J processor and Intel UHD Graphics. It includes 8GB of LPDDR4 memory and 64GB of eMMC storage, with additional storage options via M.2 PCIe, M.2 SATA, and SATA connectors. The board supports Windows and Linux operating systems, and offers a range of connectivity options including Wi-Fi, Bluetooth, and optional 4G LTE. It is compatible with Raspberry Pi and Arduino ecosystems, making it suitable for a wide range of applications.', 'target_applications': 'IoT, Edge Computing, Home Automation, Industrial Automation, Prototyping'}","{'generate_missing_features': [{'input_tokens': 3836, 'output_tokens': 104, 'time_taken': 6.871801137924194}, {'input_tokens': 3014, 'output_tokens': 30, 'time_taken': 2.4742929935455322}, {'input_tokens': 2696, 'output_tokens': 30, 'time_taken': 3.1230781078338623}], 'store_and_chunk_data': [{'input_tokens': 0, 'output_tokens': 0, 'time_taken': 1.3607492446899414}], 'extract_features': [{'input_tokens': 1705, 'output_tokens': 808, 'time_taken': 8.22458291053772}], 'search_missing_features': [{'input_tokens': 0, 'output_tokens': 0, 'time_taken': 25.051876068115234}, {'input_tokens': 0, 'output_tokens': 0, 'time_taken': 18.799216747283936}, {'input_tokens': 0, 'output_tokens': 0, 'time_taken': 18.81556510925293}]}","[4, 1, 1, 1]","[0, 0, 0, 0]"
iW-G57D-2302-4L004G-E0016G-LCA,{},"{'store_and_chunk_data': [{'input_tokens': 0, 'output_tokens': 0, 'time_taken': 1.5308599472045898}], 'extract_features': [{'input_tokens': 1829, 'output_tokens': 782, 'time_taken': 7.8724589347839355}]}",[3],[0]
MIO-5375C7-Q4A1,{},"{'generate_missing_features': [{'input_tokens': 3738, 'output_tokens': 73, 'time_taken': 3.4008634090423584}], 'store_and_chunk_data': [{'input_tokens': 0, 'output_tokens': 0, 'time_taken': 1.3074181079864502}], 'extract_features': [{'input_tokens': 1959, 'output_tokens': 775, 'time_taken': 8.640069007873535}]}","[2, 0]","[0, 0]"
