id,extracted_data,usage_data,missing_feature_count_history,low_confidence_feature_count_history
AIMB-225G2-00A1E,"{'name': 'AIMB-225', 'manufacturer': 'ADVANTECH', 'form_factor': 'MINI-ITX', 'evaluation_or_commercialization': False, 'processor_architecture': 'X86', 'processor_core_count': '4', 'processor_manufacturer': 'AMD', 'processor_tdp': '15W', 'memory': '8GB DDR3L SDRAM', 'onboard_storage': '4 GB eMMC NAND Flash', 'input_voltage': '12V DC', 'io_count': 'COM, USB, Ethernet, SATA', 'wireless': 'Embedded boards with wireless functions', 'operating_system_bsp': 'Linux, Android', 'operating_temperature_max': '60°C', 'operating_temperature_min': '0°C', 'certifications': 'CE/FCC Class B', 'short_summary': 'Industrial motherboard with AMD Steppe Eagle Quad core processor, Mini-ITX form factor, dual display support, and multiple I/O interfaces.', 'full_summary': 'The AIMB-225 is an industrial motherboard featuring an AMD Steppe Eagle Quad core processor, Mini-ITX form factor, dual display support through DVI, LVDS, and eDP interfaces, and a variety of I/O options including COM, USB, and Ethernet ports.', 'full_product_description': 'The AIMB-225 industrial motherboard supports AMD Steppe Eagle Quad core processors, offering robust performance for industrial applications. It features a Mini-ITX form factor, dual display capabilities with DVI, LVDS, and eDP interfaces, and extensive I/O options including COM, USB, and Ethernet ports. The board supports DDR3L SDRAM up to 8GB and offers expansion slots for MiniPCIe and mSATA. It is designed for reliable operation in environments with temperatures ranging from 0°C to 60°C.', 'target_applications': 'Industrial automation, digital signage, and embedded systems.'}","{'extract_features': [{'input_tokens': 1604, 'output_tokens': 738, 'time_taken': 8.450387001037598}], 'generate_missing_features': [{'input_tokens': 4224, 'output_tokens': 121, 'time_taken': 3.897341012954712}], 'store_and_chunk_data': [{'input_tokens': 0, 'output_tokens': 0, 'time_taken': 2.092879056930542}], 'search_missing_features': [{'input_tokens': 0, 'output_tokens': 0, 'time_taken': 59.73075985908508}]}","[4, 0]","[0, 0]"
PCISA-BT-E38451-R11,{},"{'extract_features': [{'input_tokens': 1628, 'output_tokens': 790, 'time_taken': 8.852243900299072}], 'generate_missing_features': [{'input_tokens': 4537, 'output_tokens': 55, 'time_taken': 4.016465187072754}, {'input_tokens': 4191, 'output_tokens': 64, 'time_taken': 2.566227912902832}, {'input_tokens': 3684, 'output_tokens': 36, 'time_taken': 3.464649200439453}], 'store_and_chunk_data': [{'input_tokens': 0, 'output_tokens': 0, 'time_taken': 2.0794620513916016}], 'search_missing_features': [{'input_tokens': 0, 'output_tokens': 0, 'time_taken': 28.68237018585205}, {'input_tokens': 0, 'output_tokens': 0, 'time_taken': 15.34688687324524}]}","[2, 2, 1, 0]","[0, 0, 0, 0]"
UNO-2362G-T2AE,"{'name': 'UNOGTAE', 'manufacturer': 'ADVANTECH', 'form_factor': 'SMALL SIZE', 'evaluation_or_commercialization': False, 'processor_architecture': 'X86', 'processor_core_count': '2', 'processor_manufacturer': 'AMD', 'processor_tdp': '28W (passive cooled)', 'memory': '4GB DDR3 SODIMM', 'onboard_storage': 'One mSATA drive, One SATA HDD bay', 'input_voltage': '9-36 VDC', 'io_count': '2x GbE, 4x USB, 2x RS-232/422/485, 2x DisplayPort, 1x HDMI', 'wireless': 'WiFi, Bluetooth', 'operating_system_bsp': 'Windows XP, Windows Embedded Standard, Advantech Linux', 'operating_temperature_max': '60°C', 'operating_temperature_min': '-20°C', 'certifications': ['CE', 'FCC', 'UL', 'CCC', 'BSMI'], 'short_summary': 'Compact, fanless automation computer with AMD dual-core processor and diverse I/O options.', 'full_summary': 'The UNOGTAE is a compact, fanless embedded automation computer featuring an AMD G-series dual-core processor, 4GB DDR3 memory, and a variety of I/O interfaces including Ethernet, USB, and HDMI. It supports multiple operating systems and is designed for industrial applications.', 'full_product_description': ""Advantech's UNOGTAE is a ruggedized, fanless embedded automation computer designed for industrial environments. It features an AMD G-series dual-core processor, 4GB DDR3 memory, and supports multiple operating systems including Windows XP and Advantech Linux. The device offers extensive I/O options, including Ethernet, USB, and HDMI, and supports iDoor technology for additional communication and I/O capabilities. It is certified for CE, FCC, UL, CCC, and BSMI standards."", 'target_applications': ['Data gateway', 'Concentrator', 'Data server applications']}","{'extract_features': [{'input_tokens': 1608, 'output_tokens': 783, 'time_taken': 9.807980060577393}], 'generate_missing_features': [{'input_tokens': 4594, 'output_tokens': 36, 'time_taken': 3.5441229343414307}], 'store_and_chunk_data': [{'input_tokens': 0, 'output_tokens': 0, 'time_taken': 2.072204828262329}], 'search_missing_features': [{'input_tokens': 0, 'output_tokens': 0, 'time_taken': 57.68458700180054}]}","[1, 0]","[0, 0]"
D:\mouser\mouser_devkit\ESP32-C3-AWS-ExpressLink-DevKit,"{'name': 'ESPCAWSExpressLinkDevKit', 'manufacturer': 'ESPRESSIF SYSTEMS', 'form_factor': 'Development Board', 'evaluation_or_commercialization': True, 'processor_architecture': 'Xtensa 32-bit', 'processor_core_count': 'Dual-core', 'processor_manufacturer': 'Espressif Systems', 'processor_tdp': 'Not Available', 'memory': '512 KB SRAM, 384 KB ROM', 'onboard_storage': 'Embedded flash', 'input_voltage': '5V', 'io_count': 'Not Available', 'wireless': ['Wi-Fi', 'Bluetooth LE'], 'operating_system_bsp': 'Not Available', 'operating_temperature_max': 'Not Available', 'operating_temperature_min': 'Not Available', 'certifications': 'Not Available', 'short_summary': 'Development board based on ESPCMINI module with Wi-Fi and Bluetooth LE capabilities.', 'full_summary': 'The ESPCAWSExpressLinkDevKit is a development board featuring the ESPCMINI module, compatible with Arduino Zero, and supports AWS IoT Core services.', 'full_product_description': 'The ESPCAWSExpressLinkDevKit is designed for easy integration with AWS IoT Core services. It features the ESPCMINI module with Wi-Fi and Bluetooth LE, a USB-to-UART port for power and communication, and is compatible with Arduino Zero peripherals.', 'target_applications': ['IoT Development', 'AWS IoT Core Integration']}","{'extract_features': [{'input_tokens': 2540, 'output_tokens': 627, 'time_taken': 7.769894123077393}], 'generate_missing_features': [{'input_tokens': 3614, 'output_tokens': 246, 'time_taken': 6.743728876113892}, {'input_tokens': 2545, 'output_tokens': 265, 'time_taken': 5.147878885269165}, {'input_tokens': 2891, 'output_tokens': 152, 'time_taken': 5.43816614151001}, {'input_tokens': 2891, 'output_tokens': 152, 'time_taken': 5.323819637298584}], 'store_and_chunk_data': [{'input_tokens': 0, 'output_tokens': 0, 'time_taken': 2.0901360511779785}], 'search_missing_features': [{'input_tokens': 0, 'output_tokens': 0, 'time_taken': 27.00624394416809}, {'input_tokens': 0, 'output_tokens': 0, 'time_taken': 152.0851309299469}, {'input_tokens': 0, 'output_tokens': 0, 'time_taken': 36.967472076416016}, {'input_tokens': 0, 'output_tokens': 0, 'time_taken': 16.053303003311157}]}","[10, 10, 6, 6, 6]","[0, 0, 0, 0, 0]"
WAFER-BW-N4-R21,"{'name': 'WAFER-BW', 'manufacturer': 'IEI', 'form_factor': 'Single Board Computer', 'evaluation_or_commercialization': False, 'processor_architecture': 'x86', 'processor_core_count': 'Quad-core', 'processor_manufacturer': 'Intel', 'processor_tdp': '6W', 'memory': '8GB DDR3L 1600MHz', 'onboard_storage': 'mSATA', 'input_voltage': '12V', 'io_count': '2x HDMI, 2x USB 3.0, 2x GbE LAN, 2x RS-232', 'wireless': 'Not Available', 'operating_system_bsp': 'Not Available', 'operating_temperature_max': '60°C', 'operating_temperature_min': '0°C', 'certifications': 'CE, FCC', 'short_summary': 'A compact single board computer with Intel Pentium/Celeron processors, dual HDMI, and multiple I/O interfaces.', 'full_summary': 'The WAFER-BW is a single board computer featuring Intel Pentium/Celeron processors, supporting dual HDMI, LVDS, dual PCIe GbE, USB 3.0, SATA, and mSATA interfaces, designed for versatile applications.', 'full_product_description': 'The WAFER-BW series offers a range of single board computers powered by Intel Pentium and Celeron processors. It supports triple independent displays via dual HDMI and LVDS, and provides extensive connectivity options including dual PCIe GbE, multiple USB 3.0 ports, SATA, and mSATA. The board is compliant with CE and FCC standards, making it suitable for various industrial applications.', 'target_applications': ['Digital Signage', 'Industrial Automation', 'Embedded Systems']}","{'extract_features': [{'input_tokens': 1656, 'output_tokens': 728, 'time_taken': 8.337592124938965}], 'generate_missing_features': [{'input_tokens': 3675, 'output_tokens': 55, 'time_taken': 4.85253119468689}, {'input_tokens': 3801, 'output_tokens': 55, 'time_taken': 5.54906702041626}], 'store_and_chunk_data': [{'input_tokens': 0, 'output_tokens': 0, 'time_taken': 2.075911283493042}], 'search_missing_features': [{'input_tokens': 0, 'output_tokens': 0, 'time_taken': 17.03765892982483}, {'input_tokens': 0, 'output_tokens': 0, 'time_taken': 18.847745895385742}]}","[2, 2, 2]","[0, 0, 0]"
