id,extracted_data,usage_data,missing_feature_count_history,low_confidence_feature_count_history
AGS-913I-R11A1E,"{'name': 'AGS GPU SERVER', 'manufacturer': 'ADVANTECH', 'form_factor': 'U RACKMOUNT', 'evaluation_or_commercialization': False, 'processor_architecture': 'x86', 'processor_core_count': '128 CPU cores', 'processor_manufacturer': 'INTEL', 'processor_tdp': '205W', 'memory': 'DDR4 2400MHz ECC REG, 512GB', 'onboard_storage': 'Intel C622 SATA3 (6Gb/s) controller', 'input_voltage': '100-240V AC', 'io_count': ['Front IO: 2 x USB 3.0', 'Rear IO: 2 x USB 3.0, 1 x VGA, 2 x RJ45'], 'wireless': 'Not Available', 'operating_system_bsp': 'Ubuntu 20.04', 'operating_temperature_max': '35°C', 'operating_temperature_min': '0°C', 'certifications': ['UL', '80 PLUS Platinum'], 'short_summary': 'Dual Intel Xeon E5 GPU server with multiple PCIe slots and redundant power supply.', 'full_summary': 'The AGS GPU Server by Advantech is designed for high-performance computing with dual Intel Xeon E5 processors, supporting multiple PCIe expansion slots for GPU cards, and features a redundant 1600W power supply.', 'full_product_description': ""Advantech's AGS GPU Server is equipped with dual Intel Xeon E5 processors, offering robust performance for demanding applications. It supports up to 512GB of DDR4 ECC REG memory and features multiple PCIe slots for expansion, including support for double-deck and single-deck GPU cards. The server is housed in a U rackmount form factor and includes a 1600W redundant power supply with 80 PLUS Platinum certification, ensuring reliability and efficiency."", 'target_applications': ['High-performance computing', 'Data centers', 'AI and machine learning', 'Scientific simulations']}","{'extract_features': [{'input_tokens': 1214, 'output_tokens': 768, 'time_taken': 8.59933590888977}], 'store_and_chunk_data': [{'input_tokens': 0, 'output_tokens': 0, 'time_taken': 2.297821044921875}], 'search_missing_features': [{'input_tokens': 0, 'output_tokens': 0, 'time_taken': 17.02901601791382}, {'input_tokens': 0, 'output_tokens': 0, 'time_taken': 28.604736804962158}, {'input_tokens': 0, 'output_tokens': 0, 'time_taken': 16.91361713409424}, {'input_tokens': 0, 'output_tokens': 0, 'time_taken': 19.497488975524902}], 'generate_missing_features': [{'input_tokens': 4339, 'output_tokens': 143, 'time_taken': 4.46000599861145}, {'input_tokens': 3560, 'output_tokens': 60, 'time_taken': 2.9632718563079834}, {'input_tokens': 3684, 'output_tokens': 29, 'time_taken': 1.8075199127197266}, {'input_tokens': 3684, 'output_tokens': 29, 'time_taken': 3.5269880294799805}]}","[5, 2, 1, 1, 1]","[0, 0, 0, 0, 0]"
EmNANO-a56M0-210HA,"{'name': 'EMNANOAM', 'manufacturer': 'ARBOR TECHNOLOGY', 'form_factor': 'COM EXPRESS MINI', 'evaluation_or_commercialization': True, 'processor_architecture': 'x86', 'processor_core_count': 'Dual Core', 'processor_manufacturer': 'AMD', 'processor_tdp': '6W/9W', 'memory': '4 GB DDR3L SDRAM', 'onboard_storage': 'eMMC 5.1 (OEM Request)', 'input_voltage': '12V', 'io_count': ['4 USB ports', '2 PCIe x1 Gen2 lanes', '1 SPI', '1 LPC', '2 Serial ATA ports', '1 Gigabit Ethernet'], 'wireless': '802.11 a/b/g/n/ac + BT 4.2', 'operating_system_bsp': 'Windows 10 64-bit, Linux: Ubuntu', 'operating_temperature_max': '85°C', 'operating_temperature_min': '-40°C', 'certifications': 'EN50155:2021', 'short_summary': 'COM Express Mini Type CPU Module with AMD G-Series SoC Dual Core HA and 4 GB DDR3L SDRAM.', 'full_summary': 'The EmNANOaM is a COM Express Mini Type CPU Module featuring an AMD G-Series SoC Dual Core HA processor, integrated Gigabit Ethernet, and 4 GB DDR3L SDRAM. It supports dual independent displays and operates in extended temperature ranges.', 'full_product_description': 'The EmNANOaM module is designed for evaluation purposes, featuring a soldered onboard AMD G-Series SoC Dual Core HA processor. It includes integrated Gigabit Ethernet, single channel 18-bit LVDS, and a DDI port supporting dual independent displays. The module operates in extended temperature ranges from -40°C to 85°C and includes 4 GB DDR3L SDRAM. It offers various I/O interfaces including USB, PCIe, SPI, LPC, and SATA.', 'target_applications': 'Industrial automation, embedded systems, and evaluation platforms.'}","{'extract_features': [{'input_tokens': 1221, 'output_tokens': 754, 'time_taken': 8.742878913879395}], 'store_and_chunk_data': [{'input_tokens': 0, 'output_tokens': 0, 'time_taken': 1.8817660808563232}], 'search_missing_features': [{'input_tokens': 0, 'output_tokens': 0, 'time_taken': 14.225582122802734}, {'input_tokens': 0, 'output_tokens': 0, 'time_taken': 13.838878870010376}], 'generate_missing_features': [{'input_tokens': 3813, 'output_tokens': 176, 'time_taken': 5.034779787063599}, {'input_tokens': 4160, 'output_tokens': 72, 'time_taken': 3.9789838790893555}]}","[6, 2, 0]","[0, 0, 0]"
IB916F-3965  (MOQ),{},"{'extract_features': [{'input_tokens': 1317, 'output_tokens': 760, 'time_taken': 8.885478019714355}], 'store_and_chunk_data': [{'input_tokens': 0, 'output_tokens': 0, 'time_taken': 2.290720224380493}]}",[5],[0]
EmNANO-i2300-E3825,"{'name': 'EMNANOIE', 'manufacturer': 'ARBOR TECHNOLOGY', 'form_factor': 'COM EXPRESS MINI', 'evaluation_or_commercialization': True, 'processor_architecture': 'X86', 'processor_core_count': 'Dual cores for x6211E, Quad cores for x6413E', 'processor_manufacturer': 'INTEL', 'processor_tdp': '6W for x6211E, 9W for x6413E', 'memory': '4GB DDR3L SDRAM', 'onboard_storage': 'Soldered onboard eMMC 5.1 (OEM Request)', 'input_voltage': '5V/12V Auto detect', 'io_count': ['4 x USB ports', '1 x Serial Port', '1 x PCIe x1 Gen2 lanes', '1 x SPI', '1 x LPC', '2 x Serial ATA ports', '1 x Intel i210 PCIe GbE controller'], 'wireless': '4G LTE Modules', 'operating_system_bsp': 'Windows 10 64-bit, Linux: Ubuntu', 'operating_temperature_max': '85 oC', 'operating_temperature_min': '-40 oC', 'certifications': 'CE/FCC Class A', 'short_summary': 'COM Express Mini Type CPU Module with Intel Atom E series processor.', 'full_summary': 'The EmNANOiE is a COM Express Mini Type CPU Module featuring an Intel Atom E series processor, integrated Gigabit Ethernet, and support for dual independent displays.', 'full_product_description': 'The EmNANOiE module is equipped with a soldered onboard Intel Atom E series SoC processor, supporting various interfaces including USB, serial ports, PCIe lanes, and more. It is designed for evaluation purposes with extended operating temperature capabilities.', 'target_applications': 'Smart and integrated avionics applications on helicopters and urban air mobility vehicles'}","{'extract_features': [{'input_tokens': 1163, 'output_tokens': 675, 'time_taken': 7.88841700553894}], 'store_and_chunk_data': [{'input_tokens': 0, 'output_tokens': 0, 'time_taken': 2.2912800312042236}], 'search_missing_features': [{'input_tokens': 0, 'output_tokens': 0, 'time_taken': 11.274771928787231}, {'input_tokens': 0, 'output_tokens': 0, 'time_taken': 13.282571077346802}, {'input_tokens': 0, 'output_tokens': 0, 'time_taken': 11.8175630569458}, {'input_tokens': 0, 'output_tokens': 0, 'time_taken': 13.726413011550903}], 'generate_missing_features': [{'input_tokens': 3290, 'output_tokens': 247, 'time_taken': 5.429141044616699}, {'input_tokens': 3660, 'output_tokens': 314, 'time_taken': 6.756281137466431}, {'input_tokens': 3778, 'output_tokens': 94, 'time_taken': 3.561605215072632}, {'input_tokens': 3540, 'output_tokens': 33, 'time_taken': 2.808954954147339}]}","[10, 10, 3, 1, 0]","[0, 0, 0, 0, 0]"
SRMX6DLW00D01GE008X00CE,"{'name': 'CUBOXI', 'manufacturer': 'SOLIDRUN LTD', 'form_factor': 'FANLESS CUBE', 'evaluation_or_commercialization': False, 'processor_architecture': 'ARM CORTEX A', 'processor_core_count': 'SINGLE OR QUAD CORE', 'processor_manufacturer': 'NXP', 'processor_tdp': 'Not Available', 'memory': 'UP TO 4GB DDR3', 'onboard_storage': 'UP TO 128GB EMMC', 'input_voltage': '5V', 'io_count': 'RJ45, USB HOST, HDMI, SPDIF, IR RECEIVER, IR TRANSMITTER', 'wireless': ['WIFI', 'BLUETOOTH'], 'operating_system_bsp': ['LINUX', 'ANDROID'], 'operating_temperature_max': '95°C', 'operating_temperature_min': '0°C', 'certifications': 'Not Available', 'short_summary': ""CuBoxi is a fanless mini PC based on NXP's iMX processor, offering up to quad-core ARM Cortex A, with various connectivity options."", 'full_summary': ""CuBoxi is a compact, fanless mini PC designed for embedded edge computing, featuring NXP's iMX ARM Cortex A processors, up to 4GB DDR3 memory, and multiple connectivity options including Wi-Fi and Bluetooth."", 'full_product_description': ""The CuBoxi is a versatile mini PC housed in a fanless cube enclosure, powered by NXP's iMX ARM Cortex A processors. It supports up to 4GB of DDR3 memory and up to 128GB of eMMC storage. Connectivity options include RJ45, USB host, HDMI, SPDIF, and IR interfaces. It is compatible with Linux and Android operating systems, making it suitable for a range of applications."", 'target_applications': 'Embedded edge computing, home automation, media streaming, industrial control systems.'}","{'extract_features': [{'input_tokens': 1332, 'output_tokens': 754, 'time_taken': 8.413434267044067}], 'store_and_chunk_data': [{'input_tokens': 0, 'output_tokens': 0, 'time_taken': 2.29461407661438}], 'search_missing_features': [{'input_tokens': 0, 'output_tokens': 0, 'time_taken': 16.103250980377197}, {'input_tokens': 0, 'output_tokens': 0, 'time_taken': 16.877863883972168}], 'generate_missing_features': [{'input_tokens': 3182, 'output_tokens': 53, 'time_taken': 2.4910552501678467}, {'input_tokens': 4279, 'output_tokens': 53, 'time_taken': 3.412645101547241}]}","[2, 2, 2]","[0, 0, 0]"
