id,extracted_data,usage_data,missing_feature_count_history,low_confidence_feature_count_history
conga-TC175slash3965U,"{'name': 'CONGATC', 'manufacturer': 'CONGATEC', 'form_factor': 'COM EXPRESS COMPACT', 'evaluation_or_commercialization': False, 'processor_architecture': 'X86', 'processor_core_count': '2', 'processor_manufacturer': 'INTEL', 'processor_tdp': '15W', 'memory': 'Up to 32 GByte dual channel DDR4', 'onboard_storage': 'Optional eMMC 5.1 on board mass storage', 'input_voltage': 'Not Available', 'io_count': ['x PCI Express Gen 3 lanes', 'x Serial ATA Gen 3', 'x USB 3.0', 'x USB 2.0', 'LPC bus', 'I2C bus', 'x UART'], 'wireless': 'Not Available', 'operating_system_bsp': ['Microsoft Windows', 'Microsoft Windows IoT Enterprise', 'Linux'], 'operating_temperature_max': '60°C', 'operating_temperature_min': '0°C', 'certifications': 'CE', 'short_summary': 'Compact COM Express module with Intel Core processors and dual channel DDR4 memory.', 'full_summary': 'The congaTC is a COM Express Compact module featuring Intel Core i7/i5/i3 and Celeron processors, supporting dual channel DDR4 memory, and offering a range of I/O interfaces including PCIe, SATA, USB, and more.', 'full_product_description': ""The congaTC module is designed for high-performance applications, featuring Intel's 7th generation Core processors with integrated Intel HD Graphics. It supports dual channel DDR4 memory and offers extensive connectivity options including PCIe, SATA, USB, and more. The module is suitable for a variety of industrial and embedded applications, providing robust performance and flexibility."", 'target_applications': ['Industrial automation', 'Embedded systems', 'Digital signage', 'Medical devices']}","{'extract_features': [{'input_tokens': 2119, 'output_tokens': 760, 'time_taken': 8.19457197189331}], 'generate_missing_features': [{'input_tokens': 3724, 'output_tokens': 87, 'time_taken': 2.6153740882873535}, {'input_tokens': 3151, 'output_tokens': 52, 'time_taken': 1.3950750827789307}, {'input_tokens': 3821, 'output_tokens': 52, 'time_taken': 2.2726449966430664}], 'search_missing_features': [{'input_tokens': 0, 'output_tokens': 0, 'time_taken': 13.193719863891602}, {'input_tokens': 0, 'output_tokens': 0, 'time_taken': 12.982780933380127}, {'input_tokens': 0, 'output_tokens': 0, 'time_taken': 8.834581136703491}], 'store_and_chunk_data': [{'input_tokens': 0, 'output_tokens': 0, 'time_taken': 0.6858510971069336}]}","[3, 2, 2, 2]","[0, 0, 0, 0]"
MEFV22G,{},"{'extract_features': [{'input_tokens': 2933, 'output_tokens': 649, 'time_taken': 7.296288013458252}], 'store_and_chunk_data': [{'input_tokens': 0, 'output_tokens': 0, 'time_taken': 0.5480399131774902}]}",[7],[0]
6069-410-000,"{'name': 'MCC VOLTAGE MEASUREMENT DAQ HAT', 'manufacturer': 'MEASUREMENT COMPUTING', 'form_factor': 'HAT', 'evaluation_or_commercialization': False, 'processor_architecture': 'ARM', 'processor_core_count': 'Quad-core', 'processor_manufacturer': 'Not Available', 'processor_tdp': 'Not Available', 'memory': 'Not Available', 'onboard_storage': 'Not Available', 'input_voltage': '5V', 'io_count': 'GPIO, SPI, External Digital Trigger', 'wireless': 'Not Available', 'operating_system_bsp': ['Linux', 'Raspbian'], 'operating_temperature_max': '85°C', 'operating_temperature_min': '0°C', 'certifications': 'ISO 9001:2015, ISO 14001:2015', 'short_summary': 'Eight 16-bit voltage inputs, 100 kS/s max sample rate, stackable HAT for Raspberry Pi.', 'full_summary': 'The MCC Voltage Measurement DAQ HAT provides eight 16-bit single-ended analog inputs with a maximum sample rate of 100 kS/s. It is designed for use with Raspberry Pi and supports stacking up to eight HATs for expanded functionality.', 'full_product_description': 'The MCC Voltage Measurement DAQ HAT is a hardware attached on top (HAT) board designed for the Raspberry Pi. It features eight 16-bit single-ended analog inputs with a fixed input range of ±10V. The HAT supports a maximum sample rate of 100 kS/s for a single board and up to 320 kS/s aggregate when multiple boards are stacked. It includes onboard sample buffers for high-speed acquisition, an external scan clock I/O, and an external digital trigger input. The HAT is powered via the Raspberry Pi GPIO header connector and is compatible with the MCC DAQ HAT Library, which supports C/C++ and Python programming on Linux.', 'target_applications': ['Data Acquisition', 'Voltage Measurement', 'Embedded Systems']}","{'extract_features': [{'input_tokens': 2329, 'output_tokens': 755, 'time_taken': 7.939084053039551}], 'generate_missing_features': [{'input_tokens': 4100, 'output_tokens': 197, 'time_taken': 3.8468668460845947}, {'input_tokens': 4313, 'output_tokens': 161, 'time_taken': 3.4739248752593994}, {'input_tokens': 4304, 'output_tokens': 123, 'time_taken': 3.1576147079467773}, {'input_tokens': 4304, 'output_tokens': 123, 'time_taken': 3.7639098167419434}], 'search_missing_features': [{'input_tokens': 0, 'output_tokens': 0, 'time_taken': 13.873353004455566}, {'input_tokens': 0, 'output_tokens': 0, 'time_taken': 11.773565292358398}, {'input_tokens': 0, 'output_tokens': 0, 'time_taken': 17.36093783378601}, {'input_tokens': 0, 'output_tokens': 0, 'time_taken': 15.103530168533325}], 'store_and_chunk_data': [{'input_tokens': 0, 'output_tokens': 0, 'time_taken': 0.8314681053161621}]}","[8, 6, 5, 5, 5]","[0, 0, 0, 0, 0]"
conga-QA5slashi-E3950-8G eMMC32 eDP,"{'name': 'CONGASA', 'manufacturer': 'CONGATEC', 'form_factor': 'SMARC', 'evaluation_or_commercialization': True, 'processor_architecture': 'X86', 'processor_core_count': 'Quad Core', 'processor_manufacturer': 'INTEL', 'processor_tdp': '6W', 'memory': '8GB LPDDR4', 'onboard_storage': '64GB eMMC', 'input_voltage': '10% to 90% of nominal', 'io_count': ['4x USB', '2x SATA', '1x PCIe Gen3', '1x SDIO', '1x SPI', '2x UART'], 'wireless': 'WiFi, Bluetooth', 'operating_system_bsp': ['Microsoft Windows', 'Microsoft Windows IoT Enterprise', 'Microsoft Windows IoT Core', 'Linux Yocto'], 'operating_temperature_max': '85°C', 'operating_temperature_min': '-40°C', 'certifications': 'HumiSeal® 1A33 coating; MIL-I-46058C qualified, IPC-CC-830 and RoHS Directive 2002/95/EC compliant, UL File Number E105698', 'short_summary': 'Low power Intel Atom E Series processors with high performance Intel HD Graphics and industrial temperature range.', 'full_summary': 'The congaSA is a SMARC module featuring low power Intel Atom E Series processors, high performance Intel HD Graphics, and supports a wide range of industrial temperature conditions.', 'full_product_description': 'The congaSA module is designed for industrial applications, offering Intel Atom E Series processors with up to quad-core performance, integrated Intel HD Graphics, and support for multiple I/O interfaces including USB, SATA, PCIe, and more. It supports a wide range of operating systems and is suitable for harsh environments with its industrial temperature range.', 'target_applications': ['Industrial Automation', 'IoT Devices', 'Embedded Systems', 'Digital Signage']}","{'extract_features': [{'input_tokens': 2232, 'output_tokens': 741, 'time_taken': 8.543138980865479}], 'generate_missing_features': [{'input_tokens': 4092, 'output_tokens': 52, 'time_taken': 2.1744821071624756}, {'input_tokens': 3791, 'output_tokens': 60, 'time_taken': 2.240373134613037}, {'input_tokens': 3755, 'output_tokens': 71, 'time_taken': 4.597263813018799}], 'search_missing_features': [{'input_tokens': 0, 'output_tokens': 0, 'time_taken': 13.456737995147705}, {'input_tokens': 0, 'output_tokens': 0, 'time_taken': 11.862560033798218}, {'input_tokens': 0, 'output_tokens': 0, 'time_taken': 17.001299142837524}], 'store_and_chunk_data': [{'input_tokens': 0, 'output_tokens': 0, 'time_taken': 0.6221511363983154}]}","[2, 2, 1, 0]","[0, 0, 0, 0]"
IMB-H810-i2-R11,"{'name': 'IMB-H110', 'manufacturer': 'IEI', 'form_factor': 'MicroATX', 'evaluation_or_commercialization': False, 'processor_architecture': 'x86', 'processor_core_count': 'quad-core', 'processor_manufacturer': 'Intel', 'processor_tdp': '35W', 'memory': 'Two 288-pin 2133 MHz dual channel DDR4/DDR4L SDRAM unbuffered DIMMs, support up to 32GB', 'onboard_storage': '1 x mSATA (SATA & USB signal)', 'input_voltage': 'ATX power supply', 'io_count': ['2 x USB 3.0', '4 x USB 2.0', '2 x RS-232', '1 x VGA', '1 x HDMI', '1 x DVI-D', '2 x LAN'], 'wireless': 'Not Available', 'operating_system_bsp': 'Not Available', 'operating_temperature_max': '60°C', 'operating_temperature_min': '0°C', 'certifications': ['CE', 'FCC'], 'short_summary': 'MicroATX motherboard supporting Intel Core i3/i5/i7, dual-channel DDR4, and multiple I/O interfaces.', 'full_summary': 'The IMB-H110 is a MicroATX motherboard designed for industrial applications, supporting Intel Core i3/i5/i7 processors, dual-channel DDR4 memory, and a variety of I/O interfaces including USB, RS-232, VGA, HDMI, and DVI-D.', 'full_product_description': 'The IMB-H110 motherboard from IEI is built for industrial use, featuring support for Intel Core i3/i5/i7 processors with an LGA1151 socket. It includes dual-channel DDR4 memory slots supporting up to 32GB, and offers extensive connectivity options with USB 3.0, USB 2.0, RS-232, VGA, HDMI, DVI-D, and dual LAN ports. The board is CE and FCC compliant, ensuring reliable performance in various environments.', 'target_applications': ['Industrial automation', 'Embedded systems', 'Digital signage', 'Kiosk systems']}","{'extract_features': [{'input_tokens': 2232, 'output_tokens': 817, 'time_taken': 8.695342063903809}], 'generate_missing_features': [{'input_tokens': 4267, 'output_tokens': 131, 'time_taken': 3.270848035812378}, {'input_tokens': 4287, 'output_tokens': 90, 'time_taken': 2.6532399654388428}, {'input_tokens': 4237, 'output_tokens': 55, 'time_taken': 2.2910900115966797}, {'input_tokens': 4237, 'output_tokens': 55, 'time_taken': 2.3150017261505127}], 'search_missing_features': [{'input_tokens': 0, 'output_tokens': 0, 'time_taken': 13.06932020187378}, {'input_tokens': 0, 'output_tokens': 0, 'time_taken': 8.892745018005371}, {'input_tokens': 0, 'output_tokens': 0, 'time_taken': 10.130289793014526}, {'input_tokens': 0, 'output_tokens': 0, 'time_taken': 9.648877143859863}], 'store_and_chunk_data': [{'input_tokens': 0, 'output_tokens': 0, 'time_taken': 0.6410617828369141}]}","[5, 3, 2, 2, 2]","[0, 0, 0, 0, 0]"
