id,extracted_data,usage_data,missing_feature_count_history,low_confidence_feature_count_history
CAPA55RPHGG-i3-1115G4E WslashFAN,"{'name': 'CAPA13R', 'manufacturer': 'AXIOMTEK', 'form_factor': 'Embedded SBC', 'evaluation_or_commercialization': False, 'processor_architecture': 'x86', 'processor_core_count': 'Not Available', 'processor_manufacturer': 'INTEL', 'processor_tdp': '15W', 'memory': '8GB DDR4 SODIMM', 'onboard_storage': 'M.2 Key B slot for storage cards', 'input_voltage': '12V', 'io_count': ['2x GbE LAN', '4x USB 3.2 Gen 1', '2x USB 2.0', '2x COM', '1x HDMI', '1x LVDS', '1x DisplayPort'], 'wireless': 'M.2 Key E slot for wireless modules', 'operating_system_bsp': 'Not Available', 'operating_temperature_max': '60°C', 'operating_temperature_min': '-20°C', 'certifications': 'Not Available', 'short_summary': 'Embedded SBC with 8th Gen Intel Core/Celeron Processor, supporting multiple display interfaces and dual GbE LAN.', 'full_summary': 'The CAPA13R is an embedded SBC featuring 8th Gen Intel Core i3/i5/i7 or Celeron processors, offering robust performance with dual-channel DDR4 SODIMM memory support, multiple display outputs including HDMI, LVDS, and DisplayPort, and dual GbE LAN for enhanced connectivity.', 'full_product_description': 'The CAPA13R by Axiomtek is a compact embedded single board computer designed for industrial applications. It supports 8th Gen Intel Core and Celeron processors, providing high performance and energy efficiency. The board includes dual-channel DDR4 SODIMM slots for up to 32GB of memory, multiple I/O interfaces including USB 3.2 Gen 1, USB 2.0, COM ports, and dual GbE LAN ports. It also features multiple display interfaces such as HDMI, LVDS, and DisplayPort, making it suitable for a variety of display applications. The board operates within a temperature range of -20°C to 60°C, making it ideal for harsh environments.', 'target_applications': ['Industrial Automation', 'Digital Signage', 'Kiosk', 'Medical Equipment']}","{'extract_features': [{'input_tokens': 1492, 'output_tokens': 832, 'time_taken': 9.729148864746094}], 'search_missing_features': [{'input_tokens': 0, 'output_tokens': 0, 'time_taken': 20.58263921737671}, {'input_tokens': 0, 'output_tokens': 0, 'time_taken': 17.233728885650635}, {'input_tokens': 0, 'output_tokens': 0, 'time_taken': 18.07902503013611}], 'generate_missing_features': [{'input_tokens': 3865, 'output_tokens': 144, 'time_taken': 4.696088075637817}, {'input_tokens': 3868, 'output_tokens': 79, 'time_taken': 3.7441678047180176}, {'input_tokens': 3471, 'output_tokens': 79, 'time_taken': 3.7901220321655273}], 'store_and_chunk_data': [{'input_tokens': 0, 'output_tokens': 0, 'time_taken': 0.8883881568908691}]}","[5, 3, 3, 3]","[0, 0, 0, 0]"
SC0372,"{'name': 'RASPBERRY PI', 'manufacturer': 'RASPBERRY PI TRADING LTD', 'form_factor': 'COMPACT KEYBOARD', 'evaluation_or_commercialization': False, 'processor_architecture': 'ARM', 'processor_core_count': '4', 'processor_manufacturer': 'BROADCOM', 'processor_tdp': 'Not Available', 'memory': '4 GB LPDDR4', 'onboard_storage': 'MicroSD card slot', 'input_voltage': '5V DC', 'io_count': ['2 USB 3.0 ports', '2 USB 2.0 ports', 'Gigabit Ethernet', '40-pin GPIO header', '2 micro HDMI ports'], 'wireless': 'Dual-band 2.4GHz and 5GHz IEEE 802.11b/g/n/ac wireless LAN, Bluetooth 5.0, BLE', 'operating_system_bsp': 'Raspberry Pi OS', 'operating_temperature_max': '50°C', 'operating_temperature_min': '0°C', 'certifications': 'Not Available', 'short_summary': 'Raspberry Pi is a complete personal computer built into a compact keyboard, featuring a quad-core processor, wireless networking, and dual-display output.', 'full_summary': 'The Raspberry Pi is a versatile personal computer integrated into a compact keyboard, ideal for web surfing, document editing, video playback, and programming with Raspberry Pi OS. It supports dual-display output and 4K video playback.', 'full_product_description': 'Raspberry Pi features a Broadcom BCM quad-core Cortex-A ARM v8 64-bit SoC at 1.8GHz, 4GB LPDDR4 RAM, dual-band wireless LAN, Bluetooth 5.0, BLE, Gigabit Ethernet, and multiple USB ports. It supports micro HDMI for 4Kp60 video output and includes a 40-pin GPIO header for expansion.', 'target_applications': ['Web browsing', 'Document editing', 'Video playback', 'Programming education']}","{'extract_features': [{'input_tokens': 1368, 'output_tokens': 780, 'time_taken': 9.246098279953003}], 'search_missing_features': [{'input_tokens': 0, 'output_tokens': 0, 'time_taken': 22.065237998962402}, {'input_tokens': 0, 'output_tokens': 0, 'time_taken': 17.871651887893677}], 'generate_missing_features': [{'input_tokens': 4075, 'output_tokens': 53, 'time_taken': 2.914538860321045}, {'input_tokens': 4126, 'output_tokens': 53, 'time_taken': 3.1007895469665527}], 'store_and_chunk_data': [{'input_tokens': 0, 'output_tokens': 0, 'time_taken': 1.6762278079986572}]}","[2, 2, 2]","[0, 0, 0]"
CC-SBP-WMX-JN58,"{'name': 'DIGI CONNECTCORE UL SBC PRO', 'manufacturer': 'DIGI INTERNATIONAL INC', 'form_factor': 'SINGLE BOARD COMPUTER', 'evaluation_or_commercialization': False, 'processor_architecture': 'Cortex-A7', 'processor_core_count': 'Single-core', 'processor_manufacturer': 'NXP', 'processor_tdp': 'Not Available', 'memory': '256 MB DDR3', 'onboard_storage': '256 MB NAND', 'input_voltage': '5 VDC', 'io_count': 'Not Available', 'wireless': '802.11a/b/g/n/ac Wi-Fi, Bluetooth 4.2', 'operating_system_bsp': 'DIGI ACCELERATED LINUX', 'operating_temperature_max': '+85° C', 'operating_temperature_min': '-40° C', 'certifications': 'FCC Part 15 Class B, EN 55022 Class B, EN 61000-3-2, EN 61000-3-3, ICES-003 Class B, VCCI Class II, AS 3548', 'short_summary': 'DIGI CONNECTCORE UL SBC PRO is a single board computer by Digi International Inc.', 'full_summary': 'The DIGI CONNECTCORE UL SBC PRO is designed for robust applications, featuring Digi Accelerated Linux for enhanced device functionality.', 'full_product_description': 'DIGI CONNECTCORE UL SBC PRO is a single board computer offering advanced connectivity and integration options, suitable for various industrial applications.', 'target_applications': 'Industrial Automation, Smart Cities, Transportation'}","{'extract_features': [{'input_tokens': 1380, 'output_tokens': 596, 'time_taken': 7.138612985610962}], 'search_missing_features': [{'input_tokens': 0, 'output_tokens': 0, 'time_taken': 17.299970865249634}, {'input_tokens': 0, 'output_tokens': 0, 'time_taken': 21.938969135284424}, {'input_tokens': 0, 'output_tokens': 0, 'time_taken': 18.118605613708496}], 'generate_missing_features': [{'input_tokens': 4443, 'output_tokens': 378, 'time_taken': 6.99766993522644}, {'input_tokens': 3660, 'output_tokens': 53, 'time_taken': 2.4480679035186768}, {'input_tokens': 3200, 'output_tokens': 53, 'time_taken': 2.827855110168457}], 'store_and_chunk_data': [{'input_tokens': 0, 'output_tokens': 0, 'time_taken': 1.2275490760803223}]}","[12, 2, 2, 2]","[0, 0, 0, 0]"
WAFER-AL-N1-R10,"{'name': 'WAFER-AL', 'manufacturer': 'IEI', 'form_factor': 'Single Board Computer', 'evaluation_or_commercialization': False, 'processor_architecture': 'x86', 'processor_core_count': 'Quad-core', 'processor_manufacturer': 'Intel', 'processor_tdp': '6W', 'memory': '8GB DDR3L', 'onboard_storage': 'eMMC 5.0 high-speed drive 32GB soldered on board', 'input_voltage': '12V DC', 'io_count': ['4 USB 3.0', '2 RS-232', '2 RS-422/485', '2 SATA 6Gb/s', '2 PCIe Mini Card slots'], 'wireless': 'Wi-Fi 6E and Bluetooth via M.2 2230 A Key slot', 'operating_system_bsp': 'Windows 10 and Linux', 'operating_temperature_max': '60°C', 'operating_temperature_min': '0°C', 'certifications': ['CE', 'FCC'], 'short_summary': 'WAFER-AL is a single board computer with Intel Apollo Lake platform, supporting quad-core Pentium and dual-core Celeron processors, triple display, and multiple I/O interfaces.', 'full_summary': ""The WAFER-AL SBC features Intel's Apollo Lake platform with options for quad-core Pentium or dual-core Celeron processors. It supports triple independent displays and offers a variety of high-speed I/O interfaces including USB 3.0, SATA, and PCIe Mini slots."", 'full_product_description': ""The WAFER-AL single board computer is designed for industrial applications, featuring Intel's Apollo Lake platform with onboard SoC options for Pentium N4200 or Celeron N3350 processors. It supports up to 8GB of DDR3L memory, triple display outputs, and a wide range of I/O interfaces including USB 3.0, SATA 6Gb/s, and dual PCIe Mini Card slots. The board is CE and FCC compliant, making it suitable for various industrial and commercial applications."", 'target_applications': ['Industrial automation', 'Digital signage', 'Kiosk systems', 'Embedded systems']}","{'extract_features': [{'input_tokens': 1521, 'output_tokens': 801, 'time_taken': 9.349594831466675}], 'search_missing_features': [{'input_tokens': 0, 'output_tokens': 0, 'time_taken': 20.36017894744873}], 'generate_missing_features': [{'input_tokens': 2855, 'output_tokens': 117, 'time_taken': 3.9751968383789062}], 'store_and_chunk_data': [{'input_tokens': 0, 'output_tokens': 0, 'time_taken': 1.3607420921325684}]}","[3, 0]","[0, 0]"
DS-280GB-S8A1E,"{'name': 'DIGITAL SIGNAGE PLAYER DS', 'manufacturer': 'ADVANTECH', 'form_factor': 'OPS', 'evaluation_or_commercialization': False, 'processor_architecture': 'x86', 'processor_core_count': 'Not Available', 'processor_manufacturer': 'INTEL', 'processor_tdp': 'Not Available', 'memory': 'Up to 32GB DDR4 SODIMM', 'onboard_storage': 'Supports SATA III and mSATA', 'input_voltage': '12V', 'io_count': ['2 x HDMI', '2 x DP', '2 x USB 3.0', '2 x USB 2.0', '2 x LAN', 'Audio Line-out'], 'wireless': 'Optional Wi-Fi and 3G/LTE module', 'operating_system_bsp': ['Windows 10', 'Windows 8.1', 'Windows 7', 'Linux'], 'operating_temperature_max': '60°C', 'operating_temperature_min': '0°C', 'certifications': ['CE', 'FCC Class B', 'CCC', 'BSMI', 'UL', 'CB'], 'short_summary': 'Digital Signage Player with Intel Core i series, supporting 4K resolution and multiple display outputs.', 'full_summary': 'The Digital Signage Player DS features Intel Core i processors, dual-channel DDR4 memory, and supports up to 4K resolution with multiple HDMI and DP outputs. It is designed for easy installation and maintenance with an Intel OPS slot-in design.', 'full_product_description': 'The Digital Signage Player DS is equipped with Intel Core i processors and supports dual-channel DDR4 SODIMM memory up to 32GB. It offers multiple display outputs including HDMI and DP, and supports 4K resolution at 60Hz. The player is designed for easy installation and maintenance with an Intel OPS slot-in design. It includes various I/O interfaces such as USB, LAN, and audio outputs, and supports optional Wi-Fi and 3G/LTE modules. The player is compatible with Windows and Linux operating systems and meets various certifications including CE, FCC, and UL.', 'target_applications': ['Digital Signage', 'Retail Displays', 'Information Kiosks']}","{'extract_features': [{'input_tokens': 1414, 'output_tokens': 847, 'time_taken': 8.982939958572388}], 'search_missing_features': [{'input_tokens': 0, 'output_tokens': 0, 'time_taken': 21.39731478691101}, {'input_tokens': 0, 'output_tokens': 0, 'time_taken': 20.9537672996521}], 'generate_missing_features': [{'input_tokens': 4388, 'output_tokens': 54, 'time_taken': 2.654431104660034}, {'input_tokens': 4269, 'output_tokens': 54, 'time_taken': 3.6467390060424805}], 'store_and_chunk_data': [{'input_tokens': 0, 'output_tokens': 0, 'time_taken': 1.4033699035644531}]}","[2, 2, 2]","[0, 0, 0]"
