id,extracted_data,usage_data,missing_feature_count_history,low_confidence_feature_count_history
TPC-B510-853BE,"{'name': 'TPCB MODULAR TPC COMPUTING BOX', 'manufacturer': 'ADVANTECH', 'form_factor': 'MODULAR', 'evaluation_or_commercialization': False, 'processor_architecture': 'x86', 'processor_core_count': '4', 'processor_manufacturer': 'INTEL', 'processor_tdp': 'Not Available', 'memory': '8 GB DDR4 SODIMM', 'onboard_storage': 'NVMe SSD', 'input_voltage': '24 VDC', 'io_count': '4 USB, 2 GbE LAN, 1 DisplayPort, 1 Audio line/mic', 'wireless': ['Wi-Fi', 'Bluetooth'], 'operating_system_bsp': ['Windows', 'Android', 'Linux'], 'operating_temperature_max': '60°C', 'operating_temperature_min': '-20°C', 'certifications': ['CE', 'FCC Class A', 'CB', 'UL'], 'short_summary': 'Compact, fanless embedded system with Intel Core processors and modular design.', 'full_summary': ""The TPCB Modular TPC Computing Box is a high-performance, fanless embedded system designed for industrial applications. It features Intel's 8th Gen Core processors, dual-channel DDR4 memory, and supports various expansion options through Mini PCIe and M.2 slots."", 'full_product_description': ""Advantech's TPCB Modular TPC Computing Box is part of the Modular Series TPC family, powered by 8th Generation Intel Core processors. It offers a compact, fanless design with robust performance for daily operation control panels. The system supports diverse I/O interfaces, fieldbus protocols, and wireless capabilities via iDoor technology. It is equipped with TPM hardware security and supports a range of operating systems including Windows, Android, and Linux."", 'target_applications': ['Industrial automation', 'Control panels', 'IoT applications']}","{'store_and_chunk_data': [{'input_tokens': 0, 'output_tokens': 0, 'time_taken': 0.8923380374908447}], 'generate_missing_features': [{'input_tokens': 2876, 'output_tokens': 30, 'time_taken': 2.569856882095337}, {'input_tokens': 2989, 'output_tokens': 30, 'time_taken': 1.5535008907318115}], 'search_missing_features': [{'input_tokens': 0, 'output_tokens': 0, 'time_taken': 8.851543188095093}, {'input_tokens': 0, 'output_tokens': 0, 'time_taken': 9.44993782043457}], 'extract_features': [{'input_tokens': 2098, 'output_tokens': 749, 'time_taken': 8.642306089401245}]}","[1, 1, 1]","[0, 0, 0]"
102110641,{},"{'store_and_chunk_data': [{'input_tokens': 0, 'output_tokens': 0, 'time_taken': 1.0920178890228271}], 'extract_features': [{'input_tokens': 1895, 'output_tokens': 501, 'time_taken': 6.293567895889282}]}",[20],[0]
SOM-5883C3Q-U4A1,"{'name': 'SOM', 'manufacturer': 'ADVANTECH', 'form_factor': 'COM EXPRESS BASIC', 'evaluation_or_commercialization': False, 'processor_architecture': 'x86', 'processor_core_count': '20', 'processor_manufacturer': 'INTEL', 'processor_tdp': '45W', 'memory': 'DDR4 SODIMM, Max 128GB, ECC support', 'onboard_storage': 'NVMe SSD', 'input_voltage': '12V', 'io_count': 'PCIe x16, PCIe x4, USB 3.2 Gen 2, SATA III, GbE', 'wireless': 'Dual GbE & wireless connectivity', 'operating_system_bsp': ['Windows 10', 'Ubuntu'], 'operating_temperature_max': '85°C', 'operating_temperature_min': '-40°C', 'certifications': 'MIL-STD-810G compliance', 'short_summary': 'SOM with Intel 11th Gen Core Processors, COM Express Basic Type, supports ECC memory and NVMe SSD.', 'full_summary': 'The SOM is a COM Express Basic Type module featuring Intel 11th Gen Core Processors, supporting dual-channel DDR4 SODIMM with ECC, NVMe SSD, and a variety of I/O interfaces including PCIe, USB, and SATA.', 'full_product_description': 'This SOM module is designed for high-performance applications, equipped with Intel 11th Gen Core Processors and Intel Iris Xe Graphics. It supports up to 128GB DDR4 SODIMM with ECC, onboard NVMe SSD, and multiple I/O options including PCIe x16, PCIe x4, USB 3.2 Gen 2, and SATA III. The module is suitable for industrial environments with an operating temperature range from -40°C to 85°C.', 'target_applications': ['Industrial Automation', 'Edge Computing', 'AI Applications']}","{'store_and_chunk_data': [{'input_tokens': 0, 'output_tokens': 0, 'time_taken': 1.3731818199157715}], 'generate_missing_features': [{'input_tokens': 4187, 'output_tokens': 116, 'time_taken': 3.9984498023986816}], 'search_missing_features': [{'input_tokens': 0, 'output_tokens': 0, 'time_taken': 18.34284281730652}], 'extract_features': [{'input_tokens': 2001, 'output_tokens': 741, 'time_taken': 7.921545028686523}]}","[4, 0]","[0, 0]"
ASMB-785G2-00A1E,"{'name': 'ASMBGAE', 'manufacturer': 'ADVANTECH', 'form_factor': 'ATX', 'evaluation_or_commercialization': False, 'processor_architecture': 'Not Available', 'processor_core_count': '12', 'processor_manufacturer': 'INTEL', 'processor_tdp': '95W', 'memory': 'DDR4, ECC/Non-ECC, up to 128GB', 'onboard_storage': 'Not Available', 'input_voltage': '+12V/+5V/+3.3V/+5Vsb/-12V/12V_8P_0/12V_8P_1', 'io_count': ['10 RS-232', '6 RS-422', '4 RS-485', 'USB ports', 'PCIe slots'], 'wireless': 'Not Available', 'operating_system_bsp': ['Windows 10', 'Windows Server'], 'operating_temperature_max': '60°C', 'operating_temperature_min': '0°C', 'certifications': 'CE/FCC', 'short_summary': 'ATX server board supporting Intel Xeon E processors with multiple I/O and expansion slots.', 'full_summary': 'The ASMBGAE is an ATX server board designed for Intel Xeon E processors, featuring DDR4 memory support, multiple PCIe slots, and extensive I/O options including RS-232/422/485 ports.', 'full_product_description': 'The ASMBGAE server board by Advantech supports Intel Xeon E processors and offers a robust set of features including DDR4 ECC/Non-ECC memory support up to 128GB, multiple PCIe slots for expansion, and a variety of I/O interfaces such as RS-232, RS-422, and RS-485 ports. It is optimized for rackmount applications with a design that ensures positive airflow and supports operating temperatures from 0°C to 60°C.', 'target_applications': ['Server applications', 'Industrial automation', 'Data centers']}","{'store_and_chunk_data': [{'input_tokens': 0, 'output_tokens': 0, 'time_taken': 1.0139567852020264}], 'generate_missing_features': [{'input_tokens': 3946, 'output_tokens': 183, 'time_taken': 4.734460353851318}, {'input_tokens': 3989, 'output_tokens': 101, 'time_taken': 3.6971487998962402}, {'input_tokens': 4152, 'output_tokens': 102, 'time_taken': 4.7203147411346436}, {'input_tokens': 4404, 'output_tokens': 77, 'time_taken': 3.267038106918335}, {'input_tokens': 4404, 'output_tokens': 77, 'time_taken': 3.634481191635132}], 'search_missing_features': [{'input_tokens': 0, 'output_tokens': 0, 'time_taken': 12.171092987060547}, {'input_tokens': 0, 'output_tokens': 0, 'time_taken': 6.852504014968872}, {'input_tokens': 0, 'output_tokens': 0, 'time_taken': 16.546689748764038}, {'input_tokens': 0, 'output_tokens': 0, 'time_taken': 12.596605062484741}, {'input_tokens': 0, 'output_tokens': 0, 'time_taken': 7.933713912963867}], 'extract_features': [{'input_tokens': 1917, 'output_tokens': 748, 'time_taken': 8.324090719223022}]}","[6, 4, 4, 3, 3, 3]","[0, 0, 0, 0, 0, 0]"
AIMB-210F-S6B1E,"{'name': 'AIMB', 'manufacturer': 'ADVANTECH', 'form_factor': 'MINI ITX', 'evaluation_or_commercialization': False, 'processor_architecture': 'x86', 'processor_core_count': '4', 'processor_manufacturer': 'INTEL', 'processor_tdp': '6W', 'memory': 'Up to 2 GB DDR2 533 MHz', 'onboard_storage': 'SSDs', 'input_voltage': '5V, 12V, 3.3V, 5VSB', 'io_count': ['6 Serial Ports', '8 USB Ports', '1 Parallel Port', '2 SATA Ports', '1 IDE Connector', '1 PS/2 Keyboard/Mouse Connector', '1 VGA Connector', '1 TV-Out Connector', '2 Ethernet Ports'], 'wireless': '1 x M.2 E key for wireless', 'operating_system_bsp': 'Win10/Ubuntu', 'operating_temperature_max': '60°C', 'operating_temperature_min': '0°C', 'certifications': 'FCC', 'short_summary': 'AIMB Mini ITX motherboard with Intel Atom processor, supporting multiple I/O interfaces.', 'full_summary': 'The AIMB is a Mini ITX motherboard featuring an Intel Atom processor, offering a range of I/O interfaces including serial, USB, and Ethernet ports, suitable for various industrial applications.', 'full_product_description': 'The AIMB motherboard is equipped with an Intel Atom processor, supporting up to 2 GB of DDR2 memory. It includes a variety of I/O options such as 6 serial ports, 8 USB ports, and dual Ethernet ports, making it ideal for industrial and embedded applications. The board operates within a temperature range of 0°C to 60°C and complies with FCC standards.', 'target_applications': 'Industrial applications, embedded systems'}","{'store_and_chunk_data': [{'input_tokens': 0, 'output_tokens': 0, 'time_taken': 0.8852102756500244}], 'generate_missing_features': [{'input_tokens': 3753, 'output_tokens': 160, 'time_taken': 3.733200788497925}, {'input_tokens': 3703, 'output_tokens': 64, 'time_taken': 3.213911771774292}], 'search_missing_features': [{'input_tokens': 0, 'output_tokens': 0, 'time_taken': 16.900843143463135}, {'input_tokens': 0, 'output_tokens': 0, 'time_taken': 25.649524927139282}], 'extract_features': [{'input_tokens': 1937, 'output_tokens': 743, 'time_taken': 8.402386903762817}]}","[6, 2, 0]","[0, 0, 0]"
