id,extracted_data,usage_data,missing_feature_count_history,low_confidence_feature_count_history
PCM-3353Z-L0A3,"{'name': 'PCM-9375', 'manufacturer': 'ADVANTECH', 'form_factor': 'PC/104', 'evaluation_or_commercialization': False, 'processor_architecture': 'x86', 'processor_core_count': '1', 'processor_manufacturer': 'AMD', 'processor_tdp': 'Not Available', 'memory': 'DDR 333 MHz, Max Capacity 1 GB', 'onboard_storage': 'CompactFlash socket Type I', 'input_voltage': '5V', 'io_count': ['4 USB ports', '4 COM ports', '1 Parallel port', '1 Ethernet port'], 'wireless': 'Not Available', 'operating_system_bsp': ['Windows CE', 'Windows XP Embedded', 'QNX', 'Linux', 'Ubuntu', 'VxWorks'], 'operating_temperature_max': '60°C', 'operating_temperature_min': '-20°C', 'certifications': 'Not Available', 'short_summary': 'The PCM-9375 is a low-power, compact PC/104 CPU module featuring an AMD Geode LX processor, suitable for industrial applications.', 'full_summary': 'The PCM-9375 offers a robust solution for industrial applications, equipped with an AMD Geode LX processor, DDR memory support, and multiple I/O interfaces including USB, COM, and Ethernet.', 'full_product_description': 'The PCM-9375 is a compact PC/104 CPU module designed for industrial use, featuring an AMD Geode LX processor with a frequency of 500 MHz. It supports DDR 333 MHz memory up to 1 GB and offers a variety of I/O interfaces including 4 USB ports, 4 COM ports, and Ethernet. The module supports multiple operating systems such as Windows CE, Windows XP Embedded, QNX, Linux, Ubuntu, and VxWorks, making it versatile for various applications. It operates within a temperature range of -20°C to 60°C, ensuring reliability in harsh environments.', 'target_applications': ['Industrial automation', 'Embedded systems', 'Kiosk systems', 'Digital signage']}","{'generate_missing_features': [{'input_tokens': 3703, 'output_tokens': 76, 'time_taken': 5.871993780136108}, {'input_tokens': 3820, 'output_tokens': 76, 'time_taken': 5.028890132904053}], 'search_missing_features': [{'input_tokens': 0, 'output_tokens': 0, 'time_taken': 16.76343822479248}, {'input_tokens': 0, 'output_tokens': 0, 'time_taken': 16.10535502433777}], 'extract_features': [{'input_tokens': 1633, 'output_tokens': 799, 'time_taken': 10.983257055282593}], 'store_and_chunk_data': [{'input_tokens': 0, 'output_tokens': 0, 'time_taken': 0.7664108276367188}]}","[3, 3, 3]","[0, 0, 0]"
LEC-AL-E3940-8G-32G-ER,"{'name': 'LECAL SMARC SHORT SIZE MODULE', 'manufacturer': 'ADLINK TECHNOLOGY INC', 'form_factor': 'SMARC', 'evaluation_or_commercialization': False, 'processor_architecture': 'x86', 'processor_core_count': 'Dual/Quad', 'processor_manufacturer': 'INTEL', 'processor_tdp': '6W', 'memory': 'Up to 8GB DDR3L 1866 MT/s', 'onboard_storage': 'Up to 64GB eMMC', 'input_voltage': '5V DC', 'io_count': ['2x GbE', '2x PCIe', '4x USB', '1x SATA', '1x SDIO', '2x MIPI CSI', '4x UART', '1x SPI', '1x eSPI', '1x I2C', '1x SMBus', '1x LPC', '12x GPIO'], 'wireless': 'Not Available', 'operating_system_bsp': ['Windows IoT Enterprise', 'Windows IoT Core', 'Yocto Linux', 'VxWorks', 'Android'], 'operating_temperature_max': '85°C', 'operating_temperature_min': '-40°C', 'certifications': ['IEC 60068-2-27', 'IEC 60068-2-64', 'MIL-STD-810F'], 'short_summary': 'LECAL SMARC Short Size Module with Intel Atom E Series, Pentium N, and Celeron N processors, supporting dual/quad-core configurations, up to 8GB DDR3L memory, and triple display support.', 'full_summary': 'The LECAL SMARC Short Size Module is designed for industrial applications, featuring Intel Atom E Series, Pentium N, and Celeron N processors. It supports dual and quad-core configurations, up to 8GB DDR3L memory, and onboard eMMC storage. The module offers extensive I/O options, including dual GbE, PCIe, USB, SATA, and MIPI CSI interfaces, and supports multiple operating systems.', 'full_product_description': 'The LECAL SMARC Short Size Module by ADLINK Technology Inc is a versatile embedded solution featuring Intel Atom E Series, Pentium N, and Celeron N processors. It supports dual and quad-core configurations with a TDP of 6W. The module includes up to 8GB DDR3L memory and up to 64GB eMMC storage. It offers a wide range of I/O interfaces, including dual GbE, PCIe, USB, SATA, and MIPI CSI, making it suitable for various industrial applications. The module supports multiple operating systems, including Windows IoT Enterprise, Yocto Linux, and VxWorks, and is designed to operate in extreme temperatures ranging from -40°C to 85°C.', 'target_applications': ['Industrial Automation', 'IoT', 'Embedded Systems', 'Digital Signage', 'Medical Devices']}","{'generate_missing_features': [{'input_tokens': 4113, 'output_tokens': 29, 'time_taken': 2.4156060218811035}, {'input_tokens': 3961, 'output_tokens': 29, 'time_taken': 6.3796610832214355}], 'search_missing_features': [{'input_tokens': 0, 'output_tokens': 0, 'time_taken': 24.20837116241455}, {'input_tokens': 0, 'output_tokens': 0, 'time_taken': 23.362155199050903}], 'extract_features': [{'input_tokens': 1681, 'output_tokens': 1007, 'time_taken': 12.159270286560059}], 'store_and_chunk_data': [{'input_tokens': 0, 'output_tokens': 0, 'time_taken': 0.6665019989013672}]}","[1, 1, 1]","[0, 0, 0]"
6879MBNX9131F,{},"{'extract_features': [{'input_tokens': 1575, 'output_tokens': 895, 'time_taken': 10.29744267463684}], 'store_and_chunk_data': [{'input_tokens': 0, 'output_tokens': 0, 'time_taken': 1.1781439781188965}]}",[5],[0]
UNO-2372G-J121AU,"{'name': 'UNOG V', 'manufacturer': 'ADVANTECH', 'form_factor': 'SMALL ENCLOSURE', 'evaluation_or_commercialization': False, 'processor_architecture': 'X86', 'processor_core_count': 4, 'processor_manufacturer': 'INTEL', 'processor_tdp': '28W (passive cooled)', 'memory': '8 GB DDR3L', 'onboard_storage': '1 x mSATA, 1 x SATA HDD drive bay', 'input_voltage': '12 VDC', 'io_count': '2 x GbE, 4 x USB, 4 x RS-232/422/485, 2 x HDMI, 2 x DP', 'wireless': 'Optional WiFi, Bluetooth, cellular connectivity', 'operating_system_bsp': ['Microsoft Windows', 'Advantech Linux', 'Ubuntu'], 'operating_temperature_max': '60 C', 'operating_temperature_min': '-20 C', 'certifications': ['CE', 'FCC', 'UL', 'CCC', 'BSMI'], 'short_summary': 'Compact, modular box platform with Intel Celeron processor, fanless design, and optional expansion.', 'full_summary': 'The UNOG V is a compact, robust, fanless system featuring an Intel Celeron J1900 quad-core processor, modular design for optional expansion, and support for various iDoor modules.', 'full_product_description': ""Advantech's UNOG V is a highly ruggedized, fanless embedded automation computer. It features a modular design that offers numerous performance and cost-saving advantages, including eliminating unnecessary features and expenses, accelerated production and delivery, rapid deployment and integration, and reduced system downtime and maintenance costs. The system supports future upgrades and expansion with its optional second stack and iDoor technology."", 'target_applications': ['Industrial automation', 'Embedded systems', 'IoT applications']}","{'generate_missing_features': [{'input_tokens': 4184, 'output_tokens': 30, 'time_taken': 6.129400730133057}, {'input_tokens': 4550, 'output_tokens': 36, 'time_taken': 2.6829168796539307}], 'search_missing_features': [{'input_tokens': 0, 'output_tokens': 0, 'time_taken': 16.6496319770813}, {'input_tokens': 0, 'output_tokens': 0, 'time_taken': 41.35338592529297}], 'extract_features': [{'input_tokens': 1803, 'output_tokens': 750, 'time_taken': 8.853849172592163}], 'store_and_chunk_data': [{'input_tokens': 0, 'output_tokens': 0, 'time_taken': 1.8325750827789307}]}","[1, 1, 0]","[0, 0, 0]"
ARK-2120L-S6A1E,"{'name': 'ARK-2120L', 'manufacturer': 'ADVANTECH', 'form_factor': 'Fanless Box PC', 'evaluation_or_commercialization': False, 'processor_architecture': 'x86', 'processor_core_count': 'Dual Core', 'processor_manufacturer': 'INTEL', 'processor_tdp': 'Not Available', 'memory': 'DDR3 800 MHz, Max 4 GB', 'onboard_storage': 'Supports one SATA HDD Bay, one external CFast socket', 'input_voltage': '12 VDC', 'io_count': '4 USB ports, 4 COM ports, 2 LAN ports, Digital IO', 'wireless': 'Supports WLAN via Mini PCIe expansion', 'operating_system_bsp': ['Microsoft Windows 7', 'Windows 7 Embedded', 'XP Professional', 'XP Embedded'], 'operating_temperature_max': '60°C', 'operating_temperature_min': '-20°C', 'certifications': ['CE', 'FCC Class A', 'CCC', 'BSMI', 'UL'], 'short_summary': 'Fanless embedded box PC with Intel Atom dual-core processor, multiple IOs, and extended temperature support.', 'full_summary': 'The ARK-2120L is a fanless embedded box PC featuring an Intel Atom dual-core processor, supporting dual independent displays via VGA and HDMI, with multiple IO interfaces including USB, COM, and LAN ports. It is designed for industrial applications with extended temperature range and robust certifications.', 'full_product_description': 'The ARK-2120L is a robust fanless embedded box PC designed for industrial applications. It is powered by an Intel Atom dual-core processor, supporting up to 4 GB of DDR3 memory. The device offers dual independent display capabilities through VGA and HDMI outputs, and features a variety of IO interfaces including 4 USB ports, 4 COM ports, and 2 LAN ports. It supports one SATA HDD bay and an external CFast socket for storage. The system is compliant with multiple safety and EMC standards, making it suitable for a wide range of industrial environments.', 'target_applications': ['Industrial Automation', 'Embedded Systems', 'IoT Gateways']}","{'generate_missing_features': [{'input_tokens': 3793, 'output_tokens': 30, 'time_taken': 2.7620010375976562}, {'input_tokens': 3420, 'output_tokens': 30, 'time_taken': 7.716106653213501}], 'search_missing_features': [{'input_tokens': 0, 'output_tokens': 0, 'time_taken': 20.381680011749268}, {'input_tokens': 0, 'output_tokens': 0, 'time_taken': 22.904404878616333}], 'extract_features': [{'input_tokens': 1572, 'output_tokens': 806, 'time_taken': 11.825191259384155}], 'store_and_chunk_data': [{'input_tokens': 0, 'output_tokens': 0, 'time_taken': 0.5863847732543945}]}","[1, 1, 1]","[0, 0, 0]"
