id,extracted_data,usage_data,missing_feature_count_history,low_confidence_feature_count_history
AIMB-787G2-00A3,"{'name': 'AIMB-785', 'manufacturer': 'ADVANTECH', 'form_factor': 'ATX', 'evaluation_or_commercialization': False, 'processor_architecture': 'x86', 'processor_core_count': '4', 'processor_manufacturer': 'INTEL', 'processor_tdp': '65 W', 'memory': '64GB DDR4', 'onboard_storage': 'Not Available', 'input_voltage': '12V', 'io_count': 'Not Available', 'wireless': 'Not Available', 'operating_system_bsp': 'Windows', 'operating_temperature_max': '60°C', 'operating_temperature_min': '0°C', 'certifications': 'Not Available', 'short_summary': 'Industrial motherboard with Intel 10th Gen Core processors, ATX form factor, and extensive I/O support.', 'full_summary': 'The AIMB-785 is an industrial motherboard designed for high-performance applications, featuring Intel 10th Gen Core processors, ATX form factor, and a wide range of I/O interfaces including USB 3.2, dual GbE LAN, and support for Intel vPro and TPM technologies.', 'full_product_description': ""The AIMB-785 motherboard by Advantech is built for industrial applications, supporting Intel 10th Gen Core i3/i5/i7 processors with an ATX form factor. It offers four DIMM sockets for up to 64GB DDR4 memory, triple display outputs (DP/DVI/VGA), dual GbE LAN, and multiple USB ports. It supports Intel vPro and TPM technologies for enhanced security and management, and includes Advantech's iBMC for remote management."", 'target_applications': 'Industrial automation, digital signage, and embedded computing.'}","{'store_and_chunk_data': [{'input_tokens': 0, 'output_tokens': 0, 'time_taken': 1.5581672191619873}], 'generate_missing_features': [{'input_tokens': 3994, 'output_tokens': 150, 'time_taken': 4.285097122192383}, {'input_tokens': 4285, 'output_tokens': 99, 'time_taken': 3.309887409210205}, {'input_tokens': 4285, 'output_tokens': 99, 'time_taken': 2.262049674987793}], 'search_missing_features': [{'input_tokens': 0, 'output_tokens': 0, 'time_taken': 16.565102100372314}, {'input_tokens': 0, 'output_tokens': 0, 'time_taken': 21.652471780776978}, {'input_tokens': 0, 'output_tokens': 0, 'time_taken': 22.812247037887573}], 'extract_features': [{'input_tokens': 1894, 'output_tokens': 715, 'time_taken': 8.440995216369629}]}","[6, 4, 4, 4]","[0, 0, 0, 0]"
IMBA-Q471-R10,"{'name': 'IMBAQ', 'manufacturer': 'IEI', 'form_factor': 'ATX', 'evaluation_or_commercialization': False, 'processor_architecture': 'x86', 'processor_core_count': 'Not Available', 'processor_manufacturer': 'Intel', 'processor_tdp': 'Not Available', 'memory': 'DDR4, up to 64GB', 'onboard_storage': '128 GB eMMC flash', 'input_voltage': 'ATX/AT power supply', 'io_count': ['6 x USB 3.2 Gen 1', '4 x USB 2.0', '3 x Intel I210-AT GbE LAN', '6 x SATA 6Gb/s', '1 x VGA', '1 x HDMI', '1 x DP', '8 x RS-232/422/485'], 'wireless': 'Not Available', 'operating_system_bsp': 'Not Available', 'operating_temperature_max': '60°C', 'operating_temperature_min': '0°C', 'certifications': ['CE', 'FCC'], 'short_summary': 'IMBAQ ATX industrial motherboard supporting Intel 10th Gen processors with triple independent display output and triple Intel GbE LAN.', 'full_summary': 'The IMBAQ is an ATX industrial motherboard designed for Intel 10th Gen Core, Celeron, and Pentium processors. It supports triple independent displays, triple Intel I210-AT GbE LAN, and multiple PCIe expansion slots.', 'full_product_description': 'The IMBAQ motherboard supports Intel 10th Gen processors and features a robust set of I/O options including USB 3.2 Gen 1, USB 2.0, SATA 6Gb/s, and RS-232/422/485 ports. It is designed for industrial applications with support for triple independent displays and multiple PCIe expansion slots.', 'target_applications': ['Industrial automation', 'Embedded systems', 'Network appliances']}","{'store_and_chunk_data': [{'input_tokens': 0, 'output_tokens': 0, 'time_taken': 1.560671091079712}], 'generate_missing_features': [{'input_tokens': 4210, 'output_tokens': 132, 'time_taken': 5.391525030136108}, {'input_tokens': 4210, 'output_tokens': 103, 'time_taken': 3.166080951690674}, {'input_tokens': 4258, 'output_tokens': 103, 'time_taken': 3.490247964859009}], 'search_missing_features': [{'input_tokens': 0, 'output_tokens': 0, 'time_taken': 16.939980030059814}, {'input_tokens': 0, 'output_tokens': 0, 'time_taken': 19.931153774261475}, {'input_tokens': 0, 'output_tokens': 0, 'time_taken': 14.97918701171875}], 'extract_features': [{'input_tokens': 2025, 'output_tokens': 779, 'time_taken': 8.997133016586304}]}","[5, 4, 4, 4]","[0, 0, 0, 0]"
KINO-TGL-U-i5-R10,"{'name': 'KINOTGLU', 'manufacturer': 'IEI', 'form_factor': 'MINI-ITX', 'evaluation_or_commercialization': False, 'processor_architecture': 'X86', 'processor_core_count': '4', 'processor_manufacturer': 'INTEL', 'processor_tdp': '28W', 'memory': 'DDR4, up to 64GB', 'onboard_storage': 'Not Available', 'input_voltage': '12V DC', 'io_count': 'Multiple USB, HDMI, DP, SATA, PCIe', 'wireless': 'Supports Bluetooth and Wi-Fi via M.2 modules', 'operating_system_bsp': 'Not Available', 'operating_temperature_max': '60°C', 'operating_temperature_min': '0°C', 'certifications': ['CE', 'FCC', 'RoHS'], 'short_summary': 'High-performance Mini-ITX SBC with Intel Tiger Lake-UP processor, supporting triple display and dual GbE LAN.', 'full_summary': ""The KINOTGLU is a Mini-ITX single board computer featuring Intel's Tiger Lake-UP processors, offering robust performance for multitasking. It supports triple independent displays and dual Intel GbE LAN, making it suitable for various industrial applications."", 'full_product_description': 'The KINOTGLU Mini-ITX SBC is designed for high-performance applications, equipped with Intel Tiger Lake-UP processors. It supports up to 64GB DDR4 memory, triple independent display outputs via HDMI, DP, and iDPM, and dual Intel GbE LAN ports. Expansion options include PCIe slots and M.2 slots for additional connectivity and storage solutions.', 'target_applications': ['Industrial automation', 'Digital signage', 'Embedded systems']}","{'store_and_chunk_data': [{'input_tokens': 0, 'output_tokens': 0, 'time_taken': 0.8537590503692627}], 'generate_missing_features': [{'input_tokens': 4149, 'output_tokens': 56, 'time_taken': 2.264734983444214}, {'input_tokens': 3169, 'output_tokens': 56, 'time_taken': 1.7709770202636719}], 'search_missing_features': [{'input_tokens': 0, 'output_tokens': 0, 'time_taken': 26.06372570991516}, {'input_tokens': 0, 'output_tokens': 0, 'time_taken': 22.02108883857727}], 'extract_features': [{'input_tokens': 2089, 'output_tokens': 722, 'time_taken': 8.20506501197815}]}","[2, 2, 2]","[0, 0, 0]"
iW-G40S-OLPQ-4L004G-E016G-BIA,"{'name': 'IMX M PLUS OSM SBC', 'manufacturer': 'IWAVE SYSTEMS', 'form_factor': 'PICO ITX', 'evaluation_or_commercialization': False, 'processor_architecture': 'ARM', 'processor_core_count': 'Quad', 'processor_manufacturer': 'NXP', 'processor_tdp': 'Not Available', 'memory': 'Up to 8GB LPDDR4', 'onboard_storage': 'eMMC Flash 16GB, Expandable', 'input_voltage': '12V', 'io_count': ['USB OTG micro AB', 'USB 3.0', 'HDMI', 'PCIe', 'MIPI DSI', 'MIPI CSI', 'CAN', 'UART', 'Ethernet'], 'wireless': 'Wi-Fi IEEE 802.11 a/b/g/n/ac/ax, Bluetooth 5.0', 'operating_system_bsp': 'Linux', 'operating_temperature_max': '85°C', 'operating_temperature_min': '-40°C', 'certifications': 'REACH, RoHS Compliant', 'short_summary': 'The iMX M Plus OSM SBC is a compact, high-performance single board computer designed for industrial applications with advanced multimedia and machine learning capabilities.', 'full_summary': ""The iMX M Plus OSM SBC integrates NXP's iMX M Plus processors, offering a range of configurations including Quad, QuadLite, and Dual Cortex-A cores. It supports a variety of interfaces such as HDMI, MIPI DSI, and PCIe, and is equipped with up to 8GB LPDDR4 memory and 16GB eMMC storage. The board is designed for industrial automation, machine learning, and multimedia applications."", 'full_product_description': ""The iMX M Plus OSM SBC by iWave Systems is a versatile single board computer featuring NXP's iMX M Plus processors. It offers robust connectivity options including dual Gigabit Ethernet, Wi-Fi, Bluetooth, and multiple USB ports. The board supports high-resolution displays via HDMI and MIPI DSI, and includes a range of expansion options such as PCIe and CAN. With a compact Pico ITX form factor, it is suitable for a wide range of industrial and multimedia applications."", 'target_applications': ['Machine Learning', 'Vision Systems', 'Advanced Multimedia', 'Industrial Automation', 'High Performance Computing']}","{'store_and_chunk_data': [{'input_tokens': 0, 'output_tokens': 0, 'time_taken': 1.577542781829834}], 'generate_missing_features': [{'input_tokens': 2959, 'output_tokens': 30, 'time_taken': 1.6630048751831055}, {'input_tokens': 4292, 'output_tokens': 30, 'time_taken': 3.8725922107696533}], 'search_missing_features': [{'input_tokens': 0, 'output_tokens': 0, 'time_taken': 20.309979915618896}, {'input_tokens': 0, 'output_tokens': 0, 'time_taken': 17.981995105743408}], 'extract_features': [{'input_tokens': 2056, 'output_tokens': 868, 'time_taken': 8.861220121383667}]}","[1, 1, 1]","[0, 0, 0]"
IMBA-R680-R10,"{'name': 'IMBAR', 'manufacturer': 'IEI', 'form_factor': 'ATX', 'evaluation_or_commercialization': False, 'processor_architecture': 'x86', 'processor_core_count': 'Not Available', 'processor_manufacturer': 'Intel', 'processor_tdp': '125W', 'memory': '64GB DDR4 3200MHz ECC/non-ECC', 'onboard_storage': 'Not Available', 'input_voltage': 'ATX/AT', 'io_count': ['6 x USB 3.2 Gen 1', '4 x RS-232/422/485', '2 x LAN', '4 x SATA 6Gb/s'], 'wireless': 'Not Available', 'operating_system_bsp': 'Not Available', 'operating_temperature_max': '60°C', 'operating_temperature_min': '0°C', 'certifications': ['CE', 'FCC'], 'short_summary': 'High-performance ATX motherboard supporting Intel Alder Lake-S processors with extensive I/O and expansion capabilities.', 'full_summary': ""The IMBAR is an ATX motherboard designed for industrial applications, supporting Intel's 12th generation Alder Lake-S processors. It offers triple independent display outputs, dual GbE LAN, multiple USB and SATA interfaces, and extensive PCIe expansion slots."", 'full_product_description': ""The IMBAR motherboard supports LGA 1700 socket for Intel's 12th generation Core, Pentium, and Celeron processors with a TDP of up to 125W. It features dual-channel DDR4 memory support up to 64GB, triple independent display outputs via DP, HDMI, and iDPM, dual Intel I225-V GbE LAN, and multiple USB 3.2 Gen 1 and SATA 6Gb/s interfaces. The board is equipped with PCIe Gen 4 and Gen 3 slots for high-speed expansion and supports RAID configurations."", 'target_applications': ['Industrial automation', 'Embedded systems', 'Digital signage', 'Networking']}","{'store_and_chunk_data': [{'input_tokens': 0, 'output_tokens': 0, 'time_taken': 1.55902099609375}], 'generate_missing_features': [{'input_tokens': 4155, 'output_tokens': 103, 'time_taken': 3.7340428829193115}, {'input_tokens': 4165, 'output_tokens': 103, 'time_taken': 2.4540510177612305}], 'search_missing_features': [{'input_tokens': 0, 'output_tokens': 0, 'time_taken': 19.773093223571777}, {'input_tokens': 0, 'output_tokens': 0, 'time_taken': 21.545639753341675}], 'extract_features': [{'input_tokens': 1965, 'output_tokens': 789, 'time_taken': 8.352001905441284}]}","[4, 4, 4]","[0, 0, 0]"
