id,extracted_data,usage_data,missing_feature_count_history,low_confidence_feature_count_history
CC-SBP-WMX-JM8E,"{'name': 'DIGI CONNECTCORE X', 'manufacturer': 'DIGI INTERNATIONAL', 'form_factor': 'PICO-ITX', 'evaluation_or_commercialization': False, 'processor_architecture': 'ARM', 'processor_core_count': '4', 'processor_manufacturer': 'NXP', 'processor_tdp': 'Not Available', 'memory': '2 GB LPDDR4', 'onboard_storage': '8 GB eMMC', 'input_voltage': '4.2 - 5.5 V', 'io_count': '103 GPIOs', 'wireless': ['Wi-Fi abgnac', 'Bluetooth'], 'operating_system_bsp': ['Yocto Project', 'Linux', 'Android'], 'operating_temperature_max': '85 C', 'operating_temperature_min': '-40 C', 'certifications': ['WiFi Alliance', 'FCC', 'CE', 'VCCI', 'AS/NZS'], 'short_summary': 'Secure, connected system-on-module for industrial IoT applications.', 'full_summary': 'The Digi ConnectCore X is a secure, cost-effective connected system-on-module platform designed for industrial IoT applications, featuring NXP i.MX8X processor, dual-band Wi-Fi, Bluetooth, and extensive connectivity options.', 'full_product_description': 'Digi ConnectCore X is an intelligent, connected embedded system-on-module based on the NXP i.MX8X scalable dual/quad-core processor. It offers secure, cost-effective solutions for industrial IoT applications with a multitude of high-performance interconnecting options including USB, dual Gigabit Ethernet, PCIe, and pre-certified dual-band Wi-Fi and Bluetooth connectivity. The platform supports Yocto Project, Linux, and Android operating systems, and is designed for ultimate reliability and design freedom with Digi SMTplus form factor.', 'target_applications': ['Industrial IoT', 'Streaming video/audio devices', 'Voice control', 'Human-machine interface solutions']}","{'extract_features': [{'input_tokens': 2565, 'output_tokens': 745, 'time_taken': 7.661968946456909}], 'generate_missing_features': [{'input_tokens': 3168, 'output_tokens': 88, 'time_taken': 2.6107401847839355}, {'input_tokens': 4484, 'output_tokens': 30, 'time_taken': 2.167404890060425}, {'input_tokens': 4484, 'output_tokens': 30, 'time_taken': 2.8816728591918945}], 'search_missing_features': [{'input_tokens': 0, 'output_tokens': 0, 'time_taken': 8.54417109489441}, {'input_tokens': 0, 'output_tokens': 0, 'time_taken': 8.337430000305176}, {'input_tokens': 0, 'output_tokens': 0, 'time_taken': 10.67647099494934}], 'store_and_chunk_data': [{'input_tokens': 0, 'output_tokens': 0, 'time_taken': 1.2306859493255615}]}","[3, 1, 1, 1]","[0, 0, 0, 0]"
VL-EPM-19EAK,"{'name': 'FOX PCPLUS SINGLE BOARD COMPUTER', 'manufacturer': 'VERSALOGIC CORPORATION', 'form_factor': 'PCPLUS', 'evaluation_or_commercialization': False, 'processor_architecture': 'X86', 'processor_core_count': '1', 'processor_manufacturer': 'DMP', 'processor_tdp': '6.7W', 'memory': 'Up to 2 GB DDR2 soldered-on', 'onboard_storage': 'One SATA 3 Gbps port, One Mini PCIe mSATA socket, One microSD socket', 'input_voltage': '5V', 'io_count': ['Four USB ports', 'Two RS-232/422/485 serial ports', 'Eight TTL I/O lines', 'One SATA port', 'One microSD socket'], 'wireless': 'Supports WiFi modems via Mini PCIe', 'operating_system_bsp': ['Windows', 'Windows Embedded', 'Linux'], 'operating_temperature_max': '85°C', 'operating_temperature_min': '-40°C', 'certifications': ['RoHS', 'MIL-STD-810G'], 'short_summary': 'The Fox PCPlus Single Board Computer is a low-power, fanless embedded system with a DMP VortexDX processor, designed for industrial applications.', 'full_summary': 'The Fox PCPlus Single Board Computer by VersaLogic Corporation is a robust, low-power embedded system featuring a DMP VortexDX processor. It offers multiple I/O interfaces, expansion options, and is designed to withstand extreme temperatures and high-impact vibrations, making it ideal for industrial applications.', 'full_product_description': 'The Fox PCPlus Single Board Computer is engineered for industrial environments, featuring a DMP VortexDX processor and up to 2 GB of soldered-on DDR2 RAM. It includes a variety of I/O options such as USB, serial ports, and digital I/O lines, along with storage options like SATA and mSATA. The board supports operating temperatures from -40°C to 85°C and complies with MIL-STD-810G for shock and vibration.', 'target_applications': ['Industrial automation', 'Embedded systems', 'Rugged computing environments']}","{'extract_features': [{'input_tokens': 2563, 'output_tokens': 834, 'time_taken': 8.309868097305298}], 'generate_missing_features': [{'input_tokens': 4644, 'output_tokens': 59, 'time_taken': 1.8991222381591797}], 'search_missing_features': [{'input_tokens': 0, 'output_tokens': 0, 'time_taken': 37.36568284034729}], 'store_and_chunk_data': [{'input_tokens': 0, 'output_tokens': 0, 'time_taken': 0.9120879173278809}]}","[2, 0]","[0, 0]"
68010-0000-51-1,"{'name': 'COMEBEP E', 'manufacturer': 'KONTRON', 'form_factor': 'COM EXPRESS BASIC', 'evaluation_or_commercialization': True, 'processor_architecture': 'x86', 'processor_core_count': 'Up to 8 cores', 'processor_manufacturer': 'AMD', 'processor_tdp': '25 to 45 watts', 'memory': 'Up to 64 GByte DDR4 SODIMM', 'onboard_storage': 'Up to 1 TByte NVMe SSD', 'input_voltage': '12V', 'io_count': 'Quad GbE interfaces, multiple PCIe Gen3 lanes, USB interfaces', 'wireless': 'Not Available', 'operating_system_bsp': ['Linux', 'Ubuntu', 'Windows Server'], 'operating_temperature_max': '85°C', 'operating_temperature_min': '-40°C', 'certifications': 'Not Available', 'short_summary': 'COM Express Basic module with AMD EPYC Embedded SoC, supporting industrial and commercial temperature ranges.', 'full_summary': 'The COMebEP E is a COM Express Basic module featuring AMD EPYC Embedded SoC processors, designed for both industrial and commercial applications. It supports up to 64 GByte DDR4 SODIMM memory and offers extensive I/O capabilities including Quad GbE interfaces and multiple PCIe Gen3 lanes.', 'full_product_description': 'The COMebEP E module by Kontron is built on the COM Express Basic form factor, integrating AMD EPYC Embedded SoC processors. It is suitable for a wide range of applications due to its support for up to 64 GByte DDR4 SODIMM memory, Quad GbE interfaces, and multiple PCIe Gen3 lanes. The module is available in both commercial and industrial temperature variants, ensuring reliability in various environments.', 'target_applications': ['Industrial automation', 'Embedded computing', 'Networking']}","{'extract_features': [{'input_tokens': 2343, 'output_tokens': 722, 'time_taken': 7.126836061477661}], 'generate_missing_features': [{'input_tokens': 4546, 'output_tokens': 169, 'time_taken': 3.1730079650878906}, {'input_tokens': 3924, 'output_tokens': 52, 'time_taken': 2.2259912490844727}, {'input_tokens': 3924, 'output_tokens': 52, 'time_taken': 2.781801223754883}], 'search_missing_features': [{'input_tokens': 0, 'output_tokens': 0, 'time_taken': 17.81154775619507}, {'input_tokens': 0, 'output_tokens': 0, 'time_taken': 13.249521970748901}, {'input_tokens': 0, 'output_tokens': 0, 'time_taken': 12.014771223068237}], 'store_and_chunk_data': [{'input_tokens': 0, 'output_tokens': 0, 'time_taken': 0.845700740814209}]}","[6, 2, 2, 2]","[0, 0, 0, 0]"
MYD-C3354-4E512D-80-C-GW,{},"{'extract_features': [{'input_tokens': 2609, 'output_tokens': 780, 'time_taken': 7.761119842529297}], 'store_and_chunk_data': [{'input_tokens': 0, 'output_tokens': 0, 'time_taken': 0.6626460552215576}]}",[4],[0]
047502,{},"{'extract_features': [{'input_tokens': 2633, 'output_tokens': 765, 'time_taken': 7.742790937423706}], 'search_missing_features': [{'input_tokens': 0, 'output_tokens': 0, 'time_taken': 13.564165830612183}], 'generate_missing_features': [{'input_tokens': 4311, 'output_tokens': 177, 'time_taken': 3.314561128616333}, {'input_tokens': 4196, 'output_tokens': 147, 'time_taken': 3.784708023071289}], 'store_and_chunk_data': [{'input_tokens': 0, 'output_tokens': 0, 'time_taken': 0.5302848815917969}]}","[7, 6, 5]","[0, 0, 0]"
