id,extracted_data,usage_data,missing_feature_count_history,low_confidence_feature_count_history
SCMB30X41,"{'name': 'STRATO PI CM', 'manufacturer': 'SFERA LABS', 'form_factor': 'DIN RAIL', 'evaluation_or_commercialization': False, 'processor_architecture': 'ARM', 'processor_core_count': 'Quad-core', 'processor_manufacturer': 'ARM', 'processor_tdp': 'Not Available', 'memory': 'Up to 8GB RAM', 'onboard_storage': 'eMMC', 'input_voltage': '12-28 VDC', 'io_count': ['Ethernet port', 'Two USB type-A ports', 'RS-485 interface'], 'wireless': 'Not Available', 'operating_system_bsp': 'Raspbian', 'operating_temperature_max': '70 C', 'operating_temperature_min': '-20 C', 'certifications': ['UE EMC', 'EN EMC Immunity', 'EN Emission', 'UE RoHS'], 'short_summary': 'Industrial computer based on Raspberry Pi Compute Module with DIN rail case.', 'full_summary': 'The Strato Pi CM is an industrial computer featuring a Raspberry Pi Compute Module, housed in a compact DIN rail case. It includes features like surge and reverse polarity protection, a real-time clock with a replaceable battery, and multiple I/O interfaces.', 'full_product_description': 'Strato Pi CM is designed for industrial environments, offering a robust solution with a Raspberry Pi Compute Module pre-installed. It supports various Raspberry Pi Compute Module versions and provides essential features such as a real-time clock, Ethernet, USB ports, and RS-485 interface. The device is compliant with several EU directives and standards, ensuring reliable performance in demanding conditions.', 'target_applications': ['Industrial automation', 'IoT applications', 'Embedded systems']}","{'extract_features': [{'input_tokens': 3863, 'output_tokens': 721, 'time_taken': 8.068696975708008}], 'generate_missing_features': [{'input_tokens': 3966, 'output_tokens': 132, 'time_taken': 2.529855966567993}, {'input_tokens': 3793, 'output_tokens': 53, 'time_taken': 2.842067003250122}, {'input_tokens': 3793, 'output_tokens': 53, 'time_taken': 2.2283849716186523}], 'search_missing_features': [{'input_tokens': 0, 'output_tokens': 0, 'time_taken': 14.934634923934937}, {'input_tokens': 0, 'output_tokens': 0, 'time_taken': 12.186319828033447}, {'input_tokens': 0, 'output_tokens': 0, 'time_taken': 23.35429811477661}], 'store_and_chunk_data': [{'input_tokens': 0, 'output_tokens': 0, 'time_taken': 1.4598872661590576}]}","[5, 2, 2, 2]","[0, 0, 0, 0]"
VL-EPU-3312-EAP,"{'name': 'RAVEN', 'manufacturer': 'VERSALOGIC', 'form_factor': 'EMBEDDED', 'evaluation_or_commercialization': False, 'processor_architecture': 'X86', 'processor_core_count': 'Quad, Dual, Single', 'processor_manufacturer': 'INTEL', 'processor_tdp': '6 to 8W typical depending on model', 'memory': 'Up to 8 GB DDR3L SDRAM', 'onboard_storage': 'Up to 64 GB eMMC', 'input_voltage': '8-30 V DC', 'io_count': ['1 USB 3.0 port', '4 USB 2.0 ports', '4 RS-232/422/485 ports', '8 TTL I/O lines', '8 analog inputs'], 'wireless': 'Supports WiFi modems', 'operating_system_bsp': ['Windows', 'Windows Embedded', 'Linux', 'VxWorks'], 'operating_temperature_max': '85°C', 'operating_temperature_min': '-40°C', 'certifications': ['MIL-STD-810G', 'RoHS'], 'short_summary': 'Rugged embedded computer with Intel Atom processor, suitable for harsh environments.', 'full_summary': 'The Raven is a compact, rugged embedded computer designed for military and medical applications, featuring an Intel Atom processor, wide input voltage range, and extensive I/O capabilities.', 'full_product_description': 'The Raven is a small, ultrarugged embedded x86 computer equipped with an Intel Atom E3800 series processor. It is designed to withstand extreme temperatures, impact, and vibration, making it ideal for military and medical applications. The board supports up to 8 GB of soldered-on DDR3L RAM and up to 64 GB of onboard eMMC storage. It offers a wide range of I/O options, including USB, Ethernet, serial ports, and analog inputs, and is compatible with a variety of operating systems.', 'target_applications': ['Military', 'Medical', 'Industrial']}","{'extract_features': [{'input_tokens': 2996, 'output_tokens': 800, 'time_taken': 9.758466005325317}], 'generate_missing_features': [{'input_tokens': 3227, 'output_tokens': 39, 'time_taken': 1.6434428691864014}], 'search_missing_features': [{'input_tokens': 0, 'output_tokens': 0, 'time_taken': 11.498483896255493}], 'store_and_chunk_data': [{'input_tokens': 0, 'output_tokens': 0, 'time_taken': 0.9456996917724609}]}","[1, 0]","[0, 0]"
VL-EPME-30EAP,"{'name': 'BENGAL', 'manufacturer': 'VERSALOGIC', 'form_factor': 'PC', 'evaluation_or_commercialization': False, 'processor_architecture': 'X86', 'processor_core_count': 'Quad, Dual, Single', 'processor_manufacturer': 'INTEL', 'processor_tdp': 'Not Available', 'memory': 'Up to 8 GB DDR3L SODIMM', 'onboard_storage': 'mSATA support', 'input_voltage': '5V', 'io_count': '5 USB ports, 2 Ethernet ports, 1 SATA port, 16 Digital IO lines', 'wireless': 'Supports WiFi via Mini PCIe socket', 'operating_system_bsp': 'Windows, Windows Embedded, Linux, VxWorks, QNX', 'operating_temperature_max': '85°C', 'operating_temperature_min': '-40°C', 'certifications': 'MIL-STD-810G', 'short_summary': 'High-performance, low-power single board computer with Intel Atom processor.', 'full_summary': 'The Bengal SBC offers a high-performance, low-power solution with Intel Atom processors, supporting a range of industrial applications with extensive I/O options and robust operating temperature range.', 'full_product_description': 'The Bengal SBC is designed for high reliability and long-term availability, featuring Intel Atom processors with up to quad-core options, extensive I/O including USB, Ethernet, and SATA, and support for various operating systems. It is suitable for harsh environments with an operating temperature range from -40°C to 85°C.', 'target_applications': 'Industrial, embedded computing, OEM applications, high-reliability environments.'}","{'extract_features': [{'input_tokens': 3009, 'output_tokens': 701, 'time_taken': 8.32535696029663}], 'generate_missing_features': [{'input_tokens': 3556, 'output_tokens': 30, 'time_taken': 1.6129028797149658}, {'input_tokens': 4009, 'output_tokens': 30, 'time_taken': 2.463884115219116}], 'search_missing_features': [{'input_tokens': 0, 'output_tokens': 0, 'time_taken': 11.099678039550781}, {'input_tokens': 0, 'output_tokens': 0, 'time_taken': 8.325240135192871}], 'store_and_chunk_data': [{'input_tokens': 0, 'output_tokens': 0, 'time_taken': 0.9993422031402588}]}","[1, 1, 1]","[0, 0, 0]"
VL-EBXE-41EJP,"{'name': 'COPPERHEAD', 'manufacturer': 'VERSALOGIC', 'form_factor': 'EBX', 'evaluation_or_commercialization': False, 'processor_architecture': 'X86', 'processor_core_count': 4, 'processor_manufacturer': 'INTEL', 'processor_tdp': 'Not Available', 'memory': 'Up to 16 GB DDR3L', 'onboard_storage': 'mSATA and eUSB options', 'input_voltage': '9-15 V', 'io_count': ['10 USB ports', '4 RS-232/422/485 ports', '2 SATA ports', '2 Ethernet ports'], 'wireless': 'Supports WiFi modems', 'operating_system_bsp': ['Windows', 'Windows Embedded', 'Linux', 'VxWorks'], 'operating_temperature_max': '85°C', 'operating_temperature_min': '-40°C', 'certifications': 'MIL-STD-810G', 'short_summary': 'High-performance embedded computer with extensive I/O and Intel Ivy Bridge processors.', 'full_summary': ""The Copperhead is a high-performance embedded computer powered by Intel's 3rd Generation Ivy Bridge processors. It offers extensive I/O capabilities, high-speed memory interface, and multiple display outputs, making it suitable for digital signal processing and real-time video processing."", 'full_product_description': 'Copperhead is a high-performance embedded computer featuring Intel Ivy Bridge processors, supporting up to 16 GB DDR3L RAM, and offering a wide range of I/O interfaces including USB, Ethernet, SATA, and more. It is designed for industrial applications with a rugged design meeting MIL-STD-810G standards.', 'target_applications': ['Digital signal processing', 'Real-time video processing', 'Industrial applications']}","{'extract_features': [{'input_tokens': 3359, 'output_tokens': 746, 'time_taken': 9.611708164215088}], 'generate_missing_features': [{'input_tokens': 2845, 'output_tokens': 30, 'time_taken': 2.072072982788086}, {'input_tokens': 3477, 'output_tokens': 30, 'time_taken': 2.1667110919952393}], 'search_missing_features': [{'input_tokens': 0, 'output_tokens': 0, 'time_taken': 6.34768009185791}, {'input_tokens': 0, 'output_tokens': 0, 'time_taken': 5.0927417278289795}], 'store_and_chunk_data': [{'input_tokens': 0, 'output_tokens': 0, 'time_taken': 0.9905977249145508}]}","[1, 1, 1]","[0, 0, 0]"
PNTGK100PB0S1NTD0CB,{},"{'extract_features': [{'input_tokens': 2961, 'output_tokens': 617, 'time_taken': 7.45682168006897}], 'store_and_chunk_data': [{'input_tokens': 0, 'output_tokens': 0, 'time_taken': 1.039867877960205}]}",[12],[0]
