id,extracted_data,usage_data,missing_feature_count_history,low_confidence_feature_count_history
GUM3703ABY,"{'name': 'OVEROMORTY', 'manufacturer': 'GUMSTIX', 'form_factor': 'COM', 'evaluation_or_commercialization': 'True', 'processor_architecture': 'ARM Cortex-A8', 'processor_core_count': '1', 'processor_manufacturer': 'TEXAS INSTRUMENTS', 'processor_tdp': 'Not Available', 'memory': '512 MB RAM', 'onboard_storage': '512 MB NAND', 'input_voltage': '3.0V-5.5V', 'io_count': 'Not Available', 'wireless': ['Wi-Fi b/g/n', 'Bluetooth', 'BLE'], 'operating_system_bsp': 'Not Available', 'operating_temperature_max': '70°C', 'operating_temperature_min': '-20°C', 'certifications': 'PSA Certified', 'short_summary': 'The Overo AirSTORMBY COM features a Texas Instruments AM Sitara applications processor with Wi-Fi and Bluetooth capabilities.', 'full_summary': ""The Overo AirSTORMBY COM is equipped with a Texas Instruments AM Sitara ARM Cortex-A8 processor, offering Wi-Fi b/g/n and Bluetooth BLE connectivity through TI's WiLink wireless module. It includes 512 MB RAM and 512 MB NAND storage."", 'full_product_description': 'The Overo AirSTORMBY COM is designed for mid-level applications, featuring a single-core ARM Cortex-A8 processor from Texas Instruments. It supports wireless communication via Wi-Fi and Bluetooth, and includes a microSD card slot for storage expansion. The module uses a new Panasonic pin connector and comes with a UFL antenna collar.', 'target_applications': 'Not Available'}","{'search_missing_features': [{'input_tokens': 0, 'output_tokens': 0, 'time_taken': 15.684974193572998}, {'input_tokens': 0, 'output_tokens': 0, 'time_taken': 26.073370933532715}, {'input_tokens': 0, 'output_tokens': 0, 'time_taken': 73.64716005325317}, {'input_tokens': 0, 'output_tokens': 0, 'time_taken': 16.188491106033325}], 'generate_missing_features': [{'input_tokens': 3907, 'output_tokens': 212, 'time_taken': 5.212092876434326}, {'input_tokens': 3924, 'output_tokens': 129, 'time_taken': 2.8308839797973633}, {'input_tokens': 4414, 'output_tokens': 103, 'time_taken': 3.8022499084472656}, {'input_tokens': 4414, 'output_tokens': 103, 'time_taken': 3.9676990509033203}], 'store_and_chunk_data': [{'input_tokens': 0, 'output_tokens': 0, 'time_taken': 1.059617042541504}], 'extract_features': [{'input_tokens': 1010, 'output_tokens': 679, 'time_taken': 8.893873691558838}]}","[8, 5, 4, 4, 4]","[0, 0, 0, 0, 0]"
IEC-EDGE2-0216,"{'name': 'EDGE KIT', 'manufacturer': 'MIXTILE', 'form_factor': 'SINGLE BOARD COMPUTER', 'evaluation_or_commercialization': True, 'processor_architecture': 'ARM', 'processor_core_count': 'Quad-core', 'processor_manufacturer': 'ROCKCHIP', 'processor_tdp': 'Not Available', 'memory': '4 GBytes LPDDR4 SDRAM', 'onboard_storage': '16 GBytes eMMC Flash Memory', 'input_voltage': '12 VDC', 'io_count': ['2 x Gigabit Ethernet Port', '1 x MicroSD Flash Expansion Socket', '4 x USB 3.0 ports', '1 x HDMI', '1 x eDP', '1 x MIPI-DSI', '1 x MIPI-CSI', '2 x RS232', '2 x CAN', '2 x I2C', '2 x UART', '1 x PDM', '1 x SPDIF', '1 x Speaker', '1 x IR', '1 x ADC', '1 x SATA', '1 x RGMII', '1 x SPI', '1 x I2S', '1 x USB Real Time Clock Battery Backup'], 'wireless': ['WiFi 6 (802.11ax)', 'Dual-Mode Bluetooth', '5G', 'LoRa', 'Zigbee'], 'operating_system_bsp': ['Android', 'Linux'], 'operating_temperature_max': '70°C', 'operating_temperature_min': '-20°C', 'certifications': 'Not Available', 'short_summary': 'High performance edge computing single board computer for IoT applications.', 'full_summary': 'The MIXTILE Edge Kit is a high-performance single board computer designed for a wide range of IoT networking and computing applications. It features a Rockchip Quad-core Cortex-A SoC, 4 GBytes LPDDR4 SDRAM, and 16 GBytes eMMC Flash Memory. It supports various wireless technologies including WiFi 6, Bluetooth, 5G, LoRa, and Zigbee.', 'full_product_description': 'The MIXTILE Edge Kit is a versatile single board computer designed for edge computing in IoT applications. It includes a Rockchip Quad-core Cortex-A SoC, 4 GBytes LPDDR4 SDRAM, and 16 GBytes eMMC Flash Memory. The board supports a wide range of I/O interfaces and wireless technologies, making it suitable for diverse applications. It comes with Android and Linux Board Support Packages and operates within a temperature range of -20°C to 70°C.', 'target_applications': ['IoT networking', 'Edge computing', 'Industrial automation', 'Smart cities', 'Connected devices']}","{'search_missing_features': [{'input_tokens': 0, 'output_tokens': 0, 'time_taken': 13.035533905029297}, {'input_tokens': 0, 'output_tokens': 0, 'time_taken': 15.734719038009644}], 'generate_missing_features': [{'input_tokens': 3220, 'output_tokens': 53, 'time_taken': 3.0247020721435547}, {'input_tokens': 3551, 'output_tokens': 53, 'time_taken': 1.8900160789489746}], 'store_and_chunk_data': [{'input_tokens': 0, 'output_tokens': 0, 'time_taken': 1.272278070449829}], 'extract_features': [{'input_tokens': 1122, 'output_tokens': 964, 'time_taken': 11.233214855194092}]}","[2, 2, 2]","[0, 0, 0]"
PER-T720-M2AI-0801,"{'name': 'MAI AI EDGE COMPUTING MODULE', 'manufacturer': 'KNERON', 'form_factor': 'PCIe', 'evaluation_or_commercialization': 'True', 'processor_architecture': 'ARM', 'processor_core_count': 'Quad ARM Cortex A55', 'processor_manufacturer': 'KNERON', 'processor_tdp': 'Not Available', 'memory': 'LPDDR', 'onboard_storage': 'Not Available', 'input_voltage': 'Not Available', 'io_count': 'Not Available', 'wireless': 'Not Available', 'operating_system_bsp': ['Pytorch', 'ONNX', 'TensorFlow', 'Tensorflow lite', 'Keras', 'Caffe'], 'operating_temperature_max': '158°F (70°C)', 'operating_temperature_min': '32°F (0°C)', 'certifications': ['CE', 'FCC Class A'], 'short_summary': 'AI Edge Computing Module with Kneron KL NPU and PCIe interface.', 'full_summary': 'The MAI AI Edge Computing Module features dual Kneron KL NPUs, ARM architecture, and supports multiple AI frameworks including Pytorch and TensorFlow.', 'full_product_description': 'The MAI AI Edge Computing Module is designed for high-resolution recognition tasks, featuring dual Kneron KL NPUs, ARM Cortex M, and LPDDR memory. It supports AI frameworks such as Pytorch, ONNX, TensorFlow, Tensorflow lite, Keras, and Caffe. Certifications include CE and FCC Class A.', 'target_applications': 'AI edge computing, high-resolution recognition, industrial AI applications.'}","{'search_missing_features': [{'input_tokens': 0, 'output_tokens': 0, 'time_taken': 13.342913150787354}, {'input_tokens': 0, 'output_tokens': 0, 'time_taken': 11.783971071243286}, {'input_tokens': 0, 'output_tokens': 0, 'time_taken': 20.322916984558105}, {'input_tokens': 0, 'output_tokens': 0, 'time_taken': 20.36260676383972}, {'input_tokens': 0, 'output_tokens': 0, 'time_taken': 14.180681943893433}], 'generate_missing_features': [{'input_tokens': 2647, 'output_tokens': 202, 'time_taken': 4.879317045211792}, {'input_tokens': 2628, 'output_tokens': 173, 'time_taken': 4.129856824874878}, {'input_tokens': 3944, 'output_tokens': 183, 'time_taken': 4.122704982757568}, {'input_tokens': 3747, 'output_tokens': 123, 'time_taken': 5.222377777099609}, {'input_tokens': 3747, 'output_tokens': 123, 'time_taken': 2.3747589588165283}], 'store_and_chunk_data': [{'input_tokens': 0, 'output_tokens': 0, 'time_taken': 2.0236480236053467}], 'extract_features': [{'input_tokens': 936, 'output_tokens': 669, 'time_taken': 8.32866096496582}]}","[8, 7, 7, 5, 5, 5]","[0, 0, 0, 0, 0, 0]"
A10-OLINUXINO-LIME,"{'name': 'AOLINUXINOLIME', 'manufacturer': 'OLIMEX', 'form_factor': 'SINGLE BOARD COMPUTER', 'evaluation_or_commercialization': True, 'processor_architecture': 'ARM', 'processor_core_count': 'Dual-core', 'processor_manufacturer': 'ALLWINNER', 'processor_tdp': 'Not Available', 'memory': '512 MB DDR3 RAM', 'onboard_storage': 'MicroSD card connector', 'input_voltage': '5V', 'io_count': 'HDMI, USB Highspeed host, USB-OTG, Ethernet, GPIOs', 'wireless': 'Not Available', 'operating_system_bsp': ['Linux', 'Android'], 'operating_temperature_max': '+85C', 'operating_temperature_min': '-25C', 'certifications': 'DO-178C, DO-254', 'short_summary': 'A compact open-source ARM Linux single board computer with Allwinner A Cortex-A CPU.', 'full_summary': 'The AOLinuXinoLIME is an open-source hardware embedded ARM Linux single board computer featuring an Allwinner A Cortex-A CPU, 512 MB DDR3 RAM, HDMI, USB, Ethernet, and GPIO interfaces.', 'full_product_description': 'AOLinuXinoLIME is a compact, open-source hardware single board computer designed for embedded applications. It features an Allwinner A Cortex-A CPU, 512 MB DDR3 RAM, and supports Linux and Android operating systems. The board includes HDMI, USB Highspeed host, USB-OTG, Ethernet, and GPIO interfaces, along with a MicroSD card connector for storage expansion. It is designed for noise-immune operation with a 5V input power supply.', 'target_applications': 'Embedded systems, educational projects, prototyping, and industrial applications.'}","{'search_missing_features': [{'input_tokens': 0, 'output_tokens': 0, 'time_taken': 10.399951934814453}, {'input_tokens': 0, 'output_tokens': 0, 'time_taken': 15.804918050765991}, {'input_tokens': 0, 'output_tokens': 0, 'time_taken': 15.92215085029602}, {'input_tokens': 0, 'output_tokens': 0, 'time_taken': 22.537845849990845}, {'input_tokens': 0, 'output_tokens': 0, 'time_taken': 17.640947103500366}], 'generate_missing_features': [{'input_tokens': 2940, 'output_tokens': 154, 'time_taken': 4.4922871589660645}, {'input_tokens': 3567, 'output_tokens': 108, 'time_taken': 3.5599381923675537}, {'input_tokens': 3542, 'output_tokens': 79, 'time_taken': 2.3186018466949463}, {'input_tokens': 3881, 'output_tokens': 53, 'time_taken': 3.059391975402832}, {'input_tokens': 3881, 'output_tokens': 53, 'time_taken': 3.057912826538086}], 'store_and_chunk_data': [{'input_tokens': 0, 'output_tokens': 0, 'time_taken': 1.2073540687561035}], 'extract_features': [{'input_tokens': 1754, 'output_tokens': 718, 'time_taken': 8.73923921585083}]}","[6, 4, 3, 2, 2, 2]","[0, 0, 0, 0, 0, 0]"
EmQ-i2506,"{'name': 'EMQI INTEL ATOM N QSEVEN CPU MODULE', 'manufacturer': 'ARBOR TECHNOLOGY', 'form_factor': 'QSEVEN', 'evaluation_or_commercialization': True, 'processor_architecture': 'Apollo Lake', 'processor_core_count': '8', 'processor_manufacturer': 'INTEL', 'processor_tdp': '15W', 'memory': '2 GB DDR3 SDRAM', 'onboard_storage': 'eMMC 5.0 up to 16GB/32GB', 'input_voltage': '5V', 'io_count': ['4 USB ports', '2 PCIe x1 lanes', '1 LPC interface', '2 Serial ATA ports'], 'wireless': 'Not Available', 'operating_system_bsp': 'Windows 10 64-bit, Linux: Ubuntu', 'operating_temperature_max': '85°C', 'operating_temperature_min': '-40°C', 'certifications': 'Not Available', 'short_summary': 'Fanless Qseven CPU module with Intel Atom N processor and extended temperature range.', 'full_summary': 'The EmQi Intel Atom N Qseven CPU Module features a fanless design with a soldered onboard Intel Atom N processor, supporting single channel 18-bit LVDS, analog RGB, and DDI port. It includes integrated Gigabit Ethernet and supports extended operating temperatures.', 'full_product_description': 'The EmQi Intel Atom N Qseven CPU Module is designed for embedded applications requiring a compact form factor and reliable performance. It features a soldered onboard Intel Atom N 1.6 GHz processor, 2 GB DDR3 SDRAM, and supports various display interfaces including LVDS and RGB. The module includes multiple I/O options such as USB, PCIe, and SATA, making it suitable for a wide range of industrial applications.', 'target_applications': 'Industrial applications, embedded systems, evaluation and development platforms.'}","{'search_missing_features': [{'input_tokens': 0, 'output_tokens': 0, 'time_taken': 12.441733121871948}, {'input_tokens': 0, 'output_tokens': 0, 'time_taken': 25.202763080596924}, {'input_tokens': 0, 'output_tokens': 0, 'time_taken': 17.74863290786743}, {'input_tokens': 0, 'output_tokens': 0, 'time_taken': 18.348912239074707}, {'input_tokens': 0, 'output_tokens': 0, 'time_taken': 18.08272409439087}], 'generate_missing_features': [{'input_tokens': 3445, 'output_tokens': 254, 'time_taken': 5.649088144302368}, {'input_tokens': 3657, 'output_tokens': 102, 'time_taken': 3.44929575920105}, {'input_tokens': 3575, 'output_tokens': 76, 'time_taken': 3.608166217803955}, {'input_tokens': 3199, 'output_tokens': 77, 'time_taken': 2.3022348880767822}, {'input_tokens': 3966, 'output_tokens': 52, 'time_taken': 3.4583239555358887}], 'store_and_chunk_data': [{'input_tokens': 0, 'output_tokens': 0, 'time_taken': 1.252124309539795}], 'extract_features': [{'input_tokens': 1087, 'output_tokens': 725, 'time_taken': 8.700820922851562}]}","[9, 4, 3, 3, 2, 2]","[0, 0, 0, 0, 0, 0]"
