id,extracted_data,usage_data,missing_feature_count_history,low_confidence_feature_count_history
AIMB-564VG-00A1E,"{'name': 'AIMB', 'manufacturer': 'ADVANTECH', 'form_factor': 'MICROATX', 'evaluation_or_commercialization': False, 'processor_architecture': 'X86', 'processor_core_count': 'QUADCORE', 'processor_manufacturer': 'INTEL', 'processor_tdp': 'Intel Celeron J1900: 10 watts, Intel Celeron N2930: 7.5 watts, Intel Celeron N2807: 4.3 watts', 'memory': 'DDR2 800 MHz SDRAM, Max Capacity 8 GB', 'onboard_storage': '1 x mSATA', 'input_voltage': '+3.3 V, +5 V, ±12 V, +5 VSB', 'io_count': ['PCIe x16 slot', 'PCIe x4 slot', 'PCI 32-bit 33 MHz slots', 'USB 2.0 ports', 'Serial RS-232', 'Parallel port', 'PS/2 keyboard and mouse', 'eSATA', 'IEEE 1394'], 'wireless': 'Wireless I/O & Sensors', 'operating_system_bsp': ['Windows XP Embedded', 'SUSIAccess Embedded Software APIs'], 'operating_temperature_max': '60 C', 'operating_temperature_min': '0 C', 'certifications': 'FCC Part 15 Class B', 'short_summary': 'Industrial motherboard with Intel Core QuadCore/Duo support, MicroATX form factor, and extensive I/O options.', 'full_summary': 'The AIMB motherboard supports Intel Core QuadCore and Duo processors, features a MicroATX form factor, and offers a wide range of I/O interfaces including PCIe slots, USB ports, and more. It is designed for industrial applications with support for Windows XP Embedded and SUSIAccess APIs.', 'full_product_description': 'The AIMB motherboard is equipped with Intel Core QuadCore and Duo processors, providing robust performance for industrial applications. It features a MicroATX form factor, dual-channel DDR2 800 MHz SDRAM support up to 8 GB, and a variety of I/O options including PCIe slots, USB ports, and serial interfaces. The board supports SATA RAID and single 10/100 Mbps Ethernet via dedicated PCIe x1 bus. It is compatible with Windows XP Embedded and includes SUSIAccess Embedded Software APIs for enhanced functionality.', 'target_applications': ['Industrial automation', 'Embedded systems', 'Networking']}","{'extract_features': [{'input_tokens': 1423, 'output_tokens': 821, 'time_taken': 9.665650129318237}], 'search_missing_features': [{'input_tokens': 0, 'output_tokens': 0, 'time_taken': 28.57372784614563}, {'input_tokens': 0, 'output_tokens': 0, 'time_taken': 21.279476165771484}], 'generate_missing_features': [{'input_tokens': 4237, 'output_tokens': 184, 'time_taken': 4.676125764846802}, {'input_tokens': 4486, 'output_tokens': 63, 'time_taken': 3.721648931503296}], 'store_and_chunk_data': [{'input_tokens': 0, 'output_tokens': 0, 'time_taken': 1.2512073516845703}]}","[5, 2, 0]","[0, 0, 0]"
ATR2406-DEV-KIT2,{},"{'extract_features': [{'input_tokens': 1393, 'output_tokens': 734, 'time_taken': 9.290467977523804}], 'store_and_chunk_data': [{'input_tokens': 0, 'output_tokens': 0, 'time_taken': 2.010962963104248}]}",[9],[0]
TC670slashi3-12300HE,"{'name': 'CONGATC', 'manufacturer': 'CONGATEC GMBH', 'form_factor': 'COM EXPRESS COMPACT', 'evaluation_or_commercialization': False, 'processor_architecture': 'X86', 'processor_core_count': '6 P-Cores, 8 E-Cores, 2 Low Power E-Cores', 'processor_manufacturer': 'INTEL', 'processor_tdp': '28W', 'memory': 'DDR4, 64 GB MAX', 'onboard_storage': 'NVMe SSD optional', 'input_voltage': 'Not Available', 'io_count': ['PCIe Gen 4', 'USB 3.2', 'USB 2.0', 'SATA', 'UART', 'CAN', 'GPIO', 'SPI', 'LPC', 'SM Bus', 'IC Audio HDA'], 'wireless': 'Not Available', 'operating_system_bsp': ['Microsoft Windows 10', 'Microsoft Windows 11', 'Microsoft Windows IoT Enterprise', 'Linux', 'Yocto'], 'operating_temperature_max': '60°C', 'operating_temperature_min': '0°C', 'certifications': 'Not Available', 'short_summary': 'COM Express Compact module with Intel Core iHE processor and Intel Iris Xe Graphics.', 'full_summary': 'The CONGATC is a COM Express Compact module featuring Intel Core iHE processors with Intel Iris Xe Graphics, supporting dual-channel DDR4 memory and various I/O interfaces.', 'full_product_description': ""The CONGATC module is designed for embedded applications, featuring Intel's latest Core iHE processors with hybrid architecture, offering a combination of performance and efficiency cores. It supports up to 64 GB of DDR4 memory, NVMe SSD storage, and a wide range of I/O interfaces including PCIe, USB, SATA, and more. The module is suitable for industrial applications with an operating temperature range of 0°C to 60°C."", 'target_applications': ['Industrial Automation', 'Embedded Systems', 'IoT Devices']}","{'extract_features': [{'input_tokens': 1475, 'output_tokens': 783, 'time_taken': 9.647480964660645}], 'search_missing_features': [{'input_tokens': 0, 'output_tokens': 0, 'time_taken': 16.271039962768555}, {'input_tokens': 0, 'output_tokens': 0, 'time_taken': 14.21606707572937}, {'input_tokens': 0, 'output_tokens': 0, 'time_taken': 20.109073877334595}], 'generate_missing_features': [{'input_tokens': 4043, 'output_tokens': 143, 'time_taken': 4.159915924072266}, {'input_tokens': 3635, 'output_tokens': 75, 'time_taken': 2.2915849685668945}, {'input_tokens': 3546, 'output_tokens': 75, 'time_taken': 3.4086902141571045}], 'store_and_chunk_data': [{'input_tokens': 0, 'output_tokens': 0, 'time_taken': 1.4420149326324463}]}","[5, 3, 3, 3]","[0, 0, 0, 0]"
RXCA10S066PF34-SOM00T,"{'name': 'ACHILLES ARRIA SOC SYSTEMONMODULE', 'manufacturer': 'REFLEX CES', 'form_factor': 'System on Module', 'evaluation_or_commercialization': False, 'processor_architecture': 'ARM', 'processor_core_count': 'Dual-core', 'processor_manufacturer': 'Intel', 'processor_tdp': 'Not Available', 'memory': 'DDR Memory, bit wide bank', 'onboard_storage': 'Nand Flash, eMMC', 'input_voltage': '+5.5V-17V', 'io_count': 'Gigabit Ethernet, USB, UART, LVDS pairs', 'wireless': 'Not Available', 'operating_system_bsp': 'Linux, U-Boot', 'operating_temperature_max': 'Not Available', 'operating_temperature_min': 'Not Available', 'certifications': 'Not Available', 'short_summary': 'Achilles Arria SoC System on Module with dual ARM Cortex-A9 MPCore processor.', 'full_summary': 'The Achilles Arria SoC System on Module features an Intel Arria FPGA with a dual ARM Cortex-A9 MPCore processor, suitable for embedded and industrial applications.', 'full_product_description': 'Achilles Arria SoC System on Module integrates Intel Arria FPGA and dual ARM Cortex-A9 MPCore processor, offering high-speed transceivers, DDR memory, and multiple I/O interfaces including Gigabit Ethernet and USB. It supports Linux OS and U-Boot bootloader.', 'target_applications': 'Life Science Instrumentation, Printing Machines, Radar Systems, Communication Networking'}","{'extract_features': [{'input_tokens': 1454, 'output_tokens': 665, 'time_taken': 8.962064981460571}], 'search_missing_features': [{'input_tokens': 0, 'output_tokens': 0, 'time_taken': 15.652595043182373}, {'input_tokens': 0, 'output_tokens': 0, 'time_taken': 20.467259883880615}, {'input_tokens': 0, 'output_tokens': 0, 'time_taken': 12.453968286514282}], 'generate_missing_features': [{'input_tokens': 2925, 'output_tokens': 156, 'time_taken': 3.9456698894500732}, {'input_tokens': 3114, 'output_tokens': 126, 'time_taken': 2.565842866897583}, {'input_tokens': 3671, 'output_tokens': 126, 'time_taken': 4.838177680969238}], 'store_and_chunk_data': [{'input_tokens': 0, 'output_tokens': 0, 'time_taken': 1.4338769912719727}]}","[6, 5, 5, 5]","[0, 0, 0, 0]"
ARK-1122C-S6A1E,"{'name': 'ARK-2120', 'manufacturer': 'ADVANTECH', 'form_factor': 'PALMSIZE', 'evaluation_or_commercialization': False, 'processor_architecture': 'X86', 'processor_core_count': '2', 'processor_manufacturer': 'INTEL', 'processor_tdp': '19 Watt', 'memory': 'Up to 4GB DDR3 1066MHz', 'onboard_storage': 'mSATA', 'input_voltage': '12VDC', 'io_count': ['4 x COM ports', '6 x USB ports', '2 x LAN ports'], 'wireless': 'WiFi module support', 'operating_system_bsp': ['Microsoft Windows 7', 'Windows 7 Pro 32-bit', 'WES 7 32-bit', 'XP Embedded'], 'operating_temperature_max': '60°C', 'operating_temperature_min': '-20°C', 'certifications': ['CE', 'FCC Class A', 'CCC', 'BSMI', 'CB', 'UL'], 'short_summary': 'Fanless embedded box PC with Intel Atom dual-core processor, supporting wide temperature range and multiple I/O interfaces.', 'full_summary': 'The ARK-2120 is a fanless embedded box PC featuring an Intel Atom dual-core processor, palm-size form factor, and support for a wide range of operating temperatures. It offers extensive I/O options including COM ports, USB ports, and LAN connectivity, making it suitable for various industrial applications.', 'full_product_description': 'The ARK-2120 is designed for industrial applications requiring a compact, fanless solution. It features an Intel Atom dual-core N2600 processor, up to 4GB DDR3 memory, and mSATA storage. The device supports a wide operating temperature range from -20°C to 60°C, making it ideal for harsh environments. It includes multiple I/O interfaces such as COM ports, USB ports, and LAN ports, and supports optional WiFi modules. The system is housed in an aluminum chassis and offers flexible mounting options including VESA, DIN rail, and wall mounts.', 'target_applications': ['Industrial automation', 'Kiosk systems', 'Digital signage', 'Transportation']}","{'extract_features': [{'input_tokens': 1411, 'output_tokens': 846, 'time_taken': 10.404668807983398}], 'search_missing_features': [{'input_tokens': 0, 'output_tokens': 0, 'time_taken': 9.979867935180664}], 'generate_missing_features': [{'input_tokens': 2559, 'output_tokens': 32, 'time_taken': 2.5183768272399902}], 'store_and_chunk_data': [{'input_tokens': 0, 'output_tokens': 0, 'time_taken': 1.4295072555541992}]}","[1, 0]","[0, 0]"
