id,extracted_data,usage_data,missing_feature_count_history,low_confidence_feature_count_history
SOM-4455R-L0A2E,"{'name': 'AMD LX LVDS VT DEVELOPMENT BOARD', 'manufacturer': 'ADVANTECH', 'form_factor': 'ETX', 'evaluation_or_commercialization': True, 'processor_architecture': 'X86', 'processor_core_count': 'Not Available', 'processor_manufacturer': 'AMD', 'processor_tdp': 'Up to 54W', 'memory': 'Up to 1 GB DDR 333 MHz', 'onboard_storage': 'Type II CF socket', 'input_voltage': '5V, 5VSB', 'io_count': ['PCI', 'ISA', 'IDE', 'SATA', 'USB', 'Ethernet', 'COM', 'LPT', 'FDD'], 'wireless': 'Not Available', 'operating_system_bsp': ['WinCE', 'Win XPE', 'QNX'], 'operating_temperature_max': '60°C', 'operating_temperature_min': '0°C', 'certifications': 'CE/FCC Class B', 'short_summary': 'The AMD LX LVDS VT Development Board is an ETX form factor board featuring an AMD Geode LX processor, supporting DDR memory and various I/O interfaces.', 'full_summary': 'The AMD LX LVDS VT Development Board is designed for embedded applications, featuring an AMD Geode LX processor, DDR memory support, and a range of I/O interfaces including PCI, ISA, IDE, SATA, USB, and Ethernet. It supports multiple operating systems including WinCE, Win XPE, and QNX.', 'full_product_description': 'The AMD LX LVDS VT Development Board is an ETX form factor board equipped with an AMD Geode LX processor and AMD CS chipset. It supports up to 1 GB of DDR 333 MHz memory via a 200-pin SODIMM socket. The board includes integrated graphics with support for LVDS and TTL displays, and offers a variety of I/O options such as PCI, ISA, IDE, SATA, USB, and Ethernet. It is designed for fanless operation with a passive thermal solution and supports operating temperatures from 0°C to 60°C.', 'target_applications': 'Embedded systems, industrial automation, and development environments.'}","{'extract_features': [{'input_tokens': 1470, 'output_tokens': 815, 'time_taken': 9.215327024459839}], 'search_missing_features': [{'input_tokens': 0, 'output_tokens': 0, 'time_taken': 16.013274908065796}, {'input_tokens': 0, 'output_tokens': 0, 'time_taken': 21.82180619239807}, {'input_tokens': 0, 'output_tokens': 0, 'time_taken': 20.396177768707275}], 'generate_missing_features': [{'input_tokens': 4499, 'output_tokens': 110, 'time_taken': 4.660486221313477}, {'input_tokens': 4164, 'output_tokens': 53, 'time_taken': 3.4368929862976074}, {'input_tokens': 4074, 'output_tokens': 53, 'time_taken': 4.887750864028931}], 'store_and_chunk_data': [{'input_tokens': 0, 'output_tokens': 0, 'time_taken': 1.2138009071350098}]}","[4, 2, 2, 2]","[0, 0, 0, 0]"
CM3-BT1-E3815,"{'name': 'CMBT EXTREME RUGGED PCI SINGLE BOARD COMPUTER', 'manufacturer': 'ADLINK TECHNOLOGY', 'form_factor': 'PCI', 'evaluation_or_commercialization': False, 'processor_architecture': 'IA-32', 'processor_core_count': 'Singlecore', 'processor_manufacturer': 'INTEL', 'processor_tdp': '5W', 'memory': 'Up to 8GB DDR3L 1333MHz', 'onboard_storage': '4GB solid state storage', 'input_voltage': 'ATX 12V', 'io_count': 'USB 2.0 x 4, USB 3.0 x 2, SATA 3Gb/s x 2, GPIO x 8', 'wireless': 'Not Available', 'operating_system_bsp': ['Windows 10 64-bit', 'Linux 64-bit', 'QNX', 'VxWorks'], 'operating_temperature_max': '85°C', 'operating_temperature_min': '-40°C', 'certifications': ['IEC 60068-2-27', 'IEC 60068-2-64', 'MIL-STD-810F'], 'short_summary': 'Rugged PCI single board computer with Intel Atom processor, supporting extreme temperatures.', 'full_summary': 'The CMBT Extreme Rugged PCI Single Board Computer features an Intel Atom Processor E Series SOC, supporting up to 8GB DDR3L memory, and is designed for extreme temperature environments.', 'full_product_description': 'The CMBT Extreme Rugged PCI Single Board Computer by ADLINK Technology is equipped with a single-core Intel Atom Processor E Series SOC. It supports up to 8GB DDR3L 1333MHz memory and features multiple I/O interfaces including USB, SATA, and GPIO. The board is designed to operate in extreme temperatures ranging from -40°C to 85°C, making it suitable for harsh environments. It supports various operating systems including Windows 10, Linux, QNX, and VxWorks. The board also includes features like Intel HD Audio, dual BIOS, and a watchdog timer.', 'target_applications': ['Industrial automation', 'Military applications', 'Embedded systems']}","{'extract_features': [{'input_tokens': 1488, 'output_tokens': 810, 'time_taken': 9.073090076446533}], 'search_missing_features': [{'input_tokens': 0, 'output_tokens': 0, 'time_taken': 17.243669986724854}, {'input_tokens': 0, 'output_tokens': 0, 'time_taken': 15.920866012573242}, {'input_tokens': 0, 'output_tokens': 0, 'time_taken': 15.397144079208374}, {'input_tokens': 0, 'output_tokens': 0, 'time_taken': 26.323966026306152}], 'generate_missing_features': [{'input_tokens': 4207, 'output_tokens': 79, 'time_taken': 3.64585018157959}, {'input_tokens': 3755, 'output_tokens': 58, 'time_taken': 5.093587875366211}, {'input_tokens': 4101, 'output_tokens': 29, 'time_taken': 3.6159932613372803}, {'input_tokens': 4056, 'output_tokens': 29, 'time_taken': 1.719270944595337}], 'store_and_chunk_data': [{'input_tokens': 0, 'output_tokens': 0, 'time_taken': 1.9351611137390137}]}","[3, 2, 1, 1, 1]","[0, 0, 0, 0, 0]"
SRX2160S01D00GE064V21C0,{},"{'extract_features': [{'input_tokens': 1510, 'output_tokens': 710, 'time_taken': 9.922224760055542}], 'search_missing_features': [{'input_tokens': 0, 'output_tokens': 0, 'time_taken': 19.47611403465271}], 'generate_missing_features': [{'input_tokens': 4237, 'output_tokens': 53, 'time_taken': 2.1689672470092773}, {'input_tokens': 4215, 'output_tokens': 53, 'time_taken': 3.743964910507202}], 'store_and_chunk_data': [{'input_tokens': 0, 'output_tokens': 0, 'time_taken': 1.843832015991211}]}","[2, 2, 2]","[0, 0, 0]"
D:\mouser\mouser_devkit\QC-DB-M10023A,"{'name': 'OPENQ 820A DEVELOPMENT KIT', 'manufacturer': 'INTRINSYC TECHNOLOGIES CORPORATION', 'form_factor': 'EXPOSED BOARD', 'evaluation_or_commercialization': True, 'processor_architecture': 'ARM', 'processor_core_count': '8', 'processor_manufacturer': 'QUALCOMM TECHNOLOGIES INC', 'processor_tdp': 'Not Available', 'memory': '3 GB LPDDR4 RAM', 'onboard_storage': '32 GB eMMC Flash', 'input_voltage': '12 V', 'io_count': ['USB Type C', 'Debug UART', 'GPIO expansion header', 'SPI', 'I2C buses', 'Haptics output'], 'wireless': ['Wi-Fi a/b/g/n/ac', 'Bluetooth BLE', 'GPS', 'GLONASS', 'Compass'], 'operating_system_bsp': 'Android Oreo', 'operating_temperature_max': '+70 °C', 'operating_temperature_min': '-10 °C', 'certifications': 'Pre-certified Wi-Fi/BT module', 'short_summary': 'Cost-effective, feature-rich development kit powered by Qualcomm Snapdragon processor, ideal for AI-enabled home hub products.', 'full_summary': 'The OpenQ 820A Development Kit is a cost-effective, feature-rich exposed board platform powered by the OpenQ 820A SOM based on the Snapdragon processor by Qualcomm Technologies Inc. It is ideal for evaluating the OpenQ 820A SOM and jumpstarting development of AI-enabled home hub products requiring tasks such as video conferencing, remote video monitoring, and movie/video streaming.', 'full_product_description': 'The OpenQ 820A Development Kit includes a carrier board and SOM with 3 GB LPDDR4 RAM and 32 GB eMMC Flash. It features a Qualcomm Snapdragon APQ8096 processor with an octa-core 64-bit ARM Cortex-A72 CPU and Qualcomm Adreno GPU. The kit supports audio with included microphones and stereo speaker amps, video options with camera accessory and LCD touch panel accessory, and wireless capabilities including Wi-Fi, Bluetooth, GPS, GLONASS, and Compass. It also offers generous IO expansion headers and supports Android Oreo.', 'target_applications': ['AI-enabled home hub products', 'Video conferencing', 'Remote video monitoring', 'Movie/video streaming']}","{'extract_features': [{'input_tokens': 1528, 'output_tokens': 850, 'time_taken': 11.14397382736206}], 'search_missing_features': [{'input_tokens': 0, 'output_tokens': 0, 'time_taken': 46.92714810371399}, {'input_tokens': 0, 'output_tokens': 0, 'time_taken': 30.25437903404236}, {'input_tokens': 0, 'output_tokens': 0, 'time_taken': 19.380613088607788}, {'input_tokens': 0, 'output_tokens': 0, 'time_taken': 14.477062702178955}], 'generate_missing_features': [{'input_tokens': 3001, 'output_tokens': 80, 'time_taken': 2.360504150390625}, {'input_tokens': 3097, 'output_tokens': 86, 'time_taken': 4.742754697799683}, {'input_tokens': 3342, 'output_tokens': 30, 'time_taken': 2.90402889251709}, {'input_tokens': 3342, 'output_tokens': 30, 'time_taken': 2.970533847808838}], 'store_and_chunk_data': [{'input_tokens': 0, 'output_tokens': 0, 'time_taken': 2.24182391166687}]}","[3, 3, 1, 1, 1]","[0, 0, 0, 0, 0]"
SRM6828S00D01GE000B01CH,{},"{'extract_features': [{'input_tokens': 1542, 'output_tokens': 867, 'time_taken': 9.868335008621216}], 'store_and_chunk_data': [{'input_tokens': 0, 'output_tokens': 0, 'time_taken': 1.8767690658569336}]}",[4],[0]
