id,extracted_data,usage_data,missing_feature_count_history,low_confidence_feature_count_history
ARK-2232L-S6A1,"{'name': 'ARKL', 'manufacturer': 'ADVANTECH', 'form_factor': 'MINI PCIE', 'evaluation_or_commercialization': False, 'processor_architecture': 'X86', 'processor_core_count': '4', 'processor_manufacturer': 'INTEL', 'processor_tdp': '35W', 'memory': 'DDR3L, 8GB MAX', 'onboard_storage': 'MSATA, SATA', 'input_voltage': '12V', 'io_count': '4 USB, 4 COM, 2 LAN, 1 HDMI, 1 VGA', 'wireless': 'WiFi', 'operating_system_bsp': 'WINDOWS, LINUX', 'operating_temperature_max': '60C', 'operating_temperature_min': '-20C', 'certifications': 'UL, CB, CCC, BSMI, CE, FCC CLASS B, ROHS', 'short_summary': 'Fanless Embedded Box PC with Intel Atom E Quad Core SoC, dual independent displays, and extended temperature support.', 'full_summary': 'The ARKL is a fanless embedded box PC featuring an Intel Atom E Quad Core SoC, dual independent displays via HDMI and VGA, and a robust design for extended temperature ranges. It supports multiple expansion options including Mini PCIe and Advantech iDoor modules.', 'full_product_description': 'The ARKL is a modular fanless box PC designed for industrial applications. It is powered by an Intel Atom E Quad Core SoC and supports dual independent displays with HDMI and VGA outputs. The system is equipped with DDR3L memory support up to 8GB, and offers multiple storage options including mSATA and SATA. It features a wide range of I/O interfaces, including USB, COM, and LAN ports, and supports wireless communication via WiFi modules. The ARKL is compliant with various certifications such as UL, CB, CCC, BSMI, CE, and FCC Class B, and is designed to operate in harsh environments with an extended temperature range of -20C to 60C.', 'target_applications': 'Industrial automation, IoT, digital signage, transportation'}","{'extract_features': [{'input_tokens': 2189, 'output_tokens': 805, 'time_taken': 8.903339862823486}], 'generate_missing_features': [{'input_tokens': 3729, 'output_tokens': 32, 'time_taken': 1.9448258876800537}], 'search_missing_features': [{'input_tokens': 0, 'output_tokens': 0, 'time_taken': 13.5555100440979}], 'store_and_chunk_data': [{'input_tokens': 0, 'output_tokens': 0, 'time_taken': 0.6848759651184082}]}","[1, 0]","[0, 0]"
TR4slashR1505G,"{'name': 'CONGATR', 'manufacturer': 'CONGATEC', 'form_factor': 'COM EXPRESS BASIC', 'evaluation_or_commercialization': False, 'processor_architecture': 'ZEN', 'processor_core_count': 'Not Available', 'processor_manufacturer': 'AMD', 'processor_tdp': 'Scalable', 'memory': 'Dual channel DDR4, 3200 MT/s', 'onboard_storage': 'Not Available', 'input_voltage': 'Not Available', 'io_count': ['4x USB 3.1 Gen 2', '4x USB 2.0', '4x SATA 6Gb/s', '1x Gigabit Ethernet', '32x PCI Express lanes'], 'wireless': 'Not Available', 'operating_system_bsp': ['Microsoft Windows', 'Microsoft Windows IoT Enterprise', 'Linux'], 'operating_temperature_max': '85°C', 'operating_temperature_min': '-40°C', 'certifications': 'Not Available', 'short_summary': 'High-performance COM Express module with AMD Zen core architecture and Vega GPU.', 'full_summary': ""The CONGATR is a high-performance COM Express Basic module featuring AMD's next-generation V processor series with Zen core architecture and improved graphics performance via Vega GPU. It supports dual-channel DDR4 memory and offers extensive I/O interfaces."", 'full_product_description': ""The CONGATR module is designed for high-performance applications, featuring AMD's Zen core architecture and Vega GPU for enhanced graphics. It supports dual-channel DDR4 memory up to 3200 MT/s and offers a wide range of I/O interfaces including USB 3.1, SATA, and PCI Express lanes. The module is suitable for both commercial and industrial applications with an operating temperature range from -40°C to 85°C."", 'target_applications': ['Industrial automation', 'Embedded systems', 'Graphics-intensive applications']}","{'extract_features': [{'input_tokens': 2163, 'output_tokens': 755, 'time_taken': 12.948559045791626}], 'generate_missing_features': [{'input_tokens': 4043, 'output_tokens': 123, 'time_taken': 2.6184918880462646}, {'input_tokens': 4100, 'output_tokens': 123, 'time_taken': 2.8642611503601074}], 'search_missing_features': [{'input_tokens': 0, 'output_tokens': 0, 'time_taken': 13.533690214157104}, {'input_tokens': 0, 'output_tokens': 0, 'time_taken': 12.390482902526855}], 'store_and_chunk_data': [{'input_tokens': 0, 'output_tokens': 0, 'time_taken': 0.6291031837463379}]}","[5, 5, 5]","[0, 0, 0]"
conga-TCGslashGX-217GA,"{'name': 'CONGATEC CONGATCG', 'manufacturer': 'CONGATEC', 'form_factor': 'COM EXPRESS', 'evaluation_or_commercialization': False, 'processor_architecture': 'X86', 'processor_core_count': '4', 'processor_manufacturer': 'AMD', 'processor_tdp': '15W', 'memory': '8GB ECC DDR3L', 'onboard_storage': 'Not Available', 'input_voltage': 'Not Available', 'io_count': 'PCIe, SATA, USB, LPC, GPIO', 'wireless': 'Not Available', 'operating_system_bsp': ['Microsoft Windows', 'Linux'], 'operating_temperature_max': '85C', 'operating_temperature_min': '-40C', 'certifications': 'CE', 'short_summary': 'High-performance COM Express module with AMD Embedded G-Series SOC.', 'full_summary': 'The congatec congaTCG is a COM Express module featuring AMD Embedded G-Series SOC, offering high performance with integrated graphics and ECC memory support, suitable for industrial applications.', 'full_product_description': 'The congatec congaTCG module is designed for industrial applications, featuring AMD Embedded G-Series SOC with quad-core processors, integrated Radeon HD graphics, and ECC DDR3L memory. It supports multiple I/O interfaces including PCIe, SATA, USB, and more, with an industrial temperature range.', 'target_applications': ['Industrial Automation', 'Embedded Systems', 'Digital Signage']}","{'extract_features': [{'input_tokens': 2326, 'output_tokens': 662, 'time_taken': 12.074075937271118}], 'generate_missing_features': [{'input_tokens': 3168, 'output_tokens': 76, 'time_taken': 2.351564884185791}, {'input_tokens': 3841, 'output_tokens': 76, 'time_taken': 2.637298107147217}], 'search_missing_features': [{'input_tokens': 0, 'output_tokens': 0, 'time_taken': 14.62009882926941}, {'input_tokens': 0, 'output_tokens': 0, 'time_taken': 12.238461971282959}], 'store_and_chunk_data': [{'input_tokens': 0, 'output_tokens': 0, 'time_taken': 1.2460689544677734}]}","[3, 3, 3]","[0, 0, 0]"
LEC-EL-6200FE-2G-32G-CT,"{'name': 'SMARC SHORT SIZE MODULE', 'manufacturer': 'ADLINK TECHNOLOGY INC', 'form_factor': 'SMARC', 'evaluation_or_commercialization': False, 'processor_architecture': 'X86', 'processor_core_count': '4', 'processor_manufacturer': 'INTEL', 'processor_tdp': '12W', 'memory': '8GB LPDDR4', 'onboard_storage': '64GB eMMC', 'input_voltage': '12V DC', 'io_count': 'USB 3.0, USB 2.0, SATA, CAN, Ethernet', 'wireless': 'Not Available', 'operating_system_bsp': ['Windows IoT Enterprise', 'Yocto Linux', 'Ubuntu', 'VxWorks'], 'operating_temperature_max': '85°C', 'operating_temperature_min': '-40°C', 'certifications': 'IEC, MIL-STD-810F', 'short_summary': 'A compact SMARC module with Intel Atom processor, suitable for industrial applications.', 'full_summary': 'The SMARC Short Size Module features a quad-core Intel Atom processor, offering robust performance for industrial applications. It supports multiple I/O interfaces, including USB, SATA, and Ethernet, and operates in a wide temperature range.', 'full_product_description': 'The SMARC Short Size Module by ADLINK Technology Inc is designed for industrial use, featuring a quad-core Intel Atom processor with a TDP of 12W. It includes 8GB of LPDDR4 memory and 64GB of eMMC storage. The module supports a variety of I/O interfaces such as USB 3.0, USB 2.0, SATA, CAN, and Ethernet. It is compliant with SMARC specifications and operates in temperatures ranging from -40°C to 85°C.', 'target_applications': ['Industrial Automation', 'Embedded Systems', 'IoT Devices']}","{'extract_features': [{'input_tokens': 2492, 'output_tokens': 746, 'time_taken': 13.873730182647705}], 'generate_missing_features': [{'input_tokens': 4126, 'output_tokens': 29, 'time_taken': 2.2518279552459717}, {'input_tokens': 4126, 'output_tokens': 29, 'time_taken': 1.956258773803711}], 'search_missing_features': [{'input_tokens': 0, 'output_tokens': 0, 'time_taken': 13.680653095245361}, {'input_tokens': 0, 'output_tokens': 0, 'time_taken': 13.651213884353638}], 'store_and_chunk_data': [{'input_tokens': 0, 'output_tokens': 0, 'time_taken': 0.8387100696563721}]}","[1, 1, 1]","[0, 0, 0]"
Conga-PA5slashN4200E-8G,"{'name': 'CONGAPA', 'manufacturer': 'CONGATEC', 'form_factor': 'PICOITX', 'evaluation_or_commercialization': False, 'processor_architecture': 'X86', 'processor_core_count': 'Quad Core', 'processor_manufacturer': 'INTEL', 'processor_tdp': '6W', 'memory': '8GB LPDDR4', 'onboard_storage': 'eMMC 5.1 flash storage, up to 128 GB', 'input_voltage': '12V', 'io_count': ['2x LAN', '4x USB', '1x DisplayPort', '1x SATA', '1x miniPCIe'], 'wireless': 'WiFi and WWAN support via M.2 Key-E interface', 'operating_system_bsp': ['Microsoft Windows', 'Microsoft Windows IoT Enterprise', 'Microsoft Windows IoT Core', 'Linux', 'Android'], 'operating_temperature_max': '85°C', 'operating_temperature_min': '-40°C', 'certifications': 'DIN EN ISO 9001', 'short_summary': 'Compact Pico-ITX board with Intel Atom, Celeron, and Pentium processors, suitable for industrial applications.', 'full_summary': 'The CONGAPA is a Pico-ITX single board computer featuring Intel Atom, Celeron, and Pentium processors, designed for industrial environments with extended temperature variants and enhanced security features.', 'full_product_description': 'The CONGAPA Pico-ITX board is equipped with Intel Atom, Celeron, and Pentium processors, offering quad-core performance and low power consumption. It supports up to 8GB LPDDR4 memory, features multiple I/O options including LAN, USB, and DisplayPort, and is designed for harsh environments with extended temperature support.', 'target_applications': ['Industrial automation', 'Embedded systems', 'IoT devices', 'Harsh environment computing']}","{'extract_features': [{'input_tokens': 2586, 'output_tokens': 747, 'time_taken': 7.973222732543945}], 'generate_missing_features': [{'input_tokens': 3951, 'output_tokens': 103, 'time_taken': 2.769674062728882}, {'input_tokens': 4126, 'output_tokens': 35, 'time_taken': 2.069845199584961}], 'search_missing_features': [{'input_tokens': 0, 'output_tokens': 0, 'time_taken': 13.566307783126831}, {'input_tokens': 0, 'output_tokens': 0, 'time_taken': 12.194537878036499}], 'store_and_chunk_data': [{'input_tokens': 0, 'output_tokens': 0, 'time_taken': 0.6434421539306641}]}","[3, 1, 0]","[0, 0, 0]"
