id,extracted_data,usage_data,missing_feature_count_history,low_confidence_feature_count_history
S32G-VNP-RDB2,{},"{'extract_features': [{'input_tokens': 1424, 'output_tokens': 824, 'time_taken': 8.83810806274414}], 'store_and_chunk_data': [{'input_tokens': 0, 'output_tokens': 0, 'time_taken': 0.7453329563140869}]}",[6],[0]
MI990EF-6100,"{'name': 'MIVF SERIES MINI-ITX MOTHERBOARD', 'manufacturer': 'IBASE TECHNOLOGY', 'form_factor': 'MINI-ITX', 'evaluation_or_commercialization': False, 'processor_architecture': 'X86', 'processor_core_count': 'Not Available', 'processor_manufacturer': 'INTEL', 'processor_tdp': 'Not Available', 'memory': 'Up to 64GB DDR4 SODIMM, ECC compatible', 'onboard_storage': 'mSATA via Mini PCIe, SATA III', 'input_voltage': '12V', 'io_count': ['2x Intel Gigabit LAN', '6x USB 3.0', '4x USB 2.0', '6x COM', '4x SATA III', '2x PCIe', '2x Mini PCIe', '1x M.2'], 'wireless': 'Not Available', 'operating_system_bsp': 'Not Available', 'operating_temperature_max': '60°C', 'operating_temperature_min': '0°C', 'certifications': 'EuP/ErP compliant', 'short_summary': 'Mini-ITX motherboard with Intel Xeon E, Core i3, and Celeron processors, supporting dual Gigabit LAN and multiple I/O interfaces.', 'full_summary': 'The MIVF Series Mini-ITX motherboard by IBASE Technology features Intel Xeon E, Core i3, and Celeron processors, with support for up to 64GB DDR4 SODIMM memory. It offers extensive connectivity options including dual Gigabit LAN, multiple USB and COM ports, and various video outputs.', 'full_product_description': ""IBASE Technology's MIVF Series Mini-ITX motherboard is designed for high-performance applications, equipped with Intel Xeon E, Core i3, and Celeron processors. It supports up to 64GB of DDR4 SODIMM memory with ECC compatibility. The board includes dual Intel Gigabit LAN, multiple USB 3.0 and 2.0 ports, COM ports, SATA III, and PCIe expansion slots. It also features integrated graphics with support for DVI-D, HDMI, DisplayPort, and LVDS outputs. The motherboard is EuP/ErP compliant and operates within a temperature range of 0°C to 60°C."", 'target_applications': 'Industrial automation, digital signage, network security, and embedded systems.'}","{'extract_features': [{'input_tokens': 1483, 'output_tokens': 867, 'time_taken': 9.49675965309143}], 'search_missing_features': [{'input_tokens': 0, 'output_tokens': 0, 'time_taken': 25.275349140167236}, {'input_tokens': 0, 'output_tokens': 0, 'time_taken': 24.89186406135559}], 'generate_missing_features': [{'input_tokens': 4676, 'output_tokens': 103, 'time_taken': 2.5424258708953857}, {'input_tokens': 4621, 'output_tokens': 103, 'time_taken': 3.7380950450897217}], 'store_and_chunk_data': [{'input_tokens': 0, 'output_tokens': 0, 'time_taken': 0.7819230556488037}]}","[4, 4, 4]","[0, 0, 0]"
AIMB-556G2-00A1E,{},"{'extract_features': [{'input_tokens': 1415, 'output_tokens': 782, 'time_taken': 8.478487014770508}], 'generate_missing_features': [{'input_tokens': 4495, 'output_tokens': 158, 'time_taken': 3.215611219406128}], 'store_and_chunk_data': [{'input_tokens': 0, 'output_tokens': 0, 'time_taken': 0.6286909580230713}]}","[6, 3]","[0, 0]"
ROM-5420CD-MEB1E,"{'name': 'ROM NXP ARM CORTEXA IMX SMARC V MODULE', 'manufacturer': 'ADVANTECH', 'form_factor': 'SMARC V', 'evaluation_or_commercialization': False, 'processor_architecture': 'ARM', 'processor_core_count': '4x Cortex-A53, 2x Cortex-A72, 2x Cortex-M4F', 'processor_manufacturer': 'NXP', 'processor_tdp': 'Not Available', 'memory': 'DDR3 2GB', 'onboard_storage': 'eMMC 16GB', 'input_voltage': '5V', 'io_count': ['CAN x2', 'UART x4', 'I2C x2', 'GPIO x28', 'PCIe x1', 'Camera input x1', 'Gigabit LAN x1', 'USB Host x2', 'USB OTG x1', 'HDMI x1', 'LVDS x1'], 'wireless': 'Not Available', 'operating_system_bsp': ['Linux', 'Android'], 'operating_temperature_max': '85°C', 'operating_temperature_min': '-40°C', 'certifications': ['RoHS', 'CE', 'FCC Class B'], 'short_summary': 'High-performance NXP ARM Cortex-A iMX SMARC v module with rich I/O and low power consumption.', 'full_summary': 'The ROM NXP ARM CortexA iMX SMARC v Module features a high-performance processor, onboard DDR memory, eMMC storage, and supports a wide range of interfaces including CAN, UART, and PCIe. It is designed for portable applications with support for Linux and Android BSPs.', 'full_product_description': 'The ROM NXP ARM CortexA iMX SMARC v Module integrates an NXP iMX processor with ARM Cortex-A architecture, offering powerful CPU performance and graphics acceleration. It includes onboard DDR3 memory and eMMC storage, and supports various interfaces such as CAN, UART, PCIe, and HDMI. The module is designed for low power consumption and fanless operation, making it suitable for portable and industrial applications. It supports Linux and Android operating systems and complies with RoHS, CE, and FCC Class B certifications.', 'target_applications': ['Portable applications', 'Industrial automation', 'Embedded systems']}","{'extract_features': [{'input_tokens': 1474, 'output_tokens': 838, 'time_taken': 8.950443983078003}], 'search_missing_features': [{'input_tokens': 0, 'output_tokens': 0, 'time_taken': 21.936126232147217}, {'input_tokens': 0, 'output_tokens': 0, 'time_taken': 13.943823099136353}, {'input_tokens': 0, 'output_tokens': 0, 'time_taken': 11.759589910507202}], 'generate_missing_features': [{'input_tokens': 3031, 'output_tokens': 97, 'time_taken': 3.1989388465881348}, {'input_tokens': 3241, 'output_tokens': 53, 'time_taken': 3.7945308685302734}, {'input_tokens': 3166, 'output_tokens': 53, 'time_taken': 3.194777011871338}], 'store_and_chunk_data': [{'input_tokens': 0, 'output_tokens': 0, 'time_taken': 0.7883398532867432}]}","[3, 2, 2, 2]","[0, 0, 0, 0]"
CPU-521-17-01,"{'name': 'CPU MINIITX SBC', 'manufacturer': 'EUROTECH', 'form_factor': 'MINI-ITX', 'evaluation_or_commercialization': False, 'processor_architecture': 'X86', 'processor_core_count': '2', 'processor_manufacturer': 'INTEL', 'processor_tdp': '15W', 'memory': 'Up to 16GB DDR3L 1600MHz Dual Channel', 'onboard_storage': '2 x SATA 6Gb/s, 1 x Mini SATA Slot', 'input_voltage': '12V DC', 'io_count': ['2 x Gbit Ethernet', '4 x USB 3.0', '4 x USB 2.0', '3 x RS-232/422/485', '8 x DIO', '3 x HDMI', '1 x LVDS', '1 x DP'], 'wireless': 'WiFi 6E', 'operating_system_bsp': ['Windows IoT Enterprise', 'Linux', 'Yocto', 'Fedora', 'RTOS'], 'operating_temperature_max': '85°C', 'operating_temperature_min': '-40°C', 'certifications': ['RoHS', 'REACH'], 'short_summary': 'Rugged Mini-ITX SBC with Intel Core/Celeron, fanless design, wide temperature range.', 'full_summary': 'The CPU Mini-ITX SBC is a rugged, low-profile board featuring Intel Core and Celeron processors, designed for industrial applications with fanless operation and a wide range of interfaces.', 'full_product_description': ""The CPU Mini-ITX SBC by Eurotech is a robust single board computer designed for industrial and rugged applications. It features Intel's 8th Generation Core and Celeron processors, dual-core configurations, and supports up to 16GB DDR3L RAM. The board offers extensive connectivity options including dual Gbit Ethernet, multiple USB ports, and triple independent display outputs. It is capable of operating in extreme temperatures from -40°C to 85°C, making it suitable for harsh environments. The board supports various operating systems including Windows IoT Enterprise and Linux, and is compatible with Eurotech's IoT middleware platform."", 'target_applications': ['Industrial automation', 'Rugged computing', 'IoT gateways', 'Embedded systems']}","{'extract_features': [{'input_tokens': 1509, 'output_tokens': 867, 'time_taken': 9.276176929473877}], 'search_missing_features': [{'input_tokens': 0, 'output_tokens': 0, 'time_taken': 20.795818090438843}], 'generate_missing_features': [{'input_tokens': 3888, 'output_tokens': 34, 'time_taken': 3.1369879245758057}], 'store_and_chunk_data': [{'input_tokens': 0, 'output_tokens': 0, 'time_taken': 0.749258279800415}]}","[1, 0]","[0, 0]"
