id,extracted_data,usage_data,missing_feature_count_history,low_confidence_feature_count_history
D:\mouser\mouser_devkit\9402,{},"{'extract_features': [{'input_tokens': 1197, 'output_tokens': 604, 'time_taken': 7.577516078948975}], 'store_and_chunk_data': [{'input_tokens': 0, 'output_tokens': 0, 'time_taken': 0.5850229263305664}]}",[14],[0]
AIMB-262VG-00A1E,"{'name': 'AIMB', 'manufacturer': 'ADVANTECH', 'form_factor': 'MINI-ITX', 'evaluation_or_commercialization': False, 'processor_architecture': 'x86', 'processor_core_count': '4', 'processor_manufacturer': 'INTEL', 'processor_tdp': '6W', 'memory': 'Supports up to 4GB DDR2 667 MHz SDRAM', 'onboard_storage': '1 x mSATA (shared)', 'input_voltage': '12V DC-in', 'io_count': ['1 x CRT', '2 x Ethernet', '6 x USB 2.0', '1 x Audio (Mic-in, Line-out, Line-in)', '2 x Serial (RS-232)', '1 x Parallel', '1 x PS/2 keyboard', '1 x PS/2 mouse'], 'wireless': '1 x M.2 E key for wireless', 'operating_system_bsp': ['Windows XP Embedded'], 'operating_temperature_max': '60°C', 'operating_temperature_min': '0°C', 'certifications': 'RoHS COMPLIANT 2002/95/EC', 'short_summary': 'Industrial motherboard supporting Intel processors with Mini-ITX form factor.', 'full_summary': 'The AIMB is an industrial motherboard designed for Intel LGA processors, featuring a Mini-ITX form factor, dual-channel DDR2 memory support, and a variety of I/O interfaces including CRT, Ethernet, USB, and serial ports.', 'full_product_description': 'The AIMB motherboard supports Intel Core Duo, Pentium Dual-Core, Pentium, and Celeron processors. It features an Intel 945GC chipset, dual-channel DDR2 667 MHz SDRAM support up to 4GB, integrated graphics, and a range of I/O options including CRT, Ethernet, USB, and serial ports. It is suitable for industrial applications requiring reliable performance and flexibility.', 'target_applications': ['Industrial automation', 'Embedded systems', 'Kiosk systems']}","{'extract_features': [{'input_tokens': 1301, 'output_tokens': 766, 'time_taken': 8.198490142822266}], 'store_and_chunk_data': [{'input_tokens': 0, 'output_tokens': 0, 'time_taken': 1.2134783267974854}], 'search_missing_features': [{'input_tokens': 0, 'output_tokens': 0, 'time_taken': 21.187047958374023}, {'input_tokens': 0, 'output_tokens': 0, 'time_taken': 39.61263823509216}], 'generate_missing_features': [{'input_tokens': 3657, 'output_tokens': 175, 'time_taken': 3.875149965286255}, {'input_tokens': 3564, 'output_tokens': 37, 'time_taken': 5.87165379524231}]}","[6, 1, 0]","[0, 0, 0]"
UBC-220DL-MDA1E,"{'name': 'UBC-DS31', 'manufacturer': 'ADVANTECH', 'form_factor': 'RISC Compact Box Computer', 'evaluation_or_commercialization': False, 'processor_architecture': 'ARM Cortex-A9', 'processor_core_count': 2, 'processor_manufacturer': 'FREESCALE', 'processor_tdp': 'Not Available', 'memory': '1 GB DDR3', 'onboard_storage': '4 GB eMMC Flash', 'input_voltage': '12 VDC', 'io_count': 'USB 2.0, USB OTG, HDMI, RS-232, Ethernet', 'wireless': 'Wi-Fi 802.11 b/g/n', 'operating_system_bsp': ['Linux', 'Android'], 'operating_temperature_max': '60°C', 'operating_temperature_min': '0°C', 'certifications': ['CE', 'FCC Class B', 'RoHS Compliant'], 'short_summary': 'Compact RISC box computer with Freescale ARM Cortex-A9 processor, supporting multiple OS and wireless connectivity.', 'full_summary': 'The UBC-DS31 is a compact RISC box computer featuring a Freescale ARM Cortex-A9 Dual Lite processor, 1 GB DDR3 memory, and 4 GB eMMC storage. It supports HDMI, USB, and Ethernet interfaces, with wireless capabilities including Wi-Fi 802.11 b/g/n. The device is suitable for industrial applications with support for Linux and Android operating systems.', 'full_product_description': 'The UBC-DS31 by Advantech is a RISC-based compact box computer designed for industrial applications. It is powered by a Freescale ARM Cortex-A9 Dual Lite processor, offering high performance with low power consumption. The system includes 1 GB of DDR3 memory and 4 GB of onboard eMMC flash storage. It features multiple I/O options including HDMI, USB 2.0, USB OTG, RS-232, and Ethernet, along with wireless connectivity through Wi-Fi 802.11 b/g/n. The device supports Linux and Android operating systems, making it versatile for various applications. It is compliant with CE, FCC Class B, and RoHS standards, ensuring reliability and safety in industrial environments.', 'target_applications': ['Industrial Automation', 'Embedded Systems', 'IoT Applications']}","{'extract_features': [{'input_tokens': 1296, 'output_tokens': 842, 'time_taken': 9.017183065414429}], 'store_and_chunk_data': [{'input_tokens': 0, 'output_tokens': 0, 'time_taken': 0.7447669506072998}], 'search_missing_features': [{'input_tokens': 0, 'output_tokens': 0, 'time_taken': 12.438653945922852}, {'input_tokens': 0, 'output_tokens': 0, 'time_taken': 19.848788022994995}], 'generate_missing_features': [{'input_tokens': 3656, 'output_tokens': 30, 'time_taken': 2.589120864868164}, {'input_tokens': 3672, 'output_tokens': 30, 'time_taken': 3.2980968952178955}]}","[1, 1, 1]","[0, 0, 0]"
TREK-303R-HA0E,"{'name': 'TREK-RH', 'manufacturer': 'ADVANTECH', 'form_factor': 'In-Vehicle Smart Display', 'evaluation_or_commercialization': False, 'processor_architecture': 'x86', 'processor_core_count': 'Single-core', 'processor_manufacturer': 'Intel', 'processor_tdp': 'Not Available', 'memory': '2 GB DDR3L SODIMM 1066 MHz, non-ECC (up to 8 GB)', 'onboard_storage': '16 GB UMLC, SQFlash mSATA', 'input_voltage': '12V', 'io_count': 'USB Type A, Power button, Reset button', 'wireless': 'IEEE 802.11a/b/g/n + Bluetooth V4.0', 'operating_system_bsp': 'WES7, WES8, Win10 IoT LTSB, Linux Ubuntu 14.04 Lite (32 bit), Intel IDP 3.x Moon Island', 'operating_temperature_max': '70°C', 'operating_temperature_min': '-30°C', 'certifications': ['CE', 'FCC', 'CCC', 'EMARK E'], 'short_summary': 'TREK-RH is an in-vehicle smart display with a resistive touchscreen, designed for fleet management and dispatch applications.', 'full_summary': 'The TREK-RH is a vehicle-grade smart display featuring a WVGA resolution TFT LCD with a resistive touchscreen, designed for mobile resource management applications in trucks, buses, and taxis. It includes user-programmable function keys, a built-in light sensor for automatic dimming, and extended I/O ports.', 'full_product_description': 'The TREK-RH smart display is designed for in-vehicle use, offering a WVGA resolution with a resistive touchscreen. It features a lightweight housing compatible with RAM mounting solutions, making it easy to install. The display includes a single watt speaker, a built-in light sensor for automatic brightness adjustment, and is paired with a TREK computing box via a single-cable connection. It operates within a wide temperature range and meets automotive-grade requirements.', 'target_applications': ['Fleet management', 'Dispatch applications', 'Mobile Resource Management', 'Trucks', 'Buses', 'Taxis']}","{'extract_features': [{'input_tokens': 1340, 'output_tokens': 736, 'time_taken': 8.398183822631836}], 'store_and_chunk_data': [{'input_tokens': 0, 'output_tokens': 0, 'time_taken': 1.1998100280761719}], 'search_missing_features': [{'input_tokens': 0, 'output_tokens': 0, 'time_taken': 22.321502208709717}, {'input_tokens': 0, 'output_tokens': 0, 'time_taken': 73.11391496658325}, {'input_tokens': 0, 'output_tokens': 0, 'time_taken': 18.93356680870056}, {'input_tokens': 0, 'output_tokens': 0, 'time_taken': 18.89250922203064}, {'input_tokens': 0, 'output_tokens': 0, 'time_taken': 19.23300290107727}], 'generate_missing_features': [{'input_tokens': 3770, 'output_tokens': 282, 'time_taken': 5.750802993774414}, {'input_tokens': 4232, 'output_tokens': 54, 'time_taken': 3.9409470558166504}, {'input_tokens': 4304, 'output_tokens': 56, 'time_taken': 3.24776291847229}, {'input_tokens': 3926, 'output_tokens': 30, 'time_taken': 3.4337317943573}, {'input_tokens': 3926, 'output_tokens': 30, 'time_taken': 2.812061071395874}]}","[8, 2, 2, 1, 1, 1]","[0, 0, 0, 0, 0, 0]"
EmETXe-i89M3-WT-6442EQ,"{'name': 'EMETXEIM', 'manufacturer': 'ARBOR TECHNOLOGY', 'form_factor': 'COM EXPRESS BASIC', 'evaluation_or_commercialization': True, 'processor_architecture': 'Not Available', 'processor_core_count': 'Not Available', 'processor_manufacturer': 'INTEL', 'processor_tdp': 'Not Available', 'memory': 'DDR4 SODIMM sockets', 'onboard_storage': '1 x BGA NVMe SSD (Optional)', 'input_voltage': '8V-20V', 'io_count': ['4 USB 3.0 ports', '4 USB 2.0 ports', '2 UART ports', 'PCIe lanes'], 'wireless': 'No Wireless LAN Card (no WiFi enablement)', 'operating_system_bsp': ['Windows 10 64-bit', 'Windows 7 64-bit', 'Linux Ubuntu'], 'operating_temperature_max': '60°C', 'operating_temperature_min': '-40°C', 'certifications': 'Not Available', 'short_summary': 'COM Express Basic Type CPU Module with Intel Core and Xeon processors.', 'full_summary': ""The EmETXeiM is a COM Express Basic Type CPU Module featuring Intel's latest Core and Xeon processors, supporting a wide range of operating temperatures and voltage inputs."", 'full_product_description': 'The EmETXeiM module is designed for high-performance computing applications, equipped with soldered onboard Intel Core and Xeon processors. It supports dual-channel DDR4 SODIMM memory, multiple I/O interfaces including USB and PCIe, and is compatible with various operating systems including Windows and Linux.', 'target_applications': ['Industrial automation', 'Embedded systems', 'High-performance computing']}","{'extract_features': [{'input_tokens': 1400, 'output_tokens': 707, 'time_taken': 7.786275148391724}], 'store_and_chunk_data': [{'input_tokens': 0, 'output_tokens': 0, 'time_taken': 1.2638311386108398}], 'search_missing_features': [{'input_tokens': 0, 'output_tokens': 0, 'time_taken': 17.1717689037323}, {'input_tokens': 0, 'output_tokens': 0, 'time_taken': 27.0086030960083}, {'input_tokens': 0, 'output_tokens': 0, 'time_taken': 24.965739011764526}, {'input_tokens': 0, 'output_tokens': 0, 'time_taken': 26.005409002304077}], 'generate_missing_features': [{'input_tokens': 4303, 'output_tokens': 157, 'time_taken': 4.024794816970825}, {'input_tokens': 4059, 'output_tokens': 134, 'time_taken': 6.1617748737335205}, {'input_tokens': 4209, 'output_tokens': 101, 'time_taken': 4.527181148529053}, {'input_tokens': 4209, 'output_tokens': 101, 'time_taken': 4.565187931060791}]}","[6, 5, 4, 4, 4]","[0, 0, 0, 0, 0]"
