id,extracted_data,usage_data,missing_feature_count_history,low_confidence_feature_count_history
RSB-3720CD-BCA2E,"{'name': 'RSB', 'manufacturer': 'ADVANTECH', 'form_factor': 'SBC', 'evaluation_or_commercialization': False, 'processor_architecture': 'ARM', 'processor_core_count': 'Quad/Dual', 'processor_manufacturer': 'NXP', 'processor_tdp': 'Not Available', 'memory': 'LPDDR4, 3GB', 'onboard_storage': '16GB eMMC', 'input_voltage': '12V', 'io_count': 'USB 3.0, HDMI, LVDS, CAN, RS232, GPIO', 'wireless': 'Wi-Fi, Bluetooth', 'operating_system_bsp': ['Yocto', 'Linux', 'Android'], 'operating_temperature_max': '85°C', 'operating_temperature_min': '-40°C', 'certifications': ['CE', 'FCC', 'RoHS'], 'short_summary': 'RISC computing platform with NXP i.MX8M Plus, supporting AI and multimedia applications.', 'full_summary': 'The RSB is a single board computer featuring the NXP i.MX8M Plus processor, offering robust performance for AI and multimedia applications. It supports a wide range of interfaces including HDMI, LVDS, and multiple USB ports, and is compatible with Yocto, Linux, and Android operating systems.', 'full_product_description': 'The RSB SBC by Advantech is equipped with the NXP i.MX8M Plus processor, available in both quad and dual-core configurations. It includes 3GB of LPDDR4 memory and 16GB of eMMC storage. The board supports a variety of interfaces such as HDMI, LVDS, USB 3.0, CAN, and RS232, making it suitable for diverse industrial applications. It operates in temperatures ranging from -40°C to 85°C and complies with CE, FCC, and RoHS standards.', 'target_applications': ['Industrial Automation', 'AI Applications', 'Multimedia Processing']}","{'extract_features': [{'input_tokens': 2445, 'output_tokens': 768, 'time_taken': 7.872295141220093}], 'generate_missing_features': [{'input_tokens': 3600, 'output_tokens': 30, 'time_taken': 1.9136559963226318}, {'input_tokens': 3589, 'output_tokens': 30, 'time_taken': 1.4195690155029297}], 'search_missing_features': [{'input_tokens': 0, 'output_tokens': 0, 'time_taken': 12.13251805305481}, {'input_tokens': 0, 'output_tokens': 0, 'time_taken': 13.999311685562134}], 'store_and_chunk_data': [{'input_tokens': 0, 'output_tokens': 0, 'time_taken': 0.6896450519561768}]}","[1, 1, 1]","[0, 0, 0]"
015512,"{'name': 'CONGA-QA', 'manufacturer': 'CONGATEC', 'form_factor': 'QSEVEN', 'evaluation_or_commercialization': True, 'processor_architecture': 'X86', 'processor_core_count': 4, 'processor_manufacturer': 'INTEL', 'processor_tdp': '6W', 'memory': '8GB DDR3L', 'onboard_storage': '64GB eMMC', 'input_voltage': '5V', 'io_count': ['4x PCIe', '4x USB 3.0', '2x USB 2.0', '2x SATA', '1x SDIO', '1x LPC', '1x SMBus', '1x UART'], 'wireless': 'Not Available', 'operating_system_bsp': ['Microsoft Windows IoT Enterprise', 'Microsoft Windows IoT Core', 'Linux', 'Yocto'], 'operating_temperature_max': '85°C', 'operating_temperature_min': '-40°C', 'certifications': 'CE', 'short_summary': 'High-performance Qseven module with Intel Atom processor and extensive I/O options.', 'full_summary': 'The CONGA-QA is a Qseven module featuring Intel Atom processors, offering robust performance with up to quad-core processing, integrated graphics, and a wide range of I/O interfaces. It supports various operating systems and is suitable for industrial applications.', 'full_product_description': 'The CONGA-QA module by Congatec is designed for high-performance embedded applications. It features Intel Atom processors with up to quad-core configurations, integrated Intel HD Graphics supporting 4K displays, and a comprehensive set of I/O interfaces including PCIe, USB, SATA, and more. The module supports multiple operating systems, making it versatile for various industrial and commercial applications. It is compliant with the Qseven standard and offers extended temperature ranges for industrial use.', 'target_applications': ['Industrial automation', 'IoT devices', 'Embedded computing', 'Digital signage']}","{'extract_features': [{'input_tokens': 2574, 'output_tokens': 797, 'time_taken': 8.007037878036499}], 'generate_missing_features': [{'input_tokens': 3008, 'output_tokens': 54, 'time_taken': 1.7196621894836426}, {'input_tokens': 3943, 'output_tokens': 29, 'time_taken': 1.9340062141418457}, {'input_tokens': 3498, 'output_tokens': 29, 'time_taken': 3.4734768867492676}], 'search_missing_features': [{'input_tokens': 0, 'output_tokens': 0, 'time_taken': 14.153901815414429}, {'input_tokens': 0, 'output_tokens': 0, 'time_taken': 9.776395082473755}, {'input_tokens': 0, 'output_tokens': 0, 'time_taken': 12.672807931900024}], 'store_and_chunk_data': [{'input_tokens': 0, 'output_tokens': 0, 'time_taken': 1.2194187641143799}]}","[2, 1, 1, 1]","[0, 0, 0, 0]"
108024,{},"{'extract_features': [{'input_tokens': 2388, 'output_tokens': 655, 'time_taken': 6.830343961715698}], 'store_and_chunk_data': [{'input_tokens': 0, 'output_tokens': 0, 'time_taken': 0.5840981006622314}]}",[14],[0]
SOM-6763D-S6A1E,"{'name': 'COMEXPRESS COMPACT MODULE', 'manufacturer': 'ADVANTECH', 'form_factor': 'COMEXPRESS COMPACT MODULE', 'evaluation_or_commercialization': False, 'processor_architecture': 'x86', 'processor_core_count': 'Single core for N450, Dual core for D510', 'processor_manufacturer': 'INTEL', 'processor_tdp': 'Not Available', 'memory': 'Up to 2GB DDR2 SODIMM', 'onboard_storage': 'eMMC, 4GB - 32GB; SSD, 8GB - 64GB', 'input_voltage': '12V', 'io_count': 'PATA, SATA, USB, PCIe, LPC, GPIO', 'wireless': 'Not Available', 'operating_system_bsp': ['Windows XP Embedded', 'Windows Embedded Standard'], 'operating_temperature_max': '60°C', 'operating_temperature_min': '0°C', 'certifications': 'Not Available', 'short_summary': 'COMExpress Compact Module with Intel Atom processors, supporting DDR2 memory and various I/O interfaces.', 'full_summary': 'The COMExpress Compact Module features Intel Atom processors, supporting up to 2GB DDR2 memory, multiple I/O interfaces including PCIe, SATA, USB, and more, with a focus on embedded applications.', 'full_product_description': ""This module is designed for embedded applications, featuring Intel Atom N450 and D510 processors, supporting DDR2 SODIMM memory, and offering a range of I/O options such as PCIe, SATA, USB, and more. It includes Advantech's iManager software for enhanced system management."", 'target_applications': ['Embedded systems', 'Industrial automation', 'Digital signage']}","{'extract_features': [{'input_tokens': 2026, 'output_tokens': 698, 'time_taken': 7.0987019538879395}], 'generate_missing_features': [{'input_tokens': 4352, 'output_tokens': 100, 'time_taken': 2.9648942947387695}, {'input_tokens': 4319, 'output_tokens': 120, 'time_taken': 2.489758014678955}, {'input_tokens': 4338, 'output_tokens': 76, 'time_taken': 2.127965211868286}, {'input_tokens': 4244, 'output_tokens': 76, 'time_taken': 2.67337703704834}], 'search_missing_features': [{'input_tokens': 0, 'output_tokens': 0, 'time_taken': 15.346707820892334}, {'input_tokens': 0, 'output_tokens': 0, 'time_taken': 11.72454285621643}, {'input_tokens': 0, 'output_tokens': 0, 'time_taken': 15.360883235931396}, {'input_tokens': 0, 'output_tokens': 0, 'time_taken': 14.983613014221191}], 'store_and_chunk_data': [{'input_tokens': 0, 'output_tokens': 0, 'time_taken': 1.2130460739135742}]}","[4, 4, 3, 3, 3]","[0, 0, 0, 0, 0]"
MYC-JD9360-16E2D-160-I,{},"{'extract_features': [{'input_tokens': 2454, 'output_tokens': 896, 'time_taken': 9.117414951324463}], 'store_and_chunk_data': [{'input_tokens': 0, 'output_tokens': 0, 'time_taken': 0.5750031471252441}]}",[3],[0]
