id,extracted_data,usage_data,missing_feature_count_history,low_confidence_feature_count_history
PCA-6028G2-00A3,"{'name': 'PCA PICMG SINGLE BOARD COMPUTER', 'manufacturer': 'ADVANTECH', 'form_factor': 'PICMG', 'evaluation_or_commercialization': False, 'processor_architecture': 'x86', 'processor_core_count': 'Quad-core', 'processor_manufacturer': 'INTEL', 'processor_tdp': 'Not Available', 'memory': 'Dual channel, DDR3, 8GB per DIMM, max capacity 16GB', 'onboard_storage': 'mSATA', 'input_voltage': '12V', 'io_count': ['2 RS-232', '6 USB ports', '2 LAN ports', '1 VGA', '1 DVI'], 'wireless': 'Not Available', 'operating_system_bsp': 'Not Available', 'operating_temperature_max': '60°C', 'operating_temperature_min': '0°C', 'certifications': 'FCC', 'short_summary': 'A single board computer with Intel Core processor, dual-channel DDR3 memory, and multiple I/O interfaces.', 'full_summary': 'The PCA PICMG Single Board Computer features an Intel Core processor, dual-channel DDR3 memory, and supports various I/O interfaces including USB, LAN, and VGA. It is designed for industrial applications with a robust set of features.', 'full_product_description': 'The PCA PICMG Single Board Computer by Advantech is equipped with an LGA Intel Core processor and supports dual-channel DDR3 memory up to 16GB. It includes multiple I/O interfaces such as USB, LAN, and VGA, making it suitable for a range of industrial applications. The board is compliant with FCC standards and operates within a temperature range of 0°C to 60°C.', 'target_applications': ['Industrial automation', 'Embedded systems', 'Networking']}","{'generate_missing_features': [{'input_tokens': 2571, 'output_tokens': 103, 'time_taken': 2.7726049423217773}, {'input_tokens': 3810, 'output_tokens': 105, 'time_taken': 3.6371309757232666}, {'input_tokens': 3622, 'output_tokens': 79, 'time_taken': 2.674851179122925}, {'input_tokens': 3986, 'output_tokens': 79, 'time_taken': 3.1412532329559326}], 'search_missing_features': [{'input_tokens': 0, 'output_tokens': 0, 'time_taken': 8.84751272201538}, {'input_tokens': 0, 'output_tokens': 0, 'time_taken': 11.454841136932373}, {'input_tokens': 0, 'output_tokens': 0, 'time_taken': 13.61057186126709}, {'input_tokens': 0, 'output_tokens': 0, 'time_taken': 14.2652428150177}], 'extract_features': [{'input_tokens': 1651, 'output_tokens': 733, 'time_taken': 7.657449007034302}], 'store_and_chunk_data': [{'input_tokens': 0, 'output_tokens': 0, 'time_taken': 1.2543396949768066}]}","[4, 4, 3, 3, 3]","[0, 0, 0, 0, 0]"
ROM-5722CD-RFA1E,"{'name': 'ROM NXP IMXM PLUS', 'manufacturer': 'ADVANTECH', 'form_factor': 'SMARC', 'evaluation_or_commercialization': True, 'processor_architecture': 'ARM', 'processor_core_count': 'Quad/Dual', 'processor_manufacturer': 'NXP', 'processor_tdp': 'Not Available', 'memory': 'LPDDR4, 3GB', 'onboard_storage': '16GB eMMC NAND Flash', 'input_voltage': '5V', 'io_count': ['1x HDMI', '2x USB 3.0', '2x USB 2.0', '1x USB OTG', '2x UART', '1x PCIe', '1x Gigabit LAN', '2x CAN', '1x MIPI CSI', '1x MIPI DSI', '1x LVDS'], 'wireless': 'Wi-Fi, Bluetooth', 'operating_system_bsp': 'Yocto Linux', 'operating_temperature_max': '85°C', 'operating_temperature_min': '-40°C', 'certifications': 'RoHS, CE, FCC Class B', 'short_summary': 'SMARC module with NXP iMXM Plus, ARM Cortex-A cores, and extensive I/O options.', 'full_summary': ""The Advantech ROM NXP iMXM Plus is a SMARC Computer-on-Module featuring NXP's iMXM Plus SOC with ARM Cortex-A cores, offering a combination of high-performance computing and real-time processing capabilities. It supports a wide range of interfaces including HDMI, USB, PCIe, and CAN, making it suitable for embedded applications."", 'full_product_description': ""Advantech's ROM NXP iMXM Plus SMARC module is designed for embedded applications, powered by NXP's iMXM Plus SOC. It includes ARM Cortex-A cores and a Cortex-M core for real-time processing. The module supports a variety of interfaces such as HDMI, USB, PCIe, and CAN, and is equipped with onboard LPDDR4 memory and eMMC storage. It is compliant with SMARC standards and supports Yocto Linux BSP."", 'target_applications': 'Embedded systems, industrial automation, IoT devices, and multimedia applications.'}","{'generate_missing_features': [{'input_tokens': 3851, 'output_tokens': 30, 'time_taken': 3.127196788787842}, {'input_tokens': 3904, 'output_tokens': 30, 'time_taken': 2.6038148403167725}], 'search_missing_features': [{'input_tokens': 0, 'output_tokens': 0, 'time_taken': 19.501219749450684}, {'input_tokens': 0, 'output_tokens': 0, 'time_taken': 16.965325117111206}], 'extract_features': [{'input_tokens': 1800, 'output_tokens': 838, 'time_taken': 9.143349885940552}], 'store_and_chunk_data': [{'input_tokens': 0, 'output_tokens': 0, 'time_taken': 1.572732925415039}]}","[1, 1, 1]","[0, 0, 0]"
36021-0000-20-1,"{'name': 'COMEC SL', 'manufacturer': 'KONTRON', 'form_factor': 'COM EXPRESS', 'evaluation_or_commercialization': False, 'processor_architecture': 'X86', 'processor_core_count': 'Up to 14 cores', 'processor_manufacturer': 'INTEL', 'processor_tdp': '15W', 'memory': 'Up to 32 GByte DDR4', 'onboard_storage': 'Up to 64 GByte SLC eMMC', 'input_voltage': '12V', 'io_count': 'Not Available', 'wireless': 'Not Available', 'operating_system_bsp': ['Windows 10', 'Windows 8', 'Windows 7', 'Linux', 'VxWorks'], 'operating_temperature_max': '85°C', 'operating_temperature_min': '-40°C', 'certifications': 'Not Available', 'short_summary': 'COM Express module with Intel Core processors and up to 32 GByte DDR4 memory.', 'full_summary': ""The COMecSL is a COM Express module featuring Intel's 6th Gen Core processors, supporting up to 32 GByte DDR4 memory, and offering a range of I/O options including PCIe, USB, and SATA."", 'full_product_description': ""The COMecSL module is designed for high-performance applications, integrating Intel's 6th Gen Core processors with up to 32 GByte DDR4 memory. It supports a variety of interfaces including PCIe, USB, and SATA, and is suitable for both commercial and industrial environments with operating temperatures ranging from -40°C to 85°C."", 'target_applications': ['Industrial automation', 'Embedded computing', 'IoT devices']}","{'generate_missing_features': [{'input_tokens': 3878, 'output_tokens': 104, 'time_taken': 4.590465068817139}, {'input_tokens': 3765, 'output_tokens': 75, 'time_taken': 3.2776801586151123}, {'input_tokens': 3765, 'output_tokens': 75, 'time_taken': 2.9614620208740234}], 'search_missing_features': [{'input_tokens': 0, 'output_tokens': 0, 'time_taken': 15.481327772140503}, {'input_tokens': 0, 'output_tokens': 0, 'time_taken': 15.51624083518982}, {'input_tokens': 0, 'output_tokens': 0, 'time_taken': 17.808372974395752}], 'extract_features': [{'input_tokens': 1602, 'output_tokens': 715, 'time_taken': 7.573434114456177}], 'store_and_chunk_data': [{'input_tokens': 0, 'output_tokens': 0, 'time_taken': 1.3627500534057617}]}","[4, 3, 3, 3]","[0, 0, 0, 0]"
SOM-6897C3-U3A3,"{'name': 'SOM COM EXPRESS COMPACT MODULE', 'manufacturer': 'ADVANTECH', 'form_factor': 'COM EXPRESS COMPACT', 'evaluation_or_commercialization': False, 'processor_architecture': 'x86', 'processor_core_count': '2', 'processor_manufacturer': 'INTEL', 'processor_tdp': '15W', 'memory': 'Up to 32GB DDR4', 'onboard_storage': 'On board eMMC (Option)', 'input_voltage': '12V', 'io_count': ['PCIe x1', 'PCIe x4', 'USB 3.0', 'USB 2.0', 'SATA III', 'HDMI', 'DisplayPort', 'LVDS'], 'wireless': 'Not Available', 'operating_system_bsp': ['Windows Embedded Standard', 'Linux'], 'operating_temperature_max': '60°C', 'operating_temperature_min': '0°C', 'certifications': 'Not Available', 'short_summary': 'Compact module with Intel Core/Celeron processors, supporting dual-channel DDR4 memory and multiple display outputs.', 'full_summary': ""The SOM COM Express Compact Module features Intel's 6th Gen Core and Celeron processors, offering robust performance with integrated graphics and flexible I/O options. It supports dual-channel DDR4 memory and multiple display interfaces, making it suitable for a variety of industrial applications."", 'full_product_description': ""The SOM COM Express Compact Module by Advantech is designed for industrial applications requiring high performance and flexibility. It is equipped with Intel's 6th Gen Core and Celeron processors, supporting up to 32GB of DDR4 memory. The module offers a range of I/O options including PCIe, USB, SATA, and multiple display outputs such as HDMI, DisplayPort, and LVDS. It is suitable for environments with operating temperatures ranging from 0°C to 60°C."", 'target_applications': ['Industrial automation', 'Embedded systems', 'Digital signage', 'Medical devices']}","{'generate_missing_features': [{'input_tokens': 4072, 'output_tokens': 82, 'time_taken': 2.735471248626709}, {'input_tokens': 4519, 'output_tokens': 52, 'time_taken': 3.1850228309631348}, {'input_tokens': 4238, 'output_tokens': 52, 'time_taken': 2.2389211654663086}], 'search_missing_features': [{'input_tokens': 0, 'output_tokens': 0, 'time_taken': 19.92881202697754}, {'input_tokens': 0, 'output_tokens': 0, 'time_taken': 16.4564049243927}, {'input_tokens': 0, 'output_tokens': 0, 'time_taken': 18.297861337661743}], 'extract_features': [{'input_tokens': 1666, 'output_tokens': 788, 'time_taken': 8.492180109024048}], 'store_and_chunk_data': [{'input_tokens': 0, 'output_tokens': 0, 'time_taken': 1.9420208930969238}]}","[3, 2, 2, 2]","[0, 0, 0, 0]"
TF037F-2000-P,{},"{'extract_features': [{'input_tokens': 1658, 'output_tokens': 650, 'time_taken': 8.190890789031982}], 'store_and_chunk_data': [{'input_tokens': 0, 'output_tokens': 0, 'time_taken': 1.6426286697387695}]}",[13],[1]
