id,extracted_data,usage_data,missing_feature_count_history,low_confidence_feature_count_history
MIC-710IVX-00A1,"{'name': 'MICIVX', 'manufacturer': 'ADVANTECH', 'form_factor': 'ATX', 'evaluation_or_commercialization': False, 'processor_architecture': 'ARM', 'processor_core_count': '6', 'processor_manufacturer': 'NVIDIA', 'processor_tdp': '28W (passive cooled), 15-25W (passive cooled), 54W (fan)', 'memory': '8 GB LPDDR4', 'onboard_storage': '16 GB eMMC', 'input_voltage': '100-240 VAC', 'io_count': 'Ethernet x 1000 Mbps, PoE x 4, HDMI, USB 3.0 x 2, USB 2.0 x 2, RS-232, Micro USB', 'wireless': 'Wi-Fi/BT5.0', 'operating_system_bsp': 'Linux OS, Jetpack', 'operating_temperature_max': '60°C', 'operating_temperature_min': '0°C', 'certifications': 'CE, FCC, BSMI', 'short_summary': 'AI Network Video Recorder with NVIDIA Jetson Xavier NX, supports PoE and SATAIII.', 'full_summary': 'The MICIVX is an AI Network Video Recorder featuring the NVIDIA Jetson Xavier NX processor, supporting PoE, SATAIII, and Linux OS with Jetpack BSP.', 'full_product_description': 'The MICIVX AI Network Video Recorder is based on the NVIDIA Jetson Xavier NX, offering 8 GB LPDDR4 memory and 16 GB eMMC storage. It supports multiple I/O interfaces including Ethernet, PoE, HDMI, USB, and RS-232. The device is designed for desktop installation and operates within a temperature range of 0°C to 60°C. It is certified with CE, FCC, and BSMI standards.', 'target_applications': 'AI video systems, network video recording, industrial automation.'}","{'extract_features': [{'input_tokens': 1114, 'output_tokens': 730, 'time_taken': 10.055393934249878}], 'store_and_chunk_data': [{'input_tokens': 0, 'output_tokens': 0, 'time_taken': 0.6217441558837891}], 'search_missing_features': [{'input_tokens': 0, 'output_tokens': 0, 'time_taken': 25.376105785369873}, {'input_tokens': 0, 'output_tokens': 0, 'time_taken': 30.682092905044556}, {'input_tokens': 0, 'output_tokens': 0, 'time_taken': 22.04739499092102}], 'generate_missing_features': [{'input_tokens': 4251, 'output_tokens': 53, 'time_taken': 2.933459997177124}, {'input_tokens': 4488, 'output_tokens': 60, 'time_taken': 3.8583858013153076}, {'input_tokens': 3566, 'output_tokens': 52, 'time_taken': 2.9589200019836426}]}","[2, 2, 1, 0]","[0, 0, 0, 0]"
FORLINX-OK1012A-C+10512MOE01IA11I11,{},"{'extract_features': [{'input_tokens': 983, 'output_tokens': 753, 'time_taken': 9.349240064620972}], 'store_and_chunk_data': [{'input_tokens': 0, 'output_tokens': 0, 'time_taken': 1.2475903034210205}]}",[6],[0]
MB966,"{'name': 'NETWORKING MOTHERBOARD', 'manufacturer': 'IBASE', 'form_factor': 'ATX', 'evaluation_or_commercialization': False, 'processor_architecture': 'x86', 'processor_core_count': 'Not Available', 'processor_manufacturer': 'INTEL', 'processor_tdp': 'Not Available', 'memory': 'DDR3 DIMM, Max 32GB, supports ECC', 'onboard_storage': 'CF socket, mSATA compatible', 'input_voltage': '12V', 'io_count': '6 USB, 6 COM, 4 SATA II, 2 LAN, 1 VGA', 'wireless': 'Not Available', 'operating_system_bsp': 'Not Available', 'operating_temperature_max': '60°C', 'operating_temperature_min': '0°C', 'certifications': 'Not Available', 'short_summary': 'Networking motherboard with Intel Xeon/Core/Pentium support, multiple I/O options, and LAN bypass.', 'full_summary': 'The IBASE Networking Motherboard supports Intel Xeon, Core, and Pentium processors, featuring multiple I/O interfaces including USB, COM, SATA II, and LAN with bypass capability. It is designed for robust networking applications.', 'full_product_description': 'This networking motherboard by IBASE is equipped with Intel Xeon, Core, and Pentium processor support, offering a range of I/O options such as USB, COM, SATA II, and LAN with bypass. It includes features like a watchdog timer, hardware monitor, and supports ECC memory. The board is suitable for demanding networking environments.', 'target_applications': 'Networking, Industrial Communication'}","{'extract_features': [{'input_tokens': 1080, 'output_tokens': 690, 'time_taken': 8.560993671417236}], 'store_and_chunk_data': [{'input_tokens': 0, 'output_tokens': 0, 'time_taken': 0.5964560508728027}], 'search_missing_features': [{'input_tokens': 0, 'output_tokens': 0, 'time_taken': 21.65877604484558}, {'input_tokens': 0, 'output_tokens': 0, 'time_taken': 17.046518087387085}], 'generate_missing_features': [{'input_tokens': 4506, 'output_tokens': 126, 'time_taken': 6.355058908462524}, {'input_tokens': 4494, 'output_tokens': 126, 'time_taken': 4.374780893325806}]}","[5, 5, 5]","[0, 0, 0]"
102110423,{},"{'extract_features': [{'input_tokens': 810, 'output_tokens': 740, 'time_taken': 9.362941980361938}], 'store_and_chunk_data': [{'input_tokens': 0, 'output_tokens': 0, 'time_taken': 1.0970098972320557}]}",[7],[0]
102110365,"{'name': 'ROCK PI S', 'manufacturer': 'RADXA', 'form_factor': 'SINGLEBOARD COMPUTER', 'evaluation_or_commercialization': False, 'processor_architecture': 'ARM', 'processor_core_count': '4', 'processor_manufacturer': 'ROCKCHIP', 'processor_tdp': 'Not Available', 'memory': '256 MB RAM', 'onboard_storage': '128 MB/1 GB onboard NAND storage', 'input_voltage': '+5V', 'io_count': 'USB, Ethernet, GPIO, SPI, UART, I2C', 'wireless': ['Wi-Fi', 'Bluetooth'], 'operating_system_bsp': ['Debian', 'Buildroot'], 'operating_temperature_max': '50°C', 'operating_temperature_min': '0°C', 'certifications': 'Not Available', 'short_summary': 'A small, high-performance single-board computer suitable for IoT and voice applications.', 'full_summary': 'The ROCK PI S is a compact single-board computer featuring a Rockchip RK3308 quad-core processor, designed for IoT and voice applications, with support for Debian and Buildroot operating systems.', 'full_product_description': 'The ROCK PI S is a tiny single-board computer equipped with a Rockchip RK3308 quad-core processor. It includes a variety of interfaces such as USB, Ethernet, and GPIO, and supports wireless connectivity with Wi-Fi and Bluetooth. The board is ideal for small projects and offers a high-performance to cost ratio.', 'target_applications': ['IoT projects', 'Voice applications', 'Media center', 'Central controller']}","{'extract_features': [{'input_tokens': 1046, 'output_tokens': 676, 'time_taken': 8.576300859451294}], 'store_and_chunk_data': [{'input_tokens': 0, 'output_tokens': 0, 'time_taken': 1.2873449325561523}], 'search_missing_features': [{'input_tokens': 0, 'output_tokens': 0, 'time_taken': 23.560163736343384}, {'input_tokens': 0, 'output_tokens': 0, 'time_taken': 19.197208881378174}, {'input_tokens': 0, 'output_tokens': 0, 'time_taken': 15.493304014205933}], 'generate_missing_features': [{'input_tokens': 3258, 'output_tokens': 164, 'time_taken': 5.1129150390625}, {'input_tokens': 4071, 'output_tokens': 53, 'time_taken': 5.498676061630249}, {'input_tokens': 4071, 'output_tokens': 53, 'time_taken': 2.913853883743286}]}","[6, 2, 2, 2]","[0, 0, 0, 0]"
